Company Names,Job Titles,Posted On,Job Details,Images,Type Location,Locations,Link
TripleTen,"Backend Developer (Growth Team) - Hybrid (Belgrade, Serbia)",Posted 27 days ago,"Please note that both Russian and English skills are necessary for this role. Candidates without working proficiency in Russian won't be considered. Thank you for your understanding.

TripleTen is a service that empowers individuals, regardless of their prior experience, to embark on the exciting and challenging journey of mastering IT professions such as software engineering, data science, business intelligence analytics, and QA engineering in a feasible and accessible way, ultimately leading to employment opportunities.

Our mission is to ensure that every student has the opportunity to master a new profession successfully and become a valuable member of the IT industry. We are successfully producing highly desirable tech professionals in the most competitive EdTech market in the world — the US and LATAM markets.
In this role, you'll be responsible for managing users from their first interaction with our landing pages all the way through to payment. You will maintain all integrations within our funnel to ensure we capture new leads effectively and efficiently. Join us and play a crucial role in optimizing our user acquisition strategies and contributing to our success.

Tech stack:
Python, FastAPI, PySpark, Pytest
TypeScript, Node.js
Redis, DynamoDB, Postgres
AWS, Kubernetes, Terraform, GitLab CI

Requirements:
Fluent in Russian, with upper intermediate or higher proficiency in English.
Ability to write clean, maintainable, well-documented code using Python.
Experience applying DDD and Clean Architecture in real projects.
Experience with TypeScript and Node.js is an advantage.
Experience writing unit and integration tests; experience in TDD is an advantage.
Experience with AWS, particularly Lambdas, or similar technologies is a plus.
Experience with ETL projects is a plus.
Fluent in Russian, with upper intermediate or higher proficiency in English.
Willingness to work in a team and invest in team processes.
Knowledge and acceptance of Agile principles.

What you will do:
Develop and maintain server-side applications using Python and TypeScript.
Build and optimize integrations across various platforms to enhance user acquisition and lead management.
Participate in product development, from clarifying requirements to delivering features to real users.
Work in a cross-functional fast-paced growth team with frontend developers, QA engineers, designers, and product managers using Scrum methodology and pair programming.

What we can offer you:
Relocation to Belgrade, Serbia. Hybrid office in the center of Belgrade if you join us in Serbia.
Employment according to Serbian legislation. Visa support for you and your partner.
Comprehensive medical insurance for you and 80% coverage for your family members (applicable if you join our team in Serbia).
A diverse and tight-knit team. Our teammates are spread across Serbia, the US, Israel, Georgia, Armenia, Latin America, and more. They've worked at all of the big techs, ed-techs, design agencies, and cultural institutions.
Comfortable digital workspace. We use modern digital tools — Jira, Miro, Notion, Google Workspace, Figma, etc. — to make the working together process seamless.
Remarkable work results measured by the percentage of students who find a job after completing one of our courses.",,Full-time,Jakarta,https://id.indeed.com/rc/clk?jk=43ec8178d5308bcc&bb=2wALNLScpdkM3yW9CXyyQXNYISicIaO4gdgZdkt1dMYgHHArsUEqZkpfceNX9mRiuiPHoQdgGEzAdx81zi-kiaeRBMP86GrF_SsHPiTE9sYf0omCgqmGUrcElL_pnoBd&xkcb=SoCp67M38fHbXJw82R0IbzkdCdPP&fccid=b23997f96b43abbb&vjs=3
Adveli,"Software Engineer, Back-End Infrastructure Engineering",Posted 30+ days ago,"We’re looking for several experienced Software Engineers to join us in developing an exciting Enterprise Content Management Software and Web Media Applications.

Responsibilities:

Design core, backend software components

Expert in either of the following languages: Ruby on Rails, Backbone, HTML 5, PHP, Java, etc.

Analyze and improve efficiency, scalability and stability of various system resources

Requirements:

5 – 10 years of experiences in Software Development

Experiences in developing Web Applications in any of the following languages: Ruby on Rails, HTML 5, or PHP

Fluent in at least 2 of the following languages: C++, Java, Python, Perl, or VBS

Experiences with Linux OS and Filesystems

Experiences with Compilers, Distributed Systems, and/or Server Architectures

Job Location:

Hayam Wuruk, Jakarta Pusat 10120

To Apply:

Send your Cover Letter and CV to: info@adveli.com",,,Jakarta,https://id.indeed.com/rc/clk?jk=c26e13d1d52ed1df&bb=2wALNLScpdkM3yW9CXyyQYAfbuKf5gdU4WlQshFy1LIVxxtLyT5Ce6kbCS5b2pE9o8MPlS4BHZgjM-DNuK0VYTzgGrzaiEhFuMIiuCdVjUPr2yi1GG64cgiJATUG1emr&xkcb=SoAn67M38fHbXJw82R0PbzkdCdPP&fccid=f8cd908afe7791e6&vjs=3
TikTok,Backend Engineer Intern - 2024 Start - Indonesia,Posted 30+ days ago,"Responsibilities
TikTok is the leading destination for short-form mobile video. At TikTok, our mission is to inspire creativity and bring joy. TikTok's global headquarters are in Los Angeles and Singapore, and its offices include New York, London, Dublin, Paris, Berlin, Dubai, Jakarta, Seoul, and Tokyo.

Creation is the core of TikTok's purpose. Our platform is built to help imaginations thrive. This is doubly true of the teams that make TikTok possible.
Together, we inspire creativity and bring joy - a mission we all believe in and aim towards achieving every day.
To us, every challenge, no matter how difficult, is an opportunity; to learn, to innovate, and to grow as one team. Status quo? Never. Courage? Always.
At TikTok, we create together and grow together. That's how we drive impact - for ourselves, our company, and the communities we serve.
Join us.

The e-commerce industry has seen tremendous growth in recent years and has become a hotly contested space amongst leading Internet companies, and its future growth cannot be underestimated. With millions of loyal users globally, we believe TikTok is an ideal platform to deliver a brand new and better e-commerce experience to our users. We aim to bring discovery, inspiration, and joy back to shopping by making TikTok the commerce channel of choice for merchants, creators, and affiliates.With millions of loyal users globally, we believe TikTok is an ideal platform to deliver a brand new and better e-commerce experience to our users. We are looking for passionate and talented people to join our product and operations team, to build an e-commerce ecosystem that is innovative, secure and intuitive for our users and brands.

We are looking for talented individuals to join us for an internship in 2024. Internships at TikTok aim to offer students industry exposure and hands-on experience. Watch your ambitions become reality as your inspiration brings infinite opportunities at TikTok.

Successful candidates must be able to commit to an internship from August to December 2024.

Please state your availability clearly in your resume (Start date, End date).

Candidates can apply to a maximum of two positions and will be considered for jobs in the order you apply. The application limit is applicable to TikTok and its affiliates' jobs globally. Applications will be reviewed on a rolling basis - we encourage you to apply early.

Responsibilities:
Engaged in the full development lifecycle designing, developing, testing, deploying, maintaining, monitoring and improving software.
Deploy code daily and use data to drive our decisions, while delivering software and analytics to consumers and dealers.
Collaborate with fellow engineers to solve problems.
Write well formatted modular code.
Compile and integrate changes with the project.
Implement unit tests and functional tests for their tasks.
Convert given high level software design to low level software design.
Use suitable data structures.
Perform, debug and fix bugs, competency in 1 programming language.
Qualifications
Minimum Qualifications
Majoring in Computer Science or related field.
Expertise with Golang or similar object-oriented languages.
Strong understanding of SQL or similar relational databases.
Understanding of how to build high volume, distributed back-end services with latest technologies.
Preferred Qualifications
Experienced with a modern Javascript framework like React.js is a plus.
Experienced with building scalable websites (e-commerce) or large-scale applications.
Possess strong debugging skills.
TikTok is committed to creating an inclusive space where employees are valued for their skills, experiences, and unique perspectives. Our platform connects people from across the globe and so does our workplace. At TikTok, our mission is to inspire creativity and bring joy. To achieve that goal, we are committed to celebrating our diverse voices and to creating an environment that reflects the many communities we reach. We are passionate about this and hope you are too.

By submitting an application for this role, you accept and agree to our global applicant privacy policy, which may be accessed here: https://careers.tiktok.com/legal/privacy.

If you have any questions, please reach out to us at apac-earlycareers@tiktok.com",,Internship,Yogyakarta,https://id.indeed.com/rc/clk?jk=7dc925379741427c&bb=2wALNLScpdkM3yW9CXyyQd8ljdXhIeE2jqq40Uv4N-2Q45kL4q5RuilXL0ASAI04WpYpjkkhRIVEc85RMnyU18oxuCEWpcQ60tZ9j3vestLCWPZ6aswBTOxw8_NKX5w9&xkcb=SoCT67M38fHbXJw82R0ObzkdCdPP&fccid=caed318a9335aac0&vjs=3
Kredivo Group,Backend Engineer - Transaction (SDE 3),Active 3 days ago,"Design and implement backend services for various FinAccel lending platforms like Kredivo.
Work with the Product, Business and Sales teams to gather and understand requirements and deliver scalable solutions.
Write high quality, maintainable code.
Own parts of the system and continuously work to improve them in an agile environment.
Benchmarking, load testing, diagnosing problems and helping create solutions.
Research and implement modern frameworks and technologies for back-end systems.
Participate in design discussions, reviews and propose/implement solutions to technical problems and challenges.",,Full-time,Jakarta,https://id.indeed.com/rc/clk?jk=45e861614dd69a38&bb=2wALNLScpdkM3yW9CXyyQcO7zeQh1i2HuTzavAFCemyz114ZXl4ZLykJTBPwpuK7mYpOoKIz_JLU1UFit4c7iorHeWnpbFBaw1Z0tM8rG-DSy9PfmBFC9H7oF_MxVhuB&xkcb=SoAO67M38fHbXJw82R0NbzkdCdPP&fccid=9b6381bd7b084eeb&vjs=3
EY,Backend Engineer - Junior or Senior Consultant,Posted 2 days ago,"About EY:

EY, a global leader operating in more than 150 countries delivers unparalleled service in Consulting and assists clients to transform and upskill their capabilities.

We serve our clients to build a better working world, helping them to create long-term value for people and society and build trust in the capital markets. That starts with a culture that believes in giving you the training, opportunities, and creative freedom to make things better. Whenever you join, however long you stay, the exceptional EY experience lasts a lifetime. And with a commitment to hiring and developing the most passionate people, we work towards our ambition to be the best employer.

EY advises clients to understand, architect, select and implement bleeding-edge solutions required to efficiently run their businesses, with a focus on Digital and Cloud. These service areas span E-commerce, Solution Architecture, Mobile Applications, Digital Platform Architecture, Digital Technology Strategy, and Digital IT Operations.

The exceptional EY experience. It’s yours to build.

The opportunity:
The Digital & Emerging Technology team works collaboratively with clients to transform their business through disruptive innovation enablement and transformational design solutions. The team supports our clients in modernizing systems, processes and products to enhance business and customer-facing platforms and services to support high performance in a rapidly changing and competitive environment. Our team helps clients sustain competitive advantage and profitability by developing technology strategies, products, and solutions to stay ahead of the rapid pace of change and disruption and supporting the execution of complex transformations.
We're seeking a highly skilled and experienced Backend Engineer to join our dynamic team. In this role, you will play a crucial role in designing, developing, and maintaining scalable and high-performance backend systems. You will collaborate with cross-functional teams, including front-end developers, product managers, and QA engineers, to deliver robust and efficient solutions. While our teams primary focus is within the financial services industries, you will have opportunities to support other sectors including healthcare, automotive, high-tech, and media.
Your key responsibilities:
The goal is to support our clients to transform their business through technology. As a Backend Engineer you will be collaborate with cross-functional teams to define, design, and ship new features, identify and address performance bottlenecks in the backend systems, design and optimize database schemas, develop and maintain RESTful APIs for seamless communication between front-end and back-end systems, write unit tests and participate in code reviews, collaborate with technical writers to create user and developer documentation, and operating your team's software systems in a consistently high quality manner. When working on the systems within your team's domain, you take into account the appropriate architectural patterns, code design, and infrastructure options, ensuring that you deliver a system that is secure, reliable, maintainable, extensible and very well tested. Beyond delivery to the production system, engineers will be responsible for post deployment monitoring as well.
In addition to being trusted to operate independently, you also maintain a good partnership with your technical and non-technical stakeholders for projects that you are involved in. You take an active role in your projects as a team member involved in product design to rollout, taking ownership of your work and constantly focusing on moving these projects forward.
Being an experienced team member, you are also expected to continuously help the team grow and improve either by mentoring new or junior members of your team or by introducing and adopting process improvements.

Requirements:
Bachelor's degree (Computer Science, Computer Engineering or Mathematics) or related experience
1-3 years of Development experience
Strong knowledge of algorithms and data structures
Fluency in developing and understanding sequence diagrams, class models, etc.
Strong proficiency in programming languages such as Java, C# .Net, or Golang.
Solid understanding of database systems, both relational and NoSQL.
Strong in fundamental programming like SOLID Principle, Clean Architecture or related fundamental knowledge and practices
Experience in writing maintainable and testable code, including API design, unit testing and UI testing techniques.
Experience working in an Agile/Scrum development process.
Humble and hungry engineer. Always curious, always looking for a better way
Highly accountable and takes ownership of one's own work.

For senior software engineer:
4+ years of professional backend software development experience
Experience with Event-Driven Architecture such as Kafka or RabbitMQ
Familiarity with cloud services (e.g., AWS, Azure, Google Cloud).
Knowledge of containerization and orchestration tools (e.g., Docker, Kubernetes).
Possess excellent communication, sharp analytical abilities with proven design skills, able to think critically of the current system in terms of growth and stability
Ability to understand business requirements and translate them into technical requirements
Familiarity with modern build pipelines and tools
Identify and resolve performance and scalability issues

What we look for
We’re interested in passionate individuals with a strong vision and a desire to stay on top of trends. If you have a genuine passion for helping businesses achieve their full potential, then these role(s) are for you.

What we offer
Continuous learning: You’ll develop the mindset and skills to navigate whatever comes next
Success as defined by you: We’ll provide the tools and flexibility, so you can make a meaningful impact, on your way
Transformative leadership: We’ll give you the insights, coaching, and confidence to be the leader the world needs
Diverse and inclusive culture: You’ll be embraced for who you are and empowered to use your voice to help others find theirs

If you can demonstrate that you meet the criteria above, please contact us as soon as possible.

EY is an equal opportunity, affirmative action employer providing equal employment opportunities to applicants and employees without regard to race, color, religion, age, sex, sexual orientation, gender identity/expression, national origin, protected veteran status, disability status, or any other legally protected basis, including arrest and conviction records, by applicable law.

EY is committed to providing reasonable accommodation to individuals with special needs. If you are a qualified individual with special needs and need assistance applying online or need to request an accommodation during the interview process, please speak to our HR executives, and we will be happy to help you.",,,Jakarta,https://id.indeed.com/rc/clk?jk=a4a22de919008602&bb=2wALNLScpdkM3yW9CXyyQeNpIS6sI05pAFRFjbe-e13MJfb3D6pNAfDoiUDnvPoVFlsj3CORMK2-gO8L-Fh1ZHT28zc9LcPGYMH3LtduCQEInPH2Ab6UVqVL0nonHrNB&xkcb=SoC667M38fHbXJw82R0MbzkdCdPP&fccid=1544766d4c2915b0&vjs=3
Mekari (PT. Mid Solusi Nusantara),Software Engineer 2 - Backend,Active 6 days ago,"Mekari is Indonesia's no. 1 Software-as-a-Service (SaaS) company. With our ecosystem of software solutions—including Mekari Jurnal, Mekari Talenta, Mekari Qontak, and Mekari Flex, we aim to facilitate entrepreneurs and leaders as they accelerate the digital transformation of their businesses.
In our 10+ years of journey we have reached over 1 Million platform users, and we're not planning to stop any time soon. We need more people like you: builders and owners with calculated ambition who are eager to grow and create their #BiggestImpact.
Job Descriptions:
Design and develop scalable software products that will impact thousands of businesses and millions of users
Write clear, concise source-code, unit, and integration tests
Develop both back-end and front-end components, and connect the application with the other (often third-party) web services
Work closely with Product Manager and other business stakeholders to develop solutions that delight our customers
Work with Technical Program Manager to run development lifecycle (concept, design, test, release, support)
Work closely with DevOps to maintain the application in our infrastructure
Requirements:
Minimum 3-year experience in SaaS, Fintech or related tech company
Experience in Go/Ruby programming language. Experience or exposure in other programming languages is a plus.
Good understanding of modern software engineering practices such as TDD, continuous integration, code review, and microservices design patterns
Familiarity with software development methodologies and frameworks such as Agile or Scrum
Excellent communication skills, written and verbal, with a focus on collaboration, understanding, and information sharing between team members and stakeholders
Our team will review your application and will be in touch if your application is shortlisted to the next stage. If you do not hear from us in 30 days, we will keep your resume on file in case a relevant opportunity opens up.
Don't forget to check our Recruitment FAQ at bit.ly/RecruitmentFAQ-Mekari [ENG] or bit.ly/RekrutmenMekari-FAQ [INA] to find the answers to commonly-asked questions regarding our recruitment process.
We wish you the best. Hope to see you around soon!",,,Jakarta,https://id.indeed.com/rc/clk?jk=c3d42575449c6274&bb=2wALNLScpdkM3yW9CXyyQWiaFGfm08i9NUH1KXemtmyTZJPSXPgb6m0YT7Y7wLfL-G9pM6-LrsyQXg-sKf7Hv0TDvCE4ztM8tiySkRLNfdIB41O15agack9yWPCHJ-oz&xkcb=SoBT67M38fHbXJw82R0DbzkdCdPP&fccid=1ab920afc43e1f08&vjs=3
PT IONPay Networks (NICEPAY),PT IONPay Networks (NICEPAY) visibility public,Posted 5 days ago,"NICEpay is an Internet Payment Gateway Provider which brings you a reliable technical support and proven expertise in local system integration, empowering merchant boarding, and maintenance. We are empowering merchant to secure its e-commerce revenue streams from anywhere in the world with our enhanced Fin-Tech solution. We are IT company working with banks and online merchant in delivering Internet Payment Gateway Solution for your e-commerce business.
Developing and implementing highly-responsive user interface

Contribute and maintain Engineering Documentation

Coordinate and align with stakeholders

Troubleshooting interface software and debugging application codes

Create quality mockups and prototypes on tight timelines

Keep up with latest technology and industry best practices and adapting them

Deliver code with high quality standard
More than two years experience as Frontend Developer

Solid understanding of Javascript & Typescript

Having solid experience with frontend framework such as React/Angular

Experience in integrating frontend to API backend

Good understanding of UI/UX Principles

Familiar with Cross-Browser Development and Responsive Design

Friendly, discipline, team player and tough personality

Have good initative and problem solving mindset",,Full-time,Jakarta,https://id.indeed.com/rc/clk?jk=e0ee4372cc049912&bb=2wALNLScpdkM3yW9CXyyQZ1Jq1UgvrqAeFQIVWvxJXTX4osxBioxvZC2NBFgPlaO1XEcJudRx5F_zMO1Qgm62sXmRuaGmv11ISwYLH8JEkO8qXrYvOOLgD4P8Bg5A4-i&xkcb=SoDn67M38fHbXJw82R0CbzkdCdPP&fccid=55881fc6c0d15fa5&vjs=3
GudangAda,Software Engineer (Front End),Posted 30+ days ago,"Job Description

Job Description
Our Tech & Product team members hail from the top company working experiences such as Facebook, Google, Amazon, Uber, Twitter, and Traveloka.
Responsibilities:
You'll brainstorm with Product Managers, Designers, and Backend Engineers on your team to conceptualize and build new features for GudangAda large (and growing!) user base.
You’ll produce high-quality results by contributing heavily to team projects that have a significant impact on the business.
You’ll actively own team features or systems and define their long-term health, while also improving the health of surrounding systems.
You'll assist our skilled support team and operations team in triaging and resolving production issues.
You'll mentor other engineers and deeply review code.
You’ll improve engineering standards, tooling, and processes
Tech stack that we use:
Reactjs
NextJS
Typescript
Redux: Library
TailwindCSS
Material UI: Design System

Qualifications

We are looking for someone with:
Deep passion for software engineering with an excellent understanding of software engineering concepts, design patterns, and algorithms.
You can contribute to technical architecture discussions and help drive technical decisions within your team.
You write understandable, testable code with an eye towards maintainability.
You are a strong communicator. Explaining complex technical concepts to designers, support, and other engineers is no problem for you.
You possess strong computer science fundamentals: data structures, algorithms, programming languages, distributed systems, and information retrieval.
You have completed a bachelor's degree in Computer Science, Engineering or related field, or equivalent training, fellowship, or work experience.

Additional Information

What will you get on working at GudangAda?
Competitive salary
Learning experience
Personal Growth
Impact at scale
Mentorship from a world-class team",,Full-time,Jakarta,https://id.indeed.com/rc/clk?jk=e882fbd287ccb124&bb=2wALNLScpdkM3yW9CXyyQd3_bfQyP_wezFRPA6Yv8s26hY1wMObfu134QaC4yaw56bT0Jz4aqnHGZ-xebrJePFiQa-9UDzc_m7vQvyBCVpklwMOLxarBw5mvsXwopUIk&xkcb=SoB667M38fHbXJw82R0BbzkdCdPP&fccid=e2d6af177a54729a&vjs=3
