Company Names,Job Titles,Posted On,Job Details,Images,Type Location,Locations,Link
WovV Technologies,MDM Developer,Posted 30+ days ago,"Locations: All Metro Cities/ Chennai/ Mumbai/ Vadodara / Remote
Job Summary:
WovV Technologies, Global Business Productivity SaaS Company, is hiring MDM Developer for Remote locations.
Experience: 7 to 10 years
Work Mode: WFH
Mandatory Technology:
Profisee front-end and backend scripts, MDM Tool, Informatica, Reltio, SQL or Oracle, C#, .Net
Key Roles and Responsibilities:
Maintain and configure Profisee front-end and backend scripts support MDM production domains.
Knowledge in C# coding and Dot Net experience.
Design, develop, test, and deploy new scripts as needed in support of existing domains or new projects.
Maintain and enhance Profisee workflows.
Analyze and advice onshore team on MDM related queries raised by business
Analyze end users’ data needs and develop user-oriented solutions which interface with existing applications.
Coordinate all aspects of implementation and training to support new domain implementations (ex. Product domain)
Provide input to Business Analyst(s) to assist continuous improvement of MDM solution and correct scripts as needed in response to tickets raised by the business users.
Recognize processing/programming inefficiencies and recommend improvements.
Perform other duties as assigned either by offshore lead or client team.
Requirements:
Bachelor’s degree in MIS, Computer Science, or related field
Knowledge of, and skill in applying software design principles, methods, and approaches
Knowledge and experience (minimum 2 to 4 years) in MDM tool. Preference is knowledge of Profisee tool but Informatica, Reltio and other tools acceptable option.
Understands the concepts of MDM including golden record, de-duplication, matching rules etc.
Good knowledge of Data Quality concepts and some experience with a Data Quality tool.
Good knowledge and experience in SQL either SqlServer or Oracle.
Principles, methods, and procedures for designing, developing, optimizing, and integrating new and/or reusable systems components.
Familiarity with all aspects of data processing and management information systems and interrelations
Exceptional attention to detail, organizational skills & problem-solving abilities
Ability to work independently and in a team environment with varying levels - team members, peers, management, and business stakeholders.
Experience clearly describing, summarizing, and documenting how work was performed.
Proven experience meeting deadlines and complying with Service Level Agreements (SLAs) while working with confidential information.
Ability to handle multiple tasks.
Excellent problem resolving skills.
Excellent organizational skills.
Previous Internship experience and/or knowledge of python or Data warehousing a bonus
Perks and Benefits:
WFH
Flexibility in timings
5 Days working
Team Outing
Performance Bonus
Employee reference bonus policy
Exciting career path with an exponentially growing company
Fun activities
Deserving compensation
To Apply send your CV to Happy2Connect@WovVTech.com",,,Metro,https://id.indeed.com/rc/clk?jk=579b5ce3f7c88c81&bb=QeempWQW9YAyJBq_AViQaN3NjRniMypsngiXmgGJYfggBK3ZBLXllf6VU0qf2gGn3ME7W0W1COxeSJ7u9TjewrXNSn6oG78n4eLTLAdNc7j4aLbrYb-Gk4r7OkAf2pq9&xkcb=SoDU67M38fZ98yAAl70IbzkdCdPP&fccid=5c4ea3c30ac35dd5&vjs=3
PAN ASIA SOFTWARE SOLUTIONS SDN BHD,Immediate Opening for Nodejs Developer,Posted 26 days ago,"We have an Immediate Openings for NodeJs Developer with our reputed Client.
Work Location: Remote
Exp: 6+ years (NodeJS)
Job Responsibility:
Bachelor's degree in Computer Science, Engineering, or a related field (Master's degree preferred)
6+ years of experience in backend development using Node.js
Proficiency in JavaScript/TypeScript and knowledge of modern JavaScript frameworks/libraries
Experience with relational databases e.g., MsSQL Server
Strong understanding of microservices architecture and RESTful API design principles
Nice to have experience with containerization and orchestration tools such as Docker and Kubernetes
Familiarity with cloud platforms such as AWS, Azure, or GCP
Excellent problem-solving and analytical skills
Strong communication and collaboration skills
Ability to work effectively in a fast-paced, dynamic environment
Proficiency in using process management tools such as PM2 for monitoring, managing, and scaling Node.js applications in production environments
Familiarity with popular Node.js libraries and frameworks such as Express.js, Socket.IO, Koa, Nest.js, or Hapi.js
Experience with authentication and authorization mechanisms such as JWT, OAuth, or Passport.js
Knowledge of asynchronous programming and handling of asynchronous operations in Node.js using Promises, async/await, or callbacks
Understanding of event-driven architecture and proficiency in using EventEmitter and other event-driven patterns in Node.js applications
Experience with testing frameworks such as Mocha, Chai, Jest, or Jasmine for writing unit tests, integration tests, and end-to-end tests for Node.js applications
Understanding of security best practices and techniques for securing Node.js applications against common vulnerabilities such as SQL injection, XSS, CSRF, and DDOS attacks
Familiarity with DevOps practices and tools for CI/CD pipelines, automated deployments, and infrastructure as code (IaC) using tools such as Jenkins, GitLab CI/CD, CircleCI, or Travis CI
Understanding of WebSocket protocols and proficiency in using WebSockets for real-time communication in Node.js applications.
Interested Share your updated resume with Photo to or Watsapp: +60 165720562 along with below details
Current Salary:
Expected Salary:
Notice Period:
Total Exp:
Relevant Exp:
{Note: if it doesn't suit you, please refer your matching friends or kindly ignore it}
Senior IT Talent Acquisition Specialist
HP : +6016 572 0562
Job Type: Full-time",,Full-time,Jakarta,https://id.indeed.com/rc/clk?jk=7b99168195ff9c2f&bb=QeempWQW9YAyJBq_AViQaGoEq6ImjCZ3nxy6HBIDsbhMpz4El2pOCsFnOnXd3_UdR-erIpP19tEsIMhN1frd4Vn-c1r0sDrTJdii7xOyKugvrZ9nMpE0cOfcvHBjApaW&xkcb=SoBa67M38fZ98yAAl70PbzkdCdPP&fccid=3c6c88f8bb40dd64&cmp=PAN-ASIA-SOFTWARE-SOLUTIONS-SDN-BHD&ti=Developer&vjs=3
PT Akhdani Reka Solusi,PT Akhdani Reka Solusi visibility public,Posted 30+ days ago,"PT. Akhdani Reka Solusi (ARS), merupakan perusahaan software khususnya pengembangan software, datawarehouse, maintenance, system integration dan konsultan.

Job Description:
Coding dan Debugging

Melakukan pengujian modul yang dikembangkan

Mengelola database

Mempersiapkan environment server

Deploy source code dan databas
PT. Akhdani Reka Solusi membuka lowongan Software Engineer, full time dengan kualifikasi sebagai berikut:

Pendidikan minimal S1 dari Jurusan Teknik Informatika, Ilmu Komputer, Sistem Informasi, dan sejenisnya

Memahami konsep dasar pemrograman

Menguasai dan berpengalaman dalam proyek iOS menggunakan Objective-C dan atau Swift

Menguasai pemrograman backend : Java, PHP.

Memahami konsep basis data dan menguasai SQL

Menguasai pembuatan API / SOAP Web Service

Nilai tambah : Menguasai ISO 8583

Nilai tambah : Menguasai Jurnal transaksi perbankan secara umum, khususnya untuk Teller dan DPK.

Mau dan mampu belajar hal-hal baru dengan cepat

Memiliki kemampuan komunikasi yang baik

Mampu bekerja dalam team maupun individu

Bersedia kerja onsite di kantor client di Jakarta

Bersedia WFO-WFH tergantung kebijakan di kantor client

Bersedia mengikuti tes masuk dan wawancara

Calon iOS Developer yang terpilih berdasar CV selanjutnya akan mengikuti test dalam tahapan - tahapan sebagai berikut :

Tahap 1 : Test basic pemrograman via Google Form dan video call (Google Meet). Jika lolos akan dipanggil ke tahap berikutnya

Tahap 2 : Test advanced programming untuk yang lolos test tahap 1 (Take Home Test). Peserta mengerjakan soal test di rumah dan mempresentasikan hasilnya di waktu yang ditentukan.

Interview User : Wawancara dilakukan oleh user.

Setelah lulus interview, calon programmer akan menjalani :
Probation . Proses pembelajaran calon programmer Akhdani untuk memastikan kesesuaian kapasitas kerja, adaptasi, kemampuan belajar dan kecocokan culture untuk bekerja di Akhdani. Durasi probation adalah 3 bulan. Selama probation, calon programmer menerima 80% dari gaji bulanan yang disepakati.

Pengangkatan Pegawai. Bagi yang lolos probation akan diangkat sebagai pegawai tetap atau pegawai kontrak berbasis waktu, tergantung hasil evaluasi masa probation.

Lokasi penempatan:
Kantor client (on-site) di Jakarta Pusat.

Terima Kasih",,Full-time,Jakarta,https://id.indeed.com/rc/clk?jk=f3b20021683a3161&bb=QeempWQW9YAyJBq_AViQaGoEq6ImjCZ31MDl5JdvzCaYObhVdB-GPjmwF3DT4dJifTJ8dY6rWh0z-Pg5VRVwg7HHIHn0-yZzYxs02H2hSfXxLN4SfqVUXWmuWdS9umXm&xkcb=SoDu67M38fZ98yAAl70ObzkdCdPP&fccid=4768f4191e6881f3&vjs=3
Mekari (PT. Mid Solusi Nusantara),Community Associate,Posted 30+ days ago,"Mekari is Indonesia's no. 1 Software-as-a-Service (SaaS) company. With our ecosystem of software solutions—including Mekari Jurnal, Mekari Talenta, Mekari Qontak, and Mekari Flex, we aim to facilitate entrepreneurs and leaders as they accelerate the digital transformation of their businesses.

In our 10+ years of journey we have reached over 1 Million platform users, and we're not planning to stop any time soon. We need more people like you: builders and owners with calculated ambition who are eager to grow and create their #BiggestImpact.
Job Descriptions:
Develop and implement strategic plans for community programs (loyality program, gamifications, etc) and partnerships in alignment with organizational goals and objectives.
Lead the design, implementation, and evaluation of community programs and initiatives, ensuring they effectively address the needs of the target audience.
Build collaboration and Identify partnership opportunities for funding, supporting events, or in-kind collaboration for Community Mekari and establish relationships with partners to support mutual objectives.
Monitor and track program metrics, analyze data, and prepare regular reports to assess program effectiveness and inform decision-making.
Stay informed about community trends, issues, and opportunities to identify areas for collaboration and innovation.
Working closely with internal stakeholders to enhance community programs and supporting core functions
Maintain community special project (customer advisory board and buddy program) and Involve in Community Plan and Operational Event
Requirements/Qualifications:
Bachelor's degree in Marketing, Communications, Social Science or related field
Excellent communication skills, including the ability to articulate ideas clearly, negotiate effectively, and build consensus among stakeholders
Strategic thinker with the ability to develop and execute comprehensive plans to achieve program goals and objectives.
Min 1-2 years of experience working in community program or partners field
Responsible, reliable, self-motivated, and possess excellent time management skills.
ideally have community experience, good understanding of community metrics
Experence in create community program, loyalty program, gamification, and engagement activities
Having Experience in event planning and operations is a plus
Demonstrated success in building and managing partnerships with diverse stakeholders, including community organizations, government agencies, corporate partners, and donors.
Strong project management skills, including the ability to manage multiple priorities, meet deadlines, and adapt to changing circumstances.
Analytical mindset with proficiency in data analysis and reporting to measure program impact and effectiveness. Have an ability to use excel and familiar with data management.
Having a sense of initiative and experience working with cross-functional teams
⁠
Have Experience with administering the backend for digital products is a plus (e.g CRM)

What You Will Get:
1. Competitive salary + daily allowance.
2. Premium private health insurance (outpatient, inpatient, maternity, dental).
3. Early access to salary + flex installment (employee loan) via Mekari Flex.
4. Allowance for sports activities and glasses/contact lenses.
5. Flexible working hours and remote work culture with free co-working space services.
6. Annual and unpaid leaves from day 1 of join date + unlimited sick leave with doctor note.
7. Notebook Ownership Program.
8. Strategic office location, accessible by MRT.
9. Friendly and dynamic work environment.
10. Opportunity to take part in growing Indonesia's no. 1 SaaS company
Our team will review your application and will be in touch if your application is shortlisted to the next stage. If you do not hear from us in 30 days, we will keep your resume on file in case a relevant opportunity opens up.

Don't forget to check our Recruitment FAQ at bit.ly/RecruitmentFAQ-Mekari [ENG] or bit.ly/RekrutmenMekari-FAQ [INA] to find the answers to commonly-asked questions regarding our recruitment process.
We wish you the best. Hope to see you around soon!",,,Jakarta,https://id.indeed.com/rc/clk?jk=1cf4ea657c1506d5&bb=QeempWQW9YAyJBq_AViQaMRmwk4e2Vs2L2icLQRZIHlay4Cj4Pq9PL5wI7tyMiCW49y5PBlq_tyw5Wx_L57dEiqfheG54lfcBxwf8sy_d8iYJao2MhRQ9cRTRjC75QCs&xkcb=SoBz67M38fZ98yAAl70NbzkdCdPP&fccid=1ab920afc43e1f08&vjs=3
Mekari (PT. Mid Solusi Nusantara),Software Engineer 1 - Fullstack,Posted 30+ days ago,"Mekari is Indonesia's no. 1 Software-as-a-Service (SaaS) company. With our ecosystem of software solutions—including Mekari Jurnal, Mekari Talenta, Mekari Qontak, and Mekari Flex, we aim to facilitate entrepreneurs and leaders as they accelerate the digital transformation of their businesses.
In our 10+ years of journey we have reached over 1 Million platform users, and we're not planning to stop any time soon. We need more people like you: builders and owners with calculated ambition who are eager to grow and create their #BiggestImpact.
Job Descriptions:
Design and develop the product that will impact thousands of businesses and millions of users
Work closely with Product Manager and other business stakeholders to develop solutions that delight our customers
Work with Technical Program Manager to run development lifecycle (concept, design, test, release, support)
Work closely with DevOps to maintain the application in our infrastructure
Requirements:
Minimum 1-year experience in SaaS, Fintech or related tech company
Experience in Ruby or other relevant programming languages (backend) and Vue.js (frontend)
Good understanding of modern software engineering practices such as TDD, continuous integration, code review, and microservices design patterns
Familiarity with software development methodologies and frameworks such as Agile or Scrum
Excellent communication skills, written and verbal, with a focus on collaboration, understanding, and information sharing between team members and stakeholders
Our team will review your application and will be in touch if your application is shortlisted to the next stage. If you do not hear from us in 30 days, we will keep your resume on file in case a relevant opportunity opens up.
Don't forget to check our Recruitment FAQ at bit.ly/RecruitmentFAQ-Mekari [ENG] or bit.ly/RekrutmenMekari-FAQ [INA] to find the answers to commonly-asked questions regarding our recruitment process.
We wish you the best. Hope to see you around soon!",,,Jakarta,https://id.indeed.com/rc/clk?jk=a0f16731ee8543dd&bb=QeempWQW9YAyJBq_AViQaAYnH_0eoAOBqrfUxhGhsbLegsyLW0Y66xWns0Qs13GMG824J0iL9Y588ZgByDWVDvzvI5aLwIAKmMao2ycKHh-jN2agwN6FIXjbJQlJfSqH&xkcb=SoDH67M38fZ98yAAl70MbzkdCdPP&fccid=1ab920afc43e1f08&vjs=3
Transcosmos Indonesia,Transcosmos Indonesia visibility public,Posted 14 days ago,"Welcome to transcosmos Indonesia where we redefine possibilities and empower businesses to thrive. As a global digital transformation partner, we specialize in delivering exceptional services that drive cost optimization and elevate customer experiences to new heights.

At transcosmos Indonesia, we excel in two key areas: elevating customer experiences and optimizing corporate infrastructure. With a holistic approach, we take swift and effective actions that encompass digital promotion, EC operations, and online services.

Additionally, we extend our expertise to your internal operations, digitally transforming processes such as IT helpdesk support, back-office operations, and invoice and procurement procedures. This integrated approach ensures a streamlined corporate infrastructure, unlocking new levels of efficiency and productivity. Together, we deliver exceptional experiences and driving sustainable growth for your business.
Work with development teams and product managers to ideate software solutions.

Design client-side and server-side architecture.

Build the front-end of applications through appealing visual design.

Develop and manage well-functioning databases and applications.

Write effective APIs.

Test software to ensure responsiveness and efficiency.

Troubleshoot, debug and upgrade software.

Create security and data protection settings.

Build features and applications with a mobile responsive design.

Write technical documentation

Work with data scientists and analysts to improve software.
Proven experience as a Full Stack Developer or similar role.

2+ years of experience as an Full stack backend Dev.

Experience developing desktop and mobile applications.

Familiarity with common stacks.

Knowledge of multiple front-end languages and libraries (e.g. HTML/ CSS, JavaScript, XML, jQuery).

Knowledge of multiple back-end languages (e.g. C#, Java, PHP, Python) and JavaScript frameworks (e.g. Angular, React, Node.js).

Familiarity with databases (e.g. MySQL, MongoDB), web servers (e.g. Apache) and UI/UX design.

Excellent communication and teamwork skills.

Great attention to detail.

Organizational skills.

An analytical mind.",,,Jakarta,https://id.indeed.com/rc/clk?jk=c12b4ff4c049afc2&bb=QeempWQW9YAyJBq_AViQaJeyfDhs8YmKVCk0rjTm6mS-_GEzcL3ECNJ4IjEA4Up90B_IGS_tN-DmHoMOpSXCQBf12C7YwuYVuhovDusTirQLOjo0GoJCuAF29RGuV8kw&xkcb=SoAu67M38fZ98yAAl70DbzkdCdPP&fccid=4ffb8c2bd833d60b&vjs=3
Bravo Boss Website Design and Development Agency,Full Time Senior Java Developer with CMS experience,Posted 30+ days ago,"Informasi Lowongan
Tipe Pekerjaan

Remote/On-site

Fungsi Pekerjaan
Backend Developer
Jenjang Karir
Staf Senior
Job Deskripsi
Bravo Boss has been partnering with the world's top B2B and B2C brands, delivering marketing and technology solutions that significantly enhance business outcomes. Our approach combines human-centric design with data-driven insights, facilitated by our position within a leading global media and content company.
Looking for a candidate who also has strong experience in CMS and Java development and can move seamlessly between UI and Backend work.
Job:
Develop Java code for high-visibility marketing and eCommerce websites.
Lead the design, development, coding, and testing of complex technical solutions within our Java code and CMS (content management system).
Play a key role in application development teams, ensuring timely completion of assignments and high-quality deliverables.
Collaborate closely with Technical Managers to estimate and schedule tasks, report on progress, and identify any issues.
Participate fully in all Scrum processes, including planning, daily stand-ups, and retrospectives.
Innovate and maintain functionality, troubleshoot and resolve issues, and oversee deployment processes across various projects.
Work collaboratively with cross-functional teams to ensure scalable, reliable performance of Java and CMS-based solutions and engage in all phases of the development lifecycle.
Provide high-level problem-solving and technical leadership, ensuring the integration of best practices throughout the development process.

Our Mission & Values
At Bravo Boss Indonesia, our mission is to transform experiences, focusing on a human-centric future that improves the world for everyone. Our culture is guided by values of kindness, candor, and community — prioritizing collective success over individual achievement.
Benefits
Competitive salary range
Comprehensive benefits package including health insurance, generous PTO, paid holidays, family leave, and more.
Opportunities for professional growth and development in an innovative and supportive environment.
Job Type: Full-time
We value diversity and are committed to creating an inclusive environment for all employees.

If you are passionate about making a significant impact through technology, apply today to join our forward-thinking team at Bravo Boss Indonesia.
Persyaratan
Tingkat Pendidikan
Apa Saja
Jurusan Pendidikan
Semuanya
Minimal Pengalaman
3 tahun
Deskripsi Persyaratan
Who You Are
Java (3+years)
CMS (3+years)

A seasoned developer with at least 3+ years of experience in building websites, APIs, or microservices, particularly in Java and CMS.

Proficient with open-source Java frameworks, especially Spring, and skilled in using CMS.
Capable of working with SQL and NoSQL databases and integrating APIs with CMS platforms.
Experienced in cloud platforms like AWS and continuous integration technologies such as Maven, Docker, Jenkins.
Skill yang Dibutuhkan
Lokasi
Kota
Surabaya
Alamat
Jalan Embong Gayam Nomor 2A Surabaya 60271 Jawa Timur

Tentang Perusahaan
Bravo Boss Website Design and Development Agency

Industri
Konsultan (IT, IPTEK)
Benefit
Deskripsi Perusahaan
Bravo Boss adalah perusahaan teknologi informatika est. 2010 yang memberikan servis pembuatan website, eCommerce (toko online), custom web apps (SaaS application), mobile application (iOS dan Android) dan digital marketing untuk bisnis around the world. Perusahaan kami berbasis di Malang dan Surabaya. Bravo Boss mendapatkan banyak project unik dari klien around the world, sehingga project selalu fun dan challenging. Anda akan dapat terus belajar sesuatu yang baru yang akan meningkatkan skill dan knowledge, sehingga job performance semakin meningkat dan proses penyelesaian project semakin efektif dan efisien. Hal ini tentunya akan meningkatkan base salary dan bonus performance anda. Kami menghargai tim yang dapat berkreatifitas dan berinovasi di suatu project.",,Full-time,Surabaya,https://id.indeed.com/rc/clk?jk=d2471deafeda582d&bb=QeempWQW9YAyJBq_AViQaLIvT0F8UC_pFlaEVyhRWu5KKfAC1OMTt0vMLpzZH-tPqF9bmvFRv2h_7pL1seyRCCKl0lEyLjxpvLSa5P0x1Xq1AImYRdIz-AWufz1lobam&xkcb=SoCa67M38fZ98yAAl70CbzkdCdPP&fccid=dd616958bd9ddc12&vjs=3
