Company Names,Job Titles,Posted On,Job Details,Images,Type Location,Locations,Link
Wowrack,Back End Developer,Posted 30+ days ago,"Software Engineer
Developing and maintaining scalable and robust backend services
Job Descriptions
Maintaining existing production codes.
Documenting applications including flow chart, data tables, etc.
Collaborate with other engineers to ensure effective development process.
Interacting with client to understand their needs.
Stay up-to-date on emerging technologies.
Qualification
Holds a Diploma/Bachelor Degree, preferably from IT fields
Have proven years of working experience in web programming
Strong understanding and application of Python, PHP, MySQL, Linux, and Apache/Nginx
Strong understanding and application of HTML, CSS, and jQuery.
Strong understanding and application RESTful API and JSON/ XML
Must have an experience in using frameworks such as Yii/Ci/Laravel
Proficiency in version control systems such as Git
Good in database design",,,East Java,https://id.indeed.com/rc/clk?jk=aff1cac2a018d658&bb=-shAXu03fYr6EgyacqCTs9ouNFiZUmdchXkq6YqNBjh7oQhAj0Xzv3LHCPiayZ9ntXtRLknypsVQ2um8CzBOC8BDQjQpfjCLdiGbBw7bPzw3v_s_BQHa9kwvrnko4vkV&xkcb=SoBl67M38fY8wQAAl70BbzkdCdPP&fccid=ea885c2bcc4f320c&vjs=3
PT Green City Traffic,Backend Developer (Node.js),Posted 6 days ago,"We are seeking a skilled Backend Developer with extensive experience in Node.js development to join our team. The ideal candidate will have a strong background in building ERP systems and a passion for developing robust, scalable backend solutions.

Responsibilities
Design, develop, and maintain backend services and APIs using Node.js
Collaborate with frontend developers, designers, and product managers to deliver high-quality ERP solutions
Architect scalable and maintainable code structures to support our growing user base
Implement integrations with third-party systems and services as needed
Optimize application performance and reliability through code improvements and infrastructure enhancements
Participate in code reviews, team meetings, and agile development processes

Bachelors degree in Computer Science, Engineering, or related field (or equivalent work experience)
Minimum 3 years of professional experience in backend development with Node.js
Proven track record of building and maintaining ERP systems or similar enterprise applications
Strong understanding of software architecture principles and design patterns
Experience with relational databases such as MySQL, PostgreSQL, or similar
Familiarity with NoSQL databases such as MongoDB is a plus
Proficiency in RESTful API design and implementation
Solid understanding of version control systems, particularly Git
Excellent communication skills and ability to work effectively in a collaborative team environment
Working Days : Mon-Sat (Full WFO)
Placement : Haji Nawi, Jakarta Selatan
""Waspada terhadap Modus Penipuan pada saat proses interview. Perusahaan tidak akan memungut biaya apapun dalam melakukan proses interview. Mohon segera melaporkan ke kami, jika pada saat Anda diundang untuk interview dan diminta untuk melakukan pembayaran dengan sejumlah uang.""
""Please be aware of the Fraud Company. The company will never be collecting any payment in the process of interview. Please immediately report to us if there's any companies that collecting payment to the Jobseekers.""",,Full-time,Jakarta,https://id.indeed.com/rc/clk?jk=f8bb89cc6887cf58&bb=-shAXu03fYr6EgyacqCTs5Sgdre06yrktEZknumkZNRJ60TEw8Af7W7pp5qTOPDMuXgrE6Yg9iivb6NJZzHZGfNYHHa4nCuSn3Z8qHdh978IYYGAv5LE6wvGWJOLi8yh&xkcb=SoDR67M38fY8wQAAl70AbzkdCdPP&fccid=b6db62ae31d940b1&vjs=3
Kartu Prakerja,Senior Software Engineer Backend,Posted 30+ days ago,"At Kartu Prakerja, the Software Engineer role is at very critical to run the business process of the company. We are looking for a Senior Software Engineer Backend passionate about build a reliable workflow system that runs smoothly despite of heavy user traffic! You will join a dynamic and fast-paced environment and work with cross-functional teams to design, build and roll out the product that delivers the organisation’s vision and strategy.
Job Descriptions
Develop a reliable and scalable engineering system and API;
Develop code and library that easy to maintain and follow clean code best practices;
Optimise code and application to run with efficient computing resource and maximise the throughput;
Ensure performance of system through defensive coding with proper logging, monitoring, and alerting;
Implement security and data protection practice within the system domain.
Identify and improve bottlenecks or bugs in the system domain.
Collaborate with other engineer colleagues like Software Engineer Frontend, DevOps Engineer, Product Manager, Data Engineer, Data Analyst;
Requirements
Proficient in Ruby on rails or Golang
Have experience developing microservice with GRPC protocol,
Have experience with virtualization technology like VM, Docker, Kubernetes;
Understand of framework like ReactJS, Typescript, Node JS
Have experience using Cloud Technology like GCP, Aliyun (Alibaba Cloud),
Understand DDD (Domain Design Driven) and Event driven concept,
Have experience using event-driven system like Kafka, NSQ, Rabbit MQ, etc,
Have experience with Database like RDS Postgresql, Mysql, Redis, ElasticSearch for day-to-day operation,
Understand and can operation CI/CD tools like Gitlab Automation, Jenkins;
Benefits
Working with the biggest Innovation Public Services in Indonesia
Working on the product used by 100 Millions of people in Indonesia from 514 city and district
Working hybrid (WHF and WFO)\",,Contract,Jakarta,https://id.indeed.com/rc/clk?jk=5e6729fde75ea9a4&bb=-shAXu03fYr6EgyacqCTs4jlWhToTR3W_xhP2njBWwWcWRHOUBsWHV5xlSbf8RVyScob60jOe3Za4nDjNn88gpXdskAZAQj_uBvRXipqmMQO7PRT2AwWzljKoPhwpDj-&xkcb=SoBf67M38fY8wQAAl70HbzkdCdPP&fccid=ca73b8dcc9c434d4&vjs=3
Innovation Engineering,Java Backend Developer,Posted 30+ days ago,"Innovation Engineering SRL, a dynamic and innovative IT company part of PNO Group, specialized in the design, development, and maintenance of advanced IT solutions is looking for a Java Backend Developer to join our team.
What are we looking for:
An experienced Java Backend Developer with a focus on innovation and development and a commitment to excellence. You’ve had a similar position for the last 3 years or more, most likely in another IT Company or a technology partner. Ability to plan and organize work and problem solving, result orientation, proactivity, good interpersonal skills, and aptitude for teamwork.
Requirements
Knowledge of Java language, NoSQL (e.g. MongoDB and ElasticSearch), Java frameworks (Spring Boot, Spring Security, JPA, Hibernate, JUnit, Spring Batch);
Knowledge of at least one broker (e.g. RabbitMQ, Kafka);
Manage deadlines and push the team to ensure timeliness;
Knowledge of development and versioning environments (e.g. Eclipse, GIT);
Basic knowledge of SQL language;
Knowledge of: Docker, Kubernetes, Jenkins, Sonarqube, Ubuntu, Apache Solr, Azure, AWS, Google Cloud is an advantage;
Minimum of 3 years of proven experience in a related field;
Excellent verbal and written communication skills, both in English and Italian;
Ability to collaborate with internal and external teams;
Experience in managing a team;
Strong analytical and problem-solving skills;
Excellent communication skills;
Ability to work in a fast-paced environment and be deadline driven.
Why you should join Innovation Engineering:
Participation in national and international innovative and research projects, in an international and rapidly growing organization.
Opportunity to differentiate one's skills and develop one's professionalism in a stimulating and highly educational context.
Opportunity to be part of a dynamic and energetic group made up of great professionals and with concrete growth possibilities.
Permanent contract: salary and classification will be commensurate with previous experience.
Internal training and provided through training companies selected based on needs and the company growth plan.
A policy that supports smart-working up to 100% of one's time if necessary and promotes work-life balance.
Diversity & Inclusion:
Diversity is important to us: growing, maintaining, and promoting a diverse team is top priority. We foster and encourage diversity and provide access to resources and information to support the education of our team, facilitate dialogue and foster understanding. We really value people who bring unique perspectives and add new knowledge to our team. Our culture of inclusion, focus on health and well-being, and flexible working models help ensure that everyone - regardless of background - feels included and can run at their best. We believe we are made stronger by the unique capabilities and qualities that each person brings to our company, and we invest in our employees to inspire confidence and help everyone realize their full potential. We ultimately believe in unleashing all talent and creating a better and more equitable world. We value uniqueness and skills and are committed to ensuring that all employees have an equal opportunity to contribute and express their full potential in the work environment. Our approach to diversity and inclusion is based on the principles of ethics and integrity and represents the determining factor for the development of broader horizons, personal and corporate growth. We are an equal opportunities employer, and we welcome applications from all suitably qualified persons regardless of their sex; religious or similar philosophical belief; political opinion; race; age; sexual orientation; or, whether they are married or are in a civil partnership; or, whether they are disabled; or whether they have undergone, are undergoing or intend to undergo gender reassignment.

The company guarantees equal economic treatment and equal career opportunities regardless of gender.

Interested candidates can send their Curriculum Vitae, including authorization to process personal data, to the address: hr@innovationengineering.eu , indicating in the subject: Java Backend Developer.
If interested, you can send your CV to
risorseumane@innovationengineering.eu.",https://d2q79iu7y748jz.cloudfront.net/s/_squarelogo/256x256/4a58604a8b7226787d4e781804b10ded,,Central Java,https://id.indeed.com/rc/clk?jk=2927786dca58ebcf&bb=-shAXu03fYr6EgyacqCTs0Fa-M0GaAgCt7eD43QXFaKrIdWYZK6LzN2RwNvjpbXHDsAVyODBsQjX-6oy-FiWdAZOImIbtW6bDuMFgh7x6C-djBArfhzhQVeqj51AA0fC&xkcb=SoDr67M38fY8wQAAl70GbzkdCdPP&fccid=91aa9bd6fcafe01f&vjs=3
Stockbit,Senior Backend Engineer,Active 6 days ago,"We are looking for a skilled and passionate Senior Backend Engineer who will be responsible for our server-side application logic along with its integration with the front-end platforms. In this position, you will use your programming skills and tools to analyze and translate business/feature requirements into well-structured, efficient, scalable software. You will also be actively involved in researching new technologies/tools that can be incorporated to improve the current system.
What you will do:
Build solid, secure, performant and scalable APIs to serve our front-end platforms
Optimize existing codes to improve performance and efficiency
Collaborate with Product, QA and UI team to deliver features and improvements
Implement best practices in code quality, security and data protection
Requirements
Proficiency in at least one of the following programming languages: Go, C++, Java, .NET, or Python, demonstrating a deep understanding of their paradigms, constructs, and idioms with a minimum of 3 years of hands-on experience
Experience in developing scalable Microservices and their associated components, such as tracing and logging, showcasing an adept understanding of strategies to handle high traffic loads
Proven track record of implementing best practices including Clean Architecture, adherence to SOLID principles, and a strong foundation in Unit Testing
Hands-on experience in managing Event Stream Processing, particularly with Kafka
Familiarity and proficiency in modern version control systems such as GitLab or GitHub
Experience working with AWS/GCP Managed services like SQS, DynamoDB, SES, etc., showcasing proficiency in leveraging cloud services for robust backend development
Comfortable operating within a Linux environment, demonstrating fluency in its operations
Self-motivated, passionate, and committed to stay updated with the latest trends and advancements in backend development
Exceptional communication and teamwork skills and effective collaboration with team members
Strong self-management abilities, especially in meeting project timelines and milestones
Benefits
Supportive teammates
Health insurance benefits
Self development activities that support careers
Broaden your knowledge in financial investment",,Full-time,Jakarta,https://id.indeed.com/rc/clk?jk=fc316bbb11b945e6&bb=-shAXu03fYr6EgyacqCTs7ZEnWeR9Bb1l9S__HjitwXRYEFy7wRxEQS1O2eNXHXA-Z5CcmrY8-OA-YL3YXVyaTy6s6PetF92ZK1UNy4ID96ivs371pPcmLxYG-giOtX5&xkcb=SoB267M38fY8wQAAl70FbzkdCdPP&fccid=e967972763ad7161&vjs=3
Crossover,"Mobile Application Developer (iOS, Swift), LearnwithAI (Remote) - $100,000/year USD",Just posted,"Are you a skilled mobile engineer with a passion for engineering excellence? Join us at LearnWith.AI, where we are revolutionizing education by integrating AI, gamification, and adaptive learning into our products.
Your role will be pivotal in developing TeachTap, an app that brings historical figures to life using AI, creating a TikTok-like learning experience that's both fun and educational. You'll be responsible for transforming UI designs into functional app features, fixing bugs, and collaborating closely with our product and backend teams to deliver a seamless, engaging user experience.
This role offers you the chance to shape the future of education while growing your skills in a fast-paced environment. You'll have significant ownership over the product, directly influencing its architecture, design, and functionality. We're just beginning to explore the potential of generative AI, and you'll play a key role in harnessing its power to free our engineers from routine tasks, enabling you to focus on impactful, strategic work.
What we offer:
The chance to work with cutting-edge technologies in education and mobile app development,
A platform to showcase your engineering prowess, directly impacting how students learn,
A dynamic environment where technical innovation is not just encouraged but required.
We're looking for engineers who can deliver solutions at the highest level of quality. If you're passionate about creating robust, efficient, and maintainable code that meets the most rigorous engineering standards, we want to hear from you. Join us in revolutionizing education through cutting-edge app development!

What you will be doing
Taking high-fidelity UI designs and transforming them into interactive and efficient mobile app features,
Integrating screens with our modern APIs, ensuring data consistency and responsiveness,
Collaborating with cross-functional teams to translate complex educational concepts into elegant technical solutions.

What you will NOT be doing
Getting stuck in endless approval loops - we value swift decision-making and autonomy.
Writing code that merely 'works' without considering scalability, maintainability, and performance,
Isolated tasks - you will collaborate closely with a supportive product and backend team.

Key Responsibilities
Delivering high-quality apps that serve as the primary interface for students in our online learning environment.
Continuously improving and optimizing our codebase to meet evolving educational and technological needs.

Candidate Requirements
At least 4 years of experience developing mobile applications (any platform).
At least 2 years of experience being the primary technical contributor for a development team OR software product.
Experience using React Native for cross-platform app development.

Nice to have
Experience building educational apps,
Knowledge of using generative AI in app development.",,Full-time,Jakarta,https://id.indeed.com/pagead/clk?mo=r&ad=-6NYlbfkN0Bp-pWyh_yd7-BMq_HjiKF8q-wDEEHI6K3EhZcTze0zEsIRmf-ziQx7U3e177DT_Q3k7el9nQvCI3Xx-mFT1DSC7Xedg43uGJHylh2GSuvtduQOc11jTUoAsVIZ6TpQNQ_rx5XXQ9KZx_7oJcJQdr58NZGAG30NlMSLpYfW0RRZRbtb3MXvoMk4p_KjwundIdlRCUG_M6DWCsalBm5LCFL93MroTWHqpXFC8l5C7inEwQfYqnjoc_v18zgUrn25QZd-BByEwrmpBqNJF9VkbrwweV_3PTb-gOyyaOTCpjt-Hc_Cj5OnYXrFskmwsN-Gr12JsE09tnmnfotfz-mnowI9WJ3BazrjF_188nUf6VazZGt1t2me0onWcntTX7XftDgla-HRVax_zggBEZJPtz2dCHn603tEZwfb_AfU0vR-jMHQVyZ-Vse26Ft2LHGKbC9Pf_ZlZmEZE0o_Tgjs5Vpq9t3Ii-5ZIZ61Q67SHS9tzBKo20j3S8DR9YIkx1YKu0jxMiCIVihvexpRyr4wCa5I3u59Oe7GjUpdaa0DYnqNlJZc1fZWbxXuXBvfo2Hycqu_x9BISJEWXm1Xd8bNhfW_tFdZVDkyrxF-DLnAQ7hvZxib9a5iAf24K-4fKoGG5msgsy-ibOj7WhNvg-K5hpP7FhoZHXZq2cQKwav1zZAabfcxMOZ30CBQyJiDJBTgBrUBJ9ECDAlh2WMQqKIOJpFghA3SaK0z9bNUVPTii_WUn0nbMBfP7D-bHCuBlFR4SLoahpnFXckvnrAw1rniL-r5cnrZCshIw8j6vQNgpCWr6WvhkeWuwhnTwb8fhTVPxYZSQCedQUm9dg==&xkcb=SoDF6_M38fYyQwTfWh0LbzkdCdPP&camk=nUmJqO2E8rhJzcCFtmbPcQ==&p=0&fvj=0&vjs=3
Crossover,"Lead Engineer, LearnwithAI (Remote) - $200,000/year USD",Just posted,"Are you a seasoned Unity engineer with a passion for leading teams and making crucial technical decisions? Join us at LearnWith.AI as we integrate AI into learning, creating cutting-edge educational experiences. We're on a mission to transform how students learn, making education not just effective but engaging and fun.
Your role will be critical in leading our Unity engineering team and designing the technical architecture of Magic Academy—a game where knowledge isn't just taught, it's experienced. You'll establish technical patterns, guide the team through complex decisions, spearhead the adoption of AI within our development process, and build a game that turns abstract information into tangible, interactive experiences. This isn't just about identifying gaps in learning; it's about building robust, scalable solutions that create immersive learning adventures.
What we offer:
The chance to work with cutting-edge technologies and methodologies in education and game development.
A platform to showcase your leadership and technical expertise, directly impacting how students learn.
Ownership and independence in your work, with the authority to make impactful decisions and drive innovation.

What you will be doing
Leading the Unity engineering team, making key technical decisions, and setting the direction for our game development work.
Designing the technical architecture of Magic Academy, ensuring it aligns with our business goals.
Establishing best practices, coding standards, and development patterns that the team will follow.
Collaborating closely with product managers and designers to ensure the game's functionality, reliability, and user-friendliness.
Spearheading the integration of AI tools and techniques to improve the game and the team’s development process.

What you will NOT be doing
Getting stuck in endless approval loops - we value swift decision-making and engineering autonomy,
Focusing primarily on game design or visual aesthetics - while important, our priority is engineering excellence,
Isolated tasks - you will collaborate closely with a supportive product and backend team.

Key Responsibilities
Delivering a high-quality game that serves as the primary interface for students in our online learning environment.
Defining the technical architecture of the game, ensuring it is decoupled, robust, simple, and aligned with the long-term vision.
Continuously improving and optimizing our codebase to meet evolving educational and technological needs.
Leading the adoption of AI in game development to increase the overall throughput of the team.

Candidate Requirements
At least 5 years of experience in developing 3D games using Unity.
At least 3 years of experience leading the development of games, including designing the technical architecture.
Proven track record of leading the development of a game that successfully launched and engaged users.",,Full-time,Jakarta,https://id.indeed.com/pagead/clk?mo=r&ad=-6NYlbfkN0Bp-pWyh_yd7-BMq_HjiKF8q-wDEEHI6K3EhZcTze0zEvpHA92ZPE90LDsgPXL-NwccizVb2T3vuRjPxnpfJLiwNs1t0NtsbL75uKOiLR0VFLjOLtNs4HlHTeaVpFEAS5qDT0CdNtEs-x_Xek5ZNY9xXMyt_HzSlXXf-hT3RKB1e8qPPSFh1Bj59_IYyV3rh9gnQHON2qc1NH3KNoLSsXid8yOEkBfBl1nRWjeU1Ia-VXzOIN5ZLsiKgeWiJTEn-LggZbnLcp968yF7t2P1TbU3WnkskbwE9r-mHkXldl55usAZQnLJdtGhE8T2cK3RhcReVxM70nYfA3AYp9p0BJD-XQ6rEeRXNClv6l_jBoIsnOgscekUs98uplaW8DbdsK0FkojnewNjggxzotAJz7yFih_tYYxpb_Du5eVCjybdjxl7x0dLMadDkWk56Vjx_64690pE7iCaZh-ZAskWUOkJBHaRF0jTZfakI8pLLTlyX1ePzejivWkz0EdMelUWf6JQv5CCHbZSJ9uV5aw4E72nkClwe9H5X2jJZ7Oqcn3UxHwMfjLRb7aYR1LUSEfpGbRc_GXnnHklxN-5joRSeGJ5Qf7nfd7Yax5GAUcAg9HZIvIewJcnaGAkl21T_7WCk0-npMiCyYC5tmZMgERjbVkOkEuSr51p5wenOawyVYPyQ0xwfDVSSiZXdeaI7M3PgD5HtHTyLrf_7m-4B27HfsFu7koNPHb2kaCKJTMSVUW5f3vfRNrDpju2bokCT-gnK0N4IfCahjt8m9Gz6SQB6zEJ1RkIR3__Weo=&xkcb=SoBx6_M38fYyQwTfWh0KbzkdCdPP&camk=nUmJqO2E8rhgHyCI6vZD4g==&p=1&fvj=0&vjs=3
tiket.com,Senior Software Engineer (Frontend),Posted 30+ days ago,"We think you also hate when travel app is giving you a headache, right? A slight misinformation can ruin the trip.
That is exactly what we are tackling as t-fam! Making sure that our 17+ million users have the best experience in crafting their own adventure.
Your main duties in flying with us:
Work collaboratively with product managers to translate requirements into reusable fast web modules.
Partner and work closely with Backend developer for seamless API integration.
Develop well-written front-end code for new product features as well as maintain code and fix defects within the existing code base.
Apply best-practices and coding patterns to ensure your solutions are maintainable, modular of high code-quality and work well across browsers and devices.
Building scalable, highly available, resilient, extendable, secured architecture to provide a significant boost to the business
Following up best practices for development and championing their adoption as per company defined standards
Mandatory belongings that you must prepare:
4+ years of experience in frontend development.
Experience in working with product-based development.
Experience with HTML5, JavaScript, TypeScript, front-end technologies like React, Angular, Vue, Redux, Webpack
Deep understanding of how the web works at scale.
Experience in developing and maintaining PWA’s.
In the event that you haven’t received any updates after 3 weeks, your data will be kept and we may contact you for another career destination. Meanwhile, discover more about tiket.com on Instagram, LinkedIn, or YouTube.",https://d2q79iu7y748jz.cloudfront.net/s/_squarelogo/256x256/f5a2cccd945328946a8e5cbf8aecb337,Full-time,Jakarta,https://id.indeed.com/rc/clk?jk=264d120f6cb70ba3&bb=RndhklJAKhKRooBVHChm8x07sl9CO3vTzYuxtoJ_SlMdMqot-E42FfrGQEFhbR63P56xKmaoTtBHhvQtB-u5h3Hyj6-WPtkV_u_a-qVIPbPNkcTIdfDFkh2STexNax2K&xkcb=SoAY67M38fYyQwTfWh0JbzkdCdPP&fccid=84fbf23ad19a45e1&vjs=3
Pasarpolis,FULL STACK WEB DEVELOPER,Posted 30+ days ago,"Company Description

PT Pasar Polis Indonesia is one of the leading and fast growing insurtech company in Indonesia. Our mission is to become the largest insurtech company working to enable consumers and businesses to be protected. Our vision is to provide insurance for all, and thus, worry free life is possible for Indonesians. PasarPolis.com is proud to be trusted as the first and the only partner for BPJS Ketenagakerjaan free e-registration.



Job Description
Design Modular App
Create Clean & Rapid Backend API's
Implement Intuitive User Interface

Qualifications
Minimum Experience more than 1 Year
Good Knowledge of NodeJS/PHP/JavaScript programming language(s)
The capacity to write clean & correct code for data processing
Great eyes for detail, & strong sense of responsibility
The ambition to develop, well written & design software
The apiration to work with others to solve complex problem",,Full-time,Jakarta,https://id.indeed.com/rc/clk?jk=c3083475c7e13922&bb=RndhklJAKhKRooBVHChm80IswTtFuBX22V4VpWL-jGOlZkY2f28abNo4wU7k839D1Y9tz9diN6ERs93l4t0XPOa6NoO5Pkwuu0EdDvHxSK-HBZdEWxFLGTQlpl1RVRVK&xkcb=SoCs67M38fYyQwTfWh0IbzkdCdPP&fccid=cc56a3744363fe01&vjs=3
