Company Names,Job Titles,Posted On,Job Details,Images,Type Location,Locations,Link
Indosystem,PHP Backend Engineer,Posted 30+ days ago,"PHP Backend Engineer
Apply Now
About This Position
Are you a great coder? Do you spend hours writing beautiful efficient code that you can proudly show to the world? Do you know these terms: REST, SOAP, GIT, OOP, MVC, JSON ? Do you get excited when you see your code gets used by thousands and thousands of user everyday? Then join Indosystem as PHP Backend Engineer.
General Requirement
Passionate on web / app development & computer science / programming
Team player and having good commitment on responsibilities
Creative and responsive in online/offline communication
Thirst for knowledge and new technologies
Technical Skills
Extensive knowledge and experience on PHP-centric development
Comfortable with website fundamental (HTML – CSS – JavaScript – SQL) and network fundamental (application layer – Client/Server, TCP/IP, DNS, Sessions)
Knowledge and experience of RESTful API
Knowledge and experience with Source Control Management (e.g Git, SVN)
Knowledge and experience of UNIX system and command line
Knowledge and experience in Web Server configuration and setup (setting up PHP Engine, Database server, Load Balancing)
Appreciates reusable, scaleable and high-performance codes for high-traffic web systems
Nice to have
Great english skill
Bachelor (S1) in Computer Science / Engineering
Know Software Design Pattern & Big O Notation
Experience with Major PHP Framework (CodeIgniter & Laravel preferred)
Experience with NoSQL, Redis, MemCached, Amazon AWS, DigitalOcean
Love documentation (Have you used Sphinx or Aglio?)
Location
This is a full-time position for our awesome Jakarta & Cirebon office.
Perks / Benefit
Exciting, fun, and entrepreneurial work environment
Open-space office
Result oriented workplace
Regular Tech-Talk and team knowledge sharing
Chance to be a part of great international team
Very competitive salary (including Religious Holiday Allowance / THR)
Annual performance bonus
Great medical package (health insurance)
Free beverages
Parking benefits",https://d2q79iu7y748jz.cloudfront.net/s/_squarelogo/256x256/ebb6fe00759530a9faa06fe0a0f136a4,Full-time,Jakarta,https://id.indeed.com/rc/clk?jk=23045524f3756813&bb=CCAelZNI94Sl1l8N_9nxoLuD4kqnLJiRNz6G0h4_KTeKkGCdoIODaw2ZXKrPrnFprg3y4Ak-t5Zjjx_J_YGjWl7sRe8c9cjLq6nGzposWupTDX5BK5a7dFAGvhgmjCYU&xkcb=SoBk67M38fH72LgAl70GbzkdCdPP&fccid=7c7ea02d08f380a2&vjs=3
SoftwareSeni,Kotlin Backend Developer,Posted 30+ days ago,"SoftwareSeni is a Software Development Company based in Yogyakarta & Sydney, Australia. We have been designing and developing phone apps, websites, and mobile experiences. We love solving tough problems – from user experience to design and code.

We build enterprise web-based solutions for clients all over the world, from Australia, Indonesia, Europe, Africa, and America. Our clients from Indonesia: Astra International, Traveloka, Angkasa Pura, Peduli Anak Foundation. Our clients from Australia: Bike Exchange, Downsizing, Red Balloon, Sectara, and many more.

What will you get?
Competitive Salary. We believe that salary is one of the main factors that keep the employee in the company, therefore we can guarantee a competitive salary for our Staff.
Career Development & Training. We have a wonderful onboarding process where we help new team members get familiar with how we work.
Reasonable & Flexible Schedules. We are encouraging a culture where people can have a good work-life balance. Our schedules are pretty flexible. Need to run an errand in the middle of the day? Totally cool.
English Class. Working in SoftwareSeni means that you would get massive improvement in your English, both spoken and written guarantee!
Annual Leave entitlement. 12 working days which can be taken after 3 months of joining.
Salary Review Twice a year. We will review your salary twice annually in December and June. So, you can focus on your work and improve your performance every day.
Relocation Allowance. We provide a relocation allowance if you do not live in Yogyakarta. The allowance will cover moving costs for you and your family.
Staff Engagement Activities. We provide fun icebreaker activities in the middle of our working hours to chill and build relationships with all the staff. Sounds fun, right?
Birthday Leave. We also want to celebrate our staff's happiest day by giving them half-day leave on their birthday.

We are a growing business and need Kotlin Developer to accelerate that growth. This role also has the opportunity to work with some of our clients to design and develop their applications, in addition, to helping us grow our development practices at SoftwareSeni,

Requirements:
Have at least 2-3 years of Kotlin/Java Programming experience.
Familiarity with Spring Boot or similar frameworks.
Experience dealing with RDBMS (MySQL or PostgreSQL)
Have a solid understanding of Object Oriented Programming concepts.
Have an understanding of Software Engineering practices (software requirement, design, testing, and configuration management).
Understanding of Git
Have Javascript skills and experience.
Having Node Js and Scala Programming language skills is a plus.
Good English (written and spoken) and is a good communicator.
Have strong analytical skills and problem-solving aptitude.
Attention to detail.


Responsibilities:
Design, develop, and maintain high-performance Kotlin applications for backend development
Collaborate with cross-functional teams to define, design, and implement new app features
Write clean, maintainable, and testable code
Participate in code reviews and provide constructive feedback to other developers
Stay up-to-date with emerging trends and technologies in software development",,,Yogyakarta,https://id.indeed.com/rc/clk?jk=7ecdba4a9bb652ac&bb=CCAelZNI94Sl1l8N_9nxoFrvRTpEu4e7exQnL9IqC1FEc8OD6KLoqJM7KnoORB29eABwwzWkVSEw93z2nXDjRT701prqZoEld4Wylrd54-5i688AQjmeU4LnYl19qrQU&xkcb=SoD567M38fH72LgAl70FbzkdCdPP&fccid=26dc9f9565815d4e&vjs=3
PT Rakhasa Artha Wisesa,Programmer Aplikasi Mobile Android (Kotlin),Posted 30+ days ago,"Informasi Lowongan
Tipe Pekerjaan

Remote/On-site

Fungsi Pekerjaan
TI, Web Developer
Jenjang Karir
Pemula / Staf, Staf Senior
Job Deskripsi
Expert knowledge in Kotlin and Java
Hands-on experience with software development and app design
Experience with embedded databases
Knowledge of RESTful APIs to connect to back-end services Understanding of UI design and a user-oriented focus
Understanding of object-oriented programming Strong backend programming skills Experience with SQL Familiarity with XML basics
Proficient Understanding of code versioning tools such as Git
Critical thinker and problem-solving skills
Being informed on new language developments
Great interpersonal and communication skills
Good time-management skills
Ability to work well in a team and individually
Experienced building Android/IOS applications using native frameworks.
Excellent at writing well architected code using design patterns such as MVC, MVVM and MVP.
Persyaratan
Tingkat Pendidikan
SMA
Jurusan Pendidikan
Ilmu Komputer, Teknik Informatika
Minimal Pengalaman
1 tahun
Deskripsi Persyaratan
Minimum education S1 Informatics Engineering or equivalent.
Minimum 1 year experience in Mobile Developer Programmer using Kotlin.
Proficient in Kotlin Programming Language. Experienced in material design and Google API's.
Mastering application publication and release upgrades in Playstore.
Understand the development process for mobile applications.
Mastering REST and JSON data formats.
Mastering the Git version control application.
Mastering CI / CD development is a plus.
Skill yang Dibutuhkan
Lokasi
Kota
Prov. DKI-Jakarta
Alamat
Jakarta Pusat

Tentang Perusahaan
PT Rakhasa Artha Wisesa

Industri
Komputer / TI
Benefit
Deskripsi Perusahaan
We are a global IT Service Solution and IT Consultant company building powerful mobile and desktop application.",,,Jakarta,https://id.indeed.com/rc/clk?jk=424ad180d01fce9a&bb=rstJ1TIuDiv2QMcrV99Nogzy3oUo7BCi2XhkuYygTsw0q8EUzPoX1lhHtwbUoh7p3mwqM2xl9RVdk4XSuh7jr6FFt-W2jtOy2sXBOGRDFN_lalzMUKLNbyVIF3JNlEmf&xkcb=SoC_67M38fHxUeQ82R0LbzkdCdPP&fccid=a85814c65290ab5f&vjs=3
SoftwareSeni,Kotlin Backend Developer,Active 6 days ago,"We are a growing business and need Kotlin Backend Developer to accelerate that growth. This role also has the opportunity to work with some of our clients to design and develop their applications, in addition, to helping us grow our development practices at SoftwareSeni.
Requirements:
Have at least 2-3 years of Kotlin/Java Programming experience.
Familiarity with Spring Boot or similar frameworks.
Experience dealing with RDBMS (MySQL or PostgreSQL)
Have a solid understanding of Object Oriented Programming concepts.
Have an understanding of Software Engineering practices (software requirement, design, testing, and configuration management).
Understanding of Git
Have Javascript skills and experience.
Having Node Js and Scala Programming language skills is a plus.
Good English (written and spoken) and is a good communicator.
Have strong analytical skills and problem-solving aptitude.
Attention to detail.
Responsibilities:
Design, develop, and maintain high-performance Kotlin applications for backend development
Collaborate with cross-functional teams to define, design, and implement new app features
Write clean, maintainable, and testable code
Participate in code reviews and provide constructive feedback to other developers
Stay up-to-date with emerging trends and technologies in software development
Job Type: Full-time
Application Question(s):
Would you be open to working onsite in the Yogyakarta office?
Desired salary ?
How would you rate your English language skills? From 1 (basic), 2(medium), 3(Good), 4(excellent), 5(outstanding)
How many years of work experience do you have with Kotlin?",,Full-time,Yogyakarta,https://id.indeed.com/rc/clk?jk=bd841b7d5817c41b&bb=rstJ1TIuDiv2QMcrV99NojSNiobo0UZNTc3ky-5GfJ73V082YADjnSiom-x9t5SBm5FN_WTBlf0DFG9t1fbuiAjeKdO6qFl1hIy2IXg1FK0kv6hijfGe-WmHm-GgSh-u&xkcb=SoAL67M38fHxUeQ82R0KbzkdCdPP&fccid=ab187e80b284e258&cmp=SoftwareSeni&ti=Back+End+Developer&vjs=3
Crossover,"React Developer, LearnwithAI (Remote) - $60,000/year USD",Just posted,"Are you an aspiring mobile developer eager to make an impact in the world of educational technology? Join LearnWith.AI, where we are pioneering the integration of AI into learning, creating innovative experiences that transform how students engage with education.
You'll play a vital role in polishing our educational apps, ensuring they are intuitive, responsive, and visually appealing. Your work will directly contribute to apps like TeachTap and TeachTales, where learning becomes an immersive and interactive experience. Whether you're polishing existing screens, improving the user experience, or creating entirely new features, your work will be key to bringing our AI-driven learning apps to life.
What we offer:
The opportunity to work across multiple mobile platforms, including React Native, ReactJS and Ionic,
A hands-on role in shaping the user experience of cutting-edge educational apps,
A collaborative environment where AI is at the forefront of development, empowering you to automate and innovate.
We are looking for a developer who is enthusiastic about frontend technologies and AI, with a foundation in mobile and web development. If you're excited about crafting polished, user-friendly interfaces and eager to grow your skills in a fast-paced, AI-first environment, we want to hear from you. Join us at LearnWith.AI and help shape the future of education!

What you will be doing
Implementing UI changes and refining layouts across multiple mobile platforms, including React Native and ReactJS with Ionic.
Collaborating with designers and product managers to bring high-fidelity designs to life, ensuring an engaging user experience.
Performing manual testing and troubleshooting to ensure smooth functionality across different devices.
Using AI tools and automation to expedite repetitive tasks and improve the efficiency of your development work.

What you will NOT be doing
Handling complex backend development tasks or large-scale system architecture—your focus will be on frontend work.
Working in a siloed environment—collaboration and communication are key aspects of this role.
Spending significant time in meetings or approval loops—our development process emphasizes autonomy and swift decision-making.

Key Responsibilities
Delivering polished, user-friendly UI features that elevate the overall experience of our educational apps.
Ensuring cross-platform consistency and usability by rigorously testing and optimizing UI components.
Actively participating in design reviews and contributing to the continuous improvement of our mobile practices.

Candidate Requirements
At least 3 years of experience in mobile frontend development.
Hands-on experience with ReactJS and React Native, with a good understanding of both platforms.
A deep interest in AI and automation, with an openness to adopt AI-driven tools in your workflow.

Nice to have
Experience in using generative A.I. in your day-to-day development.",,Full-time,Indonesia,https://id.indeed.com/pagead/clk?mo=r&ad=-6NYlbfkN0Bp-pWyh_yd7-BMq_HjiKF8q-wDEEHI6K3EhZcTze0zEioibFReUEYCJuNhjT0Gy-GmbULANGcUhKYUtFkEIzwGSANV9Fn86W7sE3neuMcK8DfEuwpXt9Ap0ezSemjqsOCCP0pYhoCZEgRlKBv8MyGNuPf7NFAIlLuLcLGyhEjemcm5oaKbR0PNtFPKnq0aYMhy522cGv4JbCGePFLoYLYzrrG5DbYoGrX4BZvdVZeSjGWLOwhII3RvN2O4PAU4Fkayfs3vsWdQZRM5gZD8__9Dbbld2wDXekQsorvUhqDR8MesSIYGPyeqY8Ua2bRHmRafTGgngkfdSf7TebTRqD6naOKf0P0aUgd5O-f5DYB04GhPd21B6WD4J4yevUS5yBm2AcXFX8qMyQnWvHFYPVUcvi5eiHxFQQqFCD02hM-sQ3ROBr7n8ZeU3d2bh1YQ3DO6hE7u1X8uL6nN2K0NkBD456oWLW7sCWTfHkS9X95pJCGv7_yJaJ49X2ns47f4-8voWtO38X8N7dFQGu06ii6z-ilfNONaScw7x25RsS2mmzc9Z3YCM99c5a5BGRmGiGw6MwII6lP4y7i-nAwTziUzxspIm0BmfZSXXSMTAi9hNAsIn3nSbfVW-vl1RbnUPyFVaPZIFUDLv3PkmRmk4iA2-Eh2o34cC8YWnT0cbfdMZwNvmK6OdgcUfkriGVvpl5NIeXXCmcNqkS5RVAxbLua-ptr9bEUgyv8PzPI1hAocwuI8cMnThKCXd4nC4T5DKNiY5lc7_38G6YKuaz7HdsoModnJyg9GgbE=&xkcb=SoBi6_M38fHxUeQ82R0JbzkdCdPP&camk=nUmJqO2E8rhwiMwdzmiCxg==&p=2&fvj=0&vjs=3
PT. Jaringan VNT Indonesia (VNT Networks),Backend Developer,Active 5 days ago,"Job Description :
Knowledge of Unix/Linux environments and CLI, SQL / NoSQL database.
Knowledge about Microservices Architecture.
Good Knowledge of RESTFul APIs.
Experienced in building large-scale web apps/services/APIs.
Experienced using Cloud Service (ex. AWS, Azure), Container Platform (Docker) & CI/CD deployment.
Experienced in more than 2 projects which use NodeJS as backend services, Preferably good practice in using of Restify, Experienced with caching (Redis), message broker (Kafka, RabbitMQ), ELK stack (Elasticsearch, Logstash, Kibana), APM (Application Performance Management), Microservice Architecture
Jenis Pekerjaan: Penuh Waktu
Upah: Dari Rp0,01 per bulan",,Full-time,Yogyakarta,https://id.indeed.com/rc/clk?jk=d8b133ee7a143076&bb=rstJ1TIuDiv2QMcrV99Non98LDmnwRcaMojLmFfH0OdBd4NwN24LdgHTlbcZZz4fKThP2zwNq_mm9So0RS3l4NcgfPR9Xu69IP40i3bZ9Ohx-zHZJpThHNWrJkmU5IXm&xkcb=SoAi67M38fHxUeQ82R0IbzkdCdPP&fccid=defd2a4842c745b1&cmp=PT.-Jaringan-VNT-Indonesia-%28VNT-Networks%29&ti=Back+End+Developer&vjs=3
Coding Collective,React.js Developer,Posted 30+ days ago,"Position Status
Full Time
Company Location
Singapore
Work Location
Yogyakarta, Indonesia
Job Scheme
WFO

Duties and responsibilities
The successful applicant will carry out the following duties and responsibilities:
Developing interactive front-end designs for Decentralized applications (Dapps).
Supervision of the entire stack that runs the Dapps.
Backend development pertaining to the blockchain.
Being involved in the research, design, development, and testing of blockchain technologies.
Brainstorm and evaluate applications for new tools and technologies.
Document new solutions and maintain existing ones.
Maintain and extend client-side and server-side applications that are responsible for business logic and integration.
Requirements
The successful applicant will have the following experience and skills:
Experience in React Js, and Node Js (Knowledge in Typescript is a plus).
Expertise in Object-Oriented Programming and Web Service (RESTfull API / Micro Service Concept).
Decent English communication skills.
Min. 1 year of work experience in a software company.
Experience in React state management (mobx or redux) is a plus.
Understanding of Blockchain technologies is preferred.
Having an interest in working in a start-up environment.
Ability to work in a fast-paced and dynamic work environment.
Possessing a high-initiative attitude.
Willing to learn new technologies.",,Full-time,Yogyakarta,https://id.indeed.com/rc/clk?jk=9827c89e62c6b086&bb=rstJ1TIuDiv2QMcrV99NovuO4a7ptsiEHefRoqW_Tat_gn0BlnAKMBNmEp-Pb_a260u-SMj58-71eaR6-3AK4CVjLHca5OWvqubL8OLmr2iZZ3le8zB10dmgZPBJVhj7&xkcb=SoCs67M38fHxUeQ82R0PbzkdCdPP&fccid=18376dfd78fe16ce&vjs=3
LittleLives,Engineering Lead - Node.js,Posted 30+ days ago,"We are a fast-growing SaaS company in the EduTech space, operating mainly in Singapore, Vietnam, Malaysia and Indonesia. With more 2000 schools as customers, our mission is to revolutionize early childhood education through technology and provide innovative solutions to our customers.&nbsp;
#### What you will be doing:
Provide strong technical leadership and mentorship to the agile development team.
Define and communicate the technical vision and engineering strategy to extend our reach to every school out there.
Lead agile software development efforts, ensuring the team consistently delivers resilient and scalable software.
Collaborate with product owners and stakeholders to ensure user stories leverage on our strong technology product.
Identify areas of opportunity for platform teams to build features that improve robustness and effectiveness of developer tooling.
Lead the development and maintenance of critical backend services and APIs.
Collaborate with frontend and mobile teams to create seamless end-to-end solutions.
Review and optimize code for performance, security, and maintainability.
Work closely with product owners to understand business requirements and translate them into deployable solutions.
Collaborate with DevOps and infrastructure teams to ensure smooth deployments and system reliability.
Create and maintain technical documentation for software architecture, APIs, and processes.
Promote knowledge sharing within the team and across the organization.
#### Requirements
At least 4 years of experience in team management&nbsp;
Deep expertise in Node.js and Typecript
Sound coding practices with tools such as Docker, Git, unit testing, CI/CD, service-oriented architecture
Developed tracking and monitoring of existing systems
Designed scalable backend systems for handling high volumes of traffic
Hands-on experience with database optimizations
Worked extensively with queue management
Solid understanding of secure SDLC
Experience performing optimizations for high volume requests
Experience with Cloud services like Amazon Web Services, Aliyun
Managed Kubernetes, and Helm charts on your own
Familiarity with agile development methodologies and participating in agile ceremonies (e.g., stand-ups, retrospectives).
Experience guiding and mentoring team members, providing technical guidance, code reviews, and support to foster their growth and enhance their technical skills.
Extensive experience in communicating with stakeholders to deeply understand product roadmaps, gather requirements, and provide technical insights and recommendations.
Competency in functional programming is nice to have. We also use Elixir on some services
Job Type: Full-time",https://d2q79iu7y748jz.cloudfront.net/s/_logo/4296b095b40cfde27617f7c8fe4aa63b,Full-time,Jakarta,https://id.indeed.com/rc/clk?jk=9de90cf73fbe1f02&bb=rstJ1TIuDiv2QMcrV99NorfyI_9ojOEzRRjLvyeAUk4W7V3ErLevTjyylUwaG29qwep5iGCPAyASQWb5MYx2IYnsv7JStBBPy0mlnn1g_z01HOpezrPskJod20YgfH0x&xkcb=SoAY67M38fHxUeQ82R0ObzkdCdPP&fccid=9e7cece80dc7f2e8&cmp=LittleLives&ti=Engineering+Lead&vjs=3
Flip,Senior Software Engineer (Backend) - Core,Posted 30+ days ago,"About Flip&nbsp;
Rafi, Luqman, and Anjar, who were college friends in Universitas Indonesia, started Flip as a project in 2015 to transfer payments to each other at a fraction of what banks would charge them. They are pioneers in the Indonesian market, with their technology now helping millions of Indonesians, both individuals and businesses, carry out bank-to-bank money transfers through a reliable and seamless app.
After eight years of operations, Flip has helped Indonesians transfer money worth several trillions of rupiah and has received double-digit funding from respectable investors such as Sequoia India, Insight Partner, and Insignia. Flip’s ultimate mission is to give Indonesians access to one of the most progressive and fairest financial services in the world.
At Flip, we always strive to provide the fairest place for you to work, learn, and grow with talented and fun people in various opportunities to advance your career and get fair rewards. We believe that we have to treat employees, customers, and all stakeholders fairly and respectfully. Fair treatment for employees means we establish clear goals, facilitate our employees to achieve them, and value their contribution to the company with equitable benefits.
About the Role:
Join our dynamic Core Payment Platform team as a Senior Software Engineer - Backend. We are dedicated to building a robust payment platform that enables our clients—other product and vertical business teams—to build their business on top of our infrastructure. As a key member of our team, you will play a critical role in designing, developing, and maintaining backend services that are highly scalable, available, secure, efficient, and reliable with minimal guidance.
Key Responsibilities:
&nbsp; &nbsp;&nbsp;•&nbsp; &nbsp;&nbsp;Design and develop new backend services to enhance our payment platform.
&nbsp; &nbsp;&nbsp;•&nbsp; &nbsp;&nbsp;Write and maintain unit and integration tests to ensure code quality.
&nbsp; &nbsp;&nbsp;•&nbsp; &nbsp;&nbsp;Deliver high-quality, production-ready code in a timely manner.
&nbsp; &nbsp;&nbsp;•&nbsp; &nbsp;&nbsp;Collaborate with cross-functional teams to define, design, and ship new features.
&nbsp; &nbsp;&nbsp;•&nbsp; &nbsp;&nbsp;Monitor, debug, and optimize application performance.
&nbsp; &nbsp;&nbsp;•&nbsp; &nbsp;&nbsp;Participate in code reviews to maintain high standards of code quality and share knowledge with the team.
Required Skills:
&nbsp; &nbsp;&nbsp;•&nbsp; &nbsp;&nbsp;Proficiency in Go programming language.
&nbsp; &nbsp;&nbsp;•&nbsp; &nbsp;&nbsp;Strong understanding of microservices architecture.
&nbsp; &nbsp;&nbsp;•&nbsp; &nbsp;&nbsp;Excellent problem-solving skills and attention to detail.
Preferred Qualifications:
&nbsp; &nbsp;&nbsp;•&nbsp; &nbsp;&nbsp;Experience with cloud platforms (AWS, GCP, Azure).
&nbsp; &nbsp;&nbsp;•&nbsp; &nbsp;&nbsp;Knowledge of CI/CD pipelines.
&nbsp; &nbsp;&nbsp;•&nbsp; &nbsp;&nbsp;Hands-on experience with Redis.
&nbsp; &nbsp;&nbsp;•&nbsp; &nbsp;&nbsp;Familiarity with PubSub messaging systems.
&nbsp; &nbsp;&nbsp;•&nbsp; &nbsp;&nbsp;Experience with Kubernetes for container orchestration.
&nbsp; &nbsp;&nbsp;•&nbsp; &nbsp;&nbsp;Familiarity with database schema design and optimization.
P.S. if you experience problems when submitting your CV through this platform, you can send it directly to career@flip.id
Job Type: Full-time
Pay: Rp2,500,000,000 - Rp5,000,000,000 per year",,Full-time,Jakarta,https://id.indeed.com/rc/clk?jk=d7dc9ef5df8bb267&bb=rstJ1TIuDiv2QMcrV99NosbIVOpyvhwZkp3P72Hj1gZxfL_6E9N5XzvKyR3nMVCfXuAvWloux1N8cz1Mht2IcVtFRDJTiPbLfcb487Xae0UbWEFAOf7TJ_3k54nqRG3Z&xkcb=SoCF67M38fHxUeQ82R0NbzkdCdPP&fccid=6047d5ee8cf5e7f8&cmp=Flip&ti=Senior+Software+Engineer&vjs=3
