Company Names,Job Titles,Posted On,Job Details,Images,Type Location,Locations,Link
tiket.com,"Software Engineer I , Affiliate (Backend)",Posted 2 days ago,"We think you also hate when travel app is giving you a headache, right? A slight misinformation can ruin the trip.
That is exactly what we are tackling as t-fam! Making sure that our 17+ million users have the best experience in crafting their own adventure.

The Affiliate team at tiket.com is responsible for B2B API business on tike.com to serve our globally partners. Our solutions are designed to be generic and scalable, ensuring they can be applied to multiple products and also serving huge amount of request traffic (>100k RPM)
Your main duties in flying with us
Collaborate with product and QA teams to build features (analyzing requirements, identifying gaps, designing and implementing solutions) and to ensure timely project launches
Document and communicate your work effectively
Identify and address performance bottlenecks, technical debts, and improve existing code
Participate in peer code reviews as everyone on the team is involved in PR reviews
Mandatory belongings that you must prepare
Bachelor's degree or equivalent (preferably in Computer Science/Information Technology).
Passion in software engineering, application development, or systems development.
Strong basic data structure knowledge
Strong communication skills and analytical skills
Experience with any database (understand indexing, partitioning are a plus)
Proficiency in Golang is a plus
In the event that you haven’t received any updates after 3 weeks, your data will be kept and we may contact you for another career destination. Meanwhile, discover more about tiket.com on Instagram, LinkedIn, or YouTube.",https://d2q79iu7y748jz.cloudfront.net/s/_squarelogo/256x256/f5a2cccd945328946a8e5cbf8aecb337,Full-time,Jakarta,https://id.indeed.com/rc/clk?jk=ba0cc063a4316764&bb=2wALNLScpdkM3yW9CXyyQZkJstzlr_TrQUz1soD7LKAH7C_ZOKgMpJM-WtXv0BYBVhSzl7MpSdpq1S9nGhTQ6nft3sY4mwJzbdjs3o7EUWCAf80l0OYCZtABUu2VvnX7&xkcb=SoDO67M38fHbXJw82R0AbzkdCdPP&fccid=84fbf23ad19a45e1&vjs=3
Cilsy Fiolution Indonesia,Fullstack Web Developer (React + NodeJS) - Remote,Posted 12 days ago,"We are looking for full-time talent to assist with the project for 6 months.
About Our Product : Cicle App
Cicle App is a tool designed to assist business owners and managers in managing employee tasks, facilitating real-time communication similar to WhatsApp, and automatically generating employee performance reports all within one application. Cicle App is available in both Web App and Mobile App versions and is currently being utilized by hundreds of users on a daily basis.
What You Will Do :
We're seeking a talented individual to take charge of routine development tasks for Cicle App, responding to customer feedback and enhancing the application. Your responsibilities will include :
Adding, optimizing, and refining features for an enhanced user experience.
Resolve bugs to ensure seamless application performance.
Implementing Security Improvements.
Code Refactoring
As a Fullstack Web Developer, your role will encompass both Backend and Frontend development in the context of the above tasks.
What You Will Need :
Minimum 1 year of experience in Fullstack Web Development using React and NodeJS.
Understanding of good design patterns, clean and reusable code in every development process.
Proficiency in managing commits, pull requests, and branching in Git with good practices.
Experience in debugging.
Familiarity with Firebase.
Experience in unit testing is a plus.
Strong problem-solving and analytical skills.
Good communication skills, particularly in text, as this is a remote company.
Ability to take initiative and plan effectively.
Attention to detail while remaining practical and solution-oriented, avoiding getting stuck in problems.
Ability to work independently as well as in a team.
Backend Requirements:
Experience with NodeJS, Express, and Typescript
Proficiency in working with MongoDB
Experience with data caching using Redis and integrating it with MongoDB
Knowledge of JWT tokens
Understanding of techniques for building features/endpoints/sockets from scratch, including database schema design, routing, controller development, and distinguishing between APIs and workers, etc.
Experience with microservices architecture, particularly using RabbitMQ as a message broker. Understanding how to separate APIs from other node workers to create a lightweight and fast backend.
Experience in creating sockets using socket.io
Proficiency in using Docker and Google Cloud Platform. Advanced skills are not required, but you should understand how to use them in the context of application development.
Familiarity with basic security practices in software development.
Experience in integrating with payment gateways.
Experience using cron jobs.
Experience using email services, push notification services, and WhatsApp services.
Frontend Requirements:
Experience with ReactJS
Proficiency in Typescript
Experience in slicing Figma designs into components with pixel-perfect accuracy. Able to use CSS Modules, Inline Styling, or Tailwind CSS.
Understanding techniques for building features from scratch, including layout design, state management, routing & navigation, API/socket consumption, animation, and optimization.
Experience in integrating RESTful APIs and Websockets with backends or third-party libraries.
Experience in creating custom hooks.
Experience in developing features related to drag-and-drop components.
Experience in creating features involving charts and diagrams.
Hardware Requirements:
You must have your own Mac/PC laptop with specifications capable of running a microservice architecture and Docker.
Work Schedule :
Monday to Friday (Weekdays only)
7.5 hours / day
Must be willing to work consistently according to the specified schedule.
Must be willing to coordinate via Cicle and provide daily reports as per the above schedule.
Benefit :
BPJS Kesehatan
BPJS Ketenagakerjaan
Fullremote Company
Leave Days: Unlimited leave days, subject to leader approval and aligned with work priorities, outcomes, and urgency.
Transportation and Accommodation: Covered if sent for offline training on specific dates.
Salary: Rp. 4,300,000/month
Job Type: Contract
Contract length: 6 months
Application Deadline: 09/26/2024",,Contract,Bandung,https://id.indeed.com/rc/clk?jk=1d9017d9289caef9&bb=2wALNLScpdkM3yW9CXyyQZB57GmiJ6kiHBdkAk9pVD8Egs0SVoQYxYVMHuSCPb4m85VMwA22-8cv3roF3ogYulj9N8IyewGBWYbh2K281DNO9ktLHRsqPC8tMM3y6t56&xkcb=SoBA67M38fHbXJw82R0HbzkdCdPP&fccid=5f88a7eb029d84b8&cmp=Cilsy-Fiolution-Indonesia&ti=Full+Stack+Developer&vjs=3
PT. Maha Akbar Sejahtera,Backend Developer,Active 3 days ago,"Kualifikasi :
- Pendidikan Minimal D3 Informatika, Ilmu Komputer, Sistem Informasi atau lainnya yg relevan
- Pernah mengerjakan minimal 1 project dan Restfull API
- Menguasai salah satu bahasa pemrograman atau Framework Backend (Laravel 10+ / Node JS / Echo Golang)
- Menguasai CRUD dan Restfull API, Familiar dengan Firebase, Message Broker (Kafka, RabbitMQ) dan GIT
- Memahami Microservice Architecture dan aspek security (JWT Token / OAuth2 / Lainnya)
- Menguasai RDBMS MySQL atau PostgreSQL
- Mampu berkomunikasi dengan baik dan mampu bekerja secara individu maupun secara tim
- Problem Solving yang baik
- Bersedia bekerja dibawah tekanan
Jenis Pekerjaan: Penuh Waktu",,Full-time,Jakarta,https://id.indeed.com/rc/clk?jk=7c376237e71b736e&bb=2wALNLScpdkM3yW9CXyyQSZEuSExOVM9sgyOJv1oMJWHC5eC_nuBn45m70Z-CProNRbwHbMA-P3r_lZJsLlF_nDUcZNHEmcg2VBni4D5hj2qEB0h0YFGh8MKH2BJBT8Y&xkcb=SoD067M38fHbXJw82R0GbzkdCdPP&fccid=32999d8dcbd00891&cmp=PT.-Maha-Akbar-Sejahtera&ti=Back+End+Developer&vjs=3
Prieds Technology,Backend Developer,Posted 30+ days ago,"Company Description

PRIEDS is an emerging SaaS startup in the ERP & IoT business solutions industry. We are growing rapidly and need an agile team to come onboard with us in the fantastic journey to the future of Industrial Revolution 4.0!
As a business solution and Software as a Service (SaaS) technology, PRIEDS provides cloud-based ERP (Enterprise Resource Planning) software solutions and integrated IoT (Internet of Things) connected hardware devices.

Job Description

✅ Passionate in coding/programming
✅ Having >2 years of experience in the related field
✅ Required skills for back end: MongoDB, Node.Js, Javascript
✅ Plus point if candidate understand: C, C++, PHP, Java
✅ Having IoT and ERP experience and management experience is a plus
✅ Eager to learn new things and understanding for the business operation (ERP, supply chain, business operations, etc)
✅ Fluency in English
✅ Ambitious, fast-learner, responsible, and demonstrate the ability to work within a team
✅ Experience with Agile or Scrum software development methodologies
✅ Ability to multi-task, organize, and prioritize work

Additional Information

Benefits:
✅ Monthly salary & performance bonus
✅ Flexible working hour
✅ Health, food and internet remuneration
✅ Exposure to different industries & projects",,Full-time,Tangerang,https://id.indeed.com/rc/clk?jk=9e6b8a0df7ca8ace&bb=2wALNLScpdkM3yW9CXyyQWaoW0I_RBaGVxl20-18E-NN4N6_0newxP7pP4hsmW4BzP_2iJr8tmyNuNnrYsctWYo1AhWNimgZ4wBmxbeszwTEpgP_N_qsflcLwqz1pIxM&xkcb=SoBp67M38fHbXJw82R0FbzkdCdPP&fccid=7a61c2b6a1486a82&vjs=3
