Company Names,Job Titles,Posted On,Job Details,Images,Type Location,Locations,Link
"Palladium Group, Inc.","Economic Analyst, Augmenting Government Data on MSMEs Activity",Posted 30+ days ago,"Economic Analyst, Augmenting Government Data on MSMEs Activity
About Palladium:

Palladium is a global company working to design, develop and deliver positive impact on the lives and livelihoods of people around the globe; broaden access to health, water, power, and infrastructure; build enduring, sustainable, and transformative institutions and market systems to address global challenges; and conserve the natural world. We operate in over 90 countries and have a workforce of 4,000 talented, motivated, and diverse staff of all religions, races, languages, and gender identities.

This Proposal Opportunity:

As part of the second Millennium Challenge Corporation (MCC) compact in Indonesia, the MCC Access to Finance for Women-Owned Micro-, Small, and Medium Enterprises project (the MSME Finance Project) will facilitate more inclusive lending practices by financial service providers and improve the capacity of MSMEs to utilize finance. The MSME Finance Project has four sub-activities: 1) gender-inclusive value chain finance 2) digital and financial literacy enhancement 3) MSME capacity enhancement and 4) augmenting government data on MSMEs.

Palladium is actively preparing to bid on sub-activity 4, Augmenting Government Data on MSMEs. This sub-activity will support the Government of Indonesia, especially the Ministry of Cooperatives and SMEs (MoCSME), in gathering and analyzing MSME, especially W/MSME, financial and technical performance data. The sub-activity will improve efforts to standardize and harmonize efforts to collect information on W/MSME’s access to finance and their business performance (e.g., sales).
Palladium is seeking an Economic Analyst who will be embedded with the MoCSME to provide training on economic analysis to MoCSME staff, enhance and support the maintenance of a single database of cooperatives and W/MSMEs, advise on improving the MSME database information system, and produce policy analysis as needed.

Reporting and Supervision:

The Economic Analyst will report to the Project Director and collaborate with the Government Liaison.

Primary Duties and Responsibilities:

The Economic Analyst is expected to lead TA and capacity building for MoCSME to better collect and utilize data for policy analysis. Specifically, they will have the following primary responsibilities:

Develop a training curriculum to expand the abilities of MoCSME staff to understand methodologies related to econometrics and inferential statistics and provide quality assurance of existing or newly-created databases
Facilitate and lead workshops and other types of training (in-person or remote) at the MoCSME national and sub-national levels by leveraging adult-learning principles to strengthen MoCSME staff capacities in data use for decision-making
Manage the development of data sharing agreements with government ministries and departments, academia, and other stakeholders for MSME data
Gather and analyze data sets from other government departments to better allow MoCSME to measure the relative financial risk of W/MSMEs by a range of characteristics, such as industry, business size, location, and gender
Support the MoCSME to increase their policy impact through providing quality, evidence-based economic and public policy advice and analysis
Contribute to the development of meaningful analytics, visualizations, and infographics designed to promote and reflect decision making and respond to user requirements
Coordinate and oversee external research firms and consultants engaged in analytical exercises
Provide expert input to support the maintenance and utilization of the single database on cooperatives and W/MSMEs
Other duties that contribute to enhancing the data use capacity of MoCSME

Key Competencies Required:

The Economic Analyst will possess strong qualifications and experience in capacity building, especially with Government of Indonesia counterparts, and policy analysis for decision-making, including:
At minimum a Master degree in Economics and five years of relevant experience in economics and quantitative analysis
Demonstrated work experience conducting policy analysis and collaborative research projects that include Government of Indonesia stakeholders
Previous experience in coaching/mentoring/other activities that enhance capacity of government staff
Clear understanding of data quality assurance and general familiarity with database management
Demonstrated experience developing analytical products and visualizations for technical and non-technical audiences
Excellent written and oral communication with fluency in Bahasa Indonesia and English, including advocacy, negotiation, and presentation skills
Willingness to travel regionally within Indonesia as needed

Professional Expertise/Competencies Preferred:
An understanding of the MSME ecosystem and key institutions that collect MSME data
Prior engagement with the MoCSME and/or extended assignments with Indonesian government
Significant experience developing training materials and facilitating workshops and trainings for a wide range of individuals at varying professional levels, both on-site and remote

Equity, Diversity & Inclusion - Palladium is committed to embedding equity, diversity, and inclusion into everything we do. We welcome applications from all sections of society and actively encourage diversity to drive innovation, creativity, success and good practice. We positively welcome and seek to ensure we achieve diversity in our workforce; and that all job applicants and employees receive equal and fair treatment regardless of their background or personal characteristics. These include: (but are not limited to) socio-economic background, age, race, gender identity and expression, religion, ethnicity, sexual orientation, disability, nationality, veteran, marital or Indigenous status.

Should you require any adjustments or accommodations to be made due to a disability or you are a neurodivergent individual or for any other circumstance, please email our team at accessibility@thepalladiumgroup.com and we will be in touch to discuss.
Safeguarding - We define Safeguarding as “the preventative action taken by Palladium to protect our people, clients and the communities we work with from harm”. We are committed to ensuring that all children and adults who come into contact with Palladium are treated with respect and are free from abuse. All successful candidates will be subject to an enhanced selection process including safeguarding-focused interviews and a rigorous due diligence process.
Tentang Palladium:
Palladium adalah perusahaan global yang bekerja untuk mendesain, mengembangkan, dan membawa dampak positif pada kehidupan dan penghidupan masyarakat di seluruh dunia: memperluas akses ke kesehatan, air, energi dan infrastruktur; membangun institusi dan sistem pasar yang kuat, berkelanjutan, dan transformatif untuk mengatasi berbagai tantangan global; serta menjaga kelestarian alam. Kami beroperasi di lebih dari 90 negara dan memiliki sumber daya manusia sejumlah 4000 staff yang bertalenta, bermotivasi, dan dari berbagai agama, ras, bahasa, dan identitas gender.

Peluang dari Proposal Ini:

Sebagai bagian dari Millennium Challenge Corporation (MCC) kedua di Indonesia, proyek MCC Access to Finance for Women-Owned Micro-, Small, and Medium Enterprises (the MSME Finance Project) akan memfasilitasi lebih banyak praktik pinjaman yang inklusif oleh penyedia jasa keuangan dan meningkatkan kapasitas keuangan untuk usaha mikro, kecil, dan menengah (UMKM). Proyek MSME Finance memiliki empat sub-kegiatan: 1) pembiayaan rantai pasok yang inklusif gender, 2) peningkatan literasi digital dan finansial, 3) peningkatan kapasitas UMKM, dan 4) menambah data pemerintah terkait UMKM.

Palladium secara aktif menyiapkan tender untuk sub-kegiatan 4: Menambah Data Pemerintah terkait UMKM. Sub-kegiatan ini akan mendukung Pemerintah Indonesia, khususnya Kementerian Koperasi dan UKM (Kemenkop UKM) dalam mengumpulkan dan menganalisa UMKM, khususnya pelaku UMKM perempuan serta data kinerja finansial dan teknis. Sub-kegiatan ini akan meningkatkan upaya untuk standarisasi dan harmonisasi upaya untuk mengumpulkan informasi terkait akses pelaku UMKM perempuan untuk aspek keuangan dan kinerja dari bisnis mereka (seperti misalnya tingkat penjualan).
Palladium sedang mencari seorang Economic Analyst (Analis Ekonomi) yang akan diperbantukan ke dalam Kemenko UKM untuk menyediakan pelatihan terkait analisis ekonomi kepada staf Kemenko UKM, meningkatkan dan mendukung pemiliharaan database tunggal terkait koperasi dan pelaku UMKM perempuan, memberi saran terkait peningkatan sistem database informasi UMKM, dan membuat analisa kebijakan sesuai kebutuhan.

Pelaporan dan Supervisi:

Analis Ekonomi akan melapor kepada Direktur Proyek dan berkolaborasi dengan perwakilan Pemerintah.
Tugas dan Tanggung Jawab Utama:

Analis Ekonomi diharapkan untuk memimpin pendampingan teknis dan pembangunan kapasitas kepada Kemenko UKM untuk lebih baik dalam mengumpulkan dan menggunakan data dalam analisis kebijakan. Secara khusus, tanggung jawab utama yang akan dilakukan adalah sebagai berikut:
Mengembangkan sebuah kurikulum pelatihan untuk memperluas kemampuan staf Kemenko UKM untuk memahami metodologi terkait ekonometri dan statistik inferensial serta memberikan pengawasan kualitas kepada database yang telah ada/baru.
Memfasilitasi dan memimpin workshop dan berbagai jenis pelatihan lainnya (secara luring maupun daring) di tingkat nasional dan sub-nasional dari Kemenko UKM melalui peningkatan prinsip pembelajaran dewasa untuk memperkuat kapasitas staf Kemenko UKM dalam penggunaan data untuk pengambilan keputusan.
Mengelola perkembangan perjanjian pembagian data UMKM dengan kementerian dan departemen pemerintah, akademisi, dan pemangku kepentingan lain.
Mengumpulkan dan menganalisa kelompok data dari badan pemerintahan lain agar Kemenko UKM dapat mengukur resiko finansial relatif dari pelaku UMKM perempuan melalui serangkaian karakteristik, seperti jenis industri, besaran bisnis, lokasi, dan gender.
Mendukung Kemenko UKM untuk meningkatkan dampak kebijakan mereka melalui penyediaan saran dan analisis terkait ekonomi dan kebijakan publik yang berkualitas dan berbasis data.
Berkontribusi terhadap pengembangan analitik, visualisasi, dan infografis yang didesain untuk mempromosikan dan merefleksikan pengambilan keputusan sesuai dengan kebutuhan pengguna.
Mengkoordinasi dan mengawasi lembaga riset dan konsultan eksternal yang terlibat dalam perhitungan analitik.
Menyediakan saran ahli untuk mendukung perawatan dan penggunaan dari database tunggal kooperasi dan pelaku UMKM perempuan.
Tugas lainnya yang berkontribusi terhadap peningkatan kapasitas penggunaan data Kemenko UKM.

Kompetensi Utama yang Dibutuhkan:

Analis Ekonomi memiliki kualifikasi dan pengalaman yang kuat dalam kegiatan pembagunan kapasitas, khususnya dengan rekan Pemerintah Indonesia dan dalam analisa kebijakan untuk pembuatan keputusan, termasuk:
Minimal Magister di bidang ekonomi dan berpengalaman lima tahun di bidang ekonomi dan analisa kuantitatif.
Memiliki pengalaman kerja dalam melakukan analisa kebijakan dan proyek penelitian kolaboratif yang melibatkan rekan Pemerintah Indonesia.
Memiliki pengalaman dalam pelatihan/mentoring/kegiatan lain yang meningkatkan kapasitas dari staf pemerintah.
Memiliki pemahaman yang baik akan kualitas data dan secara umum familiar dengan pengelolaan database.
Berpengalaman dalam mengembangkan produk dan visualisasi analitik untuk audiens teknis dan non-teknis.
Kemampuan tertulis dan komunikasi verbal yang baik dalam Bahasa Indonesia dan Bahasa Inggris, termasuk dalam kemampuan advokasi, negosiasi, dan presentasi.
Bersedia untuk bepergian secara regional di Indonesia sesuai kebutuhan.
Keahlian/Kompetensi Profesional yang Diutamakan:

Pengalaman tambahan lain yang dicari termasuk:
Pemahaman akan ekosistem UMKM dan institusi-institusi kunci yang mengumpulkan data UMKM
Pengalaman dalam berhubungan dengan Kemenko UKM atau/dan penugasan tambahan dalam lingkup Pemerintah Indonesia
Pengalaman yang signifikan dalam mengembangkan materi pelatihan dan fasilitasi workshop dan pelatihan untuk berbagai jenis individu di berbagai tingkat profesi, baik luring maupun daring.

Kesetaraan, Keberagaman, dan Inklusi – Palladium berkomitmen untuk menerapkan kesetaraan, keberagaman, dan inklusi dalam segala hal yang kami lakukan. Kami menerima lamaran dari seluruh kelompok di masyarakat dan secara aktif mendorong keberagaman untuk memperkuat inovasi, kreativitas, sukses, dan praktik baik. Kami dengan positif menerima dan memastikan adanya keberagaman di tenaga kerja kami, dan memastikan seluruh lamaran kerja dan karyawan menerima perlakuan yang setara dan adil terlepas dari latar belakang atau karakteristik pribadi. Hal itu termasuk (namun tidak terbatas pada) latar belakang sosial-ekonomi, usia, ras, identitas dan ekspresi gender, agama, etnis, orientasi seksual, disabilitas, kebangsaan, veteran, serta status perkawinan.

Jika anda membutuhkan segala penyesuain atau akomodasi dikarenakan adanya disabilitas, merupakan individu neurodivergent, atau segala keadaan lain mohon email tim kami di accessibility@thepalladiumgroup.com dan kami akan menhubungi anda untuk berdiskusi.",https://d2q79iu7y748jz.cloudfront.net/s/_squarelogo/256x256/e7dc515e6699fb69ca00e984e878c6a5,,Indonesia,https://id.indeed.com/rc/clk?jk=9e8e1c27db631393&bb=oWOpHpX-Zq-TyGJkdg23h69goIo-nFgf8m9PNt6k7qzWSgmxK5MQXa5SAdxJR1XHAYQiyAuEw_zYlHG13SD630f5uNKlzioGYu6n7ts1_hegAzYmQJ4w2w%3D%3D&xkcb=SoA-67M38fNkwlQ82R0IbzkdCdPP&fccid=92445f54a51b5037&vjs=3
Noraa & Co.,Data Analyst,Posted 30+ days ago,"Get to Know the Role:
Our customer is one of the hottest kitchenware brand in Indonesia. They are seeking a Data Analytics Associate/Senior Associate to join their Strategy team. The ideal candidate for this role should excel in first-principle based problem-solving, thrive in ambiguity, demonstrate a passion for managing data at scale to derive actionable business insights, exhibit the ability to prioritize and execute tasks effectively, and possess strong communication skills with experience in stakeholder management.As a Data Analytics Associate/Senior Associate, you will collaborate closely with the Head of Strategy on various projects, including Growth (Pricing, New Product Development, Brand Due Diligence, etc.) and Operations (Sales & Operations Planning, Procurement, Fulfillment). This position will be based in Jakarta, Indonesia.
What You Will Do:
Strategy Development & Planning:
Support the development and creation of corporate strategy, brand strategy, and implementation plans based on robust internal and external data analysis.
Management Reporting:
Support the development of key updates for the board/investors on a weekly/monthly/quarterly basis.
Market Intelligence:
Identify, synthesize, and communicate external market trends and competitor activities.
Strategic Initiatives/Projects:
Support or lead the planning and execution of strategic initiatives that will drive significant impact for the business.
Who Are They Looking For?
Must-Have:
Bachelor's degree required from a top-tier university.
2 to 4 years of experience in consulting, analytics, or in-house strategy.
Hypothesis-based, data-driven problem-solving approach.
Strong track record of working with and influencing multiple stakeholders.
High ownership, driven to learn new skills, and deliver results.
Strong Excel modeling skills.
Effective written and spoken communication skills.
Highly Preferred:
Experience working in a startup or FMCG.
Experience in SQL.
What Opportunities Will You Get?
Understand how businesses scale from 0 to 1.
Grow in a merit-based organization.
Work with outstanding, fun, and motivated individuals.
Receive a competitive salary and benefits.",,,Jakarta,https://id.indeed.com/rc/clk?jk=73d0731b28529caf&bb=oWOpHpX-Zq-TyGJkdg23hzvpledqLlNBQlnUf2twIR85DwzlOe-Nd5Qa8-nmEYcns5lRByqmMDeN2naOFSP3ahaMhVFF5fHg6KPVlUl2neK50j6IMC8J7Dvxx74XlCQB&xkcb=SoCw67M38fNkwlQ82R0PbzkdCdPP&fccid=b447e298adf8e202&vjs=3
EY,Technology Consulting Junior Consultant,Posted 15 days ago,"Technology Consulting

What if your career could have a lasting impact on you, and on the world?
Here at EY, you’ll have the chance to build a truly exceptional experience. We’ll empower you with the latest technology, surround you with high-performing teams, and provide the global scale and diverse and inclusive culture you need to discover your full potential. Through our coaching and training programs, you’ll develop the skillsets you need to stay relevant today and in the future – all while building a network of colleagues, mentors, and leaders who will be on the journey with you at EY and beyond.

The exceptional EY experience. It's yours to build.

The opportunities: your next adventure awaits

EY Consulting is global practice with more than 70,000 people around the globe. We are building a better working world by transforming businesses through the power of people, technology and innovation. Our client-centric approach focuses on driving long-term value for our clients by solving their most strategic problems, and our consulting services are recognized by the global analyst community and our 25+ alliance partners. EY Consulting is made up of three sub-service lines: Business Consulting, Technology Consulting and People Advisory Services.

Whole industries have been disrupted and transformed in recent years by digital technology. As a Technology Consultant, you’ll help businesses realize the value they can gain from their IT investments — supporting strategy and being a key growth driver. As part of a high-performing team, you’ll deliver exceptional client service — implementing technology solution, providing advice on how technology enablement, digital transformation and enterprise intelligence contribute to performance improvement, as well as how IT can act as multiplying effect during major program transformations.

As organizations look to leverage the advantage IT offers, we’ll work with you to develop the consultancy and analytical skills that you’ll need in today’s environment. Working on projects that cross borders and sectors, the experiences you gain here will be more valuable than anywhere else. So whenever you join, however long you stay, the exceptional EY experience lasts a lifetime.

We have multiple opportunities available for rising Junior Consultant. We are currently recruiting for:
Cyber Security Associate.
Digital & Emerging Technology Associate
Technology Solution Delivery Associate

Some of the key responsibilities would include:

Client delivery responsibilities
Contribute to engagement team to integrate client’s strategy, process, people, and technology
Participate as a fieldwork team member in Consulting engagements
Work effectively as a team member, sharing responsibility, providing support, maintaining communication, and updating senior team members on progress
Leverage data and technology to assist senior team members in providing innovative solutions to client’s challenges
Assist in preparing high quality work products for clients and other related parties in timely manner
Anticipate and identify risks within engagements and raise any issues with senior members of the team
Develop and maintain productive working relationships with client personnel

People responsibilities
Understand and follow workplace policies and procedures
Build strong internal relationships within EY Consulting and with other services across the organization
Maintain an educational program to continually develop personal skills of staff
Contribute to people-related initiatives including recruiting and retaining consulting professionals

What we look for
You have an agile, growth-oriented mindset. What you know matters. But the right mindset is just as important in determining success. We’re looking for people who are innovative, can work in an agile way and keep pace with a rapidly changing world.
You are curious and purpose driven. We’re looking for people who see opportunities instead of challenges, who ask better questions to seek better answers that build a better working world.
You are inclusive. We’re looking for people who seek out and embrace diverse perspectives, who value differences, and team inclusively to build safety and trust.

Main Qualifications
Have a bachelor’s degree in the areas of Information Technology, Computer Science, Mathematics, Statistics, Engineering, Business, Finance, Economics, or other related major from reputable university with excellent academic record. Master’s degree will be an advantage.
Fresh graduate or has limited working experience
Min GPA 3.00 out of 4.00 from reputable university
Excellent skills in both written and verbal Bahasa Indonesia and English
Strong leadership, analytical thinking, problem solving skills, presentation and communication skills
Excellent analytical skills for both business and technology solutions to enable the development of business process and/or technical solutions, including documentation of business problems in a clear concise manner
Additional Qualifications (good to have)
Experience in applying computer-aided statistical modelling to solve business problems
Experience in machine learning, data mining and information retrieval.
Experience in extracting information from a wide variety of sources including quantitative, qualitative and big data sources
At least one of the following modelling software packages: MATLAB, R, SAS, SPSS.
At least one of the following scripting languages: C++, Java, Python.
Data visualization experience – Tableau / Qlikview / D3.js / Power BI and SAS VA as one of the tool aside from Tableau/QlikView.
Exposure to artificial intelligence, deep learning and advanced predictive modelling
Exposure to any of the following area; Solution architecture, technology sourcing for transformation, system delivery support and device, IT service management, ERP Implementation, SAP, Oracle, Peoplesoft, Hyperion, Siebel, Pega, MDM, ETL, Big Data.
Exposure to any of the following area; Enterprise Application (SAP, Oracle, Microsoft), Solution Architecture, Software Development, System Delivery and Implementation, IT Service Management
Knowledge in Cyber Security, Security Risk on Business, Networks and Operating Systems
Knowledge and experience in following domain Technology Strategy, NextGen Technology Operations, Infrastructure and Service Resiliency, and Enterprise Architecture, certification relates to the domain will be considered an asset
Trainings/Certificates for any of the following SAP modules would be advantageous; FICO, MM, HR, SD, PM, PP, or ABAP
What’s in it for you
Accelerate your technical capabilities and transformative leadership skills with future-focused courses and development programs.
Broaden your horizons by working on highly integrated teams across the globe and collaborate with people of diverse backgrounds — both professionally and culturally.
Bring out the best in yourself with continuous investment in your personal well-being and career development.
Develop your own personal purpose and help us create a positive ripple effect on our teams, our business, clients and society – building a better working world, together.
We prioritize your wellbeing by providing a competitive medical benefit.
What you can expect
Due to the volume of applications, only shortlisted candidates will be contacted.
Shortlisted candidates can expect to perform a preliminary assessment as it is a required step of the recruitment process.

About EY
EY | Building a better working world
EY exists to build a better working world, helping to create long-term value for clients, people and society and build trust in the capital markets. Enabled by data and technology, diverse EY teams in over 150 countries provide trust through assurance and help clients grow, transform and operate.
Working across assurance, consulting, law, strategy, tax and transactions, EY teams ask better questions to find new answers for the complex issues facing our world today.

If you can confidently demonstrate that you meet the criteria above, please contact us as soon as possible.

Make your mark. Apply now.",,,Jakarta,https://id.indeed.com/rc/clk?jk=a897da5bee2e66b7&bb=oWOpHpX-Zq-TyGJkdg23h1IiHN6LJ47mSLyuJm8aNkT7j-SKLePINE4pQKKFaoQ3RQuYheTSF04253jvcJNkZm8h4qeSR3e_ftPAvYS3l3OL8VQk1vvPrHF8KyD81Qq9&xkcb=SoAE67M38fNkwlQ82R0ObzkdCdPP&fccid=1544766d4c2915b0&vjs=3
