Company Names,Job Titles,Posted On,Job Details,Images,Type Location,Locations,Link
SAGA Digital Studio,Digital Data Analyst,Posted 30+ days ago,"Digital Data Analyst
Managing websites or mobile apps data set, developing reports, presenting the report to clients, and troubleshooting data issues.
Responsibilities
Creating a report that contains analytics of digital platforms such as websites, mobile apps, etc.
Presenting the data to internal and external team member.
Performs AdHoc analytical requests.
Qualification
Familiar with Google Analytics is a must (inc: GTM).
Familiar with other analytics platforms would be a plus point.
Good personality & team player.
Good communication and writing skills, in Bahasa & English.
Having experience in a startup / digital service company is a plus point.
Knowledge about UX / Design / Development is a plus point.
Knowledge about SQL queries is a plus point.
Advanced Excel skills (lookup functions, validations).
Detail-oriented and having a can-do attitude.
Must-have personal skills
Having good skills in analyzing data and making recommendations that relate to business and marketing purposes.",https://d2q79iu7y748jz.cloudfront.net/s/_squarelogo/256x256/274c9196db13ecd1e0ece9787b2e5389,,Jakarta,https://id.indeed.com/rc/clk?jk=78774edb72a6eb0e&bb=oWOpHpX-Zq-TyGJkdg23hyFtymIubvXZ80SOLlfM102XYwW-BlwOerCXsNJJMpANtH4J7pnao8nFKV-jRGd66ie-7wSsoJDLQTcFTALfGwkvSd1SRJ9U16lsSDXHdW0X&xkcb=SoBj67M38fNkwlQ82R0GbzkdCdPP&fccid=f963f8ef2edbd0c0&vjs=3
Alegrium,Data Analyst,Active 2 days ago,"Company Description

Alegrium is a casual game developer based in Jakarta, Indonesia. We've been developing lot of games since 2011. Some of our games which go viral were Icon Pop Quiz, Cash Inc, The Billionaires, and many more
Alegrium is a part of Lion Studios, Lion Studios has already achieved over a billion downloads and profitability in less than two years. You can identify many of our games sitting at the top of the iOS & Android stores such as Ink Inc, Blendy, Mr. Bullet, Happy Glass, etc

Job Description

If you are up for this challenges
Develop, implement, and maintain leading-edge analytic systems, taking complicated problems and building simple frameworks
Identify trends and opportunities for growth through analysis of complex data sets
Provide source-to-target mappings and information-model specification documents for data sets
Create best-practice reports based on data mining, analysis, and visualization
Evaluate internal systems for efficiency, problems, and inaccuracies, developing and maintaining protocols for handling, processing, and cleaning data

Qualifications
Bachelor Degree in Quantitative Analysis: Statistics, Mathematic or Computer Science.
Have a strong statistical skills and analysis. Experience working with Data from database (MySQL, PostgreSQL, etc).
Experience with R/RStudio, Tableau is advantages.
Have ability to communicate quantitative analysis in a clear, precise, and actionable manner.
Strong interpersonal and communications skills including the ability to communicate technical/statistical concepts to non-technical audiences",https://d2q79iu7y748jz.cloudfront.net/s/_squarelogo/256x256/7b94fadc02c725f1ed0dc6c7ac2123da,Full-time,Jakarta,https://id.indeed.com/rc/clk?jk=ac49c4b29827d3b6&bb=oWOpHpX-Zq-TyGJkdg23h10-7Xr88KvokleIduGeYSo7Rban2M4kN3_vfUGflRvn9tzQ-zVgyjtUvs-3uOgd2-veaTRIPhy7WNpH7fbOL6UtZQpB3hilsNoEuhsLnpB9&xkcb=SoD-67M38fNkwlQ82R0FbzkdCdPP&fccid=3068a5b012502bd7&vjs=3
COARE Communities LLC,Real Estate Acquisitions Analyst (Fully Remote),Active 3 days ago,"A Real Estate Acquisitions Analyst is responsible for evaluating potential real estate investment opportunities for the company and providing support for Capital Markets activities. This includes conducting real-estate market research, analyzing financial data, building projection models that calculate IRR, Multiple-on-Invested Capital and coordinating with the company's due diligence team and 3rd parties in order to acquire properties across the United States.
The role is ideal for high-performers who have a desire to learn US real-estate investment principles. Within 1 year of employment, employees should have a complex understanding of real-estate financial modeling principles and have deal experience on multiple closed transactions. Top performers can expect substantial bonus potential at the 1-year anniversary.
Requirements:
A modeling test will be required as part of the interview process
Must be comfortable working 9:00AM - 5:00PM EST (US Time Zone)
1 to 2 years proven work experience as an Analyst, Associate, Accountant or similar role
Prior background in Finance or Accounting required
Must be willing to work and entertain queries outside of regular working hours
Comfortable working in fast-paced environment with multiple competing deadlines
Highly organized with ability to prioritize work independently with minimal oversight
Impeccable attention to detail with a natural strength in mathematic
Highly responsive, able to respond to any inquiries from the acquisition team or 3rd parties within an hour of receipt during business hours
Responsibilities:
Creation of financial models to determine the viability of an investment and assist management in decision making (IRR, MOIC, Cash-on-Cash)
Conduct market research to identify potential investment opportunities
Perform due diligence on investment opportunities
Monitoring the performance of the Company’s investments
Prepare investor and marketing materials (teasers, investment memorandums, monthly reports), as necessary
Performs other duties that may be assigned from time to time
Coordinate due diligence tracker and outreach to ensure a transaction closes on-schedule
Asset management support including leading the refinancing process to refinancing portfolio assets and measure performance against initial budget of a property.
Compensation:
Substantial bonus potential with top ranked analysts receiving large bonuses based on demonstrated performance
Benefits:
Work from home
Employer will pay for continued development courses (Wall Street Prep and other Modeling classes for example) to support the growth of our Employees
COARE Communities, LLC is an Equal Opportunity Employer.
About COARE Communities
COARE (“Creating Opportunities in Affordable Real Estate”) or (“COARE”) is a real-estate investment company focused on solving the challenge of affordable housing through the acquisition of sustainable Manufactured Housing Communities (“MHC”) across the U.S. Manufactured Housing as a real estate category ranked as the #1 best performing real estate in the 2008-2009 recession. By acquiring, improving and maintaining these communities, COARE hopes to alleviate the increasing need of affordable housing by providing residents with a safe, reliable, and the lowest cost housing available in the U.S.
Job Type: Full-time
Pay: Rp221,525,303.00 - Rp359,978,618.00 per year
Application Question(s):
Part of the interview test requires a financial modeling test. Are you comfortable preparing a simple cash flow projection on a real-estate property?",,Full-time,Jakarta,https://id.indeed.com/pagead/clk?mo=r&ad=-6NYlbfkN0CcocjEk_AULM7KdfjlrltpVVl6QdrKPnJZCMjqvUFJ4yGbziGqfk7MRdIxywm_NVTC-QwtNiXApIvp5QmJb0Gwd0YI72N-rnjS27_l7YGK0YsAwf0V4Lw_nd-B0tajJMwx2DGT4SorAw7KYOTc2m7rmY9lDW0gMt6QqHSoWKFTb9yKfEq1Xs__8q6BQKqihe676nDWdjX6FvSZrIVNMMn8Y2GPc6Wsm-Y8RHP2D_9jzC3ApXLRYC0_AaUflnBfbrIh9_YopABF5c4LDoaAPkBwlaDwUO-1_jr_2PzycbPODWlXgeGjOOj09H2jmhYslu4U0BWh1xiDqBIqXF6apJWEWzGYLVUeVGXlWXCHOhDncxpA_mCqGveXqGHwIR6D_mksdzq1yDtPc0Gaa8KU0l4fKfbxAORwPxOoW55B2dNiL6xDkRETKOXKAi6Gi3veIYhT1_68e9FfElcfvAoRR7byVeKkS8X2g8LJh1cjkaDXK53_YsFKRJ5cg5EwAmh_b2uAI3GZw6-j3iCoEYuPR4ff9ZqhQFntTUWsC8eE-EX_4VkNBUEleFQfmGXzC3luVmRLq2IpWSqOZ62liJJgy1Y8SRHOOHZgnzPKa6QfeSPPof5pRonq5GRZ6xCcgEygyb25agIO-fXA5blddmHy0flpsHQJH4dfLcs=&xkcb=SoCK6_M38fN6aWzfWh0LbzkdCdPP&camk=nUmJqO2E8rhJE42JMXHi-g==&p=0&fvj=1&vjs=3
Manulife,Production Support,Just posted,"The opportunity
Production Support Team is responsible for maintaining and supporting the system to ensure smooth business operations.

Responsibilities
Analyzes, contributes to and improves ongoing business processes and workflows; supports incident resolution and production
Assists with resolution of issues surfaced by support analysts
Resolves technical issues and record transactions via ticketing system
Promotes persistent issues to Engineers and Architects where necessary
Support applications and systems by meeting or exceeding standards and service levels while minimizing operational risk
Performs some or all of the following tasks: data management, data loads, runs scans, validation scripts, schedule production releases

How will you create impact?

Production Support Team reporting to Head of Production and CTO.

What motivates you?
You obsess about customers, listen, engage and act for their benefit.
You think big, with curiosity to discover ways to use your agile approach and enable business outcomes.
You thrive in teams and enjoy getting things done together.
You take ownership and build solutions, focusing on what matters.
You do what is right, work with integrity and speak up.
You share your humanity, helping us build a diverse and inclusive work environment for everyone.

What we are looking for
Good Communication
Understand Web and API
Understand Java Spring Boot
Understand Oracle, SQL Server, and Mongo DB
Understand New Relic
Understand Logging System

What can we offer you?
A competitive salary and benefits packages.
A growth trajectory that extends upward and outward, encouraging you to follow your passions and learn new skills.
A focus on growing your career path with us.
Flexible work policies and strong work-life balance.
Professional development and leadership opportunities.

Our commitment to you
Values-first culture
We lead with our Values every day and bring them to life together.
Boundless opportunity
We create opportunities to learn and grow at every stage of your career.
Continuous innovation
We invite you to help redefine the future of financial services.
Delivering the promise of Diversity, Equity and Inclusion
We foster an inclusive workplace where everyone thrives.
Championing Corporate Citizenship
We build a business that benefits all stakeholders and has a positive social and environmental impact.
About Manulife and John Hancock
Manulife Financial Corporation is a leading international financial services provider, helping people make their decisions easier and lives better. To learn more about us, visit https://www.manulife.com/en/about/our-story.html .
Manulife is an Equal Opportunity Employer
At Manulife/John Hancock, we embrace our diversity. We strive to attract, develop and retain a workforce that is as diverse as the customers we serve and to foster an inclusive work environment that embraces the strength of cultures and individuals. We are committed to fair recruitment, retention, advancement and compensation, and we administer all of our practices and programs without discrimination on the basis of race, ancestry, place of origin, colour, ethnic origin, citizenship, religion or religious beliefs, creed, sex (including pregnancy and pregnancy-related conditions), sexual orientation, genetic characteristics, veteran status, gender identity, gender expression, age, marital status, family status, disability, or any other ground protected by applicable law.
It is our priority to remove barriers to provide equal access to employment. A Human Resources representative will work with applicants who request a reasonable accommodation during the application process. All information shared during the accommodation request process will be stored and used in a manner that is consistent with applicable laws and Manulife/John Hancock policies. To request a reasonable accommodation in the application process, contact recruitment@manulife.com .
Working Arrangement
Hybrid",,Full-time,Jakarta,https://id.indeed.com/rc/clk?jk=29893266671c49e3&bb=9BzQy9VF7D0gnRlC-WJKb5Rsd8u6HoaKhoGk7PIIYHzHuqtKgYcPfdVawik78y69dhskQcRJ5zyRa_PnXXY00akcDt_DfbfO-fW_K2cePoNTHnhFFDxqJt-mUogyclu0&xkcb=SoDK67M38fN6aWzfWh0KbzkdCdPP&fccid=1747adf6142beb48&vjs=3
Deloitte,Consultant - Technology Strategy and Transformation - ID,Posted 21 days ago,"Consultant - Technology Strategy and Transformation - ID
Date: 13 Aug 2024
Service Line / Portfolios: Enterprise Technology & Performance
Location: Jakarta, ID
Are you ready to unleash your potential?

At Deloitte, our purpose is to make an impact that matters for our clients, our people, and the communities we serve.
We believe we have a responsibility to be a force for good, and World Impact is our portfolio of initiatives focused on making a tangible impact on society’s biggest challenges and creating a better future. We strive to advise clients on how to deliver purpose-led growth and embed more equitable, inclusive as well as sustainable business practices.
Hence, we seek talented individuals driven to excel and innovate, working together to achieve our shared goals.
We are committed to creating positive work experiences that foster a culture of respect and inclusion, where diverse perspectives are celebrated, and everyone is recognised for their contributions.
Ready to unleash your potential with us? Join the winning team now!

Work you will do:
This role sits within the Technology Strategy and Transformation (TS&T) team of Deloitte Southeast Asia, which encompasses IT Strategy and Transformation. As a leader of this group, you will drive the growth of our TS&T business in the region and be responsible for the creation, sale and delivery of TS&T solutions: IT Strategy, Application & Systems Development, IT Business Transformation, etc.
You will review outputs from the Analysts and will provide further in-depth, root-cause analyses to formulate perspectives, as well as draw additional insights on potential areas for enhancement and improvement.
You will undertake assessments across different elements of IT functions, document and translate business requirements into specifications, and support the formulation of appropriate technology-enabled solutions by defining appropriate technology strategy, architecture vision and implementation roadmap.
You will work with the Analysts to co-develop presentation materials and to present the results of your analyses and findings to fellow project team members.
You will support the project teams in gathering business requirements and definition of problem statements by engaging clients to understand their business needs and challenges.
You will assist project teams in the set up and execution of Technology Strategy & Architecture projects, in accordance to the firm’s service delivery standards and quality requirements.
You will contribute to the development of our practice by providing guidance to junior team members and in assisting senior team members on pursuits as well as adherence with the firm’s processes for set up and execution of engagements.
You will be actively involved in deal pursuits, and will assist senior team members in the preparation, development and delivery of strong proposals, presentations and publications.
Requirements:

A good honors Degree, preferably at postgraduate level, in Information Technology, Business Information Systems, Business, Engineering, Mathematics or related disciplines.
Practical experience with Agile, DevOps will be an advantage
A minimum of 2+ years of experience working in IT implementation
Involved in overall SDLC - requirement gathering, design, test, deploy/release, data migration, project management Understanding of current IT trends (cloud computing, big data, social media, RPA, IoT, blockchain, etc.)
Strong analytical skills, excellent oral and written communication skills in English, be self-motivated, and be able to work in stressful situations with changing priorities
Excellent problem solving skills, ability to think out-of-the-box, work under pressure and tight project timelines
Drive, tenacity, client focused and results oriented
Proven demonstration of sound business acumen, teamwork and leadership qualities.
Willingness to work outside of office base and most of all…
An appreciation of the consulting lifestyle and ability to travel (both locally and abroad) is a pre-requisite to fit to our short-term and long-term project assignment

Due to volume of applications, we regret only shortlisted candidates will be notified.
Please note that Deloitte will never reach out to you directly via messaging platforms to offer you employment opportunities or request for money or your personal information. Kindly apply for roles that you are interested in via this official Deloitte website.
Requisition ID: 105039
In Indonesia, the services are provided by Imelda & Rekan and other related entities in Indonesia (""Deloitte in Indonesia""), which are affiliates of Deloitte Southeast Asia Ltd. Deloitte Southeast Asia Ltd is a member firm of Deloitte Touche Tohmatsu Limited. Deloitte in Indonesia, which is within the Deloitte Network, is the entity that is providing this Website.",,,Jakarta,https://id.indeed.com/rc/clk?jk=a8cfe7baf8ec9744&bb=9BzQy9VF7D0gnRlC-WJKb830U154RwwlsaJwAh_lAe08LspibwiG8jCCRaM7669-c-mdQCuTyNjmQhU4WS2xsCvWa16E4AUrI3i5SBafFbpudYpudx70Wg%3D%3D&xkcb=SoBX67M38fN6aWzfWh0JbzkdCdPP&fccid=9e215d88a6b33622&vjs=3
Daya Group,Supply Demand Analyst,Posted 1 day ago,"Company Description
Description
Control the balancing of supply from principle company and demand from our marketing team. Make sure stock level and data sales are always updated. Forecasting sales for the next 3 months based on type of products and monitor forecast data accuracy.
Requirement
S1 from Engineering, with GPA 3,20
Have good grade in data analysis subject
Good in using Python & Microsoft Excel
Have good attention to details
Excellent in working independently
Have the ability to make good relationship
Willing to travel around Indonesia
Job Responsibilities
Other Information
Only shortlisted candidates will be contacted.

Job Location
Kota Bandung
Deadline
30 September 2024
Quota
1
Applicants
8",https://d2q79iu7y748jz.cloudfront.net/s/_squarelogo/256x256/1ad1c5af60fd489ded4f37926d9dea5b,,Bandung,https://id.indeed.com/rc/clk?jk=2915736a67701eb1&bb=9BzQy9VF7D0gnRlC-WJKb5zhgl6w7Hx9-byoHqrUEjtlGKmwIWujsAsR2YEERZzUpXAJE1vh_yKtX0J2WQJdZ4s7VzJbfbGvxm2x-8Npj3tv1LkXBXdbGsAQVKDPu0y9&xkcb=SoDj67M38fN6aWzfWh0IbzkdCdPP&fccid=7a41a824a7f71c34&vjs=3
