Company Names,Job Titles,Posted On,Job Details,Images,Type Location,Locations,Link
United Nations Development Programme (UNDP),Software Associate,Posted 8 days ago,"Job Identification
20275
Locations
Jakarta Pusat, Indonesia
Posting Date
08/27/2024, 08:10 AM
Apply Before
09/10/2024, 10:59 PM
Job Schedule
Full time
Agency
UNDP
Grade
NPSA-7
Vacancy Type
National Personnel Service Agreement
Practice Area
Health
Bureau
Regional Bureau for Asia and the Pacific
Contract Duration
6 months
Education & Work Experience
Bachelor's Degree - 4 year(s) experience OR High School certificate- 7 year(s) experience
Required Languages
English and Bahasa Indonesia
Vacancy Timeline
2 Weeks
Mobility required/no mobility
no mobility required

Background
Diversity, Equity and Inclusion are core principles at UNDP: we value diversity as an expression of the multiplicity of nations and cultures where we operate, we foster inclusion as a way of ensuring all personnel are empowered to contribute to our mission, and we ensure equity and fairness in all our actions. Taking a ‘leave no one behind’ approach to our diversity efforts means increasing representation of underserved populations. People who identify as belonging to marginalized or excluded populations are strongly encouraged to apply. Learn more about working at UNDP including our values and inspiring stories.
UNDP does not tolerate sexual exploitation and abuse, any kind of harassment, including sexual harassment, and discrimination. All selected candidates will, therefore, undergo rigorous reference and background checks.
UNDP is committed to achieving workforce diversity in terms of gender, nationality and culture. Individuals from minority groups, indigenous groups and persons with disabilities are equally encouraged to apply. All applications will be treated with the strictest confidence.
UNDP does not tolerate sexual exploitation and abuse, any kind of harassment, including sexual harassment, and discrimination. All selected candidates will, therefore, undergo rigorous reference and background checks.
UNDP is the leading United Nations organization fighting to end the injustice of poverty, inequality, and climate change. Working with our broad network of experts and partners in 170 countries, we help nations to build integrated, lasting solutions for people and planet. Learn more at undp.org or follow at @UNDP
The United Nations Development Programme (UNDP) is the UN’s global development network, advocating for change and connecting countries to knowledge, experience and resources to help people build a better life, as envisaged by 2030 Agenda for Sustainable Development. We are on the ground in more than 170 countries and territories, working with governments and people on their own solutions to global and national development challenges to help empower lives and build resilient nations. The United Nations Development Programme UNDP Indonesia Country Programme 2016-2020 developed in partnership with the Indonesian Government addresses the unfinished business of the Millennium Development Goals and support national efforts to advance the 2030 Sustainable Development Agenda.
The programme contributes directly to MoH National Action Plan 2015-2019, objective 1) increasing the health status of society and; 2)increasing the responsiveness and protection to society towards social and financial risks related to health and Outcome 2 of the UNDP country Programme for Indonesia (2016-2020), which are aligned with the Indonesian Government Health Sector’s Objectives, commitment to Universal Health Coverage, SDG3 Ensure healthy lives and promote wellbeing for all at all ages (target 3.8 in particular) and other Sustainable Development Goals. One of its efforts is to be involved in supporting the transformation of health technology in the Ministry of Health through Network Strengthening and the Bio Informatic Biomedical & Genome Science Initiative (BGSi).
BGSi is a new initiative of the Indonesian Ministry of Health (MOH). The initiative will act as a multi-institutional ecosystem that aims to support collaborative biomedical and genomic activities in Indonesia by leveraging strengths in technology and infrastructure including biobanking, data management, high throughput sequencing and bioinformatics.
The initiative aims to build a national asset established under the Indonesia Ministry of Health with two major focusses. First, to establish a national biobank focussed on six conditions (diabetes, cancer, stroke, tuberculosis, psoriasis, and rare/genetic diseases) which will store samples from participants where each sample will be connected to a registry that manages all information associated with the participant (demographic and clinical) and second, to generate Whole Genome Sequence information, for each of those participants, that will be curated in a national database. Samples and genomics information from healthy participants will also be collected and generated by this initiative. All samples and data will be made available to researchers nationally and internationally through BGSi.
The initiative will be organised around a headquarter facility located in Jakarta, housed in the MOH repository building and the historical Eijkman building, that will host the biobank and WGS labs respectively. BGSi HQ will manage the registry system and provide technical support for the Hubs and the entire ecosystem. A second and just as important part of the ecosystem is the hospitals (referred to as HUBs) where each HUB is in charge of managing activities related to recruitment, sample collection and tertiary analysis for the disease it has been assigned.
Therefore, UNDP needs 1 Software Associate who will be responsible to maintain, design, and/or development of systems tailored for existing and upcoming plans, specifically handling participant data (related to demographic, phenotypic, survey, biospecimen, and genomic data) within distinct software environments.
The direct supervisor of this activities is IT System Integration Architect Coordinator for BGSI. She/He will work closely with project team (BGSI, FMTA, and other projects in HEART related to Bio Informatic Biomedical & Genome Science Initiative), operations units, and programme staff in the office to provide Technical Assistance and advice regarding biomedical and genome science-related issues and to ensure adequate exchange of information.

Duties and Responsibilities
Software Development and Maintenance
Support in developing, and maintaining software solutions for genomic data processing and analysis
Support regular maintenance and monitoring algorithms and data structures to handle large-scale genomic datasets efficiently
Perform routine maintenance tasks, including debugging, patching, and updating existing software systems.
Collaborate with cross-functional teams to address and resolve issues reported by end-users.
Genomic Data Processing and Containerization and Deployment
Assist solution develpment for processing genomic data generated from Illumina, BGI, and Oxford Nanopore Technologies.
Support interdisciplinary teams, including bioinformaticians and data engineers, to optimize data workflows.
Assistwork on containerization using tools like Docker for efficient deployment and scalability of software solutions.
Participate in the setup and maintenance of continuous integration and continuous deployment (CI/CD) pipelines
Quality Assurance and Testing
Perform routine testing to ensure software reliability and performance.
Adhere to coding standards and best practices for maintaining code quality
API Management, Security consideration and Documentation
Support in securing and managing APIs for business needs, ensuring robustness, scalability, and security lifecycle.
Implement and adhere to security measures to protect sensitive genomic data.
Keep updating relevant data privacy regulations, such as HIPAA.
Support in creating clear and comprehensive documentation for software architecture, design, and implementation details.
Assist in ensuring knowledge sharing within the team through documentation
The incumbent of the position should avoid any kind of discriminatory behavior including gender discrimination and ensure that
Human rights and gender equality is prioritized as an ethical principle within all actions;
Activities are designed and implemented in accordance with “Social and Environmental Standards of UNDP”;
Any kind of diversities based on ethnicity, age, sexual orientation, disability, religion, class, gender is respected within all implementations including data production.
Differentiated needs of women and men are considered.
Inclusive approach is reflected within all actions and implementations, in that sense an enabling and accessible setup in various senses such as disability gender language barrier is created;
Necessary arrangements to provide gender parity within all committees, meetings, trainings etc. introduced
Competencies

Core competencies:
Achieve Results: LEVEL 1: Plans and monitors own work, pays attention to details, delivers quality work by deadline.
Think Innovatively: LEVEL 1: Open to creative ideas/known risks, is pragmatic problem solver, makes improvements.
Learn Continuously: LEVEL 1: Open minded and curious, shares knowledge, learns from mistakes, asks for feedback.
Adapt with Agility: LEVEL 1: Adapts to change, constructively handles ambiguity/uncertainty, is flexible.
Act with Determination: LEVEL 1: Shows drive and motivation, able to deliver calmly in face of adversity, confident.
Engage and Partner: LEVEL 1: Demonstrates compassion/understanding towards others, forms positive relationships.
Enable Diversity and Inclusion: LEVEL 1: Appreciate/respect differences, aware of unconscious bias, confront discrimination.
Cross-Functional & Technical competencies:
Business management:
Digital Awareness and Literacy: Ability and inclination to rapidly adopt new technologies, either through skilfully grasping their usage or through understanding their impact and empowering others to use them as needed
Working with Evidence and Data: Ability to inspect, cleanse, transform and model data with the goal of discovering useful information, informing conclusions and supporting decision-making
Information Management & Technology
Solutions Architecture: Ability to design and manage an IT architecture, integrate of one or more applications or services within a coherent and effective IT architecture
2030 agenda-people
Gender: Gender mainstreaming
Information Management & Technology
IT Security Management : Knowledge of Cyber Security technologies, processes, and innovations and the ability to apply to strategic and practical situations. Capacity of keeping UNDP systems and data safe
Network, communication and Infrastructure Management: Ability to develop/integrate/operate/manage IT network, communications, Cloud or on-premise infrastructure, and new technologies like IoT
Research and Development : Following new technologies and technical trends, research the technologies that are applicable and beneficial to the organization and develop the systems
Required Skills and Experience

Education:
Secondary education is required, or
University Degree in computer science, information technology, engineering or equivalent field will be given due consideration, but it is not a requirement.
Experience:
A minimum of 7 years (with secondary education) or 4 (with bachelor’s degree) of relevant experience in informations technologies, data engineering of relevant related field is required.
Advance knowledge of spreadsheet/excel and database packages, Microsoft words, power point, outlook, etc.; Google language (G)
Experience/Knowledge in programming language such as Java or Google Language..
Knowledge/experience of or relational database such as postgres or noSQL databses like MongoDB
Proven Familiarity with various application development frameworks. .
Proven Proficiency in Continuous Integration or Continuous Deployment (CI/CD) tools for automated software delivery
Experience with cloud platforms, such as AWS (Amazon Web Services) or GCP (Google Cloud Platform)., for deploying and managing applications
Work experience with Infrastructure as Code (IaC) tools e for automating and managing infrastructure.
Required Languages
English and Bahasa Indonesia
Disclaimer


Important information for US Permanent Residents ('Green Card' holders)

Under US immigration law, acceptance of a staff position with UNDP, an international organization, may have significant implications for US Permanent Residents. UNDP advises applicants for all professional level posts that they must relinquish their US Permanent Resident status and accept a G-4 visa, or have submitted a valid application for US citizenship prior to commencement of employment.

UNDP is not in a position to provide advice or assistance on applying for US citizenship and therefore applicants are advised to seek the advice of competent immigration lawyers regarding any applications.

Applicant information about UNDP rosters

Note: UNDP reserves the right to select one or more candidates from this vacancy announcement. We may also retain applications and consider candidates applying to this post for other similar positions with UNDP at the same grade level and with similar job description, experience and educational requirements.

Non-discrimination

UNDP has a zero-tolerance policy towards sexual exploitation and misconduct, sexual harassment, and abuse of authority. All selected candidates will, therefore, undergo rigorous reference and background checks, and will be expected to adhere to these standards and principles.

UNDP is an equal opportunity and inclusive employer that does not discriminate based on race, sex, gender identity, religion, nationality, ethnic origin, sexual orientation, disability, pregnancy, age, language, social origin or other status.

Scam warning

The United Nations does not charge any application, processing, training, interviewing, testing or other fee in connection with the application or recruitment process. Should you receive a solicitation for the payment of a fee, please disregard it. Furthermore, please note that emblems, logos, names and addresses are easily copied and reproduced. Therefore, you are advised to apply particular care when submitting personal information on the web.",,Full-time,Jakarta,https://id.indeed.com/rc/clk?jk=9c72401b5221d7f7&bb=S8KzFLPIFT3dzdF0kiQIrb0Fy2X_NjfYq3K9WKpIYxYKIQvDlo4-y0rGMYBxUdTatOwzHEi4bWVtH_3dvwmlwCNCmADS3rj9Tbon1cCGmE_Q67Th-k54L8Sjdsj3EAWt&xkcb=SoBN67M38fJO_xQ82R0BbzkdCdPP&fccid=a9a8bf2e786e3726&vjs=3
Jakarta,Back-end Developer,Posted 7 days ago,"Jadi bagian dari tim hebat dari perusahaan global.
Bergabunglah dengan perusahaan global kami dan buka peluang tanpa batas dengan berkolaborasi bersama tim yang beragam dan berbakat. Bersama-sama, kami menciptakan kesuksesan, mendorong inovasi, dan menciptakan dunia dengan berbagai peluang yang tak terbatas.

Detail Pekerjaan
Design, develop, and maintain the server-side logic and architecture of web applications.
Implement APIs and services that enable communication between the front-end and back-end systems.
Design and manage databases, including schema design, data modeling, and optimization.
Integrate with external services, APIs, and third-party tools to enhance application functionality.
Optimize server-side code and database queries for performance and scalability.
Implement security best practices to protect applications from vulnerabilities and attacks.
Write clean, maintainable, and well-documented code.
Conduct code reviews and refactor code as necessary to improve quality and maintainability.
Identify and resolve bugs, issues, and performance bottlenecks in server-side applications.
Write and execute unit tests and integration tests to ensure application stability.
Manage deployment processes and ensure smooth application releases.
Maintain Technical Documentation of application architecture, API endpoints, and backend processes to support ongoing development and troubleshooting.
Persyaratan Keahlian
Proficiency in server-side programming languages such as PHP, Node.js, Python, Java, or .NET. Preferred PHP.
Experience with frameworks and libraries relevant to the chosen programming language (e.g. Laravel, CodeIgniter for PHP, Express.js for Node.js, Django for Python).
Strong understanding of database systems, both SQL (e.g., MySQL, PostgreSQL) and NoSQL (e.g., MongoDB, Redis).
Experience with database design, optimization, and query writing.
Experience in designing and implementing RESTful APIs and/or GraphQL APIs.
Knowledge of API security and authentication mechanisms (e.g., OAuth, JWT).
Ability to optimize server-side code and database queries for high performance and scalability.
Understanding of security principles, such as data encryption, secure authentication, and protection against common vulnerabilities (e.g., SQL injection, XSS).
Proficiency in using version control systems such as Git for code management and collaboration.
A degree in Computer Science, Software Engineering, Information Technology, or a related field.
Tingkat Pendidikan
Minimum Bachelor's degree from any discipline.",,,Jakarta,https://id.indeed.com/rc/clk?jk=da95905fd7cbd968&bb=S8KzFLPIFT3dzdF0kiQIrf6P7CK9dcCfUDhsyWcwXgp9sJGbvco9IW8DpmFsTuzG7CubnlRgJcZlMBiyPN1j13n5tnUGuqJfzFWHKsHim9K5xS0eT7kCVpvdtc2T-da4&xkcb=SoD567M38fJO_xQ82R0AbzkdCdPP&fccid=4ffb8c2bd833d60b&vjs=3
Global Tiket Network,Product Management Intern - Flight,Posted 5 days ago,"We think you also hate when travel app is giving you a headache, right? A slight misinformation can ruin the trip.
That is exactly what we are tackling as t-fam! Making sure that our 17+ million users have the best experience in crafting their own adventure.

Your main duties in flying with us:
Manage external stakeholders for product collaboration
Conduct meetings and send the MOM
Synthesize insights by analyzing data and making data improvement
Requirements:
Last year students preferably majoring in Science, Technology, Engineering, or Mathematics
Having Data Analysis and SQL skills
Passionate in the Product Management field
Excellent Communication and Interpersonal Skills
Have a Data-Driven and Growth mindset
Proficient in English
Tech-savvy which loves to stay on top of industry trends
Self-starter who doesn't hesitate to proactively approach in order to learn fast
In the event that you haven’t received any updates after 3 weeks, your data will be kept and we may contact you for another career destination. Meanwhile, discover more about tiket.com on Instagram, LinkedIn, or YouTube.",,Internship,Jakarta,https://id.indeed.com/rc/clk?jk=3cc44a2e488f4bb9&bb=S8KzFLPIFT3dzdF0kiQIrRwOFhwlzSRItjNjTe7Npg_S7B_uazzNbOHrNU8gkbLufQd5TZmQqsGJKJyh2RZSKCx9mD6KrNysha0lLr7Kb_jFYvi1q2go31aDolH-_eIz&xkcb=SoB367M38fJO_xQ82R0HbzkdCdPP&fccid=86d817bdde43fd0e&vjs=3
Global Tiket Network,Product Management Intern - Entertainment,Posted 5 days ago,"We think you also hate when travel app is giving you a headache, right? A slight misinformation can ruin the trip.
That is exactly what we are tackling as t-fam! Making sure that our 17+ million users have the best experience in crafting their own adventure.

Your main duties in flying with us:
Manage external stakeholders for product collaboration
Conduct meetings and send the MOM
Synthesize insights by analyzing data and making data improvement
Requirements:
Last year students preferably majoring in Science, Technology, Engineering, or Mathematics
Having Data Analysis and SQL skills
Passionate in the Product Management field
Excellent Communication and Interpersonal Skills
Have a Data-Driven and Growth mindset
Proficient in English
Tech-savvy which loves to stay on top of industry trends
Self-starter who doesn't hesitate to proactively approach in order to learn fast
In the event that you haven’t received any updates after 3 weeks, your data will be kept and we may contact you for another career destination. Meanwhile, discover more about tiket.com on Instagram, LinkedIn, or YouTube.",,Internship,Jakarta,https://id.indeed.com/rc/clk?jk=c3f2572f28424237&bb=S8KzFLPIFT3dzdF0kiQIrRyVQNqBuRF-0bqMP-0-9xbNV9fFZ3tmFdSDoQTuXmxtdjXI2Nd-EdIbsX25bCrlScrrzmpKgOrgQ5mqI1xnIUOqH1ys-ZWXJpQSRQ8B6PVs&xkcb=SoDD67M38fJO_xQ82R0GbzkdCdPP&fccid=86d817bdde43fd0e&vjs=3
Dekoruma,Software Engineer (Frontend / Product / Platform),Posted 30+ days ago,"Company Description

Please visit http://career.dekoruma.com to learn more about Engineering at Dekoruma
In Jan 2016, we launched our MVP, being the first Home & Living shoppable magazine in Indonesia and currently in a rapid growth of ~100% paying customer month to month. We are confident that you'll be joining one of the fastest growing startup in the region. As an end-to-end discovery engine for products, we are expanding to a more exciting business lines these coming months (ping me if you are interested to hear more!).

Since then, we rapidly extend our usage of basic tools such as Python/NodeJS/Redis/Postgres/Mongo to build advanced stuff : Isomorphic JS, Shared flux core for web/native, Crawler, Distributed Indexing, Stock Prediction, Arrival Estimation, TF-IDF based Freq Bought Together, Similarity. We also had continuous deployment workflow, whereby all code you write will go live to production within minutes.

Now, we're looking to assemble a fantastically strong engineering team and the first few engineers that join us should set the tone for that:

Job Description

Platform Engineer (Fulltime / Internship):
Extraordinary software engineering talent
Experience contributing to open source projects or building APIs is a plus
Proficiency programming in Python/NodeJS a plus
You should be ready to make this startup your primary focus during the term
Product Engineer (Fulltime / Internship):
Extraordinary software engineering talent
Experience running A/B tests to optimize conversion and engagement a plus
Experience in a hackathon with strong product & quick implementation is a plus
Proficiency programming in Python/NodeJS a plus
You should be ready to make this startup your primary focus during the term
Front End Engineer (Fulltime / Internship):
Extraordinary software engineering talent
Eye for detail & convenient with HTML/CSS
Interest to keepup with latest frontend technologies
Experience running A/B tests to optimize conversion and engagement a plus
Experience in a hackathon with strong product & quick implementation is a plus
Proficiency programming in Python/NodeJS a plus
You should be ready to make this startup your primary focus during the term

Additional Information

Cool stuffs that we're going to build:
React Native
Data science stack (Kafka/Spark/Tensorflow)
ML based feed
Geo-Aware Supplier/Shipment
Algorithmic Pricing
Dekoruma is registered under Dekoruma Pte.Ltd so we also welcome Indonesian talents from Singapore with Tuition Grant / Scholarship Bond.",,Full-time,Jakarta,https://id.indeed.com/rc/clk?jk=8dd6583f0448e3e5&bb=S8KzFLPIFT3dzdF0kiQIrV2KfP0EKfhkh-3n-VEegRc8wm8u6PCcZQneCGboEUyl3CFOuW4pIeWBihxQPFAaVgG4K6Vj0NpB-jQEuyDoT7JVOf-VdJkzDNloANBRH1Ie&xkcb=SoBe67M38fJO_xQ82R0FbzkdCdPP&fccid=286f5e91662ae764&vjs=3
