Company Names,Job Titles,Posted On,Job Details,Images,Type Location,Locations,Link
Samsung Electronics,Data Analyst - Junior,Posted 30+ days ago,"Position Summary
1. Contribute to continued discovery of business areas and strategic decision making by resolving issues through data analysis.
Role and Responsibilities
1. [Data analysis] Define and specify data analysis target and support modeling / verification / test / application.
2. [Data-based decision making] Research and support the insight to support decision making in the areas of business direction/market strategy/product strategy.
3. [Verification of decision effects] Support methods to verify the effect of decision on business (A/B Test, Simulator).
4. [Algorithms assetization] Support implementing, evaluating and verifying algorithms for data analysis.
Skills and Qualifications
Bachelor or Master Degree in Computer Science, Mathematics, Electrical Engineering and Physics from Reputable Universities.
Min 1 Year in Data Analytics
Have experience in Advance SQL Query
Knowledge and experience with data analytic tools such as Python, Excel
Strong analytical & statistical skills and ability to interpret complex data
Have experience in AWS Athena / Google Big Query is a plus
Experience in data modelling, data visualization, data manipulation (extract, transform, load), and predictive analytics is a plus
Good Organization and teamworking skill
Excellent communication abilities in English communication skill, in written and oral
Able to communicate in Korean Language is a plus
Samsung has a strict policy on trade secrets. In applying to Samsung and progressing through the recruitment process, you must not disclose any trade secrets of a current or previous employer.",https://d2q79iu7y748jz.cloudfront.net/s/_squarelogo/256x256/08f9772288de0157ee1f9a21f4ef38a0,Full-time,Jakarta,https://id.indeed.com/rc/clk?jk=60a09dd8e3689c14&bb=O-OFYyqA660Zd7g9w_1ohB_d9K3jkGViZA08HhNIWkUkCNVqlkfRkqG4p7WHCYrX4LyUeXn7WfAxWHepqSthvdiK5OjiRItgZ9cYUG4-bl_ikD1lOYFS9w%3D%3D&xkcb=SoCO67M38fNERpga9z0LbzkdCdPP&fccid=da3c7fed78dd1607&vjs=3
Mastercard,"Associate Analyst, Technology Account Management Launch Graduate Program 2025 - Jakarta, Indonesia",Posted 7 days ago,"Our Purpose
We work to connect and power an inclusive, digital economy that benefits everyone, everywhere by making transactions safe, simple, smart and accessible. Using secure data and networks, partnerships and passion, our innovations and solutions help individuals, financial institutions, governments and businesses realize their greatest potential. Our decency quotient, or DQ, drives our culture and everything we do inside and outside of our company. We cultivate a
culture of inclusion
for all employees that respects their individual strengths, views, and experiences. We believe that our differences enable us to be a better team – one that makes better decisions, drives innovation and delivers better business results.
Title and Summary
Associate Analyst, Technology Account Management Launch Graduate Program 2025 - Jakarta, Indonesia
Who is Mastercard?
We are the global technology company behind the world’s fastest payments processing network. We are a vehicle for commerce, a connection to financial systems for the previously excluded, a technology innovation lab, and the home of Priceless®. We ensure every employee has the opportunity to be a part of something bigger and to change lives. We believe as our company grows, so should you. We believe in connecting everyone to endless, priceless possibilities.

The Mastercard Launch program is aimed at early career talent, to help you develop skills and gain cross-functional work experience. Over a period of 18 months, Launch participants will be assigned to a business unit, learn and develop skills, and gain valuable on the job experience.

Job Description:
Responsible for all aspects of the technology and operational relationship with the customer
Acts as a dedicated resource for key customers
Establishes working relationships with internal delivery teams, customer support teams and customer contacts
Helps identify business opportunities through understanding of the customer’s technology infrastructure
Partners with customers to develop annual business plans and conducts quarterly operational reviews

Responsibilities
Researches basic problem requests and responds to inquiries on products and tools for internal and customers
Contributes to the delivery of integrated solutions that address customer needs
Analyzes data from technology account management projects and reports on performance relative to success metrics
Helps identify customer needs and contributes to the delivery of integrated solutions that address those needs
May produce presentation materials, analytics and reports for customer or internal communications
Develops and maintains strong working relationships, with partners in other business functions in Product and Technology to complete deliver and customer support tasks

All About You:
Experiences
Demonstrates ability to multi-task and prioritize multiple projects concurrently, while meeting deadlines
Works successfully and cooperatively in a team atmosphere
Uses insights drawn from data analytics to add value to a Customer servicing team
Fresh university graduate with a Bachelor's degree, graduating between July 2024 and July 2025.
Students pursuing a Masters/bachelor’s degree (all majors welcome to apply)
Minimum overall GPA of 3.5 strongly recommended
Able to start work on 7 July 2025
Indonesian citizen or possess relevant full working rights to work and do not require visa sponsorship now or in the future
Corporate Security Responsibility

All activities involving access to Mastercard assets, information, and networks comes with an inherent risk to the organization and, therefore, it is expected that every person working for, or on behalf of, Mastercard is responsible for information security and must:
Abide by Mastercard’s security policies and practices;
Ensure the confidentiality and integrity of the information being accessed;
Report any suspected information security violation or breach, and
Complete all periodic mandatory security trainings in accordance with Mastercard’s guidelines.",,Full-time,Jakarta,https://id.indeed.com/rc/clk?jk=44f6792c85d2e9df&bb=O-OFYyqA660Zd7g9w_1ohOdximofylBWu9d8argyA0r-Uk33es99IZ-0KkD84AGZSuBNFBirnlDtSIbZ2UEiLTdXYHx1Sq0M4YCmjNLcl0MuwtQ9V_llGg%3D%3D&xkcb=SoA667M38fNERpga9z0KbzkdCdPP&fccid=10b5c722d846df43&vjs=3
Daya Group,Data Analyst,Posted 1 day ago,"Company Description
Description
Data Analyst will responsible to analyze & visualize data to provide management in making business decision. Manage data to always updated in real time.
Requirement
S1 from Engineering, Statistic or Mathematics, Fresh Graduates are welcome to apply.
GPA 3,20.
Excellent in using Microsoft Excel and Python.
Experience in analyze big data would be a plus.
Good analytical skill and comprehensive way of thinking.
Good in details.
Job Responsibilities
Other Information
Only shortlisted candidates will be contacted.

Job Location
Kota Bandung
Deadline
30 September 2024
Quota
1
Applicants
11",https://d2q79iu7y748jz.cloudfront.net/s/_squarelogo/256x256/1ad1c5af60fd489ded4f37926d9dea5b,,Bandung,https://id.indeed.com/rc/clk?jk=b284cab204b8e657&bb=O-OFYyqA660Zd7g9w_1ohDRnEBskSd42n6GlnIVbNN-URATc0Gm41XjzbosgTeM_TGX_SqK4vhuepRXVPLafGeSqeiM9MB1rtZqszJSx7qWXzKUwHTuvCGQmUQJ3ltdF&xkcb=SoCn67M38fNERpga9z0JbzkdCdPP&fccid=7a41a824a7f71c34&vjs=3
Novo Nordisk,Data Analyst Intern,Posted 19 days ago,"Data Analyst Intern
Category: Education
Location: Jakarta, DKI Jakarta, ID
Are you passionate about data analysis and visualization? Are you looking for an opportunity to develop valuable skills in a global healthcare company? We are seeking a Data Analyst Intern to join our team in our Finance & Operations (F&O) and Customer Engagement (CE) departments. If you are eager to work on data architecture and visualization projects, collaborate with stakeholders, and drive business insights, then this internship is for you. Apply today for a life-changing career.
Novo Nordisk has been globally recognized as the Best Place to Work, topping the ranks for two consecutive years in 2022 and 2023. It is an exciting time to join Novo Nordisk and be part of a dynamic company in an even more dynamic industry, helping us achieve our aspirations to establish a global presence in the industry.
Joining the Data Analyst Intern Pipeline
You are applying to be part of the Novo Nordisk Talent Pool. We are currently not interviewing for this role but we are building a pipeline for future opportunities. If you would like to be considered for a similar position in the future, please submit your CV.
Joining our pipeline means that you will be considered a potential match for all current and upcoming Data Analyst Intern roles.
By applying, we’ll match your profile on a continuous basis against all suitable positions to ensure you don’t miss out on a life-changing career. When an opportunity arises, we will reach out and invite you for an interview. We will keep your application for six months ensuring the best opportunities to provide a solid match for open positions.
If you want to be considered for the Data Analyst Intern position, we look forward to receiving your application.

About the department
The Data Analyst Intern will be part of the Finance & Operations (F&O) and Customer Engagement (CE) departments in Novo Nordisk Indonesia. These departments play a crucial role in ensuring the smooth operation of our business and maintaining strong relationships with our customers. As an intern, you will have the opportunity to work closely with experienced professionals and gain valuable insights into the pharmaceutical industry.

The position
As a Data Analyst Intern, you will work on data architecture and visualization projects, collaborate with stakeholders on requirement gathering, and prepare frameworks to drive business insights. This internship will provide you with the opportunity to develop valuable skills such as data modelling, visualization, and analytical problem-solving.
Internship Duration: 6 months
Location: Jakarta, Indonesia
Internship allowances provided

Qualifications
Currently enrolled in a bachelor’s or master’s degree program in Computer Science, Data Science, or a related discipline.
Proficiency in data modelling and visualization tools, with a strong emphasis on PowerBI (Python is a plus).
Excellent critical thinking and problem-solving abilities.
Capable of working independently and meeting deadlines in a fast-paced environment.

Working at Novo Nordisk
We are a proud life-science company, and life is our reason to exist. We’re inspired by life in all its forms and shapes, ups and downs, opportunities, and challenges. For employees at Novo Nordisk, life means many things – from the building blocks of life that form the basis of ground-breaking scientific research, to our rich personal lives that motivate and energise us to perform our best at work. Ultimately, life is why we’re all here - to ensure that people can lead a life independent of chronic disease.

Contact
Upload your CV to our online career page (click on Apply and follow the instructions).
Deadline
The pipeline is open for applications until October 31, 2024. Due to GDPR, we close the pipelines after 3 months and send email notifications to all active candidates when they are closed, with a link to where you can re-apply to our new Pipeline.
We commit to an inclusive recruitment process and equality of opportunity for all our job applicants.

At Novo Nordisk we recognize that it is no longer good enough to aspire to be the best company in the world. We need to aspire to be the best company for the world and we know that this is only possible with talented employees with diverse perspectives, backgrounds and cultures. We are therefore committed to creating an inclusive culture that celebrates the diversity of our employees, the patients we serve and communities we operate in. Together, we’re life changing.

#LI-AMS1",,Internship,Jakarta,https://id.indeed.com/rc/clk?jk=b29574ab06f6cde4&bb=O-OFYyqA660Zd7g9w_1ohIV10mXojVNaKWvmiRXJr7eIcG_NaUKOnz3UfSgpeInd1Lu9M0VCDC32TKmDMMDll47SLPBpLT59UYHNfYeRDc3LUb0sZu9SLQ%3D%3D&xkcb=SoAT67M38fNERpga9z0IbzkdCdPP&fccid=0ee07a80a4e05d45&vjs=3
Deloitte,Graduate Analyst Program - Technology Strategy & Transformation - Oct 2024 intake,Posted 30+ days ago,"Graduate Analyst Program - Technology Strategy & Transformation - Oct 2024 intake
Date: 28 Aug 2024
Service Line / Portfolios: Enterprise Technology & Performance
Location: Jakarta, ID
Brunei, BN
Are you ready to unleash your potential?

At Deloitte, our purpose is to make an impact that matters for our clients, our people, and the communities we serve.

We believe we have a responsibility to be a force for good, and WorldImpact is our portfolio of initiatives focused on making a tangible impact on society’s biggest challenges and creating a better future. We strive to advise clients on how to deliver purpose-led growth and embed more equitable, inclusive as well as sustainable business practices.

Hence, we seek talented individuals driven to excel and innovate, working together to achieve our shared goals.

We are committed to creating positive work experiences that foster a culture of respect and inclusion, where diverse perspectives are celebrated, and everyone is recognised for their contributions.

Ready to unleash your potential with us? Join the winning team now!

Work you will do
You will be part of our structured Deloitte SEA Graduate Analyst Program and be given a personal coach, the opportunity to undergo a 2-week intensive bootcamp training aimed at equipping you with the skillsets necessary to excel, and opportunities to gain regional exposure by travelling across SEA as part of project assignments, and other professional development opportunities.


This program will allow you to develop core consulting skills and business acumen whilst gaining access to a wide scope of training and development activities. In addition, you will have an opportunity to work with like-minded people and gain exposure to a variety of projects within the chosen business area. You will be at the center of it all, performing research, data analysis and modelling to tackle complex business problems. In addition, you will contribute directly to the development of proposals, presentations, and publications.

This role sits within the Technology Strategy and Transformation (TS&T) team of Deloitte Southeast Asia, which encompasses IT Strategy and Transformation. As a leader of this group, you will drive the growth of our TS&T business in the region and be responsible for the creation, sale and delivery of TS&T solutions: IT Strategy, Application & Systems Development, IT Business Transformation, etc

As an Analyst, your role would include but not limited to:

Supporting project teams in providing end-to-end advisory and overlay point-of-views and industry insights onto the research and analyses provided by the project teams, and seek to formulate innovative technology-enabled solutions to address our clients’ business needs.
Managing the assessment and business requirements gathering processes, review appropriateness of functional specifications against the problem statements/business requirements, and support solutions prototyping and architecture re-design by applying industry insights and know-hows.
Engaging our clients in discussions, presentations and workshops to validate technology-enabled solutions provided by the project teams, as well as perform walk-through of work products and deliverables with the clients.
Develop trusted relationships with your clients and gain recognition in the marketplace for technical and advisory capabilities across the spectrum.
Provide quality assurance and ensure timely delivery of work products developed by the project teams.
Actively coach project teams during the execution of projects and support senior team members in maintaining operational excellence at all times.
Together with project team, meet clients on a regular basis to define problem statements, analyze key priorities/issues, and work with senior team members to develop responses to client enquiries, formulate proposals and produce point-of-view publications.

Your role as a leader

At Deloitte, we believe in the importance of empowering our people to be leaders at all levels. We connect our purpose and shared values to identify issues as well as to make an impact that matters to our clients, people and the communities. Additionally, Analyst across our Firm are expected to:

Demonstrate a strong commitment to personal learning and development.
Understand how our daily work contributes to the priorities of the team and business.
Understand the set expectations and demonstrate accountability in keeping personal performance on track.
Actively focus on developing effective communications and relationship-building skills with stakeholders, clients, and team.
Demonstrate an appreciation for working with others.
Understand what is fundamental to Deloitte’s success as a business.
Demonstrate integrity and an awareness of strengths, differences, and personal impact.
Develop their understanding of Deloitte and offer a fresh perspective.

What we are looking for
In your final year of study or recent graduate between 0-2 years of work experience
Available to commence in October 2024.
Strong academic performance in Information Technology, Business Information Systems, Business, Engineering or Computer Science or related disciplines
Some experience in either advisory or as implementation experience in the following areas:
- IT Strategy: IT strategy development, IT governance, IT operating model, enterprise architecture
IT Transformation: IT sourcing advisory, program and project management advisory
IT Operations: IT service management, IT shared service management
IT Optimization: IT cost reduction, IT Merger & Acquisition
Understanding of current IT trends (cloud computing, big data, social media, RPA, IoT, blockchain, etc.).
Team player with effective interpersonal and communication skills • Demonstrated leadership and teamwork within or outside a work setting
Exceptional problem-solving ability, logical reasoning, creative thinking, comfort with numbers, and the ability to untangle complex issues
Fluent verbal and written English language skills

Due to volume of applications, we regret that only shortlisted candidates will be notified.

Please note that Deloitte will never reach out to you directly via messaging platforms to offer you employment opportunities or request for money or your personal information. Kindly apply for roles that you are interested in via this official Deloitte website.

This role is open to those that possess a valid permit or status to work in Indonesia, Malaysia, Thailand, Singapore.

#LI-LC

Requisition ID: 104666
In Indonesia, the services are provided by Imelda & Rekan and other related entities in Indonesia (""Deloitte in Indonesia""), which are affiliates of Deloitte Southeast Asia Ltd. Deloitte Southeast Asia Ltd is a member firm of Deloitte Touche Tohmatsu Limited. Deloitte in Indonesia, which is within the Deloitte Network, is the entity that is providing this Website.",,,Jakarta,https://id.indeed.com/rc/clk?jk=08781ee3ce3424d2&bb=O-OFYyqA660Zd7g9w_1ohKpN8EWx5_t8kjnONGZV1aY48yUfJYAVmlsU0QfbtSyxw6kl8CTugUjgpLU_DYK3X-ui0LPp_dK1t62g_OXzuOHu13IylKK31w%3D%3D&xkcb=SoCd67M38fNERpga9z0PbzkdCdPP&fccid=9e215d88a6b33622&vjs=3
Nestle Operational Services Worldwide SA,"IT Analytics, Data and Integration Technology Expert",Posted 3 days ago,"Position Snapshot
Location: Jakarta, Indonesia
Company: Nestlé Indonesia
Full Time

Position Summary
Joining Nestlé means you are joining the largest food and Beverage Company in the world. At our very core, we are a human environment – passionate people driven by the purpose of unlocking the power of food to enhance quality of life for everyone, today and for generations to come.

As an IT Analytics, Data Integration Technology Expert, Under the supervision and guidance of her/his primary Community of Practice Lead and Product Group Manager based in Switzerland, the Technology Expert brings deep expertise and knowledge to the product or platform team. S/He guides and promotes optimal use of technology to support the cost effective delivery of business requirements within their area of expertise. Working at the leading edge of IT for the product or platform, the Technology Expert performs preliminary studies, helping to set the technological direction with the product or platform manager. S/He supports delivery and sustain of the most complex applications and business capabilities, and may be accountable for specific deliverables in relation to development or support or may lead the technical activity within their area of specialty.

A day in the life of IT Analytics, Data and Integration Technology Expert
Technology expertise; Provides deep specialist knowledge and skills in data science and engineering, supports integration of solutions with various technologies.
Operational effectiveness and efficiency; Implements continuous improvement on effectiveness, efficiency and delivery of services through the use of technology and technical methodologies.
Security, compliance & risk management; Responsible for ensuring that all solutions are delivered and maintained securely and compliant with internal standards and external regulations, including privacy requirements and understands the business risks and delivers solutions within acceptable risk level.
Stakeholder engagement; Works with functional managers, product managers, Tech Leads, Solution Architects and Business Analysts as required to ensure any solution fits with strategic and technical direction.
Supplier and strategic partners management; Liaises closely with suppliers and vendors, for example where third party works involve significant functional, technical, process, data or integration decisions.

What will make you successful
Bachelor's degree in computer science, system analysis or a related study, or equivalent experience
4 years of experience in the relevant area of expertise
Experience of successfully leading technical evaluations
Experience of resolving technical issues, including those involving 3rd parties
Preferably certification in corresponding technical fields
Experience with effective communication at different levels in the organization and in English
Experience working in a global environment and with virtual teams",,Full-time,Jakarta,https://id.indeed.com/rc/clk?jk=d4550354aa8f0dc5&bb=O-OFYyqA660Zd7g9w_1ohIzm1lIdzm36uxURxrat7cwvq-sC1s3hTWYKRGZtofGiRBS0Q331-xZz0VsClXB5FxL37c4w4ljosMLoYLw9MR15M06PWCqDxg%3D%3D&xkcb=SoAp67M38fNERpga9z0ObzkdCdPP&fccid=bfdac90a7574b77c&vjs=3
Shopee,"Budgeting & Planning - Strategic Project, ShopeeFood",Posted 6 days ago,"Department Business Intelligence and Data Analytics
LevelExperienced (Individual Contributor)
LocationIndonesia - Jakarta
The Business Intelligence and Data Analytics team plays a critical role in conducting close-loop data-driven business iterations. As business intelligence specialists and data analysts, our scope of work is not limited to just performance monitoring and reporting, but also in proactively finding actionable insights to help drive high-impact business changes. Our end-to-end data solution reduces the gap between the business teams and technical teams, and achieves real ‘intelligence’ in the iteration cycle. Browse our Business Intelligence and Data Analytics team openings to see how you can make an impact with us.
Job Description:
Develop and execute strategic initiatives to drive the growth of the food delivery business, including but not limited to focusing on city expansion plans, evaluating growth opportunities on a city-by-city basis, and exploring potential new markets for business development.
Conduct a strategic and operational analysis of the customer and stakeholder experiences with ShopeeFood, identify operation-related issues, determine their root causes, and propose solutions.
Identify opportunities to improve processes within ShopeeFood to increase efficiency and productivity, including developing SOP and process flow documentation.
Plan and lead the end-to-end implementation of the recommended solutions.
Actively liaise and collaborate with cross-functional and cross-business stakeholders to achieve business objectives.
Produce reports to update management on the performance and progress of ShopeeFood initiatives.
Requirements:
Minimum 2 years of working experience in project or product management, business intelligence (BI), management consulting, strategy, or CEO office.
Strong analytical skills, attention to detail, and strong with numbers.
Excellent communication skills and stakeholder management.
Strong in tackling multiple tasks and able to manage projects end-to-end.
Proficient in using Google Workspace (e.g. Google Docs, Google Sheets, and Google Slides).
Fluent in English (written and verbal).
SQL proficiency is a plus.",,,Jakarta,https://id.indeed.com/rc/clk?jk=bed6d8945760260b&bb=O-OFYyqA660Zd7g9w_1ohLRPqXN6Agb0Oc9MVKY_l-0MbBZkwdhXJnaRPLiVcYc0RDkp-7GaxuTD1XRPy-ZXVP-kFi0wjt2Ke4DuM0NVUw_k8eRjQLJi7O2bPmQgFj1J&xkcb=SoC067M38fNERpga9z0NbzkdCdPP&fccid=0b476c4a7add47fe&vjs=3
