Company Names,Job Titles,Posted On,Job Details,Images,Type Location,Locations,Link
Barry Callebaut,Community Development Specialist,Posted 2 days ago,"Community Development Specialist
Location: Bandung, ID, 40256
At Barry Callebaut, we are on a journey to transform the cocoa and chocolate industry. As the world’s leading manufacturer of high-quality chocolate and cocoa products, our actions truly shape the future of our industry. We are a business-to-business company, serving the entire food sector, from the cocoa bean to the finest chocolate product. We are a company with a purpose, we believe in doing well by doing good and reinvesting in the communities we operate. We have a long-standing commitment to sustainability and our goal is to shape a sustainable cocoa and chocolate future. We are headquartered in Zurich, and have more than 12,000 passionate Employees working in more than 40 countries worldwide. We are very proud of who we are and what we do. And of course, we are always looking for talented people to help us have a positive impact on our industry and beyond!
JOB SUMMARY
Sustainability is at the heart of Barry Callebaut. Forever Chocolate is our commitment to have more than 500,000 cocoa farmers in our supply chain lifted out of poverty, eradicate child labor from our supply chain, become carbon and forest positive and have 100% sustainable ingredients in all of our products. Cocoa farmer poverty and a lack of income hinders the hiring of professional workers and the utilization of mechanization, which often leads to reliance on family members, including children, to undertake work which is classified as child labor.
This role will be a key player to support the goal of Human Right pillar, including child protection, Income Generating Activity & VSLA.
In addition, this role also will support the Sustainability Team as the story teller of field activities on the ground.
KEY RESPONSIBILITIES
Developing annual work plan per cocoa sustainability program together with Area Program Manager[s] on the Community Development implementation, including budget management, & setting strategy to achieve the target
Regular monitoring in the project location(s) to ensure all the Community Development activity well implemented & have an improvement
Reviewing & updating the SOP of CCPC, human right [assess & address], IGA & VSLA implementation in Indonesia
Providing creative regular report, news & content (monthly/ quarterly/half year/ yearly) based on Customer Projects related to Community Development activities & if needed to support the other Customer report/news/ media content
Starting/ maintaining the relationship with local & national level of government which relate to all of the Community Development activities
Developing the internal communication which relate to individual Customer Projects, promote & encourage to our internal Sustainability Team to have better understanding & ownership on the implementation
Promote, assist, encourage and monitor the Human Right implementation in all Customer Projects
Capacity building of SCP[s] in all Customer Projects to ensure proper Human Right commitment process is well adopted by supply chain partners & BC stakeholders
REQUIRED ACADEMIC & TECHNICAL QUALIFICATIONS
Possess Bachelor from any major, preferable from Agriculture or Social science
Fluent in both Bahasa Indonesia & English, written & spoken
3-5 years of working experience in agriculture community development (cocoa/ coffee/ palm oil) from the credible company/ NGO
Having proper knowledge on the human right DD, and experienced on the IGA & VSLA
Have an experienced as the community storyteller and social media content creator
ADDITIONAL CONSIDERATIONS
Willing to travel to the cocoa sustainability program location[s] regularly
Based in Bandung
ESSENTIAL EXPERIENCE / KNOWLEDGE
Solid knowledge & understanding of community development (social issue) in agriculture with farmer
Expert in communication
Expert in child protection, human right, income generating & VSLA activity within smallholder farmers/ community
TECHNICAL / FUNCTIONAL COMPETENCIES
Human right DD [national & worldwide; child protection & wellbeing, forced labor, discriminations, gender equality]
IGA [income generating activity] & VSLA [village saving & loans association]
Advance social media knowledge, content creator
Project management, including manage the budget vs expense
Visual communication [photograph, animation, etc.]
INTERPERSONAL / LEADERSHIP COMPETENCIES
Good coordinator, negotiation & communication skill
Creative, initiative & agile in communicating with stakeholders (internal & external)
Ability to analyze data & draw insight
Good leader & team work
Able to work under minimum supervision
PERSONAL STYLE / ATTITUDE / MOTIVATION
Empathy & compassion, non-judgmental & positive attitude
Persistent
Creative thinking & problem solving ability
Accountable
Resilient
At Barry Callebaut, we are committed to Diversity & Inclusion. United by our strong values, we thrive on the diversity of who we are, where we come from, what we’ve experienced and how we think. We are committed to nurturing an inclusive environment where people can truly be themselves, grow to their full potential and feel they belong. #oneBC - Diverse People, Sustainable Growth.
If you want to learn more about Barry Callebaut, please find further information here.
Were you missing anything in this job ad? Please share your feedback with us by clicking here.",,,Bandung,https://id.indeed.com/rc/clk?jk=d7a230c4cce36bad&bb=nb80ecTt0NLc2WPbgrAjDf8dGpxISmLPj3BuOvL5wvQW5zkK8ld1s6GEI9RwYV4LnRG7MPKJuIOtnJKWzipMrFQFDKhGZRcxwdrWrJl8xbGb067GZry1Gech2vQ0WAR-&xkcb=SoBX67M38fJZt2TfWh0CbzkdCdPP&fccid=d5dfcb1c31e0c244&vjs=3
Samsung Electronics,Software Engineer - Fullstack (DA),Posted 30+ days ago,"Position Summary
1. Provide service reliability by analyzing requirements and planning the best quality of delivery by considering design, implementation, architecture, and operation for each service.
2. Enhance service quality by developing and operating the end-to-end service (Frontend and Backend part ) that can efficiently run.
3. Provide service engineering through standardization/automation of technology analysis for each service solution.
4. Advanced SW Certification (Coding Test).
Role and Responsibilities
Have understanding of HTML, CSS, JavaScript and TypeScript
Have experience in using React framework
Have experience in using REST API
Have deep understanding of Java and Object Oriented Programming
Have good communication skills in English
Accustomed to using versioning systems (github)
Have experience in SQL Query
Preferable
Have experience using AWS services is a plus
Have experience in REST API Development (Springboot, Ratpack or others) is a plus
Have experience in Service Oriented Architecture / Microservices Architecture is a plus
Have experience in working with DynamoDB / In-memory-DB such as Redis is a plus
Excellent communication abilities in English and Bahasa Indonesia
Skills and Qualifications
Develops professional expertise by complying with company policies and procedures
Works on problems of moderate scope where analyzing situations or data requires a review on various factors
Exercises judgment within defined procedures and practices to determine appropriate action
Normally receives general instructions on routine work with detailed instructions on new projects or assignments
Bachelor degree in Computer Science, Information System, Information Technology, Software Engineering and Electrical Engineering, Math, Physics, from Reputable Universities.
Samsung has a strict policy on trade secrets. In applying to Samsung and progressing through the recruitment process, you must not disclose any trade secrets of a current or previous employer",https://d2q79iu7y748jz.cloudfront.net/s/_squarelogo/256x256/08f9772288de0157ee1f9a21f4ef38a0,Full-time,Jakarta,https://id.indeed.com/rc/clk?jk=27dde03245a5acb1&bb=nb80ecTt0NLc2WPbgrAjDSaWYYzKxhWmVIj-FPIoo4rjdtBs6eydszMqoASWaf7eqgQoD6sBxSSP_FGP4DFbibeOqEQdyMcyGlqeL-N1-I7PDbfGbmESGw%3D%3D&xkcb=SoDK67M38fJZt2TfWh0BbzkdCdPP&fccid=da3c7fed78dd1607&vjs=3
PwC,Associate / Senior Associate - Advisory Deals - Deals Strategy and Operations - IT,Posted 30+ days ago,"Line of Service
Advisory
Industry/Sector
Not Applicable
Specialism
Deal Strategy
Management Level
Senior Associate
Job Description & Summary
A career within Delivering Deal Value - IT will provide you with the opportunity to help clients achieve maximum value on their deal transactions by solving transformational and other complex challenges. We focus on Leverage data analytics technologies to help our clients maximise the value of their data by generating actionable insights that provide real business outcomes. Work effectively cross engagement team members in analyzing data into obtaining business insights and research outcome. Manage work streams and project deliverables with other team members. And build strong internal relationships within Advisory services with other services across organization.
To really stand out and make us fit for the future in a constantly changing world, each and every one of us at PwC needs to be an authentic and inclusive leader, at all grades/levels and in all lines of service. To help us achieve this we have the PwC Professional; our global leadership development framework. It gives us a single set of expectations across our lines, geographies and career paths, and provides transparency on the skills we need as individuals to be successful and progress in our careers, now and in the future.
As an Associate , you'll work as part of a team of problem solvers, helping to solve complex business issues from strategy to execution. PwC Professional skills and responsibilities for this management level include but are not limited to:
Invite and provide evidence-based feedback in a timely and constructive manner.
Share and collaborate effectively with others.
Work with existing processes/systems whilst making constructive suggestions for improvements.
Validate data and analysis for accuracy and relevance.
Follow risk management and compliance procedures.
Keep up-to-date with technical developments for business area.
Communicate confidently in a clear, concise and articulate manner - verbally and in written form.
Seek opportunities to learn about other cultures and other parts of the business across the Network of PwC firms.
Uphold the firm's code of ethics and business conduct
As a Senior Associate , you'll work as part of a team of problem solvers, helping to solve complex business issues from strategy to execution. PwC Professional skills and responsibilities for this management level include but are not limited to:
Use feedback and reflection to develop self awareness, personal strengths and address development areas.
Delegate to others to provide stretch opportunities, coaching them to deliver results.
Demonstrate critical thinking and the ability to bring order to unstructured problems.
Use a broad range of tools and techniques to extract insights from current industry or sector trends.
Review your work and that of others for quality, accuracy and relevance.
Know how and when to use tools available for a given situation and can explain the reasons for this choice.
Seek and embrace opportunities which give exposure to different situations, environments and perspectives.
Use straightforward communication, in a structured way, when influencing and connecting with others.
Able to read situations and modify behavior to build quality relationships.
Uphold the firm's code of ethics and business conduct.
Job description IT Due Diligence
Deliver merger and acquisition programs across industry verticals focusing on the IT related function across the deal life cycle - IT Due Diligence (IT Governance, IT Strategy & Budgeting, Business Application, Infrastructures, Cybersecurity, Business resiliency), Data Due Diligence, IT integration planning and execution, IT Divestiture planning and IT Synergy Assessments.
Lead functional and technical work streams while setting up the IT IMO and setup for the IT M&A planning and execution
Support clients in the IT strategic planning of IT carve-outs and/or integrations
Facilitate client workshops for synergy realization, solution development and execution
Manage work streams and project deliverables with other team members.
Develop and maintain productive working relationships with client personnel. Build strong internal relationships within Advisory services with other services across organizations.
Preferred skills IT Due Diligence
Minimum Bachelor's Degree in IT and or Business Studies or equivalent (preferably specializing in IT Audit, IT Governance, IT Risk Management)
For Senior Associate: Minimum 3 - 5 years experience in a professional service firm with strong experience in delivering complex M&A IT integration, IT Strategy, IT transformation and implementation projects.
Functional expertise in finance, human resources, supply chain and IT functions and process areas. Ability to evaluate client IT, Finance and HR client capabilities, understand business strategy and develop respective operating models and structures
Experience and familiarity with ERP/ Business Applications (SAP, Oracle, etc), Business Intelligence and Data Analytics platforms along with a working knowledge of IT Strategy and budgeting, IT Governance and Organization, IT infrastructure, Information Security, and Business Resiliency
Comfortable with ambiguity and applying creativity to solve complex problems.
Adequate project management skills, including schedule, scope, issue and risk management experience, change management, planning and analysis.
Demonstrated ability to adapt quickly and manage an environment of rapid change and development, and lead others through this process.
Readiness to learn and eagerness to grow, not only in technical but also non-technical skills.
Strong attention to details and ability to multitask.
Exceptional communication skills and stakeholder management experiences.
Preferably, hold a CISA/CISM/CISSP certification or another similar certification.
Additional Skills
Technically inclined while being business focused and self-driven to keep up-to-date with the latest technologies.
Ability to articulate analytical findings to less-technical business-savvy audiences.
Good problem solving skills, can work with confidence unsupervised, and able to manage multiple concurrent work streams.
Team player with good communication skills.
Highly pragmatic, using technology to solve problems expediently.
Ability to tactfully challenge in discussion without alienating.
Education (if blank, degree and/or field of study not specified)
Degrees/Field of Study required:
Degrees/Field of Study preferred: Bachelor Degree - Computer Science, Bachelor Degree - Applied Mathematics, Bachelor Degree - Computing and IT Management, Bachelor Degree - Engineering
Certifications (if blank, certifications not specified)
Required Skills
Optional Skills
Desired Languages (If blank, desired languages not specified)
Travel Requirements
Up to 40%
Available for Work Visa Sponsorship?
No
Government Clearance Required?
No
Job Posting End Date",,Full-time,Jakarta,https://id.indeed.com/rc/clk?jk=7dd321bdc1dd84b6&bb=nb80ecTt0NLc2WPbgrAjDXd9vLTSiBE4eTew44YozaByCZ5BB8hejdKashRhL7vfnTP6D_XMwo8kbPL7XMeDqGaGQ-COpfPAGMAU8s6BxNf-jjiKk6kuyC_p4LWbdrO1&xkcb=SoB-67M38fJZt2TfWh0AbzkdCdPP&fccid=5e964c4afc56b180&vjs=3
Deloitte,Manager - Artificial Intelligence & Data - Financial Services - ID,Posted 7 days ago,"Manager - Artificial Intelligence & Data - Financial Services - ID
Date: 28 Aug 2024
Service Line / Portfolios: Strategy, Growth & Innovation
Location: Jakarta, ID
Are you ready to unleash your potential?

At Deloitte, our purpose is to make an impact that matters for our clients, our people, and the communities we serve.

We believe we have a responsibility to be a force for good, and WorldImpact[WSY1] is our portfolio of initiatives focused on making a tangible impact on society’s biggest challenges and creating a better future. We strive to advise clients on how to deliver purpose-led growth and embed more equitable, inclusive as well as sustainable business practices.

Hence, we seek talented individuals driven to excel and innovate, working together to achieve our shared goals.

We are committed to creating positive work experiences that foster a culture of respect and inclusion, where diverse perspectives are celebrated, and everyone is recognised for their contributions.

Ready to unleash your potential with us? Join the winning team now!

Work you’ll do

Deloitte’s Financial Services industry group strives to support clients in addressing the challenges that impact today’s industry. Our member firm’s global network engages with clients to refine their business models through innovative practices, improved processes and enabling information technologies.

You will work alongside our clients to help them make decisions and implement solutions based on ""Heart of the Business"" issues and problem statements from architecting the strategic transformation agenda through to driving business value through execution and implementation.

You will be part of Artificial Intelligence & Data (AI&D) Service Offering, Aligned with Financial Service, for Banking (retail, SME, wholesale, and wealth) or Insurance (Life & General Insurance) and drive the latest and best-in-class transformation narrative for our Financial Services (FS) sector clients across SEA. Typical engagements which you could be involved in include:

Business & Operations transformation initiatives driven by AI & Data such as:
Enable omni-channel customer journey and experience design
Operating model based on analytics practices
Digital enablement and platform implementation
You will support Deloitte and client’s business growth by:
Identifying client’s business requirements / overall strategy and vision, and any opportunities for efficiencies in existing process / service design
Undertaking extensive desktop and on-the-ground research on various aspects relevant to our current and potential clients viz. market sizing, competitive benchmarking across channels, products, customer experience, digital capabilities, customer servicing, etc.
Developing draft pitch proposals including storyboarding, data analysis, opportunity sizing, proposed team composition, project costing and fee estimates
Using tech, human-centered design thinking and innovative approaches to solve business needs.
Participating in team problem solving efforts and offer ideas to solve client issues.
Facilitating client workshops to complete current state assessment and providing basis for future state design and rollout planning.
Conducting relevant research, data analysis, and create reports.
Maintaining responsibility for quality, completion, and accuracy of work products.
Assessing restructuring operating models, organizational structures, and business processes to streamline core operations’ service delivery.
Assisting in proposal development, as requested.
Actively expanding consulting skills and professional development through training courses, mentoring, and daily interaction with Deloitte colleagues and clients.

Your role as a leader

At Deloitte, we believe in the importance of empowering our people to be leaders at all levels. We connect our purpose and shared values to identify issues as well as to make an impact that matters to our clients, people and the communities. Additionally, Managers across our Firm are expected to:

Develop diverse, high-performing people and teams through new and meaningful development opportunities.
Collaborate effectively to build productive relationships and networks.
Understand and lead the execution of key objectives and priorities for internal as well as external stakeholders.
Align your team to key objectives as well as set clear priorities and direction.
Make informed decisions that positively impact the sustainable financial performance and enhance the quality of outcomes.
Influence stakeholders, teams, and individuals positively – leading by example and providing equal opportunities for our people to grow, develop and succeed.
Lead with integrity and make a strong positive impact by energising others, valuing individual differences, recognising contributions, and inspiring self-belief.
Deliver superior value and high-quality results to stakeholders while driving high performance from people across Deloitte.
Apply their understanding of disruptive trends and competitor activity to recommend changes, in line with leading practices.

Enough about us, let's talk about you

If you are someone with:
Bachelor or Masters' Degree in any relevant discipline.
Minimum 8-10 years of working experience in the Consulting Industry within Financial Services clientele
It would be great to have
Business problem solving in the Banking or Insurance domain, using analytical tools i.e Machine Learning libraries, LLM (Large Language Model) such as Open AI, Anthrophyic, Google Bard.
Hands-on Experience in finding Data Science solutions, developing AI Models using ML Workbench (i.e PIVOTAL Cloudera, Ms Azure, NVDIA Omniverse)
Good foundation in Data Management, Data Governance (AI Model, ML Ops)
Banking domain analytics within mass market;
wealth or private banking sales & customer 360 analytics
fraud-compliance-risk analytics
operational productivity & capacity analytics
human resource analytics or various advanced analytical frameworks for SME / commercial banking
transaction banking, payments, etc.
Insurance Domain within Bancassurance, Life, General Insurance domain such as agency sales & distribution, customer acquisition & servicing analytics, claims processing, fraud, etc.
It would be nice should you have
Good foundation in programming language i.e (at least one) R, Python, Scala
Certification with relevant to Cloud / Machine Learning / Artificial Intelligence.
Regional Financial Services Experience, across SEA
Strong client relationship skills, including an ability to independently engage with clients.
An appreciation of the consulting lifestyle and ability to travel (both locally and abroad) is a pre-requisite to fit our short-term and long-term project assignments
Responsibilities

Collaborate with clients to understand their business needs, challenges, and goals within the financial services industry.
Lead or Manage:
Opportunity Management – RFI /RfP Process, Solution Designing, Budgeting and Account Planning
Delivery Management – Project Management, Manage Project Team, Project P&L
Leadership - Mentor and coach team members, fostering their professional growth and development within the banking consulting domain
Provide subject matter expertise in banking industry trends, regulations, and best practices to guide clients in making informed
Collaborate with cross-functional teams, including data analysts, technology experts, and business development, to deliver comprehensive solutions to clients.
Stay updated on emerging technologies, market trends, and regulatory changes affecting the financial services industry to provide proactive advice to clients

Due to volume of applications, we regret that only shortlisted candidates will be notified.

Please note that Deloitte will never reach out to you directly via messaging platforms to offer you employment opportunities or request for money or your personal information. Kindly apply for roles that you are interested in via this official Deloitte website.
Requisition ID: 105213
In Indonesia, the services are provided by Imelda & Rekan and other related entities in Indonesia (""Deloitte in Indonesia""), which are affiliates of Deloitte Southeast Asia Ltd. Deloitte Southeast Asia Ltd is a member firm of Deloitte Touche Tohmatsu Limited. Deloitte in Indonesia, which is within the Deloitte Network, is the entity that is providing this Website.",,,Jakarta,https://id.indeed.com/rc/clk?jk=a1856faeb3edb1fc&bb=nb80ecTt0NLc2WPbgrAjDcGLgpk5wnH3lCSt7TO8x2oPZf1bdLeoNf8ioxaBIL9D_VrZPVCDgIoRTImFiMI0mxc1dNCQBzymE37J-xLBtPawjyj2vOCvTg%3D%3D&xkcb=SoDw67M38fJZt2TfWh0HbzkdCdPP&fccid=9e215d88a6b33622&vjs=3
