Company Names,Job Titles,Posted On,Job Details,Images,Type Location,Locations,Link
GSK,CS&L Manager (Supply Chain Manager),Posted 11 days ago,"Site Name: Indonesia - DKI Jakarta - Jakarta Selatan
Posted Date: Aug 24 2024

GSK’s portfolio spans three product areas: vaccines, specialty and general medicines and our focus is to deliver better and faster for patients globally. Our unrivalled vaccine portfolio targets infectious diseases at every stage of life, helping to reduce the burden of disease for hundreds of millions of people. GSK has exceptional capabilities in vaccine science and technologies, including adjuvant/protein and mRNA. In specialty medicines, we are at the forefront of HIV prevention and treatment, and we are building our presence in key therapeutic areas such as oncology and immuno-inflammation. General medicines include our inhaled medicines for asthma and COPD, antibiotics, and medicines for skin diseases.
By 2031, we aim to deliver more than £33 billion in annual sales – a step-change in performance and growth which will significantly increase the positive impact we can have on the health of billions of patients around the world. And we’re confident in our future. Our pipeline of 21 vaccines and 43 medicines includes many with potential to be first or best-in-class opportunities for patients.
We are currently looking for a Customer Services & Logistic (CS&L) Manager / Supply Chain Manager who is accountable to develop, conducts, and improves the Customer Service and Logistics processes for the product supply inbound to the LOC and outbound to its first trade customers to achieve optimal Customer Service levels, thereby supporting the commercial ambition. He/she also manages relationships with external partners and be responsible for managing product importation and ensuring compliance with all applicable regulations in customs and trade compliance.
MAIN RESPONSIBILITIES:
Business partnering with Commercials, Demand Hub and Supply Hub for stock availability and supply continuity to serve customers and patients.
Core Commercial Cycle - actively participate with constructive inputs & challenges to drive alignment in Core Commercial Cycle (CCC) process.
Management of Customer Service, order processing, on-time-in-full delivery through distributor.
Oversight of Services Providers (customs broker, 3PL, distributor) including performance management.
Create ideas and lead /contribute into projects to drive continuous improvement and operational excellence aiming write off avoidance, cost reduction, inventory optimization, simplification, and process automation.
Why you?
We look for people who appreciate the importance of safety and quality and strive to continuously improve our performance and practices. We work in an open and transparent environment so you’ll be someone who treats others with respect and integrity – as you will be treated yourself.
Ideally, we are looking for someone who possesses:
Minimum 10 years of diverse Supply Chain experience (Demand Planning, Supply Planning, Logistics, Warehousing & Distribution, Importation, Customer Service operations), ideally in Pharmaceuticals or FMCG industries.
Strong knowledge in local customs procedure and international trade compliance.
Extensive experience in managing relationships with external parties and key internal stakeholders.
Experience in operating within a GxP environment and Environment, Health, and Safety (EHS) requirements.
Excellent communication skills in both Indonesian and English.
Ability to thrive in a dynamic environment and demonstrate eagerness to acquire new skills and knowledge.
Strong problem solving and exceptional management skills.
Strong continuous improvement mindset across the Supply Chain.
Experienced in data analytics, risk management and scenario planning.
Financial awareness & knowledge of cost drivers within Supply Chain environment.
Why GSK?
Uniting science, technology and talent to get ahead of disease together.
GSK is a global biopharma company with a special purpose – to unite science, technology and talent to get ahead of disease together – so we can positively impact the health of billions of people and deliver stronger, more sustainable shareholder returns – as an organisation where people can thrive. We prevent and treat disease with vaccines, specialty and general medicines. We focus on the science of the immune system and the use of new platform and data technologies, investing in four core therapeutic areas (infectious diseases, HIV, respiratory/ immunology and oncology).
Our success absolutely depends on our people. While getting ahead of disease together is about our ambition for patients and shareholders, it’s also about making GSK a place where people can thrive. We want GSK to be a place where people feel inspired, encouraged and challenged to be the best they can be. A place where they can be themselves – feeling welcome, valued, and included. Where they can keep growing and look after their wellbeing. So, if you share our ambition, join us at this exciting moment in our journey to get Ahead Together.
Important notice to Employment businesses/ Agencies
GSK does not accept referrals from employment businesses and/or employment agencies in respect of the vacancies posted on this site. All employment businesses/agencies are required to contact GSK's commercial and general procurement/human resources department to obtain prior written authorization before referring any candidates to GSK. The obtaining of prior written authorization is a condition precedent to any agreement (verbal or written) between the employment business/ agency and GSK. In the absence of such written authorization being obtained any actions undertaken by the employment business/agency shall be deemed to have been performed without the consent or contractual agreement of GSK. GSK shall therefore not be liable for any fees arising from such actions or any fees arising from any referrals by employment businesses/agencies in respect of the vacancies posted on this site.",,,Jakarta,https://id.indeed.com/rc/clk?jk=f9ca1e291e44d5dd&bb=69ioLC_uGUYnOugpVsYTw0oY9RQW6OXOH0k5E9C_aiG1O-hAzvnlxfc8bn_0zEEbPyZ-fxo1Nk7rQ3OUqIEA8DPcOpHD0Zq-nOr6IRkygdTOCgmCba7SKA%3D%3D&xkcb=SoAV67M38f8P_1TfWh0HbzkdCdPP&fccid=4e42ec53f4b93e02&vjs=3
Cermati.com,Product Owner (Associate - Senior/Lead Levels),Active 22 days ago,"Company Description

Cermati is a financial technology (fintech) startup based in Indonesia. Cermati simplifies the process of finding and applying for financial product by bringing everything online so people can shop around for financial products online and can apply online without having to physically visit a bank.
Our team hailed from Silicon Valley Tech companies such as Google, Microsoft, LinkedIn and Sofi as well as Indonesian startups such as Doku, Touchten. We have graduates from well known universities such as Universitas Indonesia, ITB, Stanford, University of Washington, Cornell and many others. We are building a company with the same culture of openness, transparency, drive and meritocracy as Silicon Valley companies. Join us in our cause to build a world class fintech company in Indonesia.

Job Description
Research, analyze, define product features and you create metrics to measure the impact of your product to the company
Be the primary driver of your product's planning and execution
Write the specs of new features and enhancements
Come up with product road map and rally other people to join your cause to realize your product vision. You are expected to be able to prototype your vision to convince others if necessary.
Work with engineers, designers, ops, sales, legal and even external partners to make things happen

Qualifications

Basic Qualifications:
Minimum Bachelor’s Degree (S1)
Passionate in data-driven product development and has excellent analytical skills to process the data
Detail oriented
Strong planner and very organized
A strong drive to make things happen
Solid oral and written communications skills
Preferred Qualifications (Not required but nice to have):
3+ years of experience for senior level (with IT/Computer Science related degree) in product management in strong tech company with demonstrable success in launching new products, improving products or features that brings impactful business value
Has prior experience as a product manager / software developer / UX designer / project manager
Proficiency in, at least, one programming language such as Java, PHP, Javascript, Python, Ruby, Rust, Go, Haskell
Has prior experience in agile product development
Has advanced degrees i.e. Masters, Phd, MBA, etc",https://d2q79iu7y748jz.cloudfront.net/s/_squarelogo/256x256/cd3bf57dd96c15c944f079eee3122f09,Full-time,Jakarta,https://id.indeed.com/rc/clk?jk=308245a7898a5e5c&bb=69ioLC_uGUYnOugpVsYTw1Pbo9HBB8AxxFNKmfeh4_HvOu8A9s0ZV5tddTPnjr-MZ2S8MgIejWMNb03CUDjDjirVEXowrFkhosiku7es5O1CajIXEOrnREjPwTj24_MI&xkcb=SoCh67M38f8P_1TfWh0GbzkdCdPP&fccid=72115f61555c057a&vjs=3
OPTIMA DATA INTERNASIONAL,IT Project Manager for ERP,Posted 30+ days ago,"Plan and Implement Projects for ERP product, system or solution
Help define project scope, goals and deliverables
Define tasks and required resources
Allocate project resources and manage project team
Create schedule and project timeline
Monitor and report on project progress (Track deliverable)
Implement and manage change when necessary to meet project outputs
Developing schedules and methods for measuring results

Requirement:
Having 2 or more years project management experience in IT especially in ERP
PMP certification or PMO experience preferred
Analytical and strong organizational skills, with excellent verbal and written ability
Detail-oriented and Thrives in collaborative environment
Good communications skills, with customers, team and stakeholders
Have experience in the following domains preferred: managing IT software development
and implementation projects",,,Jakarta,https://id.indeed.com/rc/clk?jk=31a0d900a151a839&bb=69ioLC_uGUYnOugpVsYTw_UAfmE_8Up_21G5AzEHtssJ5abG9JI_mWVTrpL6YRndXLFa5OzVSw6X63uL6GHHFHotiSCzfUdA7QYSYj52uZlFJtEvqID3S5Af3UeRtG98&xkcb=SoA867M38f8P_1TfWh0FbzkdCdPP&fccid=69b4d5d8ea3a806b&vjs=3
Deloitte,Manager - Technology Strategy & Transformation - ID,Posted 19 days ago,"Manager - Technology Strategy & Transformation - ID
Date: 16 Aug 2024
Service Line / Portfolios: Enterprise Technology & Performance
Location: Jakarta, ID
Title: ETP - Techology Strategy & Transformation (based in Indonesia ) – Manager

Are you ready to unleash your potential?

At Deloitte, our purpose is to make an impact that matters for our clients, our people, and the communities we serve.

We believe we have a responsibility to be a force for good, and World Impact is our portfolio of initiatives focused on making a tangible impact on society’s biggest challenges and creating a better future. We strive to advise clients on how to deliver purpose-led growth and embed more equitable, inclusive as well as sustainable business practices.

Hence, we seek talented individuals driven to excel and innovate, working together to achieve our shared goals.

We are committed to creating positive work experiences that foster a culture of respect and inclusion, where diverse perspectives are celebrated, and everyone is recognised for their contributions.

Ready to unleash your potential with us? Join the winning team now!

Work you will do

This role sits within the Technology Strategy and Transformation (TS&T) team of Deloitte Southeast Asia, which encompasses IT Strategy and Transformation. As a leader of this group, you will drive the growth of our TS&T business in the region and be responsible for the creation, sale and delivery of TS&T solutions: IT Strategy, Application & Systems Development, IT Business Transformation, etc.

As a Manager in our team you’ll build and nurture positive working relationships with teams and clients with the intention to exceed client expectations.

You will help our clients solve their most critical information and technological challenges by providing oversight and directing project teams in research efforts and analytics to develop and deliver innovative technology-enabled solutions.
You will oversee and provide directions to the project teams in undertaking IT assessments, critically examine alignment of technology elements against key business priorities, develop recommendations and advise on appropriate strategies, governance, architecture, and innovations to optimize the configuration of clients’ operations.
You will work closely with mid- to senior-level stakeholders to provide status updates and progress reports on project deliverables. You will lead the delivery of workshops with the client, as well as provide subject matter expertise in addressing issues that may be raised during key presentations.
You will be a trusted advisor to the senior IT leadership team or business sponsor and leverage your technical abilities to influence and shape key decisions and/or thought processes of the clients.
You will set up, manage and track project economics in accordance to the approved pricing parameters.
You will take responsibility for managing the project teams and will be accountable for all work products developed by the project teams.
You will take responsibility for management of project teams and will mentor team members to help them in their career progression.
You will be a trusted advisor to our clients and will work closely with them in shaping major IT transformation programmes and identify business opportunities ahead of the curve. You will drive the development of proposals, presentations and publications in response to market demands

In leading teams to deliver impact to clients through the project, you will:

Employ a business-oriented mindset and use data-driven solutions to drive transformation agenda and achieve results
Leverage expertise in a functional domain to enable client’s strategic agenda
Consider opportunities and threats related to end-user adoption when developing recommendations

Your role as a leader

At Deloitte, we believe in the importance of empowering our people to be leaders at all levels. We expect our people to embrace and live our purpose and shared values, challenging themselves every day to identify issues that are most important to our clients, our people and the communities, and to make an impact that matters. In addition to living our purpose, Managers across our Firm are expected to:

Understand the goals of Deloitte, align our people to these objectives by setting clear priorities and direction by establishing a positive relationship with a senior stakeholders.
Influence teams, and individuals positively. Lead by example and provide equal opportunity for people to grow, develop and succeed.
Delivers exceptional client service. Maximizes results and drives high performance from people while fostering collaboration across businesses and geographies.
Manage diverse teams within a highly inclusive team culture where people are respected and valued for their contribution.
Develop high-performing teams through challenging and meaningful opportunities and recognize them for the impact that they make.

Enough about us, let's talk about you

If you are someone with:

A good honors Degree, preferably at postgraduate level, in Information Technology, Business Information Systems, Business, Engineering, Mathematics or related disciplines.
Manager will require a minimum of 8+ years of experience working in IT Implementation/ IT consulting.
Experience in both advisory as well as implementation experience in the following areas:
IT Strategy: IT strategy development, IT governance, IT operating model, enterprise architecture
IT Transformation: IT sourcing advisory, program and project management advisory
IT Operations: IT service management, IT shared service management
IT Optimization: IT cost reduction, IT Merger & Acquisition
Preferably has experience related to Cloud Implementation (incl. Cloud Business Case, Cloud Design, Cloud Architecture, Cloud Operating Mode, Cloud Migration) using AWS, GCP, Azure / Cloud Certified Architect (AWS, GCP, Azure)
Strong analytical skills, excellent oral and written communication skills in English, be self-motivated, and be able to work in stressful situations with changing priorities
Excellent problem solving skills, ability to think out-of-the-box, work under pressure and tight project timelines
Drive, tenacity, client focused and results oriented
Proven demonstration of sound business acumen, teamwork and leadership qualities.
Willingness to work outside of office base and most of all…
An appreciation of the consulting lifestyle and ability to travel (both locally and abroad) is a pre-requisite to fit to our short-term and long-term project assignment.

Next Steps

Due to volume of applications, we regret that only shortlisted candidates will be notified.

Please note that Deloitte will never reach out to you directly via messaging platforms to offer you employment opportunities or request for money or your personal information. Kindly apply for roles that you are interested in via this official Deloitte website.

Requisition ID: 105076
In Indonesia, the services are provided by Imelda & Rekan and other related entities in Indonesia (""Deloitte in Indonesia""), which are affiliates of Deloitte Southeast Asia Ltd. Deloitte Southeast Asia Ltd is a member firm of Deloitte Touche Tohmatsu Limited. Deloitte in Indonesia, which is within the Deloitte Network, is the entity that is providing this Website.",,,Jakarta,https://id.indeed.com/rc/clk?jk=cd945d212032c0f8&bb=EjszcgJmGNkK-hPqTd8pEtYiIhPd9AqGdiskcT281zn5gRDW4FOKim5XwXl0o-7w6z8twhhnWObUrNO4OmeHdODgT1PNZyG-F4TpCJnCHGyU9HI-xqVcgw%3D%3D&xkcb=SoDQ67M38f8FTOTfWh0LbzkdCdPP&fccid=9e215d88a6b33622&vjs=3
EY,Digital Transformation Consultant Manager,Posted 2 days ago,"About EY:

EY, a global leader operating in more than 150 countries delivers unparalleled service in Consulting and assists clients to transform and upskill their capabilities.

We serve our clients to build a better working world, helping them to create long-term value for people and society and build trust in the capital markets. That starts with a culture that believes in giving you the training, opportunities, and creative freedom to make things better. Whenever you join, however long you stay, the exceptional EY experience lasts a lifetime. And with a commitment to hiring and developing the most passionate people, we work towards our ambition to be the best employer.

EY advises clients to understand, architect, select and implement bleeding-edge solutions required to efficiently run their businesses, with a focus on Digital and Cloud. These service areas span E-commerce, Solution Architecture, Mobile Applications, Digital Platform Architecture, Digital Technology Strategy, and Digital IT Operations.

The exceptional EY experience. It’s yours to build.

The opportunity:
The Digital & Emerging Technology team works collaboratively with clients to transform their business through disruptive innovation enablement and transformational design solutions. The team supports our clients in modernizing systems, processes and products to enhance business and customer-facing platforms and services to support high performance in a rapidly changing and competitive environment. Our team helps clients sustain competitive advantage and profitability by developing technology strategies, products, and solutions to stay ahead of the rapid pace of change and disruption and supporting the execution of complex transformations.
We're seeking a highly skilled and experienced Digital Transformation Technology Consultant to join our dynamic team. In this role, you will play a crucial role in designing, developing, and delivering scalable and high-performance digital application. You will collaborate with cross-functional teams, including front-end developers, product managers, and QA engineers, to deliver robust and efficient solutions. While our teams primary focus is within the financial services industries, you will have opportunities to support other sectors including healthcare, automotive, high-tech, and media.

Your key responsibilities:
The goal is to support our clients to transform their business through technology. As a Digital Transformation Technology Consultant, you will collaborate with cross-functional teams to define, design, and deploy new features, identify and address any system challenges in the digital application. When working on the systems within your team's responsibilities, you take into account the appropriate architectural design, ensuring that you deliver a system that is secure, reliable, maintainable, extensible and very well tested. Beyond delivery to the production system, consultant will be responsible to support post deployment monitoring as well.
In addition to being trusted to operate independently, you also maintain a good partnership with your technical and non-technical stakeholders for projects that you are involved in. You take an active role in your projects as a team leader involved in product design to rollout, taking ownership of your work and constantly focusing on moving these projects forward.
Being an experienced team leader, you are also expected to continuously help the team grow and improve either by mentoring new or junior members of your team or by introducing and adopting process improvements.

Requirements:
Bachelor's degree (Computer Science, Computer Engineering or Mathematics) or related experience
7-10 years of system implementation project
Strong knowledge of algorithms and data structures
Good understanding in programming languages such as Java, C# .Net, or Golang
Good understanding of database systems, both relational and NoSQL
Good understanding maintainable and testable code, including API design, unit testing and UI testing technique
Experience working in an Agile/Scrum development process will be preferable
Humble and hungry consultant, always curious, always looking for a better way, and have an excellent communication skill
Highly accountable and takes ownership of one's own work.
Able to articulate business requirement, stakeholder management and technology requirement
Have experience in integration project with multiple stakeholders

What we look for
We’re interested in passionate individuals with a strong vision and a desire to stay on top of trends. If you have a genuine passion for helping businesses achieve their full potential, then these role(s) are for you.

What we offer
Continuous learning: You’ll develop the mindset and skills to navigate whatever comes next
Success as defined by you: We’ll provide the tools and flexibility, so you can make a meaningful impact, on your way
Transformative leadership: We’ll give you the insights, coaching, and confidence to be the leader the world needs
Diverse and inclusive culture: You’ll be embraced for who you are and empowered to use your voice to help others find theirs

If you can demonstrate that you meet the criteria above, please contact us as soon as possible.

EY is an equal opportunity, affirmative action employer providing equal employment opportunities to applicants and employees without regard to race, color, religion, age, sex, sexual orientation, gender identity/expression, national origin, protected veteran status, disability status, or any other legally protected basis, including arrest and conviction records, by applicable law.

EY is committed to providing reasonable accommodation to individuals with special needs. If you are a qualified individual with special needs and need assistance applying online or need to request an accommodation during the interview process, please speak to our HR executives, and we will be happy to help you.",,,Jakarta,https://id.indeed.com/rc/clk?jk=ac5c3f7430677826&bb=EjszcgJmGNkK-hPqTd8pEqOTCLj1XJsl6CJq1RJsiEFAyYgh54kJFbu3bKie7SSfvnJV_ucx26tZ70paa2_DHc6icLgcMBwJKTm9Jte7n_Me6UYDz-2xNy-4_F8oHsws&xkcb=SoBk67M38f8FTOTfWh0KbzkdCdPP&fccid=1544766d4c2915b0&vjs=3
