Company Names,Job Titles,Posted On,Job Details,Images,Type Location,Locations,Link
PT Elektronik Distribusi Otomatisasi Terkemuka...,Product Manager,Posted 23 days ago,"Gather and create Product Requirement Development integrate usability studies, research and market analysis into product requirement
Measure key metrics that inform the success of products
Engage cross functionally, to ship major features and product improvement
Own and drive product roadmap to fruition Communicate about product plan, customer feedback to member team and all stakeholders
Identify cross-product and cross-functional strategic opportunities to create a better platform experience for customers
Review and increases the quality and reliability of products an devotes time to polishing products and systems
Provide stories and task lists for engineers and QA

Having at least 2 to 5 years of relevant experience. Understanding of basic product management skills.
Problem solver with clear structure and analytical skills. Strong communication skills, both verbally and in writing.
Proactive to make things happen and critical in ensuring progress.
Be flexible and adapt to changing circumstances. Have experience working in a multidisciplinary team environment.
Minimum Bachelor's Degree in Computer Science, Engineering, Business, or technical field is preferred
""Waspada terhadap Modus Penipuan pada saat proses interview. Perusahaan tidak akan memungut biaya apapun dalam melakukan proses interview. Mohon segera melaporkan ke kami, jika pada saat Anda diundang untuk interview dan diminta untuk melakukan pembayaran dengan sejumlah uang.""
""Please be aware of the Fraud Company. The company will never be collecting any payment in the process of interview. Please immediately report to us if there's any companies that collecting payment to the Jobseekers.""",,Full-time,Bandung,https://id.indeed.com/rc/clk?jk=8ee67ec581ece528&bb=i3mabTL4OjIl4AZdQXm03GoIbdZZw4DlmeLbWj_uAdQb4ySLuXEVeptiNHDHYN2t6nz6zbzfMJQY4TJEESoCyDHOZtragKsvlVsmB40DYQknR6gIpCTOitH9hQrryydY&xkcb=SoAU67M38f8ayrga9z0GbzkdCdPP&fccid=dd616958bd9ddc12&vjs=3
Mekari (PT. Mid Solusi Nusantara),Account Manager - Large Enterprise (Cross Product),Posted 30+ days ago,"Mekari is Indonesia's no. 1 Software-as-a-Service (SaaS) company. With our ecosystem of software solutions—including Mekari Jurnal, Mekari Talenta, Mekari Qontak, and Mekari Flex, we aim to facilitate entrepreneurs and leaders as they accelerate the digital transformation of their businesses.

In our 10+ years of journey we have reached over 1 Million platform users, and we're not planning to stop any time soon. We need more people like you: builders and owners with calculated ambition who are eager to grow and create their #BiggestImpact.
Responsibilities:
Manage end-to-end product renewal and expansion to existing clients (from all products).
Working closely with internal team to create and execute marketing campaigns to boost product expansion & renewal
Conduct product demonstrations to existing clients if necessary.
Continually gather feedback from our clients, then work directly with our product team to provide input on the product roadmap
Handle administrative duties e.g. the renewal emails, quotations, invoices, and weekly report
Requirements:
Bachelor’s degree from any major
Min 2 years of experience as Account Executive/Account Manager or related roles in SaaS/Tech company
Proficient with corporate productivity and web presentation tools (Microsoft & Gsuite)
Comfortable and confident speaking to mid-level and senior executives
Excellent problem solving & analytical skills
Able to multitask & good time management
Fluent in verbal and written English
Continuously updated with current business trends
Able to work under pressure
Our team will review your application and will be in touch if your application is shortlisted to the next stage. If you do not hear from us in 30 days, we will keep your resume on file in case a relevant opportunity opens up.
Don't forget to check our Recruitment FAQ at bit.ly/RecruitmentFAQ-Mekari [ENG] or bit.ly/RekrutmenMekari-FAQ [INA] to find the answers to commonly-asked questions regarding our recruitment process.
We wish you the best. Hope to see you around soon!",,,Jakarta,https://id.indeed.com/rc/clk?jk=b2265a9d3826252c&bb=i3mabTL4OjIl4AZdQXm03HeqN-jNlrBM7brSEd-Rib1AyyT5uWaeUGk-S6MX2IlpAS8cIUxPv-ig_QOiqm4fAVqC--deeEyJXPSTJYRJfRbPy9oZhcZ871q24n19HuTo&xkcb=SoCJ67M38f8ayrga9z0FbzkdCdPP&fccid=1ab920afc43e1f08&vjs=3
FrieslandCampina,Associate Account Manager (MT) Sukabumi,Just posted,"We are looking for the best talents to maintain daily sales activities operation and business process of Modern Trade Independent area to achieve targeted sales volume and ensure compliance in company’s sales policies. This position will be covering Cimahi, Cianjur & Sukabumi area.

What we ask
Must possess at least Bachelor’s Degree in any field.
Fluent in English.
Having at least 2 Year(s) of working experiences in Modern Trade Independent.
Experience as Supervisor in TOP Fast Moving Consumer Goods.
Agile, energetic, smart communication & negotiation skill.
High resilient and high drive for great results.
Willing to be stationed in Cimahi (West Java), with future possibilities to be rotated to any cities in Indonesia.
Able to drive a car and have a valid driving license.
What we offer
Unique company culture of Dutch heritage and international presence.
You’ll become a key part of our ongoing transformation and contribute to provide better nutrition for the world.
You will be working with a wonderful team who are motivated to contribute and to live our purpose.
Diverse development program to grow and enhance your professional journey.
We offer you a competitive salary & benefits package.
Opportunity to #UnleashYourNature.
Vacancy description
Daily operational of sales team and stock management:
Handling all sales operation in Modern Trade Independent channel.
Plan, check and monitor sales & merchandiser activities to ensure product availability & visibility KPI are achieved.
Coordinate with warehouse team in regards into stock management & availabilities.

Promotion & program execution:
Monitor and track execution of promotion & program to ensure the implementation compliance and effectiveness.
Gather data related promotion & program implementation to get feedback from the market.

People Development:
Conduct briefing & coaching for sales to enhance skill and knowledge.
Liaise with distributor to keep a good relationship and manage the problem occurred.

Market & Data Analysis:
Identify market opportunity and competitor data to get updated market condition and competitor activities.
Prepare data related distributor actual achievement to get comprehensive data for assessment and grading evaluation.
Staying true to who you really are, that is your starting point at FrieslandCampina. Because it is precisely by embracing our differences that we can grow together. We want to create a working environment that allows all employees to bring their best and authentic selves. If who we are suits you, but you're not sure if you're the best fit for the role, we still encourage you to apply so we can help you find the role that fits you best.",,,Bandung,https://id.indeed.com/rc/clk?jk=e0a2092f100ad3ea&bb=pxrNksXygiLxOeibBVke5rlXdEcIqSF4RMipdDWBJg9C9xQyjKiB8hl3U41nIN2y0CFM2SvfRYY60XRqrjsJIO_x9N5N6Fn0oFig_rojP8AOA5ozmQzg3B1eDVInunpt&xkcb=SoBD67M38f8QXdAAl70LbzkdCdPP&fccid=bb9c97a740367a36&vjs=3
Micromine,Mining Engineer (Technical Presales),Posted 27 days ago,"Join one of the world’s premier mining technology companies.
An established business, operating for 37 years, with offices globally.
An enjoyable team culture, work from home (WFH) options, and great benefits.

About Us
Founded in 1986, Micromine is a leading provider of next-generation technology for the mineral resources industry. With 22 offices globally, we are one of the world's premier mining software companies, with our products used in more than 90 countries.

What We Offer
An established multinational business, that is growing fast, with great benefits:
An opportunity to work within the mining technology sector.
Work from home (WFH) and flexibility options to balance work and home life.
12 weeks paid parental leave – primary and secondary carers.
Medical Reimbursement and insurance for employee and their relevant family members.
Opportunities for professional development and progression.
A team first culture and the chance to work within the mining technology industry.

About The Opportunity
Our Micromine APAC team, based in our Jakarta office, are currently seeking a Mining Engineer to join them in a Technical Presales capacity.
Being the largest and fastest-growing region of Micromine, this role will put you at the forefront of delivering our world-class open pit mine scheduling solution, Alastri, for our growing customer base. Play a leading role in the next phase of growth for the Micromine open pit product suite through delivering product demonstrations, technical input into the commercial process, configuring projects to customer needs and overall ensuring customer success.
Reporting to the Technical Services Manager, your key responsibilities will include:
Work alongside business development managers to identify, develop, and close opportunities within key accounts.
Deliver technical aspects of our solution selling process, including client demonstrations, technical input into sales proposals, model builds, training and support.
Work with the customer to ensure the software is being used to its optimum during implementation.

About You
Ideally you will have an open pit mining background with hands on experience using mining software.
Other key skills, experience, and qualifications:
Site based experience in a hard rock open pit mine production or operational planning role.
Experienced in the development, implementation, and support of mine scheduling systems.
Technical consulting or pre-sales experience will be highly advantageous.
A recognised tertiary earth science or engineering qualification.
Excellent English written and verbal communication skills.

Next Steps
If you are looking to shape the future direction of technology in the industry, we encourage you to apply for this exciting opportunity.
To learn more or apply, visit our website at www.micromine.com.

Video",,Full-time,Jakarta,https://id.indeed.com/rc/clk?jk=396bdb993e2bfa92&bb=pxrNksXygiLxOeibBVke5qRR1ZSNuEMu4a5UfiLglXQ3k7NgFOdXQtvpVJ97EIP6WBwj78vpjnGDQTmXvy6ORXJZ0OYYcGaXW6XRQUKs-TfhJGXZF6IVCUTU0LKc_CwL&xkcb=SoD367M38f8QXdAAl70KbzkdCdPP&fccid=46fb0826d2aa8436&vjs=3
Kumo,Technical Product Marketing Manager (Core),Posted 30+ days ago,"Come and change the world of AI with the Kumo team!

Companies spend millions of dollars to store terabytes of data in data lakehouses, but only leverage a fraction of it for predictive tasks. This is because traditional machine learning is slow and time consuming, taking months to perform feature engineering, build training pipelines, and achieve acceptable performance.

At Kumo, we are building a machine learning platform for data lakehouses, enabling data scientists to train powerful Graph Neural Net models directly on their relational data, with only a few lines of declarative syntax known as Predictive Query Language. The Kumo platform enables users to build models a dozen times faster, and achieve better model accuracy than traditional approaches.

This role is the connective tissue between the product management team, the marketing team, the sales team, and the customer. Become knowledgeable with the product, industry, and the technology. Understand the buyer and user personas to create resonating content and messaging. Launch product announcements and news. Enable partner sellers and Kumo sellers to amplify core messages. Bring customer and product truth into everything you do.

Partner Enablement: Collaborate closely with sales, product marketing leadership, and partners to identify and align on priority enablement bill of materials roadmap. Deliver against a bill of materials roadmap to meet business priorities - with a focus on co-selling. Identify needs, pain points, and goals, and source, build, and approve engaging, impactful, and scalable enablement content, including training collateral, sales playbooks, and other assets from the roadmap. Ensure consistent quality for sales-facing messaging, positioning, and value propositions across all enablement materials.

Launch & Product Campaigns: Own product launches and product campaigns by collaborating with the product management team and marketing stakeholders to identify, align, and execute on market impacting announcements. Develop messaging frameworks, enablement content, and market facing assets to support announcements and launches.

Website: Own expansion of product focused pages and solution focused pages to tap into benefits for both technical and business audiences. Draft content and revise in partnership with product management stakeholders. Work closely with the design team, web development, and others to ensure content contains technical accuracy, depth, and has a compelling narrative.

GTM Content: Develop GTM content and product content roadmap to support Kumo’s marketing and sales efforts. Ensure key storytelling topics have coverage across social, video, pdf, and webcopy. Partner with SEO strategist to ensure topics are optimized. Source and develop assets like webpages, ebooks, technical white papers, buyer’s guide, case studies, webinars, Kumo+Snowflake content, Kumo+Databricks content, guided walkthrough, 5 minutes to wow demo, use case by department or industry. Why Kumo for use case, business case, use case at data science level, at AI level.

Customer Advocacy: Develop and customer advocacy materials. Interview customers, draft, and finalize written stories. Use story content to create an ecosystem of content (in partnership with marketing and sales teams) Each customer story should have a combination of a written story (with as many measurable metrics as possible), blog, short video, press release, tweet/linkedin companion posts to support the story, etc.

Executive voice: Develop social media strategy and posts for executives. Work side-by-side with executives and technical contributors to identify and source content. Draft and share social copy.
Requirements:
At least 3 years of similar experience in a B2B organization.
Fluency in English.
Candidates should be available to work at least 4 hours a day overlapping the Pacific time zone.
-
We are an equal opportunity employer and value diversity at our company. We do not discriminate on the basis of race, religion, color, national origin, gender, sexual orientation, age, marital status, veteran status, or disability status.",,Full-time,Jakarta,https://id.indeed.com/rc/clk?jk=1ec993957c4897ed&bb=pxrNksXygiLxOeibBVke5iAZyofKb5b0W8hZAEYETPIocDxAGfjHN2_nSsB2xnbOUQyyYjtXyIQLC_EuGbzl05rv0YIlMl5ssm1pBoHV9Q5WR1hYH8oPQx_CdUtdWwQH&xkcb=SoBq67M38f8QXdAAl70JbzkdCdPP&fccid=31d7e1938da964e0&vjs=3
TikTok,New Business Development Manager - Small and Medium Business,Posted 30+ days ago,"Responsibilities
About Us
TikTok is the leading destination for short-form mobile video. At TikTok, our mission is to inspire creativity and bring joy. TikTok's global headquarters are in Los Angeles and Singapore, and its offices include New York, London, Dublin, Paris, Berlin, Dubai, Jakarta, Seoul, and Tokyo.

Why Join Us
Creation is the core of TikTok's purpose. Our platform is built to help imaginations thrive. This is doubly true of the teams that make TikTok possible.
Together, we inspire creativity and bring joy - a mission we all believe in and aim towards achieving every day.
To us, every challenge, no matter how difficult, is an opportunity; to learn, to innovate, and to grow as one team. Status quo? Never. Courage? Always.
At TikTok, we create together and grow together. That's how we drive impact - for ourselves, our company, and the communities we serve.
Join us.

TikTok's SMB team aims to help businesses and brands of all sizes unleash their creative side, connect with our audience, or perhaps be discovered! From designing scaled sales and service delivery programs to ensuring our customers have best-in-class tools and products at their fingertips, our SMB team combines operational expertise with a customer-centric mindset to help businesses achieve their marketing goals on TikTok, no matter how big or small.

Our SMB New Business Development Team is responsible for prospecting, qualifying, pitching and closing high potential advertisers and marketing agencies for the TikTok Ads Platform. You will consult with decision makers to help them incorporate TikTok Ads into their marketing strategies, collaborate closely with internal stakeholders to develop best practices for client acquisition and sales, while building and managing a pipeline of opportunities, establishing new client relationships, focusing on revenue and bottom line business impact. Success in this position requires a passion for sales, supporting businesses, generating new business, and the ability to thrive in a fast-paced, team-focused environment.

You will:
Stay updated with the Education industry trend, identify vertical issues and develop vertical narrative.
Onboard high-value companies within Education vertical that have never utilized TikTok Ads before. Have a thorough understanding of their business needs and how TikTok Ads can meet their marketing objectives.
Build and manage pipeline of clients within Education sub-vertical and be responsible for end-to-end sales cycle from prioritizing, qualifying and closing the deals.
Develop relationships with the key decision makers of the client and position TikTok Ads to be their trusted partner. In case TikTok Ads is unable to support their needs, document customer feedback, quantify and collaborate with our Product Team to work on the improvement of TikTok Ads solution.
Collaborate with cross functional teams on lead-generation initiatives
Consistently meet and exceed quantitative and qualitative acquisition sales targets, while delivering a best-in-class experience to clients
Generate sales pipeline through outbound prospecting efforts via phone, email, face-to-face and 3rd party tooling
Qualifications
Minimum Qualifications
Bachelor’s degree with minimum 5 years of relevant work experience in sales and/or business development
Proficient with sales prospecting tactics and technologies
Results-oriented with a strong drive for achieving goals.
Able to identify & engage main stakeholders and key decision makers
Preferred Qualifications
Deep understanding of Small and Medium Business industry is a plus
Experience in pipeline building through prospecting and reaching out to new customers.
TikTok is committed to creating an inclusive space where employees are valued for their skills, experiences, and unique perspectives. Our platform connects people from across the globe and so does our workplace. At TikTok, our mission is to inspire creativity and bring joy. To achieve that goal, we are committed to celebrating our diverse voices and to creating an environment that reflects the many communities we reach. We are passionate about this and hope you are too.",,,Jakarta,https://id.indeed.com/rc/clk?jk=9bb7d38671cb209d&bb=pxrNksXygiLxOeibBVke5kXaDw5b0KuweMxO6EF8UXe0ont2TtHDQjX-YjKL-TTKCIVlLAcqskUlEQ43BXwCQF5lQuKm4qdgj8ZIpJn909LGANtYzFsCUR05ueRE6ahp&xkcb=SoDe67M38f8QXdAAl70IbzkdCdPP&fccid=caed318a9335aac0&vjs=3
IlmuOne Data,Jr. Product Manager,Posted 30+ days ago,"Job Description:
We are seeking a highly motivated and talented individual to join our team as a Junior Product Manager. This position is ideal for a fresh graduate or someone with up to 1 year of experience in product management. As a Junior Product Manager, you will work closely with our product manager to assist in the development and execution of our product roadmap and day to day tasks.

Responsibilities:
Collaborate with cross-functional teams, including front-end and back-end engineers, and data science team, to define product requirements and specifications.
Conduct market research and analysis to identify customer needs and market trends.
Assist in the development and maintenance of the product roadmap.
Support the product development process from ideation to launch, ensuring timely delivery and high-quality standards.
Assist in the creation of product documentation, including user stories, wireframes, and product specifications.
Conduct user testing and gather feedback to drive product improvements.
Stay up-to-date with industry trends and best practices in product management.

Preferred Requirements:
Bachelor's degree in Business Administration, Marketing, Computer Science, or any related field
Excellent communication and interpersonal skills
Strong problem-solving skills.
Ability to work effectively in a fast-paced and collaborative environment.
Familiarity with product management methodologies and tools is a plus (such as
Jira, Figma, Confluence, Slack, Google Workspace, etc).
Passion for technology and a strong desire to learn and grow in the field of product management.",,Full-time,Jakarta,https://id.indeed.com/rc/clk?jk=9c511c4c7e8ed546&bb=pxrNksXygiLxOeibBVke5k7Y0WBJpQ8bQ6PQpcgCcYQQxHU58HfCz9TWFqNw-cplOC8lCFbrzE25dcYNBvStU2-t99T8U9rgsRYP_xszaI9Rfgc3rYKMtKfk-tMSpgRE&xkcb=SoBQ67M38f8QXdAAl70PbzkdCdPP&fccid=f5c945192d6f2995&vjs=3
TikTok,TikTok Shop - Automation Labelling Program Manager,Posted 30+ days ago,"Responsibilities
About Us
TikTok is the leading destination for short-form mobile video. Our mission is to inspire creativity and bring joy. TikTok has global offices including Los Angeles, New York, London, Paris, Berlin, Dubai, Singapore, Jakarta, Seoul and Tokyo.

Why Join Us
Creation is the core of TikTok's purpose. Our platform is built to help imaginations thrive. This is doubly true of the teams that make TikTok possible.
Together, we inspire creativity and bring joy - a mission we all believe in and aim towards achieving every day.
To us, every challenge, no matter how difficult, is an opportunity; to learn, to innovate, and to grow as one team. Status quo? Never. Courage? Always.
At TikTok, we create together and grow together. That's how we drive impact - for ourselves, our company, and the communities we serve.
Join us.

About the Team
E-commerce's Governance and Experience (GNE) is a global team responsible for ensuring our marketplace is safe and trustworthy for not only our users, but also sellers and creators. We value user satisfaction and work on policies, rules and systems to ensure quality. Service and moderation Team (SMT) is part of the GNE organization. Our mission is to provide world-class service and experience for customers, sellers and creators. We are looking for an Automation Labelling Program Manager to analyze customer's behavior, and manage the labelling project in the process and finding analysis, to improve the automation modeling capability.

Responsibilities
Analyze automation model data performance, and establish automation strategy with innovative thoughts.
Set the labeling process and target for vendor to ensure productivity and quality.
Provide coaching and training to help vendors to continuously meet the target setting.
Collaborate with the algorithm team and product team to improve automation modeling and feature capability.
Study the automation bad case to deliver insights for the entire automation quality improvement.
Qualifications
Minimum Qualification
Bachelor's degree or above degrees is needed.
3+ years of automation labeling and vendor management related working experience.
Expertise in project design, data analysis, communication skills, driving for results and managing changes.
Good ability of data analysis, and good at finding the issues from the data, and using data to drive improvement.
Preferred Qualification
Strengths in problem shooting, issue-resolution, ability to work in a deadline-driven work environment, attention to detail, and ability to multitask.
Flexibility in cross time zones and regions' cooperation.
Strong ownership, communication in handling the project.
Ability to work in a high tempo environment, adapt, respond to day-to-day challenges of the role.
TikTok is committed to creating an inclusive space where employees are valued for their skills, experiences, and unique perspectives. Our platform connects people from across the globe and so does our workplace. At TikTok, our mission is to inspire creativity and bring joy. To achieve that goal, we are committed to celebrating our diverse voices and to creating an environment that reflects the many communities we reach. We are passionate about this and hope you are too.

#LI-Onsite",,,Jakarta,https://id.indeed.com/rc/clk?jk=4da86edbd4852561&bb=pxrNksXygiLxOeibBVke5qTra38V9g9atCbmh5-Vf15RKYuTTDf73X-2GHtUttqr2X35GGstdZSxAXYfaV10NLPZj8F9gQ4ZA1g66983AJcWZyrHvn8wxZU6M3j4joVm&xkcb=SoDk67M38f8QXdAAl70ObzkdCdPP&fccid=caed318a9335aac0&vjs=3
