Company Names,Job Titles,Posted On,Job Details,Images,Type Location,Locations,Link
Lumina,Product Manager,Posted 30+ days ago,"Company Description

Lumina (https://lumina.mba) is a community-based recruiting and benefits platform for blue/grey collar workers in Southeast Asia. We start with helping laid-off workers to get jobs as COVID is recovering in Indonesia and getting them engaged in our community to upskill. In just a few months we attracted more than 1 million job seekers, and more than 50 thousand jobs from thousands of companies.
Lumina's mission is to build technologies for 300 million Indonesians to find jobs and be financially better off. Join our high-performing & ambitious core team, and work directly with the founders!

Job Description
Work with founders in building the product vision & execute our strategic roadmap
Own Lumina's strategic consumer facing products (Mobile App & Mobile Web) and B2B SaaS.
Translate product strategy into clear & well-scoped requirement documents and prototypes easily understood by non-technical people & executable by engineers
Work with engineers, designers, and cross-functional stakeholders to drive & deliver our roadmap
Scope, prioritize, and manage the timeline of our roadmap based on business & customer impact
Define, track, and analyze key metrics to drive company growth

Qualifications
Minimum 2 years of experience as a product manager at a consumer facing, high growth startup
Minimum bachelor's degree from STEM (Science, Technology, Engineering, Mathematics) or Business background
Excellent analytical and problem-solving skills and strong intuitions of user behaviors
A strong drive to make things happen, charisma, and ability to influence in a multicultural setting
Down to earth, sociable, and can interact with wide spectrum of people; from executives, engineers, all the way to blue-collar workers & underprivileged communities.
Mission driven. Can rally all team members & stakeholders to achieve our goals.

Additional Information

What is like to work at Lumina?
Lumina is, at heart, a technology company. To achieve our mission, we need strong engineers who can help solve the complex problems we face day-to-day. In building high-engagement consumer products, we must match varying user needs with great technological innovations.
We work in small, iterative sprints with a focus on experimentation to gain actionable insights and give value to our users. As a young team of engineers, we are keen on learning and improving ourselves together by living the journey of a fast-growing startup.
We strive to work in a company of warm, high energy, and inclusive people who treat each other exceptionally well. In retrospective sessions, we facilitate and encourage each other to grow in the direction of their personal mission and values. We are committed to build a healthy long-term working relationships where you can reach your full potential.
Note:
At Lumina, we’re looking for people with high ownership, growth-mindset, and integrity. We encourage you to apply even if your experience doesn’t precisely match the job description. Our rigorous interview and onboarding process will help in finding what’s stand out and exceptional in yourself.",,Full-time,Tangerang,https://id.indeed.com/rc/clk?jk=053bb835104253e0&bb=s0_riGku2ri5n5PEGgqNTsVF4sLUN9tHXM8FmpsV0BL08IgvMYOxCQSSy2psqCcqp8m-eyJnyeLtXFhBvDrW7ToVEktYYRCwxG59i8c4ZJU7yP7WtZHRmBgl_mSlnn8G&xkcb=SoCC67M38f7k7wTfWh0ObzkdCdPP&fccid=5ae0a3b8b1a73194&vjs=3
Shopee,UI/UX Designer - Product,Posted 23 days ago,"Department Product Management
LevelExperienced (Individual Contributor)
LocationIndonesia - Jakarta
The Product Management team at Shopee is the key focal point between the business, engineering and design teams. The team is responsible for implementing strategy, road maps and features, while adhering to business goals. It covers all functions including but not limited to Financial Services, Supply Chain, Search, Recommendation, Advertising, Order, Promotion, User, Anti-Fraud, Seller Service. Join us to own a product that is impacting millions of lives in Southeast Asia and Taiwan.
About the Team:
Shopee is the leading e-commerce platform in Southeast Asia and Taiwan. We provide easy, secure, and fast online shopping experiences to our buyers and sellers every day.
We’re looking for a mid-senior UI/UX designer to join us in enhancing our core e-commerce platforms.

You will help improve the sellers’ experience in listing products, managing inventory, monitoring shop performance and marketing initiatives, and engaging with buyers through social and engagement features. You will collaborate with cross-functional teams of designers, writers, product managers, operations, and business analysts.
Job Description:
Design our core e-commerce platforms (mobile and web/dashboard). Create high-fidelity mockups and prototypes for presentation to stakeholders and higher management.
Work closely with product and business counterparts to understand their requirements and translate them into intuitive user interfaces.
Advocate for our users’ needs by actively participating in team discussions and brainstorming sessions.

Requirements:
A degree in Visual Communication Design, Human-Computer Interaction, Computer Science, or a closely related discipline.
At least 4-6 years of experience in UI/UX or Product Design.
A robust UI/UX portfolio that demonstrates your thought process. Experience with B2B interfaces (both mobile and web/dashboard) is highly advantageous.
Proficiency in English is required; the ability to read and communicate in Chinese is a big plus.
Comfortable working in a fast-paced environment and excited to drive projects forward.
Confident and assertive in your design decisions while staying open to constructive feedback.",,,Jakarta,https://id.indeed.com/rc/clk?jk=a39fe7ca670217e6&bb=s0_riGku2ri5n5PEGgqNTonkqqSKMSViDlTUiF0_3CLFgKPMGP8tVpNHZDRfEVrh0D9010goxREdtQE0lE3NZ2xirWhc4-5i71m0OPEIKttIJTogb2QKUPsdLSqbwS2B&xkcb=SoAf67M38f7k7wTfWh0NbzkdCdPP&fccid=0b476c4a7add47fe&vjs=3
Kredivo Group,Product Manager - Digital Bank,Posted 30+ days ago,"Job Description:
Lead the research and analysis of the landscape, customers, product metrics, and latest internet trends to identify and fill product gaps
Generate new ideas that grow market share, improve customer experience and drive growth and conversion
Write product specs, evaluate pros and cons and conduct what-if scenario analysis
Translate product strategy into detailed requirements and prototypes. Conduct what-if/pros and cons analysis;
Scope and prioritize activities based on business and customer impact
Work closely with engineering, marketing and operations to scope and implement new features
Act as a product evangelist to build awareness and understanding
Requirements:
At least 2 years of experience as a product marketing or product manager in a startup environment
Solid technical background with understanding and/or hands-on experience in software development
Extremely strong communication skills
Strong intuition for user behavior
Ability to develop product and marketing strategies
Excellent analytical and problem solving skills
Self-starter with strong project management skills to follow through on execution",,Full-time,Jakarta,https://id.indeed.com/rc/clk?jk=da75e8ac3c641586&bb=s0_riGku2ri5n5PEGgqNTllbAKvhZAllao4StswGVME7kcV6-QYLY6M1TlnpQE9Kgd30lHirtxQl4ixScbqpKLZhgTPWKx9J11LiTSIVQA-rNnPeYB9OSN_Hn5kguwa_&xkcb=SoCr67M38f7k7wTfWh0MbzkdCdPP&fccid=9b6381bd7b084eeb&vjs=3
GudangAda,Product Manager,Posted 30+ days ago,"Company Description

GudangAda is a leading B2B marketplace platform with USD 120+ million raised from Sequoia Capital, Alpha JWC, Asia Partner, and Falcon Edge.

GudangAda connecting FMCG stakeholders in Indonesia to empower the FMCG value chain from transaction to distribution. We focus on addressing the underserved needs of millions of traditional retailers in Indonesia, a segment that faces challenges including limited product variety, uncompetitive wholesale prices, lack of access to producers’ promotional support, and lack of reliable and cost-effective delivery services

Job Description
As part of the product team, build the product vision and execute on the prioritized roadmap for your product area
Seek product ideas and feedback from stakeholders, gather requirements, write specs, create wireframes and workflows
Define clear and well-scoped requirements documents that are easily understood by technical and non-technical audiences
Participate in user research initiatives with the design and user research teams to understand customer problems and identify and iterate on solutions
Define, track, and analyze key metrics to drive product growth
Strong analytical/quantitative and problem-solving skills

Qualifications
Bachelor’s degree from an accredited university or college in information technology, computer science, or similar is required. An advanced degree is an advantage but not required.
At least 3 years of experience working as a product manager, ideally working on consumer-facing, internal backoffice product, large-scale products.
Successful track record in planning, developing and executing strategy for multiple projects while collaborating cross-functionally
Analytical and data-driven, you love digging into the data to understand what’s happening and define & measure success on every project.
You know how to work with agile product development teams and are excited about identifying new ways to help your team be effective.
Extensive hands-on experience working across multiple disciplines presenting findings to an executive audience.
Have strong analytical skill with an emphasis on product development.
Passionate and can influence the team to work together effectively toward the same goal.
High proficiency in communication skills, written and spoken (both in Bahasa Indonesia and English), and are a confident communicator.
Prior experience in building B2B product platforms is a great plus.",,Full-time,Tangerang,https://id.indeed.com/rc/clk?jk=2f80a3c728ebf416&bb=s0_riGku2ri5n5PEGgqNTuJfdG4LqDq8Z-YHndUkNjRzQDoBaXsM5BjlxIMfqdomzPj8cEWRYAo6cY7kBFLPD0X_XLEjCXyQi7KfMy-w30sPq4XDiN6qeNcYsYyjVGn4&xkcb=SoBC67M38f7k7wTfWh0DbzkdCdPP&fccid=e2d6af177a54729a&vjs=3
Solve Education,Product Manager,Posted 30+ days ago,"Job Category: Product
Job Type: Full Time
Job Location: Indonesia
Overview
Solve Education! is a non-profit organization committed to helping children and youth around the globe receive quality, effective education. We are currently looking for a person who has this “We need to ship this feature, make it happen!” attitude.
Benefits
Exposure to collaboration and making a positive impact with a highly motivated team not just in Indonesia but also in our International network, including Singapore, Malaysia, India, the US, and Africa.
Working on-site or hybrid
Meal and internet allowance
Healthcare
Requirements
Able to operate G Suites
Good oral and written communication skills in English, bilingual preferred
Understand the Agile framework
Demonstrate strong problem-solving skills
Demonstrate the ability to be creative and innovative
Able to guide the team to meet deadlines and follow the timeline
Understand the software development lifecycle
Able to produce a product requirement document
Able to write user stories and identify the definition of done
Able to construct prototype/prototypes and conduct user testings
Able to make a feature come to life, based on a detailed description of what the feature should be.
Plus points
Strong knowledge of statistical analysis and design of experiments
Note:
Please send your CV and other relevant documents to career@solveeducation.org.",,Full-time,Indonesia,https://id.indeed.com/rc/clk?jk=326c85d862e12ee6&bb=s0_riGku2ri5n5PEGgqNTnE79PxNbVVyzDxVEAqogU9RUzzEZp1a0P7YFIcMUdQ0KCn51n0A0YcKXYVAoKhrtYiybM50UxysWl2r2eqR98Ep2uPcG6PDjX8MBTDjLSfB&xkcb=SoD267M38f7k7wTfWh0CbzkdCdPP&fccid=36e456d895965528&vjs=3
Kredivo Group,Product Manager Data - Krom,Posted 30+ days ago,"We are looking for Product Managers that are willing to learn new challenges in product management and willing to collaborate with teams across divisions to deeply understand their opportunities and challenges, and together with UI/UX designers and engineers create high impact solutions to our products.
About the job:
Drive end to end product development, start with idea initiation, writing high quality product requirements with supporting data from analysis and technical flow (if needed), product grooming, assisting on development and testing, identify and define key metrics to measure product performance.
Monitor defined and existing key metrics to identify issues/improve the product.
Drive data-informed decisions by integrating user research, data analysis (conduct what-if/pros and cons), and stakeholder feedback into product requirements.
Scope and prioritize activities based on business and customer impact
Working closely with many types of stakeholders, including engineering, designer, analysts, data science, risk, others division to implement new features and enhancements
About you:
Must Haves:
Minimum 3 years of experiences
Minimum bachelor degree in Computer Science, Information System, Mathematics, Statistics or equivalent.
Have strong communication skills, positive energy, team work, high ownership, self-starter, strong drive to make things happen.
Learn quickly, feel comfortable teaching yourself new skills, and working in a complex and fast-paced environment.
Excellent analytical, multi-tasking and problem solving skills.
Willing to understand the technical and collaborate with Engineers.
Willing to work in a fast paced environment.
Nice to Haves:
Joined in product management internships, workshops or seminars (with certifications)
Having exposure in SQL Query.
Involved in application/system development.
Joined in product management competition.",,Full-time,Jakarta,https://id.indeed.com/rc/clk?jk=688a4dd6b5eb072a&bb=s0_riGku2ri5n5PEGgqNTvPbYG6Unuw8rNUbH8X8Ox0Bm7qFJxG_LaZY7sNPDdg9ZCnXT-MMhwjVB-8pJcne_dv6YMDXPuyNGT8AABg7N9D1WYanlqJxt_6KHbFnJkOR&xkcb=SoBr67M38f7k7wTfWh0BbzkdCdPP&fccid=9b6381bd7b084eeb&vjs=3
Techtiera Services Indonesia,Product Manager,Posted 1 day ago,"We are looking for a passionate and experienced Senior Product Manager to join our dynamic team and lead the development of innovative products that delight our customers.
Job Description:
As a Senior Product Manager, you will play a crucial role in guiding the strategic direction of our products. You will be responsible for understanding market needs and trends, defining the product vision, and working closely with cross-functional teams to bring that vision to life. Your leadership will be essential in ensuring the successful development and launch of products that meet our business objectives and exceed customer expectations.
Key Responsibilities:
Define the product strategy and roadmap in alignment with company goals.
Collaborate with stakeholders to understand and document customer needs and translate them into product requirements.
Lead cross-functional teams in the product development process.
Manage the product backlog and prioritize features based on business and customer impact.
Evaluate competitive products and develop response strategies.
Coordinate with marketing to develop product positioning strategies.
Conduct product presentations and demonstrations to stakeholders and customers.
Monitor and measure launched products and feed learnings back into the product development process.
Ensure revenue and customer satisfaction goals are met while adhering to financial and time constraints.
Manage relationships with vendors and third-party partners.
Provide leadership and mentorship to junior product managers.
Qualifications:
Bachelor’s degree in a relevant field;
At least 3 years working experience in financial and f or technology industries
Prior product management experience and one of the following is preferred: Billing, Combined payment, Card billing and E-wallet
Bilingual in English and Mandarin to collaborate with stakeholders from across different markets
Familiar with the Southeast Asian market, understanding overseas local user patterns is a plus.
Strong leadership skills and creativity.
Excellent communication and interpersonal skills.
Great analytical and problem-solving abilities.
Strong organizational and multitasking skills.
A keen eye for detail.
More Details:
Work Type: Hybrid (4 WFO & 1 WFH)
Work Location: Jakarta SCBD Area
Industry: Financial
Job Types: Full-time, Contract
Contract length: 12 months
Pay: Rp2,000,000,000 - Rp2,500,000,000 per month
Ability to commute/relocate:
Jakarta: Reliably commute or planning to relocate before starting work (Preferred)
Application Question(s):
How much is your expected monthly salary with us? (in gross)
How long will your notice period be from your current employer if required?
How much is your current monthly salary?
Are you okay with working for the Financial Industry?
Education:
D1-D4 (Preferred)
Experience:
Product Management: 3 years (Preferred)
Language:
English (Preferred)
Mandarin (Preferred)",,"Full-time,Contract",Jakarta,https://id.indeed.com/rc/clk?jk=4f43f69ca1038b43&bb=s0_riGku2ri5n5PEGgqNTqFYVd-h0cis0SOl8WWtdfSXLuveRsz9Zmm4O0QfxkblxsET9nE-jDWm3wMaKI27BaxTO-7Ip3nGQKr654oUVektTR1hm4AujJaHHy-3yGQ1&xkcb=SoDf67M38f7k7wTfWh0AbzkdCdPP&fccid=dbe30cfa271308d9&cmp=PT.-Orang-Informasi-Teknologi&ti=Product+Manager&vjs=3
tiket.com,"Lead Product Manager, Flight",Posted 30+ days ago,"We think you also hate when travel app is giving you a headache, right? A slight misinformation can ruin the trip.
That is exactly what we are tackling as t-fam! Making sure that our 17+ million users have the best experience in crafting their own adventure.

Your main duties in flying with us:
Facilitate, manage and prioritize a robust product backlog and roadmap.
Work closely with engineers, designers and other PMs on developing new features/specs and driving execution.
Analyze feature/experiment results and communicate learnings to the team and the company.
Synthesize insights by analyzing data to help build more personalized and better product features.
Work closely with internal business, operations and partnerships teams in launching and maintaining features that impact Tiket’s growth.
Drive market and usability research to understand opportunities and develop strategy.
Mandatory belongings that you must prepare:
Passion for a product management role with at least 7 years of experience as a product manager and has exposed to lead a team
A “can do” spirit combined with high energies, drive, and a positive attitude
Good problem-solving skills
Excellent and effective interpersonal and communication skills (written, verbal and listening)
Ability to drive people
Self-starter who doesn't hesitate to proactively approach in order to learn fast
Skilled at working with cross-functional groups to manage multiple projects simultaneously
Tech-savvy which loves to stay on top of industry trends
Bachelor’s Degree in Computing Science, Engineering, or related field is a must
Experience in tech start-ups, large tech companies and/or top consulting firms is an asset
Experience in the OTA or travel-related industry is an asset.
In the event that you haven’t received any updates after 3 weeks, your data will be kept and we may contact you for another career destination. Meanwhile, discover more about tiket.com on Instagram, LinkedIn, or YouTube.",https://d2q79iu7y748jz.cloudfront.net/s/_squarelogo/256x256/f5a2cccd945328946a8e5cbf8aecb337,Full-time,Jakarta,https://id.indeed.com/rc/clk?jk=eb563418a2d15ac5&bb=s0_riGku2ri5n5PEGgqNThPdPAR_cKu2fStRatq-t8tgjXG7M8m1wGJWvj0B8OmY54rlPRMzkLk-tRpjP5vbqxF4FujS1Gdvte9YRIkfBpB8_Sg9-puP7PWtg0TnqtNK&xkcb=SoBR67M38f7k7wTfWh0HbzkdCdPP&fccid=84fbf23ad19a45e1&vjs=3
TikTok,Shop|Tokopedia - Ecommerce Content Policy and Programmes Manager,Posted 16 days ago,"Responsibilities
TikTok is the leading destination for short-form mobile video. At TikTok, our mission is to inspire creativity and bring joy. TikTok's global headquarters are in Los Angeles and Singapore, and its offices include New York, London, Dublin, Paris, Berlin, Dubai, Jakarta, Seoul, and Tokyo.

Why Join Us
Creation is the core of TikTok's purpose. Our platform is built to help imaginations thrive. This is doubly true of the teams that make TikTok possible.
Together, we inspire creativity and bring joy - a mission we all believe in and aim towards achieving every day.
To us, every challenge, no matter how difficult, is an opportunity; to learn, to innovate, and to grow as one team. Status quo? Never. Courage? Always.
At TikTok, we create together and grow together. That's how we drive impact - for ourselves, our company, and the communities we serve.
Join us.

About the Team
The APAC Ecommerce's Governance and Experience team furthers this mission by connecting buyers, sellers and content creators to ensure a seamless, trusted online shopping experience. We seek to inspire trust by designing and implementing end-to-end governance & experience programmes to enable a thriving international marketplace.

As an Ecommerce Content Policy and Programme Manager, you will formulate, apply, and communicate our Ecommerce content policies. With your language, country and cultural perspectives, you can effectively localise policies to deal with country-specific trends, while being aligned with company principles. You have strong research, risk discovery, and critical analysis acumen, and will analyse metrics, surface emergent risks in the market, and drive operational optimisation to improve users' live-shopping experience. Candidates should have experience taking projects from 0 to 1 and are able to drive effective partnerships with cross-functional teams to align on common goals. You have the ability to shuttle from policy to effective implementation, and can make and implement nuanced policy decisions under time-pressure. You should embrace TikTok's Bytestyles.

Responsibilities
1. Research, craft, and implement live-selling content policies that account for the needs of a country while balancing against company principles and goals.
2. Manage go-to-market to ensure effective implementation across Asia Pacific and policy and project outcomes are met.
3. Analyse data to measure, identify, mitigate, and monitor risks to raise the overall ecommerce content ecosystem quality and personalised recommendations. Develop and implement new signals, metrics and engage in risk discovery – to identify new content quality and abuse trends and develop policies to address them.
4. Engage cross-functional stakeholders to consolidate, pre-empt and analyse content and creator pain points; derive and implement action plans and operational workflows to resolve them.
5. Develop, launch and implement new policies and operational workflows – in collaboration with cross-functional teams like Engineering, Operations, Moderation, Product, and Business teams – to enhance large-scale automation, risk detection and mitigation, as well as quality assurance and improvements.
6. Develop and implement feedback loops and operational workflows to ensure the day-to-day quality of launches and implementation.
7. Implement and review dashboards and cases as needed, to ensure day-to-day ecosystem health.
8. Act as an escalation point of contact and manage internal communications on all Ecommerce content policy issues.
Qualifications
Minimum Qualifications
1. Strong bachelor's or master's degree in fields such as Law, Political Science, International Relations, Economics, Public Policy, Philosophy, PPE etc.
2. 5+ years experience leading programmes, doing research, developing and implementing policies.

Preferred Qualifications
1. Professional experience in Government, Academia, Strategy or Operations Management Consulting, Platform Governance, Trust and Safety Policy and Operations Management, or Ecommerce Content Strategy, Seller or Product Growth, Risk Analytics, Compliance, or Experience programmes.
2. Driven, excellent programme management and communication skills with the ability to plan for, and manage complex projects, as well as influence multiple cross-functional teams to build and launch new strategies and workflows.
3. Familiarity with e-commerce, social media content landscape and ecosystem management – as well as strategic business sensitivity will be advantageous.
4. Excellent English oral and written communication skills, including the ability to propose complex solutions and explanations in writing.

TikTok is committed to creating an inclusive space where employees are valued for their skills, experiences, and unique perspectives. Our platform connects people from across the globe and so does our workplace. At TikTok, our mission is to inspire creativity and bring joy. To achieve that goal, we are committed to celebrating our diverse voices and to creating an environment that reflects the many communities we reach. We are passionate about this and hope you are too.",,,Jakarta,https://id.indeed.com/rc/clk?jk=e3cbf4126002b5d0&bb=s0_riGku2ri5n5PEGgqNTkqbtgrmTvq8ZzrOiJ9_1jAzNDaksxdFwxnvgpKHi1WCEm84D24ytXXL_1Ix6kDhSO8qrZx970k8VBpUpOKqHSxRKAtVh8Bips2QdIUMtkH1&xkcb=SoDl67M38f7k7wTfWh0GbzkdCdPP&fccid=caed318a9335aac0&vjs=3
