Company Names,Job Titles,Posted On,Job Details,Images,Type Location,Locations,Link
360 IT Bali,UX/ UI - Web Designer,Active 2 days ago,"Job Description:
We are seeking a highly talented and creative UX/UI Web Designer to join our team in Bali. The ideal candidate will have a strong passion for design, exceptional artistic creativity, and a deep understanding of design principles. Your ability to transform complex concepts into user-friendly and aesthetically compelling designs is crucial.
Key Responsibilities:
Design visually stunning and user-friendly websites and mobile applications.
Collaborate with the development team to ensure designs are optimized for both web and mobile platforms.
Work closely with clients to understand their needs and translate them into high-quality design deliverables.
Maintain a strong emphasis on creative and artistic design elements in all projects.
Qualifications:
Artistic Creativity: A strong artistic sense is crucial for this role. We are looking for someone who can think outside the box and deliver designs that stand out.
Proficiency in Figma: Expertise in Figma is essential, along with a strong understanding of design rules and best practices.
Experience: At least 3 years of experience in web design, with a portfolio that showcases a range of creative and high-quality work.
Communication Skills: Excellent communication skills and the ability to work collaboratively with team members and clients.
Independence and Project Management: Ability to work independently and manage multiple projects simultaneously.
Important Notes:
The selection process will be heavily based on your portfolio and a test project.
We are not seeking entry-level web designers. If you do not possess the skills and talent required for this role, please do not apply.
How to Apply:
If you are passionate about design and want to work in a dynamic and creative environment, we encourage you to apply. Please submit your resume and a portfolio of your work for consideration.
Job Types: Full-time, Part-time, Contract
Ability to commute/relocate:
Seminyak: Reliably commute or planning to relocate before starting work (Preferred)
Application Question(s):
How many websites have you designed using Figma that you can include in your portfolio ?
What is your expected salary for this position ?
Experience:
Web Design: 3 years (Required)
Language:
English (Required)",,"Full-time,Part-time,Contract",Kuta,https://id.indeed.com/rc/clk?jk=1a724e06604ac3c8&bb=4o_kAjWcv6ip8WqK37JzuuXgm90Yb4oD6Bhbm22bWdshvyVpdbqwLUlcrcDvA-9xa8opPQv4FgBptM0ab202EmUvfG69uznhMYn3958ahoAC5kDghbi5UIYvXvtxeqB4&xkcb=SoCP67M38fhTyAzfWh0BbzkdCdPP&fccid=564063b238dc03ac&cmp=360-IT-Bali&ti=User+Interface+Designer&vjs=3
Dipa Pharmalab Intersains,UI/UX Designer,Posted 30+ days ago,"IT
Requirements
Bachelor’s degree in Visual Communication Design, Arts, or IT
Familiar with Figma, Adobe XD, or other design tools
Strong aesthetic, conceptual, and design communication skills
Highly skilled in visual design including UI, Icon, Illustration, and Prototyping across different platforms
Experience in building and implementing design systems
Placement : Kebayoran Lama, South Jakarta (WFO)
Contract Based Min. 1 Year
Jobdesc
Conduct user research, develop wireframes and prototypes, and design visually appealing interfaces
Collaborating with cross-functional teams and ensure designs align with business goals and meet user needs.
Involve in usability testing, continuous improvement, and keeping up with the latest design trends to deliver engaging and intuitive digital experiences.
Join Us Now!
If you have all the requirement above, please send your application letter, CV, and the latest photo to
recruitment@dipa.co.id",,,Jakarta,https://id.indeed.com/rc/clk?jk=89de64b64155101d&bb=4o_kAjWcv6ip8WqK37JzukVMD6DS8p5AI0G4bCqm29YoUrPQ68bsaGwCqGLzpT1eGmI0CVOavSBqjicJ9Go-T7A98uZT-21TjouUIx6U2oKe8Brf3Nqivu0nDbgcb4sU&xkcb=SoA767M38fhTyAzfWh0AbzkdCdPP&fccid=d8efc745e89e80f2&vjs=3
Lintas Media Danawa,UI/UX Developer,Active 2 days ago,"Note: By sending a resume via this form, applicants give permission to Lintas Media Danawa (LMD) to save the applicant's resume, as well as other related information or data in LMD's personal database and give permission to share the resume with LMD partners so the applicants could be contacted by LMD Recruiter or Recruiter LMD's partner once there is a job opportunity from LMD and LMD's partner that may suit the applicant's skills and preferences.
Persyaratan:
Memiliki gelar sarjana atau diploma di bidang desain grafis, desain komunikasi, desain interaksi, atau bidang terkait.
Memiliki pengalaman minimal 2 tahun sebagai UI/UX Desainer atau peran serupa.
Menguasai software desain seperti Adobe Photoshop, Adobe Illustrator atau Sketch.
Memiliki pemahaman yang kuat tentang wireframe tools seperti Balsamiq, Figma, atau Adobe XD.
Memiliki kemampuan untuk memecahkan masalah menggunakan HTML, CSS, dan JavaScript menjadi nilai tambah.
Dapat melakukan praktik terbaik terkait UI/UX desain serta memiliki pemahaman mendalam tentang mobile-first danresponsive design.
Memiliki portofolio desain yang menunjukkan kreativitas,kemampuan visual, dan keterampilan UI/UX.
Memiliki keterampilan komunikasi, presentasi, dan kerjasamatim yang baik.
Memiliki kemampuan analisa, keingintahuan, dan berpikir kritisyang tinggi.
Memiliki user empati dan dapat mengidentifikasi kebutuhandan preferensi pengguna.
Tanggung Jawab:
elakukan riset pengguna dan analisis pesaing terkait UI/UX desain.
Bertanggung jawab untuk memahami arahan proyek dan mengubahnya menjadi UI/UX desain yang menarik dan berguna.
Merencanakan dan mengimplementasikan desain baru untuk beberapa aplikasi baik website atau aplikasi mobile.
Membuat user-centered designs dengan memahami persyaratan yang telah ditentukan oleh bisnis serta feedback dari pengguna.
Membuat user flow, storyboards, wireframe, prototype, dan mockups.
Merancang elemen UI seperti Input Control, Navigational Component, Informational Component, dan Container.
Mengidentifikasi dan memecahkan masalah UI ataupun UX.
Melakukan pengujian dan iterasi terhadap desain dan prototipedengan pengguna.
Bekerja sama dengan tim pengembang untuk memastikanimplementasi desain sesuai dengan spesifikasi.
Job Type: Contract
Contract length: 12 months
Application Question(s):
What's your expected salary? (IDR)",,Contract,Jakarta,https://id.indeed.com/rc/clk?jk=d58fe914c15737e4&bb=4o_kAjWcv6ip8WqK37JzuiFEFUYJIyyWMeeEoso0Nyoif286wTcUae4fsWUcJBkrfZFqDYX8S8CjGMsktgqoXznmzIQ8ptAh-9YdU3_y3wWBRIuX9Srm8D1np_DiE-Ki&xkcb=SoC167M38fhTyAzfWh0HbzkdCdPP&fccid=e0f54e7efb107f2c&cmp=Lintas-Media-Danawa&ti=Ui%2Fux+Developer&vjs=3
Nomura Research Institute Indonesia,Nomura Research Institute Indonesia visibility public,Posted 30+ days ago,"NRI Indonesia was established in October 2015. NRI Indonesia supports the advancement of clients' Digital Transformation (DX) with our comprehensive services of IT consulting and software development, backed by the knowledge, proven track record and expertise of our parent company, Nomura Research Institute (NRI) Japan. We realize truly meaningful solutions for our clients, and support their growth by seamlessly combining our consulting and tech capabilities. At NRI Indonesia, we strive to solve social issues and contribute to a sustainable future.

Our activities cover the following:
Planning, designing and implementing enterprise system
Designing/implementing loyalty program
Big data analytics
Managing and operating systems particularly in the area of retail and distribution, manufacturing, finance and service industries
According to NRI’s basic philosophy, NRI Indonesia aims co-prosperity with our clients in the long term relationship, and wishes to contribute to economic growth with improvement of human life in Indonesia.

Description:
Design, develop, and build highly scalable, cross-platform, and performant applications using the Flutter framework.

Perform issue analysis, root-cause analysis, and issue resolution.

Create any required technical documentation

Requirements:
Strong proficiency with Dart programming language.

Outstanding skill in the Flutter framework.

Strong understanding of user-friendly experience and interface design principles.

Pay attention to details and be proficient in app UI/UX development using Flutter.

Extensive knowledge of using RESTful APIs for data integration.

Extensive knowledge in unit testing and writing testable code in Flutter.

Experience with state management solutions like MobX, Provider, Riverpod, or equivalent in Flutter.

Experience with version control systems, preferably Git.

Preferred :
Experience with platform channels for integrating Flutter with native code (Java/Kotlin for Android or Swift/Objective-C for iOS).

Familiarity with Visual Studio Code or another IDE for Flutter development.

Experience with continuous integration and continuous delivery (CI/CD) processes using tools like GitLab CI, CircleCI, or Fastlane.

Experience in publishing apps to both the App Store and Play Store.

Experience in a formal development methodology - Agile/ SCRUM, Iterate, Waterfall.",,,Jakarta,https://id.indeed.com/rc/clk?jk=9a08d1b519d0372e&bb=4o_kAjWcv6ip8WqK37Jzui5iDgabNd3IPHB4moSFnNMsCiDM-kBKdFkNp44tLZ_UM0RmXlYdPNz915hn0qiUIHrvd9Q18y0Qr0a1FIqGocEyHNzITw9KjXGsGDs3_dqj&xkcb=SoAB67M38fhTyAzfWh0GbzkdCdPP&fccid=eae55ed3a9b44bba&vjs=3
Adveli,"UX/UI, G raphics, Web Designer",Posted 30+ days ago,"We’re looking for an experienced Graphics, Web, UX/UI (Optional) Designers to join us in developing an exciting Web Application Media.

About Yourself:
The candidate should be a motivated self-starter who thrives in a fluid and dynamic environment that changes rapidly and passionate about IT.

Required knowledge:

Photoshop, Illustrator, etc..

Confident, outgoing and enthusiastic

Creative and Solution Focused

University or equivalent educated

Fluent in English

Job Location:

Hayam Wuruk, Jakarta Pusat 10120

To Apply:

Send your Cover Letter and CV to: info@adveli.com",,,Jakarta,https://id.indeed.com/rc/clk?jk=3cb2064f3a474968&bb=4o_kAjWcv6ip8WqK37JzupXTrnbFKrXh-3WvGRwsJcBOaEUowEuFWyNOQ-F199_s8SwOukT_fDMDjRXUZyy0HThkGXIzOC83YBYfe3PTt9rta3M8deaJ10B-HLLMfIC_&xkcb=SoCc67M38fhTyAzfWh0FbzkdCdPP&fccid=f8cd908afe7791e6&vjs=3
