Company Names,Job Titles,Posted On,Job Details,Images,Type Location,Locations,Link
360 IT Bali,UX/ UI - Web Designer,Active 2 days ago,"Job Description:
We are seeking a highly talented and creative UX/UI Web Designer to join our team in Bali. The ideal candidate will have a strong passion for design, exceptional artistic creativity, and a deep understanding of design principles. Your ability to transform complex concepts into user-friendly and aesthetically compelling designs is crucial.
Key Responsibilities:
Design visually stunning and user-friendly websites and mobile applications.
Collaborate with the development team to ensure designs are optimized for both web and mobile platforms.
Work closely with clients to understand their needs and translate them into high-quality design deliverables.
Maintain a strong emphasis on creative and artistic design elements in all projects.
Qualifications:
Artistic Creativity: A strong artistic sense is crucial for this role. We are looking for someone who can think outside the box and deliver designs that stand out.
Proficiency in Figma: Expertise in Figma is essential, along with a strong understanding of design rules and best practices.
Experience: At least 3 years of experience in web design, with a portfolio that showcases a range of creative and high-quality work.
Communication Skills: Excellent communication skills and the ability to work collaboratively with team members and clients.
Independence and Project Management: Ability to work independently and manage multiple projects simultaneously.
Important Notes:
The selection process will be heavily based on your portfolio and a test project.
We are not seeking entry-level web designers. If you do not possess the skills and talent required for this role, please do not apply.
How to Apply:
If you are passionate about design and want to work in a dynamic and creative environment, we encourage you to apply. Please submit your resume and a portfolio of your work for consideration.
Job Types: Full-time, Part-time, Contract
Ability to commute/relocate:
Seminyak: Reliably commute or planning to relocate before starting work (Preferred)
Application Question(s):
How many websites have you designed using Figma that you can include in your portfolio ?
What is your expected salary for this position ?
Experience:
Web Design: 3 years (Required)
Language:
English (Required)",,"Full-time,Part-time,Contract",Kuta,https://id.indeed.com/rc/clk?jk=1a724e06604ac3c8&bb=4o_kAjWcv6ip8WqK37JzuuXgm90Yb4oD6Bhbm22bWdshvyVpdbqwLUlcrcDvA-9xa8opPQv4FgBptM0ab202EmUvfG69uznhMYn3958ahoAC5kDghbi5UIYvXvtxeqB4&xkcb=SoCP67M38fhTyAzfWh0BbzkdCdPP&fccid=564063b238dc03ac&cmp=360-IT-Bali&ti=User+Interface+Designer&vjs=3
Dipa Pharmalab Intersains,UI/UX Designer,Posted 30+ days ago,"IT
Requirements
Bachelor’s degree in Visual Communication Design, Arts, or IT
Familiar with Figma, Adobe XD, or other design tools
Strong aesthetic, conceptual, and design communication skills
Highly skilled in visual design including UI, Icon, Illustration, and Prototyping across different platforms
Experience in building and implementing design systems
Placement : Kebayoran Lama, South Jakarta (WFO)
Contract Based Min. 1 Year
Jobdesc
Conduct user research, develop wireframes and prototypes, and design visually appealing interfaces
Collaborating with cross-functional teams and ensure designs align with business goals and meet user needs.
Involve in usability testing, continuous improvement, and keeping up with the latest design trends to deliver engaging and intuitive digital experiences.
Join Us Now!
If you have all the requirement above, please send your application letter, CV, and the latest photo to
recruitment@dipa.co.id",,,Jakarta,https://id.indeed.com/rc/clk?jk=89de64b64155101d&bb=4o_kAjWcv6ip8WqK37JzukVMD6DS8p5AI0G4bCqm29YoUrPQ68bsaGwCqGLzpT1eGmI0CVOavSBqjicJ9Go-T7A98uZT-21TjouUIx6U2oKe8Brf3Nqivu0nDbgcb4sU&xkcb=SoA767M38fhTyAzfWh0AbzkdCdPP&fccid=d8efc745e89e80f2&vjs=3
Lintas Media Danawa,UI/UX Developer,Active 2 days ago,"Note: By sending a resume via this form, applicants give permission to Lintas Media Danawa (LMD) to save the applicant's resume, as well as other related information or data in LMD's personal database and give permission to share the resume with LMD partners so the applicants could be contacted by LMD Recruiter or Recruiter LMD's partner once there is a job opportunity from LMD and LMD's partner that may suit the applicant's skills and preferences.
Persyaratan:
Memiliki gelar sarjana atau diploma di bidang desain grafis, desain komunikasi, desain interaksi, atau bidang terkait.
Memiliki pengalaman minimal 2 tahun sebagai UI/UX Desainer atau peran serupa.
Menguasai software desain seperti Adobe Photoshop, Adobe Illustrator atau Sketch.
Memiliki pemahaman yang kuat tentang wireframe tools seperti Balsamiq, Figma, atau Adobe XD.
Memiliki kemampuan untuk memecahkan masalah menggunakan HTML, CSS, dan JavaScript menjadi nilai tambah.
Dapat melakukan praktik terbaik terkait UI/UX desain serta memiliki pemahaman mendalam tentang mobile-first danresponsive design.
Memiliki portofolio desain yang menunjukkan kreativitas,kemampuan visual, dan keterampilan UI/UX.
Memiliki keterampilan komunikasi, presentasi, dan kerjasamatim yang baik.
Memiliki kemampuan analisa, keingintahuan, dan berpikir kritisyang tinggi.
Memiliki user empati dan dapat mengidentifikasi kebutuhandan preferensi pengguna.
Tanggung Jawab:
elakukan riset pengguna dan analisis pesaing terkait UI/UX desain.
Bertanggung jawab untuk memahami arahan proyek dan mengubahnya menjadi UI/UX desain yang menarik dan berguna.
Merencanakan dan mengimplementasikan desain baru untuk beberapa aplikasi baik website atau aplikasi mobile.
Membuat user-centered designs dengan memahami persyaratan yang telah ditentukan oleh bisnis serta feedback dari pengguna.
Membuat user flow, storyboards, wireframe, prototype, dan mockups.
Merancang elemen UI seperti Input Control, Navigational Component, Informational Component, dan Container.
Mengidentifikasi dan memecahkan masalah UI ataupun UX.
Melakukan pengujian dan iterasi terhadap desain dan prototipedengan pengguna.
Bekerja sama dengan tim pengembang untuk memastikanimplementasi desain sesuai dengan spesifikasi.
Job Type: Contract
Contract length: 12 months
Application Question(s):
What's your expected salary? (IDR)",,Contract,Jakarta,https://id.indeed.com/rc/clk?jk=d58fe914c15737e4&bb=4o_kAjWcv6ip8WqK37JzuiFEFUYJIyyWMeeEoso0Nyoif286wTcUae4fsWUcJBkrfZFqDYX8S8CjGMsktgqoXznmzIQ8ptAh-9YdU3_y3wWBRIuX9Srm8D1np_DiE-Ki&xkcb=SoC167M38fhTyAzfWh0HbzkdCdPP&fccid=e0f54e7efb107f2c&cmp=Lintas-Media-Danawa&ti=Ui%2Fux+Developer&vjs=3
Nomura Research Institute Indonesia,Nomura Research Institute Indonesia visibility public,Posted 30+ days ago,"NRI Indonesia was established in October 2015. NRI Indonesia supports the advancement of clients' Digital Transformation (DX) with our comprehensive services of IT consulting and software development, backed by the knowledge, proven track record and expertise of our parent company, Nomura Research Institute (NRI) Japan. We realize truly meaningful solutions for our clients, and support their growth by seamlessly combining our consulting and tech capabilities. At NRI Indonesia, we strive to solve social issues and contribute to a sustainable future.

Our activities cover the following:
Planning, designing and implementing enterprise system
Designing/implementing loyalty program
Big data analytics
Managing and operating systems particularly in the area of retail and distribution, manufacturing, finance and service industries
According to NRI’s basic philosophy, NRI Indonesia aims co-prosperity with our clients in the long term relationship, and wishes to contribute to economic growth with improvement of human life in Indonesia.

Description:
Design, develop, and build highly scalable, cross-platform, and performant applications using the Flutter framework.

Perform issue analysis, root-cause analysis, and issue resolution.

Create any required technical documentation

Requirements:
Strong proficiency with Dart programming language.

Outstanding skill in the Flutter framework.

Strong understanding of user-friendly experience and interface design principles.

Pay attention to details and be proficient in app UI/UX development using Flutter.

Extensive knowledge of using RESTful APIs for data integration.

Extensive knowledge in unit testing and writing testable code in Flutter.

Experience with state management solutions like MobX, Provider, Riverpod, or equivalent in Flutter.

Experience with version control systems, preferably Git.

Preferred :
Experience with platform channels for integrating Flutter with native code (Java/Kotlin for Android or Swift/Objective-C for iOS).

Familiarity with Visual Studio Code or another IDE for Flutter development.

Experience with continuous integration and continuous delivery (CI/CD) processes using tools like GitLab CI, CircleCI, or Fastlane.

Experience in publishing apps to both the App Store and Play Store.

Experience in a formal development methodology - Agile/ SCRUM, Iterate, Waterfall.",,,Jakarta,https://id.indeed.com/rc/clk?jk=9a08d1b519d0372e&bb=4o_kAjWcv6ip8WqK37Jzui5iDgabNd3IPHB4moSFnNMsCiDM-kBKdFkNp44tLZ_UM0RmXlYdPNz915hn0qiUIHrvd9Q18y0Qr0a1FIqGocEyHNzITw9KjXGsGDs3_dqj&xkcb=SoAB67M38fhTyAzfWh0GbzkdCdPP&fccid=eae55ed3a9b44bba&vjs=3
Adveli,"UX/UI, G raphics, Web Designer",Posted 30+ days ago,"We’re looking for an experienced Graphics, Web, UX/UI (Optional) Designers to join us in developing an exciting Web Application Media.

About Yourself:
The candidate should be a motivated self-starter who thrives in a fluid and dynamic environment that changes rapidly and passionate about IT.

Required knowledge:

Photoshop, Illustrator, etc..

Confident, outgoing and enthusiastic

Creative and Solution Focused

University or equivalent educated

Fluent in English

Job Location:

Hayam Wuruk, Jakarta Pusat 10120

To Apply:

Send your Cover Letter and CV to: info@adveli.com",,,Jakarta,https://id.indeed.com/rc/clk?jk=3cb2064f3a474968&bb=4o_kAjWcv6ip8WqK37JzupXTrnbFKrXh-3WvGRwsJcBOaEUowEuFWyNOQ-F199_s8SwOukT_fDMDjRXUZyy0HThkGXIzOC83YBYfe3PTt9rta3M8deaJ10B-HLLMfIC_&xkcb=SoCc67M38fhTyAzfWh0FbzkdCdPP&fccid=f8cd908afe7791e6&vjs=3
1001malam.com,UI/UX Designer,Posted 30+ days ago,"Roles & Responsibilities
Develop and improve user interface and user experience to all our products and features
Participate in the development process, from design, build, test, and maintenance
Building mock-up and validation factors
Qualifications
Mastery of Adobe Photoshop and Illustrator
1+ years in designing for mobile applications
3+ years in visudal design
Have experience working on large scale web and mobile app
Have a good knowledge in prototyping
Solid skills in visual design with excellent attention to detail on typography and intuitive layout

. Kirimkan job application anda ke jobs@1001malam.com dengan posisi yang diinginkan di bagian subject email.",https://d2q79iu7y748jz.cloudfront.net/s/_logo/a459699dbb1a116d14e4f1601c04a55a,,Surabaya,https://id.indeed.com/rc/clk?jk=fb8a75ecf8aa4c19&bb=ZJYzb3FOywVCniO0mvQjpOBCVaqlb9CvVdm11ZUPMxOAL4cScYp0kht86z2MeAqKXAreLhVEfCigSwQn7J56z56TSfiRf-kSCxsi1MYw3ny-FXGiomgbrVtJr9q5l66a&xkcb=SoA567M38fhprZQ82R0LbzkdCdPP&fccid=98ef5a59af634c10&vjs=3
PT SIMGROUP (SOURCING HO),UI/UX PALEMBANG,Active 8 days ago,"1. Melakukan riset pengguna
2. Bertanggung jawab untuk membuat catatan rinci dan hasil riset
3. Dapat mengembangkan solusi desain yang kreatif dan inovatif, merancang user interface dengan baik, dan menciptakan berbagai titik sentuhan visual untuk interaksi dengan pengguna
4. Dll
Kualifikasi :
- Minimal Pendidikan S1 (Berpengalaman silahkan melamar),
- S1 Jurusan Sistem Informasi, Teknik Informatika dan Manajemen Informatika
- Usia 19-35 tahun
- Berdomisili di PALEMBANGLihat Lebih Sedikit
Jenis Pekerjaan: Penuh Waktu",,Full-time,Palembang,https://id.indeed.com/rc/clk?jk=b794090f6d280794&bb=ZJYzb3FOywVCniO0mvQjpP98iuehpkoBwYw-eRlNBLysiwJLdRG_dV1DUHq7ic6rJPMFnXwVemmJM4ZSPCs7aU6HI07VJilUuRkhcbMOnE_pQZRm0boPVre6Pk2QfxMZ&xkcb=SoCN67M38fhprZQ82R0KbzkdCdPP&fccid=b485d406f24e394b&cmp=PT-SIMGROUP-%28SOURCING-HO%29&ti=Ui%2Fux+Palembang&vjs=3
Aleph Labs,Aleph Labs visibility public,Posted 30+ days ago,"ALEPH PROFILE:
Hello, we noticed you taking a peek.

It all started on a stormy day in May 2006. There was rain, there was thunder, there was lightning, and there was Aleph.

Aleph is a striking group of craftsmen specialised in strategy, design and technology. We work together to plan, write and produce internet, mobile, and desktop solutions for the most daring set of clients. Bold clients who see the future of user-centric experience and engage Aleph as their rocket fuel.

ALEPH CULTURE:
We’ve grown from a garage operation to a staff strength of 300 and growing across Singapore, Indonesia, Malaysia, Vietnam and Thailand; but we still maintain a boutique company feel and culture within each local market. This is what bonds us and yet frees us enough to apply our unique talents, to deliver functional and flexible solutions, to dream big and to make it happen within this part of the world.

First discovered in 2006 the Alephian is a rare species. As a highly collaborative species, the Alephian loves to gather together and exercise great creativity to accomplish large difficult projects for its counter part in the natural hierarchy: “the client”.

The Alephian’s natural habitat is in the mobile and internet space where its nimble fingers and outstanding control of Wacom pens creates beautiful websites, apps, and campaigns.

A peculiar characteristic is the Alephian ability to communicate relevant information consistently. This is highlighted by a Friday morning tradition where they gather around food and exchange knowledge. This appears to be an effort to become a better group of species.

When not at work, Alephians can be found enjoying Southeast Asia’s beautiful resorts and beaches, planning a theme party or cycling together. And if you ever walk by, put your hand up. Alephians love giving high fives.
We are looking for a UI/UX Designer to design software, mobile apps and platforms that meet people’s needs. As an experienced designer, you will participate and lead various projects, and enjoy collaborating with peers and clients alike to solve complex design problems. You will combine interfaces and workflows to enhance user experience. In this role, you should be an analytical and creative designer who is able to grasp user needs and solve problems.

Production of wireframes, interaction models, information architecture, visual design and supporting documentations

Help define and gather UX requirements from stakeholders/business owners and drive innovative solutions

Craft user stories, personas, storyboards and flows from requirement

Stay abreast of industry best practices for UX design and processes

Conduct concept and usability testing and gather feedback
Minimum of 3+ years experience creating user interfaces, large scale websites, or applications

Proven experience leading UX on projects with an exceptional portfolio showcasing innovative design solutions

Bachelor or Master in Interaction Design, Cognitive Science, HCI, or equivalent experience

Strong attention to detail, aesthetic sensibility and organizational skills

Strong communication skills, both written and oral and able to articulate and defend design decision

Proficient with Adobe, Figma, or Sketch design software

Familiarity with wireframing and drafting tools such as Axure, OmniGraffle a plus

Must have a thorough understanding of how to interpret user needs and translate them into requirements

Ability to multitask in a fast-paced/team setting environment

A team player that enjoys a collaborative design process

Self-motivated and able to work independently, making deadlines consistently

Able to prioritize and adapt to changing objectives with a flexible positive attitude",,,Jakarta,https://id.indeed.com/rc/clk?jk=9138797609c496e4&bb=ZJYzb3FOywVCniO0mvQjpLjFekSz6Vr3uRQ4vMAz24YUH_1YZr3QstY5SsHgVdUoEPKDTu4DGW4MJQtM6Ylr3zygkYZi1UKsT3JidGFA-7zbC_Q_sPBcCwZsnPjb57by&xkcb=SoAQ67M38fhprZQ82R0JbzkdCdPP&fccid=8c50c7c47eb614b8&vjs=3
InterActive,UI UX DESIGNER,Posted 30+ days ago,"UI/UX Designer
JOB DESCRIPTION
Membuat sketsa rancangan tampilan aplikasi software Web Accounting.
Berkontribusi dan memelihara desain visual Web App, dan menguji spesifikasi untuk ide dan interaksi visual baru.
Berpartisipasi dalam research dan evaluasi validasi ide melalui pembuatan prototipe.
Menyampaikan konsep desain ke dalam produk visual dengan ketelitian tinggi.
Merancang dan menerjemahkan ide menjadi tampilan User Interface/Experience Design yang menarik dan mudah digunakan.

Kualifikasi :
Usia maksimal 30 tahun.
Pendidikan min D3/S1 Desain Komunikasi Visual/Sistem Informasi/Ilmu Komputer/lulusan yang relevan
Memiliki Kemampuan untuk merancang dan menterjemahkan ide menjadi tampilan User Interface / Experience Design yang menarik dan mudah digunakan.
Pengalaman dalam UI/UX Design/Software Designer minimal 2 tahun (lebih diutamakan).
Memiliki pengetahuan di bidang Accounting Dasar (lebih diutamakan)
Mampu mengoperasikan tools UI Design (Adobe XD,Sketch, Figma, InVision dan sejenisnya).
Mampu bekerja dan berkomunikasi dalam Tim.
Fresh graduate are welcome.

SEGERA kirimkan lamaran kalian ke email hrd@interactive.co.id
Subjek email : Nama_Posisi yg dilamar

Kirimkan lamaran lengkap Anda ke Alamat Kantor sesuai penempatan yang diinginkan :
Surabaya Head Office, Jl. Ambengan No. 85 Surabaya
Jakarta Branch Office, Jl. Lapangan Bola No. 5A, RT.3/RW.10, Kec. Kebun Jeruk, Jakarta Barat

Lamaran Kerja dan CV juga dapat dikirimkan via email ke hrd@interactive.co.id",https://d2q79iu7y748jz.cloudfront.net/s/_squarelogo/256x256/b8a6ab945941120da8e98666e1fbe754,,Surabaya,https://id.indeed.com/rc/clk?jk=3a469a6d20743837&bb=ZJYzb3FOywVCniO0mvQjpK9IVaWDbUy5cQM6uIDCuBswTrQg0I8Hcsak-7d8B1hwh7EGEnrS__QEqfAiKIOPr79gbDKH9tIIFzK_fcmDpu9MDgR7O04Gz_aA9lIUr014&xkcb=SoCk67M38fhprZQ82R0IbzkdCdPP&fccid=b7b340e3b447ac0d&vjs=3
FUSE,UI UX Designer,Posted 30+ days ago,"We are currently building the #1 Insurtech in Southeast Asia that helps people to reach insurance in the most efficient way. Therefore we need talent with great potential like you to join this growing organization, learning the right skills and also building great teams to reach our goals.
Responsibilities:

Develop and conceptualize user interface designs that create a seamless and enjoyable user experience.
Execute all visual design stages from concept to final hand-off to development.
Collaborate with product management and engineering to define and implement innovative solutions for the product direction, visuals, and user experience.
Create wireframes, storyboards, user flows, process flows, and site maps to effectively communicate interaction and design ideas.
Stay updated on industry trends and incorporate best practices into our design processes.
Qualifications
Proven experience in UI/UX design.
Strong portfolio showcasing diverse design projects.
Proficient in design and prototyping tools Figma, Adobe Illustrator, etc.
Understanding of user-centered design principles.
About FUSE
Fuse is a breakthrough company in the insurance industry. We provide one app for various insurance product types from numerous well-known and trusted insurance companies. We have expanded our business not only in Indonesia but also China and Vietnam, and are planning on an even bigger expansion to grab markets from other Southeast Asia countries.
Our vision is to deploy the latest cutting-edge technology that enables everyone to buy, claim, or sell all kinds of insurances easily and instantly.
Our mission is to be an insurance technology/platform partner that allows all online/offline channel partners to sell multiple insurance products from multiple insurance companies online in real-time.
Fuse is committed not only to make insurance easily available for everyone but also to spread awareness about the importance of having financial plans and protection through insurance.
More about FUSE
FUSE Group LinkedIn
Instagram @lifeatfuse",https://d2q79iu7y748jz.cloudfront.net/s/_squarelogo/256x256/c1befc0c6e83336cdc24541f659f0c5f,,Jakarta,https://id.indeed.com/rc/clk?jk=66c27bfba7e411e5&bb=ZJYzb3FOywVCniO0mvQjpPOPL9gA5wJnwaWofwcDd51B9QTjTYJWI8s8z_aJxJJR4gYcye_PrZHaIr63kguH6FI_zIzVsGWNl8_FImKRxm4Ghl3MgfDg75FpLXTe7DgV&xkcb=SoAq67M38fhprZQ82R0PbzkdCdPP&fccid=9b5e63f4866c68ec&vjs=3
GudangAda,Product Copywriter (Multiple Seniority Level Positions are Available),Posted 30+ days ago,"Company Description

GudangAda is a leading B2B marketplace platform with USD 120+ million raised from Sequoia Capital, Alpha JWC, Asia Partner, and Falcon Edge.

GudangAda connecting FMCG stakeholders in Indonesia to empower the FMCG value chain from transaction to distribution. We focus on addressing the underserved needs of millions of traditional retailers in Indonesia, a segment that faces challenges including limited product variety, uncompetitive wholesale prices, lack of access to producers’ promotional support, and lack of reliable and cost-effective delivery services

Job Description

As a Product Copywriter at GudangAda, your main job is to humanize digital products with words, turning complex problems into simple communications. To inform your copywriting process, you will gather information about who the users are, how they think and feel, what they need, and how they speak. This is because you fully understand the need for a deep understanding of user context to produce concise, conversational, and useful copies. You also believe that the right product voice and tone in each messaging touchpoint function beyond delightful interactions: they bring a sense of connection, relatability, and consistency across platforms.

In performing your role, you will be working with researchers, designers, product managers, and engineers. Therefore, strong interpersonal, prioritization, and stakeholder management skills are required to perform your job well.
Main Responsibilities:
Craft product copy:
Gather data on consumer, market, and competitor conditions to inform copy approach and anticipate possible user scenarios.
Develop cohesive narratives across messaging touchpoints.
Write clear, concise, conversational, and useful copy that guides users in navigating and completing their journey seamlessly within our digital products and services.
Adhere and contribute to the evolution of the product copy style guide.
With consultation from more senior copywriters, conduct usability testing, analyze user feedback, and hold copy critique sessions to check the performance of UI copy and conduct iterations based on the results.
Monitor copy effectiveness and relevance in cooperation with the product team and other designers.
Communicate and manage stakeholders' expectations:
Clarify product strategy with product managers, researchers, designers, and engineers to ensure copy accuracy and cohesiveness.
Apply strategic thinking to communicate concepts and ideas to stakeholders in a structured manner to ensure alignment.
Deliver copy according to the agreed timeline.
Collaborate with other roles:
Collaborate with product researchers and designers to learn about user needs and with product designers to ensure logical and harmonious designs.
Build a positive relationship with not only product researchers and designers but also with product managers and engineers.

Qualifications
1 – 3 years of experience as a Product Copywriter (or in other names: UX Writer, Content Designer) in a tech or digital environment.
A portfolio that showcases your copywriting craft, contributions in helping solve digital product problems, lessons learned from past projects, and impacts of copy solutions.
Working knowledge of design thinking and processes, particularly in writing for digital products and services.
Ability to follow and contribute to improving content style guides and to work with design systems.
Competency in English and proficiency in Indonesian with a good understanding of nuances, grammar, and structure.
Strong sense of accountability and adaptability.
Ability to juggle different contexts and assignments within a dynamic start-up environment.
Excellent communication and interpersonal skills. You will need to explain concepts and ideas across diverse groups of people.

Additional Information

What you will get:
Experience working in a multicultural environment
Huge impact on the society
Learning opportunities to accelerate your professional and personal growth in a growing-startup",,Full-time,Jakarta,https://id.indeed.com/rc/clk?jk=9f519c6410cc015b&bb=ZJYzb3FOywVCniO0mvQjpEeu0gLal_xpBAgfbfvHgyLq6Gbmdy5fiLN1v2o3j_heBXO1CPHpxFKn25NkMSqlNayfNQP2Myg2QYRMuTnV4PJqUA6BBt-dHSR9D3jcx1b1&xkcb=SoCe67M38fhprZQ82R0ObzkdCdPP&fccid=e2d6af177a54729a&vjs=3
