Company Names,Job Titles,Posted On,Job Details,Images,Type Location,Locations,Link
Monotaro,Web Developer,Posted 30+ days ago,"Value Kami
HONESTY & TRUSTWORTHY
DIVERSITY & FAIRNESS
TEAMWORK & COLLABORATION

Job Description

PT MONOTARO INDONESIA runs the B-to-B online stores (monotaro.id) that supply indirect materials such as office supplies, various kinds of tools including hand/power/air tools, daily supplies, and others. Many of them can help users to perform Maintenance, Repair & Operation (MRO). monotaro.id online services keep growing with over 2 million items.

The Web Developer will develop and maintain our E-Commerce website to satisfy customer experience. You will be responsible for implementing visual elements and new features that users see and interact within a web application, which makes your role crucial for the success of our business.

Job Responsibilities

As an Web Developer:
Developing features to enhance the user experience.
Striking a balance between functional and aesthetic design.
Optimize application for maximum speed and scalability.
Collaborate with the Marketing Team to drive unified consumer experience.
Translate data into informed design decisions.
Use A/B testing to evaluate design changes and propose more experiments.

Requirements:
Minimum 3 years in web development.
Solid experience in HTML, CSS, Javascript, or other web presentation technology.
Basic understanding of server-side CSS pre-processing platforms, such as LESS.
Basic understanding of asynchronous request handling, partial page updates, and Ajax.
Basic understanding of Database, SQL.
Experience with responsive design.
Familiarity with Magento2 or PHP.
Familiarity in SEO (implementation & analysis).
Good design sense.
Solid experience in code versioning system (git, cvs, etc).
Excellent oral and written communication skills.
Minimum Diploma Degree.

Proses Rekrutmen Kami


Upload CV kamu sesuai dengan posisi yang diminati.


Proses interview umumnya dilakukan 3 kali: HR, user, dan Presiden Direktur.


Kandidat akan diberikan tes sesuai dengan jobdesc dari posisi yang diminati.


Jika seluruh tahapan berhasil dilalui dengan baik, tim HR akan menghubungi kamu untuk memberikan penawaran.",,,Jakarta,https://id.indeed.com/rc/clk?jk=8e118d8ebbbc9b15&bb=rkEqvfGrBmGXA1lQwKiH4UX6-q04VnYNZLrD-0vDIiBGVV4S2CvyY26_ypaN5dxEqggtAzkcrb3tH7Hu7G3zaZTasXJJZiF5hs8QkF9HYFycNLwtItnKMPC1-NkCNqnZ&xkcb=SoB467M38fc7EqAAl70JbzkdCdPP&fccid=d97edb6300c35bfa&vjs=3
Four Vision Media,Web Programmer,Posted 30+ days ago,"Tanggung Jawab:
Membangun website/aplikasi berbasis web menggunakan PHP, Laravel/CI, atau framework PHP lainnya.
Membantu pengembangan proyek kami yang sedang berjalan/ada.
Memberikan umpan balik teknis.

Persyaratan:
Berpengalaman dalam pemrograman PHP dengan menggunakan salah satu framework.
Berpengalaman dengan salah satu CI, Laravel, atau framework PHP lainnya.
Kandidat harus memiliki pengetahuan tentang Pemrograman Berorientasi Objek dan pengembangan aplikasi web.
Kandidat harus memiliki pengetahuan dasar tentang SQL.
Kandidat harus memiliki pengetahuan tentang HTML5/CSS3 dan JavaScript.
Berpengalaman dengan Version Control (GIT).
Kemampuan komunikasi dan analisis yang baik.
Antusias untuk belajar hal-hal baru.
Kandidat harus memiliki kemampuan untuk bekerja dalam tim.
Kandidat harus memiliki kepribadian yang baik.

Kirimkan lamaran dan CV Anda ke alamat email : info@4visionmedia.com
Informasi lebih lanjut kontak via : ‪+62 812-2077-1010",,,West Java,https://id.indeed.com/rc/clk?jk=ef5a6f948936580c&bb=rkEqvfGrBmGXA1lQwKiH4TAygTO9sRpHaCZdlOAgKGEH9ovJCcdCzr6QyB4pPy_XXLeu6sI6eyNqfj5Qv-85gJRJA9JBNOru7B7C8XB7wSO3j2a1CS_kpGOvAAWQ6fPC&xkcb=SoDM67M38fc7EqAAl70IbzkdCdPP&fccid=0f04fa3720976799&vjs=3
Jakarta,Web Content Creator,Posted 7 days ago,"Jadi bagian dari tim hebat dari perusahaan global.
Bergabunglah dengan perusahaan global kami dan buka peluang tanpa batas dengan berkolaborasi bersama tim yang beragam dan berbakat. Bersama-sama, kami menciptakan kesuksesan, mendorong inovasi, dan menciptakan dunia dengan berbagai peluang yang tak terbatas.

Detail Pekerjaan
Create content: Write blog posts and recipes.
Optimize for SEO: Use keywords to improve search rankings.
Write clearly: Ensure content is easy to understand.
Use visuals: Incorporate images and videos.
Engage community: Respond to comments and encourage user-generated content.
Persyaratan Keahlian
Creating product and content in website.
Able to create, duplicate, and even develop content references according to style.
Looking for content that is currently trend, then modifying it into content.
Stay up-to-date with industry trends and best practices.
Tingkat Pendidikan
Min. Bachelor Degree in Any Major.",,,Jakarta,https://id.indeed.com/rc/clk?jk=2d104dcd4255ac48&bb=rkEqvfGrBmGXA1lQwKiH4dbVEzH6OAa8H2qr9K7pUq76LVaASc5JNbY0gzkPKzF3vK_6jcHc8vWQ7Y3y0miXGO1397rOLGGgDFoacLsUpKTTmvOM-Js6tu1Bxd85mqjO&xkcb=SoBC67M38fc7EqAAl70PbzkdCdPP&fccid=4ffb8c2bd833d60b&vjs=3
Deloitte,ICDC - Experience Analyst - Outsystem Developer - [Jakarta - ID],Posted 30+ days ago,"ICDC - Experience Analyst - Outsystem Developer - [Jakarta - ID]
Date: 29 Aug 2024
Service Line / Portfolios: Enterprise Technology & Performance
Location: Jakarta, ID
Are you ready to unleash your potential?

At Deloitte, our purpose is to make an impact that matters for our clients, our people, and the communities we serve.

We believe we have a responsibility to be a force for good, and WorldImpact is our portfolio of initiatives focused on making a tangible impact on society’s biggest challenges and creating a better future. We strive to advise clients on how to deliver purpose-led growth and embed more equitable, inclusive as well as sustainable business practices.

Hence, we seek talented individuals driven to excel and innovate, working together to achieve our shared goals.

We are committed to creating positive work experiences that foster a culture of respect and inclusion, where diverse perspectives are celebrated, and everyone is recognised for their contributions.

Ready to unleash your potential with us? Join the winning team now!

Work you’ll do:
You will develop middle logic layer and backend handoff to partnering systems.
You will involve in database design and development.
You will perform primary and secondary research, conduct analyses and appropriate modelling tasks that feeds directly into the development of technology-enabled solutions for tackling our clients’ complex business problems.
You will leverage on your training in technology, utilize analytical abilities and communication skills to support the project teams in delivery of our digital solution architectures and in development of work products that addresses our clients’ business needs and help achieve their strategic goals.
You will support the project teams in developing presentation materials and in coordination of communications with the client.
You will assist the project teams in delivery of business-driven, technology-enabled solutions to help our clients meet pressing challenges and seize opportunities in their respective markets.
You will work with diverse and talented project team members to solve problems, improve performance, and generate value for our clients across all industries.
You will uphold the firm’s standards and ethos in working with fellow team members and in your interactions with the clients.
You will support business development efforts by contributing directly to the preparation, development of proposals, presentations and publications.

Your role as a leader:

At Deloitte, we believe in the importance of empowering our people to be leaders at all levels. We connect our purpose and shared values to identify issues as well as to make an impact that matters to our clients, people and the communities. Additionally, experience analysts/consultants across our Firm are expected to:

Translate functional requirements into technical design.
Take responsibility for technical design and coding (both new or existing systems)
Recommend and evaluate detailed design of system components to ensure reusability and flexibility is practiced, where applicable.
Develop and update technical documents including technical specifications.
Perform unit testing, system integrated testing & user acceptance testing.
Responsible for system enhancements, technical support and issues/problem resolution including bugs fixing.
Report to and work closely with Project/Team Lead in all aspects of projects delivery.
Requirements:
Must have at least 2 years of Outsystems platform experience.
Bachelor’s degree with at least 2 or more years’ experience in Java, C#, ASP.Net, ADO.Net, JQuery and JavaScript is a plus.
Bachelor’s degree with at least 2 year experience consider for developer position.
Strong working knowledge of various technology platforms and practices, including, but not limited to, Microsoft .NET technologies, service-oriented architecture, and software development best practices.
Strong knowledge of new or latest technology, and able to gauge suitability to the organization’s business, especially in the healthcare provider sectors.
A good innovative team player with strong sense of integrity & accountability.
Enterprise technologies experience is very much advantageous.
Due to volume of applications, we regret that only shortlisted candidates will be notified.

Please note that Deloitte will never reach out to you directly via messaging platforms to offer you employment opportunities or request for money or your personal information. Kindly apply for roles that you are interested in via this official Deloitte website.
Requisition ID: 104786
In Indonesia, the services are provided by Imelda & Rekan and other related entities in Indonesia (""Deloitte in Indonesia""), which are affiliates of Deloitte Southeast Asia Ltd. Deloitte Southeast Asia Ltd is a member firm of Deloitte Touche Tohmatsu Limited. Deloitte in Indonesia, which is within the Deloitte Network, is the entity that is providing this Website.",,,Jakarta,https://id.indeed.com/rc/clk?jk=ef64d9f55ef40f9c&bb=rkEqvfGrBmGXA1lQwKiH4eZ-se2sQkLuB0LksGWZzzbY0tPavGkH_ij44OWNM2VFVJwEPSWI4pWUyjnfGGFASAheYfxMn9StOtJTvo1meAXSJPVT8yJK1Q%3D%3D&xkcb=SoD267M38fc7EqAAl70ObzkdCdPP&fccid=9e215d88a6b33622&vjs=3
NinaMG,Admin Online,Posted 30+ days ago,"Admin Online
NINA MG group believes that in every person lies a great talent and we always treat every staff as family member. We believe that people has been the greatest asset for us and each staff has the right to develop their abilities so they reach the maximum result for their own life.
Job Description
Melayani (menjawab) pertanyaan/ chat on line dari konsumenb baik dari marketplace maupun pesan teks
Bertindak sebagai customer service untuk menerima dan menanggapi keluhan apabila ada
Administrasi marketplace seperti : upload gambar barang atau edit harga
Menerima dan memproses pesanan (orderan) dari website marketplace
Packing dan delivery untuk memastikan barang diterima oleh konsumen
Quality control
Membuat laporan penjualan online shop
Requirements
Pendidikan minimal SMA/ SMK sederajat
Mampu mengoperasikan komputer (Ms. Office, browsing, aplikasi chatting, facebook, gmail, google docs, dll)
Mampu menggunakan Android Phone/ Tablet (bisa menggunakan aplikasi line, instagram, atau whatsapp)
Tidak sedang kuliah/bekerja/berbisnis
Wajib memiliki motor sendiri
Familiar terhadap forum online shop dan media sosial.
Komunikatif dalam melayani customer secara online.
Jujur, disiplin, rajin, teliti, ramah dan memiliki minat kerja yang tinggi.
Memiliki pengalaman kerja minimal 1 tahun di bidangnya.
Send your CV
hr@ninamg.com",,,Jakarta,https://id.indeed.com/rc/clk?jk=c3d3f7f429012c72&bb=rkEqvfGrBmGXA1lQwKiH4QEXovI9IrlRv8l8H0UntBXHX-KHRvOmvGXrGDaf8yMQl2EAlqLXmzeLoobmaayABtf_FsGf-WH4jK23LQxgGSLJc9FcPFhBVhDwOTCaAcMp&xkcb=SoBr67M38fc7EqAAl70NbzkdCdPP&fccid=8f8f90a8c2a9e4b1&vjs=3
Bisnis Indonesia,SENIOR WEB PROGRAMMER,Posted 30+ days ago,"Requirement :
Pendidikan min. S1 jurusan Ilmu Komputer/Teknologi Informasi
Memiliki pengalaman minimal 3-4 tahun dalam project website atau web application development
Menguasai bahasa pemrograman
Memiliki pengalaman dalam web portal development
Memiliki kemampuan untuk menganalisa, logic flow program, database structure, dan troubleshooting",,,Indonesia,https://id.indeed.com/rc/clk?jk=8b05027332807b40&bb=rkEqvfGrBmGXA1lQwKiH4UfPWIn2KqkAiZGRjHbmBFC4lCpcOwyiWJyo6ZO6Z-r3K2IGD5l7MygaGfiI40vUjp5GPX5O-6Q-dB-dG9fktEFj4mDfXKoX1j3oSBIWpiGo&xkcb=SoDf67M38fc7EqAAl70MbzkdCdPP&fccid=9661186bea715ca3&vjs=3
Deloitte,Graduate Analyst Program - Technology Strategy & Transformation - Oct 2024 intake,Posted 30+ days ago,"Graduate Analyst Program - Technology Strategy & Transformation - Oct 2024 intake
Date: 28 Aug 2024
Service Line / Portfolios: Enterprise Technology & Performance
Location: Jakarta, ID
Brunei, BN
Are you ready to unleash your potential?

At Deloitte, our purpose is to make an impact that matters for our clients, our people, and the communities we serve.

We believe we have a responsibility to be a force for good, and WorldImpact is our portfolio of initiatives focused on making a tangible impact on society’s biggest challenges and creating a better future. We strive to advise clients on how to deliver purpose-led growth and embed more equitable, inclusive as well as sustainable business practices.

Hence, we seek talented individuals driven to excel and innovate, working together to achieve our shared goals.

We are committed to creating positive work experiences that foster a culture of respect and inclusion, where diverse perspectives are celebrated, and everyone is recognised for their contributions.

Ready to unleash your potential with us? Join the winning team now!

Work you will do
You will be part of our structured Deloitte SEA Graduate Analyst Program and be given a personal coach, the opportunity to undergo a 2-week intensive bootcamp training aimed at equipping you with the skillsets necessary to excel, and opportunities to gain regional exposure by travelling across SEA as part of project assignments, and other professional development opportunities.


This program will allow you to develop core consulting skills and business acumen whilst gaining access to a wide scope of training and development activities. In addition, you will have an opportunity to work with like-minded people and gain exposure to a variety of projects within the chosen business area. You will be at the center of it all, performing research, data analysis and modelling to tackle complex business problems. In addition, you will contribute directly to the development of proposals, presentations, and publications.

This role sits within the Technology Strategy and Transformation (TS&T) team of Deloitte Southeast Asia, which encompasses IT Strategy and Transformation. As a leader of this group, you will drive the growth of our TS&T business in the region and be responsible for the creation, sale and delivery of TS&T solutions: IT Strategy, Application & Systems Development, IT Business Transformation, etc

As an Analyst, your role would include but not limited to:

Supporting project teams in providing end-to-end advisory and overlay point-of-views and industry insights onto the research and analyses provided by the project teams, and seek to formulate innovative technology-enabled solutions to address our clients’ business needs.
Managing the assessment and business requirements gathering processes, review appropriateness of functional specifications against the problem statements/business requirements, and support solutions prototyping and architecture re-design by applying industry insights and know-hows.
Engaging our clients in discussions, presentations and workshops to validate technology-enabled solutions provided by the project teams, as well as perform walk-through of work products and deliverables with the clients.
Develop trusted relationships with your clients and gain recognition in the marketplace for technical and advisory capabilities across the spectrum.
Provide quality assurance and ensure timely delivery of work products developed by the project teams.
Actively coach project teams during the execution of projects and support senior team members in maintaining operational excellence at all times.
Together with project team, meet clients on a regular basis to define problem statements, analyze key priorities/issues, and work with senior team members to develop responses to client enquiries, formulate proposals and produce point-of-view publications.

Your role as a leader

At Deloitte, we believe in the importance of empowering our people to be leaders at all levels. We connect our purpose and shared values to identify issues as well as to make an impact that matters to our clients, people and the communities. Additionally, Analyst across our Firm are expected to:

Demonstrate a strong commitment to personal learning and development.
Understand how our daily work contributes to the priorities of the team and business.
Understand the set expectations and demonstrate accountability in keeping personal performance on track.
Actively focus on developing effective communications and relationship-building skills with stakeholders, clients, and team.
Demonstrate an appreciation for working with others.
Understand what is fundamental to Deloitte’s success as a business.
Demonstrate integrity and an awareness of strengths, differences, and personal impact.
Develop their understanding of Deloitte and offer a fresh perspective.

What we are looking for
In your final year of study or recent graduate between 0-2 years of work experience
Available to commence in October 2024.
Strong academic performance in Information Technology, Business Information Systems, Business, Engineering or Computer Science or related disciplines
Some experience in either advisory or as implementation experience in the following areas:
- IT Strategy: IT strategy development, IT governance, IT operating model, enterprise architecture
IT Transformation: IT sourcing advisory, program and project management advisory
IT Operations: IT service management, IT shared service management
IT Optimization: IT cost reduction, IT Merger & Acquisition
Understanding of current IT trends (cloud computing, big data, social media, RPA, IoT, blockchain, etc.).
Team player with effective interpersonal and communication skills • Demonstrated leadership and teamwork within or outside a work setting
Exceptional problem-solving ability, logical reasoning, creative thinking, comfort with numbers, and the ability to untangle complex issues
Fluent verbal and written English language skills

Due to volume of applications, we regret that only shortlisted candidates will be notified.

Please note that Deloitte will never reach out to you directly via messaging platforms to offer you employment opportunities or request for money or your personal information. Kindly apply for roles that you are interested in via this official Deloitte website.

This role is open to those that possess a valid permit or status to work in Indonesia, Malaysia, Thailand, Singapore.

#LI-LC

Requisition ID: 104666
In Indonesia, the services are provided by Imelda & Rekan and other related entities in Indonesia (""Deloitte in Indonesia""), which are affiliates of Deloitte Southeast Asia Ltd. Deloitte Southeast Asia Ltd is a member firm of Deloitte Touche Tohmatsu Limited. Deloitte in Indonesia, which is within the Deloitte Network, is the entity that is providing this Website.",,,Jakarta,https://id.indeed.com/rc/clk?jk=08781ee3ce3424d2&bb=rkEqvfGrBmGXA1lQwKiH4XK9zPy20ZPtXXAo0v472PaBiDyfzs4ChjIBFDcHWMNefVahCfkh-uhMevAcDaGd9WWpDV0MH07_sXsJEq2nikIJE-S9gs0avA%3D%3D&xkcb=SoA267M38fc7EqAAl70DbzkdCdPP&fccid=9e215d88a6b33622&vjs=3
Esco Lifesciences Group,WEB DEVELOPER,Posted 14 days ago,"Company Description
Hi Esconian! We are looking for everyone to join us in WEB DEVELOPER position.
Description
Requirement
Bachelor’s in Computer Science or related field.
Proficient in HTML, CSS, JavaScript, and server-side frameworks (python, ruby, php, Java, ASP, ASP.NET).
Experience with databases (SQL, Oracle).
Basic SEO knowledge.
Strong communication and multitasking skills.
Job Responsibilities
Build websites using HTML/CSS.
Write efficient code.
Work with designers and programmers.
Coordinate with teams to meet content needs.
Maintain software documentation and plan for downtime.
Enhance websites post-launch.
Other Information
Join us and grow your career with Esco.
Esco BISA!
Only shortlisted candidates will be contacted.

Job Location
Indonesia
Deadline
20 September 2024
Quota
0
Applicants
5",https://d2q79iu7y748jz.cloudfront.net/s/_squarelogo/256x256/1ad1c5af60fd489ded4f37926d9dea5b,,Indonesia,https://id.indeed.com/rc/clk?jk=d1946ee11aa9515a&bb=rkEqvfGrBmGXA1lQwKiH4VyrT8BpU9HVOrrW3GeFMHcP7Mfbfv95sCP8vGThK6HKRcZJU5Z0T8k_lZTAZZ0EiTzLUZ-dnF03NJWmTeMa8DhJJhXykosZZqdv1c1hDU2Y&xkcb=SoCC67M38fc7EqAAl70CbzkdCdPP&fccid=7a41a824a7f71c34&vjs=3
