Company Names,Job Titles,Posted On,Job Details,Images,Type Location,Locations,Link
Crossover,"Director of Product Management, 2 Hour Learning (Remote) - $200,000/year USD",Just posted,"Drive the AI-powered learning revolution at 2 Hour Learning - where student success hinges on your ability to engage, empathize, and innovate.
At 2 Hour Learning, we're on a mission to flip the script on traditional education. Our academic ecosystem, powered by cutting-edge AI and learning science, is already enabling students to shatter learning goals in a fraction of the time. But we're just getting started.
You'll be the catalyst that takes our AI-driven products to new heights of engagement and efficacy. This role is for educational visionaries ready to roll up their sleeves and get into the trenches with students and staff. You'll engage with users constantly, gathering raw insights to inform each product iteration. No hiding behind focus groups or third-party reports - you'll build trust and rapport directly with the students whose lives your products will transform.
But gathering intel is just the start. You'll feed those insights into a non-stop cycle of AI-powered innovation. From generating new features with ChatGPT to automating marketing tasks to maintaining a comprehensive knowledge base, you'll wield AI as your copilot to bring products to life at light speed.
You'll also flex your leadership chops, guiding outsourced dev teams to execute on your vision and quality standards. It's full ownership, full accountability, and full potential to make a seismic impact on education. If you're ready to shape the future of learning, one user insight and AI breakthrough at a time, this is the place for you.
For more information on 2 Hour Learning, visit our website [https://2hourlearning.com/] and the Future of Education Instagram page [https://www.instagram.com/futureof_education/]. To see a school built around 2 Hour Learning, check out Alpha [https://alpha.school/].

What you will be doing
Engaging directly with students and staff to gather raw feedback and transform it into actionable product enhancements
Harnessing generative AI tools to rapidly ideate, prototype, and market new product concepts
Taking full ownership of the product lifecycle from ideation through launch and iteration, with a relentless focus on student success
Collaborating with outsourced dev teams to execute on product roadmap and maintain sky-high quality standards
Immersing yourself in learning science and emerging AI tech to fuel a constant cycle of product innovation

What you will NOT be doing
Treating product management as a purely theoretical exercise - you'll be in constant contact with actual students and users
Waiting for lengthy research cycles to guide product decisions - you'll gather insights directly and leverage AI to move fast
Passing the buck on product quality or timeline - you'll have full ownership and accountability for outcomes
Resting on your laurels or settling for incremental improvements - the mandate is to push boundaries and aim for 10x gains

Key Responsibilities
Deliver AI-powered educational products and experiences that demonstrably drive unprecedented student engagement, efficacy, and delight.

Candidate Requirements
At least 5 years of product management experience
Proficiency in leveraging AI tools for key product management tasks, including content creation, user interface optimization, and workflow automation
Proven ability to gather detailed user feedback through interviews and other methods, analyze data to identify trends and pain points, and translate insights into actionable product improvements
Demonstrated success managing development teams, ensuring their work aligns with product vision and meets rigorous quality standards
Excellent analytical and problem-solving skills, with a track record of using data to drive product decisions and measurably enhance user satisfaction
Outstanding written and verbal communication skills, with the ability to provide precise, actionable feedback to cross-functional teams and maintain regular, consistent communication with all stakeholders",,Full-time,Bekasi,https://id.indeed.com/pagead/clk?mo=r&ad=-6NYlbfkN0Bp-pWyh_yd7-BMq_HjiKF8q-wDEEHI6K3EhZcTze0zEsIRmf-ziQx7xWnl_-HHNcs5gPxCn82W9t4DXmfssGNyzuF15OVITdabziHvBRZxY8I96SWfuXL_fG1FFlgQ125B8YX-VzxcnBWNuVxRnTtAAOMw5TqofMCqXnNYr_vV6YjcYgbWs7ewP1XZLGF6GPGJ5TuSuDZBTc4x4FBKLFn5Cbds-ZTUXi7F1gUXHz-6Wf77oQ1jCIxzPISglfMV7_gFQG4FzDYwMx3EequvnLUBkoKGFi3sOViWgIiR25gi-zaka7_Xl0Xa_LC5qRYwS89yl8w6C97PkPWnUazwNvtwHAbKUFiiLgEI_JMndvMUi2lCuGwT6QW4L5o7kjjRowHQtpuZAyNr_2YUPqvV_HCrfFhrDyk1zOEOUHvyZZnUB8um1jBc4_rG2D0odNFd5xqwLpy_SivjuMohNv1yU6icJPDGPO2xwLElWrPoeTEm3W1IL1ad0i-bf0NGQini6q_HgU6wILi3qhGdsqlEmRwGoPE1vEDKeWygasjGb1wK9C02E1Oavx1Ve2eLPHuiWTQCCx0nU94UmwifbRpY6VilUcdnc3FL_1QHYGRkabHhS-R8YdJ1J15g1XFcLuQcqVMSfo-p4LPFMOOjZi7H5d3N-QvDMOpyNWJMcZifPxTgkZpLcaAkf0a6QX_YaCGJUDYFlsDYkBfUx_LZvkR9GGYGs7eizpev0omTEDW8MkC0DoQfNEuYeNDJZuEpj-Iefxo20mkzNBJ-TSmKHWOk7OXFlHsUy7slxQXstATHuFekRhLzzKJMFO8N&xkcb=SoDh6_M38fdv9dzfWh0ObzkdCdPP&camk=nUmJqO2E8rjY4_P3R2Iwog==&p=5&fvj=0&vjs=3
PT Sinar Kejora Indonesia,Digital Marketing,Active 3 days ago,"Kami adalah perusahaan start-up industri kosmetik yang sedang berkembang di Bandung, membutuhkan tenaga profesional sebagai Digital Marketing, dengan job desc sbb:
Melakukan riset pasar untuk menganalisa kebutuhan pasar dan tren terkini di media sosial
Memastikan seluruh kegiatan pemasaran digital melalui email, website, e-commerce, dan sosial media berjalan dengan baik dan sesuai dengan rencana
Membuat plan content/materi promosi dan memastikan content/materi promosi diupload sesuai dengan timeframe dan timeline yang ditetapkan
Menyusun dan menerapkan strategi pemasaran produk untuk meningkatkan engagement dan penjualan produk di website, e-commerce, dan sosial media
Merencanakan dan mengawasi marketing campaign agar selaras dengan pesan dan tujuan brand
Memberikan ide kreatif / konsep, dan menyusun materi / konten / copy writing untuk promosi website, e-commerce, dan sosial media
Mengelola anggaran marketing dan memastikan anggaran dialokasikan dengan efisien, benar, dan bertanggung jawab
Melaporkan semua kegiatan pemasaran digital secara berkala
Bekerjasama dengan vendor marketing lain untuk menyelaraskan ide dan strategi pemasaran demi tercapainya tujuan
Mencari mitra kerja untuk kolaborasi dan memantau perencanaan dan implementasi kegiatan promosi yang dilakukan oleh mitra kerja
Qualification:
Usia maksimal 28 tahun
Berdomisili di Bandung, bersedia ditempatkan di Mekarwangi
Minimal S1 jurusan Marketing, Bisnis, atau bidang lain sejenis
Memiliki pengalaman kerja serupa selama minimal 3 tahun
Memiliki ketertarikan besar di industri kosmetik, skincare, atau kecantikan
Fasih berbahasa Inggris
Sehat secara jasmani dan rohani
Tidak merokok
Bertanggung jawab, teliti, cekatan, disiplin
Kreatif, cepat belajar, mudah beradaptasi
Must Have Skills:
Strategic thinking
Creative thinking
Analytical skill
Communication skill
Writing skill
Note:
Kami tidak pernah memungut biaya apapun selama proses recruitment. Terimakasih
Jika kami merasa Anda adalah kandidat yang tepat, kami akan segera menghubungi Anda untuk menginformasikan langkah selanjutnya
Job Type: Full-time
Application Question(s):
Apakah Anda berdomisili di Bandung?
Expected Start Date: 09/16/2024",,Full-time,Bandung,https://id.indeed.com/rc/clk?jk=0a262b3e99bc8038&bb=-01Ry-DLJ1DNNNA3r-4NdWhENr3jXjcH_otwt_0ZS289IEqOmMgD1HLd59bv58XJ32w7LPE-KpC3WB0PENgG2zG3gdvk1VAJ-IZ09q1aB8s2BMdvWV7JBN39eWRJwsja&xkcb=SoCI67M38fdv9dzfWh0NbzkdCdPP&fccid=ad79bd21bc8d1a09&cmp=PT-Sinar-Kejora-Indonesia&ti=Staf+Marketing+Online&vjs=3
Evermos,Frontend Engineer,Posted 15 days ago,"Placement: Bandung/Yogyakarta

Job Descriptions
Developing new user-facing features using Vue.Js and Nuxt.Js
Building reusable components and front-end libraries for future use
Translating designs and wireframes into high quality code
Optimizing components for maximum performance across a vast array of web-capable devices and browsers Create unit, scenario, integration sanity test if required
Write Documentation for your code
Job Requirements
Minimum 4 years of working experience
Strong proficiency in JavaScript, including DOM manipulation and the JavaScript object model
Thorough understanding of Vue.Js, Nuxt.Js and its core principles
Experience with data structure libraries
Experience of responsive and mobile friendly website
Experience with RESTful APIs
Knowledge of modern authorization mechanisms, such as JSON Web Token
Familiarity with modern front-end build pipelines and tools
Experience with common front-end development tools such as Webpack, NPM, etc.
Ability to understand business requirements and translate them into technical requirements
Experience in optimization when load a webpage
Proficient with Git
Evermos is committed to providing an inclusive environment where equal opportunities are available to all applicants regardless of race, color, religion, gender, national origin, disability, age, genetic information, marital status, pregnancy, or related condition. We will not tolerate discrimination or harassment based on any of these characteristics.
We also emphasize the importance of diversity in all aspects of employment including recruitment, hiring, promotions, training, and organization operations.
NMByZP7yah",,Full-time,Bandung,https://id.indeed.com/rc/clk?jk=d3c21c1b85e8152c&bb=-01Ry-DLJ1DNNNA3r-4NdejMptoLBNaoklNDu6KhQX6Pot7AfybCYxtPJIBNdqHD29oNBmlOLIdWWDShQd6U2fCCWcxTVAv9a5Gel5F6LhFh8X8UVrrAoCvtLYneDMM0&xkcb=SoA867M38fdv9dzfWh0MbzkdCdPP&fccid=41e04e4a2137d5c9&vjs=3
BBC,Journalist,Posted 16 days ago,"Journalism
Permanent - Full Time
Central Jakarta, ID, 10310
BBC PS - Indonesia
Job Closing Date: 9th September 2024
THE ROLE
Package Description
Role: Journalist, BBC Indonesia
Job reference: 18064
Contract: Continuing/Permanent
Band: C, Local recruit
Location: Jakarta, Indonesia
Job board closing: 11:59pm (BST), Monday 9th September 2024

Any offer of employment with the BBC will be conditional upon you having the right to work in Indonesia, where local terms and conditions apply
Job Introduction
BBC World Service is an international multimedia broadcaster, part of BBC News, delivering a wide range of language and regional services and working increasingly with other parts of
BBC News to serve global audiences. It uses multiple platforms to reach its weekly audience of 468 million globally, including TV, digital platforms, radio, digital satellite and cable channels.

BBC News Indonesia is part of the 16 services of the Asia Region and is spread across Jakarta and London. The multimedia service broadcasts on radio and TV and has a thriving online and social media presence. The service aims to make international news relevant to our Indonesian audience.


The successful candidate will be responsible for producing and publishing multimedia content to serve our BBC New Indonesia audiences.
Main Responsibilities
To create original material for all multimedia output (online, social media, radio, TV) this will include writing for BBC News Indonesia radio and TV programs as well as its website and other social platforms (YouTube, Facebook) in an engaging format for the audience.
To be responsible for thinking through and around editorial problems, developing realistic alternative strategies and approaches.
Where required, remote produce social and digital content produced by stringers so that the final output is of highest quality.
Are you the Right Candidate?
You must have fluency in written and spoken Bahasa language and a high
Comprehension of English is an advantage.
Strong editorial judgement, based on extensive journalistic experience and a thorough understanding of the principles of BBC journalism.
A proven record in multimedia journalism.
The ability to analyse data and interpret in a relevant way for news outputs.
Strong skills in using data to drive traffic to websites and to increase the impact of editorial output.
Evidence of sound editorial and community judgement as well as an understanding of the power of online communities.
Excellent knowledge of and understanding of online technology and how it can best be used to maximize the performance of BBC News Indonesia.
A thorough understanding of production methods used in BBC news and the ability to adapt to new media.
To find, verify and seek permission for BBC publication of UGC videos relevant to breaking news or emerging trends.
About the BBC


The BBC is committed to redeploying employees seeking suitable alternative employment within the BBC for different reasons and they will be given priority consideration ahead of other applicants. Priority consideration means for those employees seeking redeployment their application will be considered alongside anyone else at risk of redundancy, prior to any individuals being considered who are not at risk.

We don’t focus simply on what we do – we also care how we do it. Our values and the way we behave are important to us. Please make sure you’ve read about our values and behaviours here.

Diversity matters at the BBC. We have a working environment where we value and respect every individual's unique contribution, enabling all of our employees to thrive and achieve their full potential.

We want to attract the broadest range of talented people to be part of the BBC – whether that’s to contribute to our programming or our wide range of non-production roles. The more diverse our workforce, the better able we are to respond to and reflect our audiences in all their diversity.

We are committed to equality of opportunity and welcome applications from individuals, regardless of age, gender, ethnicity, disability, sexual orientation, gender identity, socio-economic background, religion and/or belief. We will consider flexible working requests for all roles, unless operational requirements prevent otherwise.

To find out more about Diversity and Inclusion at the BBC, please click here.
DISCLAIMER
This job description is a written statement of the essential characteristics of the job, with its principal accountabilities, incorporating a note of the skills, knowledge and experience required for a satisfactory level of performance. This is not intended to be a complete, detailed account of all aspects of the duties involved.",,Full-time,Jakarta,https://id.indeed.com/rc/clk?jk=c98949e49189f6cc&bb=-01Ry-DLJ1DNNNA3r-4Ndb7l9dCMfjdEDN-wwzlFYpHDrzVzHuALDWBwmTAvmmsSRCV3E0THxOJJ73LUCrzLmXC6JD9Uaahf1h7rWOfY3uwAoZstqApOcg%3D%3D&xkcb=SoDV67M38fdv9dzfWh0DbzkdCdPP&fccid=40bdb3ff12c06472&vjs=3
THE AESTHETIC SKIN CLINIC,Web Developer,Active 2 days ago,"Deskripsi Jobs
Kualifikasi
Pendidikan minimal S1 bidang Ilmu Komputer, Teknik Informatika, atau sejenisnya
Memiliki pengalaman kerja sebagai web developer atau posisi terkait
Menguasai beberapa bahasa pemrograman seperti HTML.CSS, JavaScript, dan PHP
Menguasai MySQL
Memahami basic SEO
Menguasai CMS seperti WordPress, Drupal, atau Joomla
Memiliki pemahaman yang kuat tentang cara kerja aplikasi website mulai dari keamanan, session management, dan praktik development terbaik
Memiliki keahlian dalam penggunaan framework pengembangan website seperti Laravel, Angular, atau React
Memahami cara mengembangkan desain website yang responsif
Mampu bekerja secara individu dan tim
Memiliki kemampuan komunikasi yang baik
Jobdesk
Merancang, membangun, mengoptimalkan dan maintenance website dan software dengan menggunakan bahasa pemrograman HTML/CSS atau bahasa pemrograman lainnya
Mengintegrasikan data dari berbagai layanan back-end dan database
Mendesain layout dan interface halaman website yang responsif dan menarik
Menerapkan standar pengembangan web terbaik dan praktik-praktik keamanan yang ketat
Backup file website ke direktori lokal untuk recovery
Melakukan pengujian dan QA untuk memastikan website bisa diakses dengan baik di berbagai perangkat dan browser
Mengidentifikasi masalah yang ditemukan dari feedback atau testing dan memperbaikinya
Mengevaluasi code untuk memastikan bahwa code tersebut memenuhi standar, valid, terstruktur dengan baik, dan kompatibel dengan browser, perangkat, atau OS
Berkolaborasi dengan tim developer, desainer, dan tim lainnya dalam setiap tahap pengembangan proyek.
Job Type: Full-time",,Full-time,Jakarta,https://id.indeed.com/rc/clk?jk=511cf297acbe939d&bb=-01Ry-DLJ1DNNNA3r-4NdUfq0XYcHAc0deKqDAqy_luw24E2k4OicQBBPVkQ8x2rM7Do2KDC9aMC2ShH9bQQyol3tXJAKshESKi0zvNHMNYmuTckakbTvCodN0--BKrn&xkcb=SoBh67M38fdv9dzfWh0CbzkdCdPP&fccid=6905a87907538600&cmp=The-Aesthetic-Skin-Clinic&ti=Web+Developer&vjs=3
Inphosoft Group Pte Ltd,Product Manager (Mobile Advertising),Posted 30+ days ago,"Own and maintain software product requirement specifications, plan and execute product development schedule and resources, meeting time, budget, specification and quality targets
Manage, mentor and motivate software development team
Inculcate startup culture within team
Develop and execute product marketing strategy in Indonesia, launch product
Develop collaterals, materials and sales kit to attract new customers
Acquire customers for product, manage and maintain existing clients
Develop, sustain and grow business arising from product launch
Develop benchmark against competitors’ product offering to improve product features, pricing plan and business processes to ensure market competitiveness
Degree in Computer Science or equivalent
Preferably at least 2 years experience in Software Development in iphone, android, 3-tier websites
At least 3 years experience in Product Management/Marketing/Business Development
Project management skills
Proven track record of good team development and management skills
Strong client-facing skills, strong interpersonal and communication skills
Highly self-motivated, excel with minimum supervision, able to understand and focus on the big picture, strong self-navigating abilities to open-ended challenges
Enjoy and thrive in startup environment
Outgoing personality, sociable, enjoying meeting new people and cultivating business relationships and rapport
Fluent in spoken and written English, able to speak Indonesian
Possess own transport and a valid driving license",,,Indonesia,https://id.indeed.com/rc/clk?jk=24dd69cabfd33d17&bb=-01Ry-DLJ1DNNNA3r-4NdRKMKt7cqP0zA_RI5YtXsOSgYYJZAY3YPodqE8EZl0v07a0RQ5QYVL_8gD90ircxPpy85pcApaOOD7EEAIkpo54YyY5gsSIMvGp9mGA1RfZ1&xkcb=SoD867M38fdv9dzfWh0BbzkdCdPP&fccid=e7e0d56e864d5535&vjs=3
Alifah Clinic,Digital Marketing Support,Active 2 days ago,"Kriteria ;
Laki - laki, Max 35 tahun
Lulusan D3/ S1 Komunikasi atau jurusan lain yang relevan
Memiliki pemahaman tentang Digital Marketing
Memiliki kemampuan membuat Website Based on Wordpress
Memahami SEO dan Sosial Media Marketing
Memiliki kemampuan membuat Content Marketing
Memiliki kemampuan menganalisa Data Visual
Mampu beradaptasi dan bekerja dalam team
Mampu menjalankan Meta Ads atau sejenisnya akan menjadi nilai tambah
Bersedia belajar dan terus mengupgrade pengetahuan dan kemampuannya secara mandiri
Jenis Pekerjaan: Penuh Waktu, Kontrak
Panjang kontrak: 3 - 12 bulan
Pertanyaan Lamaran:
Apakah pernah membuat dan mengelola Website sebuah Brand ?
Lokasi:
Karawang (Diutamakan)",https://d2q79iu7y748jz.cloudfront.net/s/_logo/7864517d3539740352b4e1a241729e33,"Full-time,Contract",Karawang,https://id.indeed.com/rc/clk?jk=b1e9d800dd0551a9&bb=-01Ry-DLJ1DNNNA3r-4NdV1UwGtHw7x1oqPvByaAHc9-Hkx3iQH6nJxAV2y5TXLyaLCptQPHCcyLqoh6BMtLUOXavfI7QkvX4Wt2WVaNBwA6WUy6eWRy_TQbtLbJdUL9&xkcb=SoBI67M38fdv9dzfWh0AbzkdCdPP&fccid=ec4919df8501cd8d&cmp=Alifah-Clinic&ti=Staf+Marketing+Online&vjs=3
SkytreeDGTL,Junior Project Manager,Posted 30+ days ago,"Halo! Kami sedang mencari seorang talent yang kreatif dan cekatan untuk dapat bergabung dengan tim konten kami sebagai Junior Digital Content Manager.
Dalam peran ini, kamu akan berperan penting dalam mengelola dan menghasilkan konten digital yang tepat untuk berbagai macam klien di berbagai industri.
Kalau kamu siap untuk mengeksplorasi dunia konten digital dan menghasilkan karya yang luar biasa, kirim lamaran kamu sekarang juga!
Tanggung Jawab
Berkolaborasi dengan tim project dalam mengelola konten digital di berbagai platform (website, media sosial, iklan, email, dll.)
Melakukan supervisi dalam pembuatan konten digital yang menarik dan relevan dalam bentuk artikel, gambar, video, dll.
Mengelola penjadwalan pembuatan dan publikasi konten
Berkolaborasi dengan tim project untuk mengembangkan strategi konten yang efektif dan menarik
Mengukur dan menganalisis kinerja konten, serta mengembangkan konten yang lebih baik
Mengelola hubungan dengan tim pembuat konten, baik tim internal maupun freelancer
Kualifikasi
Memiliki ketertarikan tinggi terhadap konten digital untuk berbagai macam industri
Memiliki keahlian dalam mengetahui penulisan, editorial, maupun konten visual yang sesuai dengan kebutuhan industri
Memiliki pemahaman terhadap analisis konten
Mampu berkomunikasi dengan baik dengan tim internal maupun freelancer
Kreatif, fleksibel, dan memiliki kemampuan manajemen proyek yang baik

Level Pekerjaan
Staff
Pengalaman Kerja Minimum
0 – 2 tahun
Mobilitas Bekerja
Work From Anywhere",,Full-time,Indonesia,https://id.indeed.com/rc/clk?jk=8bab6fa1411b77e7&bb=-01Ry-DLJ1DNNNA3r-4NdfTIPlXLanI605uqDdgKB9sFC0FSEH0f6kavCYbgLgVyt_8YIsg-BRdPqRigEb_2gMBMte1u8zxuTx7HKNSlRNNwSiHAIko2tEobDCeSXBH4&xkcb=SoDG67M38fdv9dzfWh0HbzkdCdPP&fccid=ca188e9ebf7b1c14&vjs=3
