Company Names,Job Titles,Posted On,Job Details,Images,Type Location,Locations,Link
Novocall Pte Ltd,Frontend Developer,Posted 30+ days ago,"Company Description

What is Novocall?
Novocall is a inbound sales automation startup. We help businesses that sells high-value products to increase their sales conversions by reducing response time.
To date, we have over 2,000 businesses across 42 countries, and got featured on Product Hunt thrice.

Job Description

What is this role about?
We are looking for a passionate Front-End Engineers to share our mission and reach toward our vision of seamless sales conversations.
Your main responsibilities:
Designing, developing, and testing UI for our web application
Build reusable code and libraries for future use
Accurately translate user and business needs into functional frontend code
Communicating with the CTO and rest of team (devs, designers and PMs)
What you'll get
Career Progression - We're growing fast and we need team leaders.
Remote Work - We're a remote-first company, work from the comfort of your home
Young and Vibrant Team - We're a bunch of fun, casual group (who actually deliver performance), you'll fit right in :)
You should join us if...
You want to contribute heavily to a company and see actual results
Joining a rocketship company with fast month-on-month growth
You find professional and personal growth a priority in your career
You enjoy working remotely and flexible working hours
You are AMBITIOUS and want to innovate on how businesses communicate
Application process
We will move through the following steps to qualify you and if you meet our expectations, we will extend an offer to you:
Submission of CV and Portfolio
Pre-qualification Test
Interview
Tell us about yourself and your front-end experiences
What are your goals and how we can align them with Novocall's
Pair programming code review session
SHOW YOUR PORTFOLIO
We believe strongly that a front-end developer's portfolio speaks volumes about his/her capabilities.
Show, don’t tell. Drop us a link to your website/portfolio and we’ll take a look.
If you do not have a website yet, feel free to wrap up your project in a ZIP file labelled FirstNameLastName.zip.

Qualifications

Our requirements:
We're looking for someone who is fully invested in building frontend experiences. You love React, JS frameworks and the like. You care deeply about interactions whether that's animated hover states, scroll-based experiences, or pixel perfect execution.
2 years in in a front-end development
Experience with React.js (hooks, reducers, es2016) and modern JavaScript frameworks (next, nuxt, etc)
Experience with front end languages (HTML, CSS, modern CSS, JavaScript)
Experience with git version control tools (GitHub)
Experience with frontend project management (SCRUM, agile, etc)
Experience with frontend testing tools and frameworks (Jest, etc)
Proficient in English is a must
Bonus:
Experience working in SaaS or technology companies is preferred
Experience with CSS animations, optimisation a plus",,Full-time,Jakarta,https://id.indeed.com/rc/clk?jk=fdb853eb6b5dae39&bb=Yew5DpfwDEOjXaxwF_GoE2ueAueqo_mzSh3nE5xVyV0oW5NBkUtXGPRiErE_UN1p5kR9eYDb-hiOP09kEp8lYFRglGenHKUMlT2HmfbRa9YiPB_uw5ufiDx6vxrrCwY7&xkcb=SoDf67M38femLTw82R0HbzkdCdPP&fccid=413aa5b43f7fad12&vjs=3
Deloitte,Consultant - Operations Transformation - ID,Posted 2 days ago,"Consultant - Operations Transformation - ID
Date: 2 Sep 2024
Service Line / Portfolios: Core Business Operations
Location: Jakarta, ID
Are you ready to unleash your potential?

At Deloitte, our purpose is to make an impact that matters for our clients, our people, and the communities we serve.

We believe we have a responsibility to be a force for good, and WorldImpact is our portfolio of initiatives focused on making a tangible impact on society’s biggest challenges and creating a better future. We strive to advise clients on how to deliver purpose-led growth and embed more equitable, inclusive as well as sustainable business practices.

Hence, we seek talented individuals driven to excel and innovate, working together to achieve our shared goals.

We are committed to creating positive work experiences that foster a culture of respect and inclusion, where diverse perspectives are celebrated, and everyone is recognised for their contributions.

Ready to unleash your potential with us? Join the winning team now!

Work you will do

When it’s time to reinvent how the wheels turn in your organization—to react, innovate and reconfigure your business, our Operations Transformation professionals’ deep sector knowledge, coupled with our operational and technical expertise, bring your strategy to life in delivering lower-cost, more effective and fit-for-the-future operations that underpin profitable growth. We plan and deploy game-changing cognitive and digital technology to reduce costs, maximize efficiency, transform payments and revenue processes, and benefit from innovative and emerging business models.

You will work alongside our clients to help them make decisions and implement solutions based on ""Heart of the Business"" transformation strategies to drive business value. You will also assist in determining the requirements of clients’ projects and programs by defining, analyzing, and managing requirements to help fulfill their needs. You will have the opportunity to exercise strong analytical and critical thinking skills with the chance to solve complex problems and communicate your findings. Finally, you will work independently and collaboratively in a team.

You will support our clients in their transformation journey by:

Identify opportunities and define strategies for efficiencies in work process and innovative approaches to completing scope of work.
Participate in team problem solving efforts and offer ideas to solve client issues.
Conduct relevant research, data analysis, and create reports.
Maintain responsibility for completion and accuracy of work products.
Assessing restructuring operating models, organizational structures, and business processes to streamline core operations’ service delivery.
Assist in proposal development, as requested.
Actively expand consulting skills and professional development through training courses, mentoring, and daily interaction with clients.

Enough about us, let's talk about you:

You are someone with:
Tertiary qualification in a business or finance discipline with a well ranked institution and/or currently enrolled in a MBA program.
3 - 8 years and above of professional experience in a transformation or consulting role with exposure to one or more of the following segments: Energy, Resources & Industrials
A strong and demonstrated track record in management consulting with experience of engaging in business, operations transformation issues for clients;
Experience and skills to drive insights, develop initiatives and engage stakeholders across different functions to set strategic directions and rationale that lead to operational change and execution
Willingness and ability to take initiative and learn independently;
Emotionally intelligent: high ability to build strong relationships that inspire openness and trust; to collaborate in teamwork settings with colleagues and clients; and to balance inquiry and advocacy in all personal interactions;
Comfortable with working on difficult issues where there can be no definitive “right” answer; patient in the face of uncertainty, complexity and ambiguity;
Capable of working on multiple, overlapping tasks in a fast-paced environment;
Willing to work in fast-paced and, at times, high pressure entrepreneurial environment
Team player with excellent written and verbal communication skills.
Must have full travel mobility and the right to live and work in Indonesia.
Able to commit to contract position and on-site.

Next Steps
So what are you waiting for? Join the winning team now.

Due to volume of applications, we regret only shortlisted candidates will be notified.

Please note that Deloitte will never reach out to you directly via messaging platforms to offer you employment opportunities or request for money or your personal information. Kindly apply for roles that you are interested in via this official Deloitte website
#LI-VL
#LI-CW
Requisition ID: 105260
In Indonesia, the services are provided by Imelda & Rekan and other related entities in Indonesia (""Deloitte in Indonesia""), which are affiliates of Deloitte Southeast Asia Ltd. Deloitte Southeast Asia Ltd is a member firm of Deloitte Touche Tohmatsu Limited. Deloitte in Indonesia, which is within the Deloitte Network, is the entity that is providing this Website.",,,Jakarta,https://id.indeed.com/rc/clk?jk=6b3a4deb25d51c5d&bb=Yew5DpfwDEOjXaxwF_GoE6hPVS6rTodZ4br0m5hXYWSn-n0ZlODLvsq2IBrAw5TwkwtxihSGmLfEKKqs7YB1GYuHgBonSkLP7tYZ1S56Tw7q6H-lEXUgsg%3D%3D&xkcb=SoBr67M38femLTw82R0GbzkdCdPP&fccid=9e215d88a6b33622&vjs=3
Dentsu,Sr. Art Director,Posted 30+ days ago,"As a Sr. Art Director, you'll be the driving force behind our team's creative vision. Your leadership will shape the visual direction, guiding Middle Art Directors, Graphic Designers, and our talented creative professionals. With your unwavering dedication to excellence and genuine passion for design and art, you'll breathe life into concepts and big ideas, ensuring that every creative product we deliver is of the highest caliber.

If you're ready to make a significant impact and inspire greatness in our team, join us on this exciting journey!
Job Title:
Sr. Art Director
Job Description:
About Dentsu
Led by Dentsu Group Inc. (Tokyo: 4324; ISIN: JP3551520004), a pure holding company established on January 1, 2020, the Dentsu Group encompasses two operational networks: dentsu japan network, which oversees Dentsu’s agency operations in Japan, and dentsu international, its international business headquarters in London, which oversees Dentsu’s agency operations outside of Japan.

With a strong presence in approximately 145 countries and regions across five continents and with 65,000 dedicated professionals, the Dentsu Group provides a comprehensive range of client-centric integrated communications, media and digital services through its five leadership brands—Carat, dentsu X, iProspect, Dentsu Creative, and Merkle—as well as through Dentsu Japan Network companies, including Dentsu Inc., the world’s largest single brand agency with a history of innovation. The Group is also active in the production and marketing of sports and entertainment content on a global scale.
www.dentsu.com
About Dentsu Creative
Dentsu Creative operates in over [21] markets worldwide with more than [2,200] dedicated specialists. Bringing together our Japanese heritage in craft, data and technology, and our deep understanding of media and contemporary culture, Dentsu Creative is a new global creative agency. Born in Japan, raised in a digital world. We help transform brands and business through the power of Modern Creativity: which creates culture, changes society and invents the future and is accelerated by our deep specialist expertise in digital experience, earned attention and entertainment.
Key responsibilities
Collaborates with copy partner under the guidance of the CGH and creative director to execute creative concepts.
Demonstrates creative thinking to develop big ideas.
Presents big ideas to clients utilizing various presentation techniques.
Translates concepts into design by visualizing and interpreting them.
Takes ownership of creative work and sets an example for the design team.
Ensures that the brand tone and position are reflected in the creative output.
Provides insightful and impactful creative executions that benefit the client's business.
Leads, motivates, and develops the design team.
Serves as the main point of contact for Account Management and Project Management within the team.
A bit about you
At least 5 years of experience as an Art Director in a creative agency or a similar setting.
Bachelor's degree in Graphic Design, Fine Arts, or a related field; an advanced degree is preferred.
Proficient in handling projects end-to-end, with a strong focus on Above-the-Line (ATL), supplemented by Digital and Below-the-Line (BTL) capabilities.
Exposure to 360-degree campaign management, preferably within the Automotive/Consumer Goods sector, demonstrating a deep understanding of brand positioning and target markets.
Proven track record of collaborating with copywriters and creative directors to deliver creative outputs that meet brief requirements.
Strong presentation skills, with experience pitching big ideas to clients.
Exceptional design portfolio showcasing innovative and impactful creative executions.
Leadership experience, demonstrating the ability to lead, motivate, and develop a design team.
Excellent communication skills and the ability to serve as the main point of contact for Account and Project Management teams.
We’re proud to be different and that starts with our people. We believe in equal opportunities for everyone. We won’t define people by their race, gender, sexual-orientation, age or disability. Individuality is what makes us great, we want everyone to bring their full self to work and create something amazing. That’s what we care about.
So, whether you’re joining us, or looking to move to a different part of the business, we work hard to make sure we create equal opportunities for everyone.
Keeping connected
Please visit our website to find out more and connect with us on social.
www.dentsu.com

Please include an updated CV in your application.
**We regret that only short-listed candidates will be notified

#LI-LE1
#LI-HYBRID
Location:
Jakarta
Brand:
Dentsu Creative
Time Type:
Full time
Contract Type:
Permanent",,Full-time,Jakarta,https://id.indeed.com/rc/clk?jk=ce1bead74f6863a6&bb=Yew5DpfwDEOjXaxwF_GoEx5Re7mxAJuHhFn-v2C1PADc5Vi9bHn4n-frrNw6UKjISjOJcw3Z5z95SnjUFzt49XYWbo5ETfeB-b-vvUP8kaliHDfcfnQeCWQOmnPUqx80&xkcb=SoD267M38femLTw82R0FbzkdCdPP&fccid=9834e576343ebcc2&vjs=3
Crossover,"Artificial Intelligence Engineer, 2 Hour Learning (Remote) - $100,000/year USD",Just posted,"Are you a skilled full-stack developer with a passion for AI and a drive to transform K-12 education? At 2 Hour Learning, we're leading a revolution in digital learning backed by data and innovation.
At 2 Hour Learning, we don't just aim to improve education—we're redefining it. Our cutting-edge learning ecosystem, powered by advanced AI, learning science, and psychometrics, is twice as effective as traditional schooling. Students at every level, from kindergarten to high school, are achieving remarkable academic milestones, far surpassing standard expectations.
Your Role in the Revolution:
In this role, you’ll be at the forefront of our AI-powered educational transformation. With full autonomy and creative freedom, you’ll envision, develop, and deploy sophisticated full-stack applications and interactive AI tools that not only engage students but also enhance learning efficiency in unprecedented ways.
This is not a position for those who prefer to specialize in a single aspect of development. We're looking for innovative thinkers who can seamlessly integrate AI across both front-end and back-end systems, taking ownership of the entire product. Your work will directly impact thousands of students, ensuring that our tools meet their needs and set new standards for educational technology.
Who We're Looking For:
We need bold innovators who thrive on leveraging the latest in generative AI to create real-world educational impact. If you’re excited about pushing the boundaries of what’s possible in AI-driven education and are ready to bring your expertise in full-stack development and AI, this is your chance to make a difference.
For more information on 2 Hour Learning, visit our website [https://2hourlearning.com/] and the Future of Education Instagram page [https://www.instagram.com/futureof_education/]. To see a school built around 2 Hour Learning, check out Alpha [https://alpha.school/].

What you will be doing
Develop AI-Powered Web Applications: Architect and code sophisticated web applications that integrate both front-end and back-end components, with a focus on enhancing user experience through AI.
Experiment and Innovate with AI: Work with cutting-edge AI technologies, specifically large language models (LLMs) like GPT-4 or Claude, to create autonomous tools and interactive features that redefine how students learn.
Drive Technical Projects: Take ownership of the entire development process, from gathering requirements to launching and iterating on products. You’ll work closely with stakeholders to ensure that our solutions meet learner needs and push the boundaries of what’s possible.
Collaborate and Communicate: Partner with a global team of developers, designers, and educational experts. Your ability to communicate complex ideas simply and effectively will be key to your success.
Continuous Improvement: Stay ahead of the curve by continually learning and applying the latest advancements in AI and web development to our platform.

What you will NOT be doing
Narrow AI Development: You won’t be working on isolated AI features that don’t integrate with the overall product strategy. Your work will have a direct impact on thousands of students.
Surface-Level Coding: This is not a role for those who focus only on either front-end or back-end development. You will be expected to integrate both, creating comprehensive and scalable solutions.
Routine Maintenance: This role is not about maintaining legacy systems or making minor updates. You will be driving innovation and building new, cutting-edge applications.
Waiting for Detailed Specifications: You won't be handed fully fleshed-out requirements. Instead, you will take high-level ideas and translate them into fully developed products, leveraging your expertise in AI and full-stack development.
Working in Isolation: You won't be coding in a vacuum. Collaboration with other developers, product managers, and educational experts is key to ensuring that the solutions you build are impactful and user-centered.

Key Responsibilities
Develop and deliver engaging, human-centered AI applications that demonstrably accelerate learning outcomes and efficiency for thousands of K-12 students.

Candidate Requirements
At least 3 years of experience in full-stack development, with proficiency in front-end frameworks such as React, Angular, Vue.js, or Svelte, and back-end technologies like Node.js, Django, Ruby on Rails, Flask, or Spring Boot.
Hands-on experience integrating large language models (LLMs) like GPT-4, Claude, or similar into web applications.
Proven ability to independently manage and execute technical projects from start to finish, including gathering requirements, development, deployment, and iteration.
Excellent verbal and written communication skills, with the ability to collaborate effectively with stakeholders, team members, and users across a global, remote team.
A demonstrated passion for staying at the forefront of technology, particularly in AI and web development, with a commitment to continuous learning and applying new advancements to your work.",,Full-time,Jakarta,https://id.indeed.com/pagead/clk?mo=r&ad=-6NYlbfkN0Bp-pWyh_yd7-BMq_HjiKF8q-wDEEHI6K3EhZcTze0zEsIRmf-ziQx7T37-Ur9JFqAc8vbCqQYPXuTtXOfEZdCS7goFq8RHEir51_Hmmn7g4p5jYwIM32_Zk98W1y1-Vk81ipd-ow6jUNFpOpChZllkUQQxw2Jvs9GJ2pcBV1ipQYqriWSOiMK6T0bQaY2OQXMZ-z_qmdhlni4J73Nh8KayOuQoKInYd5PZMr_rt2XP0xk7uAfGz4hhAJIx0G6JcJSRntXsecu2eyigOF9et59Pdx_RQ11iL-cCk-p2BruWN6gCPc85PCbu9btiHPd6b6c0aBUnu8ckjH7WQ4CjVmtCOArCNSnE0vI7_jD9bhHXTeNBFewTpSlr0oWqSm448wmH0AmYPvHZwWnG4BDNJGobjCLqn1g9iVT28z-tPBu42T1tNF9M94jTNwdzTC-_xNRafBjSDaXJEifoXwSQ6mA01IcTzGOeCA9TYl1T_SaQBABnTw9LMjQqKA6vX2UsEpCSUmO9f5AfurDSvZ5bkowgum8GorbFckLRTIm0hdEY0j1cs2mcWjoFctubr-9OzENIEW9RhEYRYiic4nziaYxagCXSx_B9eJOMiv2ntvlv-j1lHcenfssF_rXmdamoPXi2tka3NKZ5Jh4c8izXvD8BWXjGOE-cFK0DtL7RNu0NieylwARh8oHeE6mdbvuihzh7M9Zdrn9YMVXkiELQHdV9NWTBFVLPdA_e6Waj6mr3rUb_zz9u9e4TrnPP-3r4t25-_h3iCwaXM7MsRG76hIqld38it-Y2w15vLAF0a2F_Csczj-cPs4_7atYsakJ7Geg=&xkcb=SoCX6_M38fe7WPzfWh0LbzkdCdPP&camk=nUmJqO2E8rjDAjcn3oB8eA==&p=0&fvj=0&vjs=3
