Company Names,Job Titles,Posted On,Job Details,Images,Type Location,Locations
EY,Technology Consulting Junior Consultant,Posted 14 days ago,"Technology Consulting

What if your career could have a lasting impact on you, and on the world?
Here at EY, you’ll have the chance to build a truly exceptional experience. We’ll empower you with the latest technology, surround you with high-performing teams, and provide the global scale and diverse and inclusive culture you need to discover your full potential. Through our coaching and training programs, you’ll develop the skillsets you need to stay relevant today and in the future – all while building a network of colleagues, mentors, and leaders who will be on the journey with you at EY and beyond.

The exceptional EY experience. It's yours to build.

The opportunities: your next adventure awaits

EY Consulting is global practice with more than 70,000 people around the globe. We are building a better working world by transforming businesses through the power of people, technology and innovation. Our client-centric approach focuses on driving long-term value for our clients by solving their most strategic problems, and our consulting services are recognized by the global analyst community and our 25+ alliance partners. EY Consulting is made up of three sub-service lines: Business Consulting, Technology Consulting and People Advisory Services.

Whole industries have been disrupted and transformed in recent years by digital technology. As a Technology Consultant, you’ll help businesses realize the value they can gain from their IT investments — supporting strategy and being a key growth driver. As part of a high-performing team, you’ll deliver exceptional client service — implementing technology solution, providing advice on how technology enablement, digital transformation and enterprise intelligence contribute to performance improvement, as well as how IT can act as multiplying effect during major program transformations.

As organizations look to leverage the advantage IT offers, we’ll work with you to develop the consultancy and analytical skills that you’ll need in today’s environment. Working on projects that cross borders and sectors, the experiences you gain here will be more valuable than anywhere else. So whenever you join, however long you stay, the exceptional EY experience lasts a lifetime.

We have multiple opportunities available for rising Junior Consultant. We are currently recruiting for:
Cyber Security Associate.
Digital & Emerging Technology Associate
Technology Solution Delivery Associate

Some of the key responsibilities would include:

Client delivery responsibilities
Contribute to engagement team to integrate client’s strategy, process, people, and technology
Participate as a fieldwork team member in Consulting engagements
Work effectively as a team member, sharing responsibility, providing support, maintaining communication, and updating senior team members on progress
Leverage data and technology to assist senior team members in providing innovative solutions to client’s challenges
Assist in preparing high quality work products for clients and other related parties in timely manner
Anticipate and identify risks within engagements and raise any issues with senior members of the team
Develop and maintain productive working relationships with client personnel

People responsibilities
Understand and follow workplace policies and procedures
Build strong internal relationships within EY Consulting and with other services across the organization
Maintain an educational program to continually develop personal skills of staff
Contribute to people-related initiatives including recruiting and retaining consulting professionals

What we look for
You have an agile, growth-oriented mindset. What you know matters. But the right mindset is just as important in determining success. We’re looking for people who are innovative, can work in an agile way and keep pace with a rapidly changing world.
You are curious and purpose driven. We’re looking for people who see opportunities instead of challenges, who ask better questions to seek better answers that build a better working world.
You are inclusive. We’re looking for people who seek out and embrace diverse perspectives, who value differences, and team inclusively to build safety and trust.

Main Qualifications
Have a bachelor’s degree in the areas of Information Technology, Computer Science, Mathematics, Statistics, Engineering, Business, Finance, Economics, or other related major from reputable university with excellent academic record. Master’s degree will be an advantage.
Fresh graduate or has limited working experience
Min GPA 3.00 out of 4.00 from reputable university
Excellent skills in both written and verbal Bahasa Indonesia and English
Strong leadership, analytical thinking, problem solving skills, presentation and communication skills
Excellent analytical skills for both business and technology solutions to enable the development of business process and/or technical solutions, including documentation of business problems in a clear concise manner
Additional Qualifications (good to have)
Experience in applying computer-aided statistical modelling to solve business problems
Experience in machine learning, data mining and information retrieval.
Experience in extracting information from a wide variety of sources including quantitative, qualitative and big data sources
At least one of the following modelling software packages: MATLAB, R, SAS, SPSS.
At least one of the following scripting languages: C++, Java, Python.
Data visualization experience – Tableau / Qlikview / D3.js / Power BI and SAS VA as one of the tool aside from Tableau/QlikView.
Exposure to artificial intelligence, deep learning and advanced predictive modelling
Exposure to any of the following area; Solution architecture, technology sourcing for transformation, system delivery support and device, IT service management, ERP Implementation, SAP, Oracle, Peoplesoft, Hyperion, Siebel, Pega, MDM, ETL, Big Data.
Exposure to any of the following area; Enterprise Application (SAP, Oracle, Microsoft), Solution Architecture, Software Development, System Delivery and Implementation, IT Service Management
Knowledge in Cyber Security, Security Risk on Business, Networks and Operating Systems
Knowledge and experience in following domain Technology Strategy, NextGen Technology Operations, Infrastructure and Service Resiliency, and Enterprise Architecture, certification relates to the domain will be considered an asset
Trainings/Certificates for any of the following SAP modules would be advantageous; FICO, MM, HR, SD, PM, PP, or ABAP
What’s in it for you
Accelerate your technical capabilities and transformative leadership skills with future-focused courses and development programs.
Broaden your horizons by working on highly integrated teams across the globe and collaborate with people of diverse backgrounds — both professionally and culturally.
Bring out the best in yourself with continuous investment in your personal well-being and career development.
Develop your own personal purpose and help us create a positive ripple effect on our teams, our business, clients and society – building a better working world, together.
We prioritize your wellbeing by providing a competitive medical benefit.
What you can expect
Due to the volume of applications, only shortlisted candidates will be contacted.
Shortlisted candidates can expect to perform a preliminary assessment as it is a required step of the recruitment process.

About EY
EY | Building a better working world
EY exists to build a better working world, helping to create long-term value for clients, people and society and build trust in the capital markets. Enabled by data and technology, diverse EY teams in over 150 countries provide trust through assurance and help clients grow, transform and operate.
Working across assurance, consulting, law, strategy, tax and transactions, EY teams ask better questions to find new answers for the complex issues facing our world today.

If you can confidently demonstrate that you meet the criteria above, please contact us as soon as possible.

Make your mark. Apply now.",,,Jakarta
PT Elektronik Distribusi Otomatisasi Terkemuka...,Data Analyst,Posted 22 days ago,"Use past data to find opportunities to optimize our strategy
Work closely with stakeholders and help with creation of reports, dashboards, monitoring tools Make data driven recommendations and monitoring performance based on the recommendations

Bachelor's degree in Information Systems, Computer Science, etc.
0-2 years of experience as a data analyst, BI, or equivalent position.
Familiarity with quantitative data collection software/platforms: knowledge of programming languages (Python)
Hands on experience with google looker studio, metabase & Table
Hands on experience with research and data collection is highly beneficial
Fluency in SQL and writing advanced SQL queries
Strong communicator, and good command in presentation skill
Data Driven: Experience managing and conducting quantitative and qualitative research with strong data quality management knowledge is highly desirable
""Waspada terhadap Modus Penipuan pada saat proses interview. Perusahaan tidak akan memungut biaya apapun dalam melakukan proses interview. Mohon segera melaporkan ke kami, jika pada saat Anda diundang untuk interview dan diminta untuk melakukan pembayaran dengan sejumlah uang.""
""Please be aware of the Fraud Company. The company will never be collecting any payment in the process of interview. Please immediately report to us if there's any companies that collecting payment to the Jobseekers.""",,Full-time,Bandung
Mekari (PT. Mid Solusi Nusantara),Associate Data Engineer,Posted 11 days ago,"Mekari is Indonesia's no. 1 Software-as-a-Service (SaaS) company. Our mission is to empower businesses and professionals to progress effortlessly. Our products (Mekari Talenta, Mekari Jurnal, Mekari KlikPajak, & Mekari Qontak) have been used by tens of thousands of businesses in Indonesia.
To reach millions, we need more people like you: entrepreneurs, builders, owners inside the company who are eager to grow at scale. Join us to empower more businesses with technology.
Job Descriptions:
Oversee the data lake, data warehouse & data pipeline that can adequately handle the needs of a rapidly growing data-driven company.
Analyze data from a large number and variety of data sources.
Maintaining the performance of our data analytics platform to ensure accurate, reliable, and timely delivery of key insights for decision making.
Collaborate with data analysts, data scientists, and business process owners in order to provide them with needed data and infrastructure.
Requirements/Qualifications:
A degree or higher in Computer Science, Software Engineering, or other related technical disciplines.
1+ years of industry experience in software and/or data engineering.
Have a good understanding of data modeling
Fluency in programming with Python/Java/Scala and SQL.
Experienced with data engineering tools such as Spark, Kafka, and Airflow.
Familiarity with cloud big data environments such as AWS (EMR, Glue, Athena, Redshift) and GCP (BigQuery, Dataflow, Dataproc).
Proficiency in software engineering best practices such as clean/maintainable code, Git, code review, unit/integration testing, Infrastructure as Code, and Continuous Integration/Continuous Delivery.
Working Arrangement: Hybrid.
Office location: Sudirman, Jakarta, Indonesia.
Our team will review your application and will be in touch if your application is shortlisted to the next stage. If you do not hear from us in 30 days, we will keep your resume on file in case a relevant opportunity opens up.
Don't forget to check our Recruitment FAQ at bit.ly/RecruitmentFAQ-Mekari [ENG] or bit.ly/RekrutmenMekari-FAQ [INA] to find the answers to commonly-asked questions regarding our recruitment process.
We wish you the best, and hope to see you around soon!",,,Jakarta
Mekari (PT. Mid Solusi Nusantara),Associate AI Engineer,Active 4 days ago,"Mekari is Indonesia's no. 1 Software-as-a-Service (SaaS) company. With our ecosystem of software solutions—including Mekari Jurnal, Mekari Talenta, Mekari Qontak, and Mekari Flex, we aim to facilitate entrepreneurs and leaders as they accelerate the digital transformation of their businesses.
In our 10+ years of journey we have reached over 1 Million platform users, and we're not planning to stop any time soon. We need more people like you: builders and owners with calculated ambition who are eager to grow and create their #BiggestImpact.
Main Responsibilities:
We are seeking a highly skilled and motivated AI Engineer to join our dynamic team. As an AI Engineer, you will play a crucial role in building cutting-edge AI features from the ground up and conducting research and development in the field of Machine Learning (ML) and Artificial Intelligence (AI) frameworks. This is an exciting opportunity for individuals passionate about pushing the boundaries of AI technology and contributing to innovative projects.
Key Responsibilities:
Design, develop, and implement AI solutions, including but not limited to natural language processing, computer vision, and other machine learning algorithms.
Collaborate with cross-functional teams to understand business requirements and translate them into AI-driven applications.
Conduct research and stay updated on the latest advancements in ML and AI frameworks to propose and implement innovative solutions.
Work on the full AI development lifecycle, from ideation and proof of concept to deployment and maintenance.
Optimize and enhance existing AI models for improved performance and efficiency.
Collaborate with data scientists and software engineers to integrate AI capabilities into existing systems.
Stay abreast of industry trends and best practices to continuously improve the company's AI capabilities.
Requirements:
Experience in building usable machine learning or AI products for end users.
Bachelor's or Master’s degree in Computer Science, Artificial Intelligence, or a related field.
Proven experience in developing and implementing AI solutions, with a focus on building features from the ground up.
Solid understanding of machine learning algorithms, neural networks, and deep learning techniques.
Experience with popular LLM frameworks and libraries such as Langchain, LlamaIndex, etc.
Familiarity with natural language processing, LLMs such as openAI, LLAMA2, Claude, etc.
Demonstrated ability to work on cross-functional teams and communicate effectively.
Strong problem-solving skills and a proactive mindset towards learning and adopting new technologies.
Working Arrangement: Hybrid.
Office location: Sudirman, Jakarta, Indonesia.
Our team will review your application and will be in touch if your application is shortlisted to the next stage. If you do not hear from us in 30 days, we will keep your resume on file in case a relevant opportunity opens up.
Don't forget to check our Recruitment FAQ at bit.ly/RecruitmentFAQ-Mekari [ENG] or bit.ly/RekrutmenMekari-FAQ [INA] to find the answers to commonly asked questions regarding our recruitment process.

We wish you the best. Hope to see you around soon!",,,Jakarta
StrategArt,Head of Analytics,Posted 30+ days ago,"Industry : Telecommunication
Level : General Manager
Job Description
Define strategiv direction on data science projects
Lead design dan deployment of enhancements and fixes to systems as needed
Create statistical and machine learning models
Communicate and works with business SME and organization leadership",,,Indonesia
Durapower Group,Data Engineer/Scientist,Posted 30+ days ago,"Responsibilities:
Design, build, and maintain robust data pipelines and systems to efficiently collect, store, and analyze diverse battery-related data.
Collaborate with cross-functional teams to integrate data from various sources, ensuring a comprehensive and cohesive representation of battery performance metrics.
Develop and implement predictive models to extract meaningful insights, contributing to strategic decision-making in the battery technology sector.
Work closely with data scientists and analysts to identify data patterns, trends, and anomalies, translating raw information into actionable insights.
Stay updated on industry trends and advancements, providing recommendations to shape data initiatives that keep the organization at the forefront of innovation in battery technology.
Requirements:
University or Master’s degree in Computer Science, Data Science, or a related field.
Demonstrable experience as a Date Scientist, focusing on designing and implementing data architectures and pipelines, particularly in the context of battery-related data.
Proficiency in data modeling and design, including SQL scripting and database administration.
Strong proficiency in relevant programming languages (e.g., Python, Java), data modeling, and database management systems. Experience with tools such as Apache Spark and familiarity with cloud platforms (e.g., AWS) is a plus.
Experienced in developing and implementing predictive models to extract insights from complex datasets, contributing to informed decision-making.
Understanding of battery technology, energy storage systems, and a keen interest in staying abreast of industry trends and advancements.
Natural curiosity, creative and critical thinking with a learner mindset.
Strong communication and collaboration skills to work effectively across diverse teams within Durapower.",,,Central Java
Mekari (PT. Mid Solusi Nusantara),AI Engineer,Posted 4 days ago,"Main Responsibilities:
We are seeking a highly skilled and motivated AI Engineer to join our dynamic team. As an AI Engineer, you will play a crucial role in building cutting-edge AI features from the ground up and conducting research and development in the field of Machine Learning (ML) and Artificial Intelligence (AI) frameworks. This is an exciting opportunity for individuals passionate about pushing the boundaries of AI technology and contributing to innovative projects.
Key Responsibilities:
Design, develop, and implement AI solutions, including but not limited to natural language processing, computer vision, and other machine learning algorithms.
Collaborate with cross-functional teams to understand business requirements and translate them into AI-driven applications.
Conduct research and stay updated on the latest advancements in ML and AI frameworks to propose and implement innovative solutions.
Work on the full AI development lifecycle, from ideation and proof of concept to deployment and maintenance.
Optimize and enhance existing AI models for improved performance and efficiency.
Collaborate with data scientists and software engineers to integrate AI capabilities into existing systems.
Stay abreast of industry trends and best practices to continuously improve the company's AI capabilities.
Requirements:
Experience in building usable machine learning or AI products for end users.
Bachelor's or Master’s degree in Computer Science, Artificial Intelligence, or a related field.
Proven experience in developing and implementing AI solutions, with a focus on building features from the ground up.
Solid understanding of machine learning algorithms, neural networks, and deep learning techniques.
Experience with popular LLM frameworks and libraries such as Langchain, LlamaIndex, etc.
Familiarity with natural language processing, LLMs such as openAI, LLAMA2, Claude, etc.
Demonstrated ability to work on cross-functional teams and communicate effectively.
Strong problem-solving skills and a proactive mindset towards learning and adopting new technologies.
Working Arrangement: Hybrid.
Office location: Sudirman, Jakarta, Indonesia.
Our team will review your application and will be in touch if your application is shortlisted to the next stage. If you do not hear from us in 30 days, we will keep your resume on file in case a relevant opportunity opens up.
Don't forget to check our Recruitment FAQ at bit.ly/RecruitmentFAQ-Mekari [ENG] or bit.ly/RekrutmenMekari-FAQ [INA] to find the answers to commonly asked questions regarding our recruitment process.

We wish you the best. Hope to see you around soon!",,,Jakarta
Shopee,Back End Engineer (ShopeePay) - Sea Labs,Posted 30+ days ago,"Department Engineering and Technology
LevelEntry Level
LocationIndonesia - Jakarta
The Engineering and Technology team is at the core of the Shopee platform development. The team is made up of a group of passionate engineers from all over the world, striving to build the best systems with the most suitable technologies. Our engineers do not merely solve problems at hand; We build foundations for a long-lasting future. We don't limit ourselves on what we can or can't do; we take matters into our own hands even if it means drilling down to the bottom layer of the computing platform. Shopee's hyper-growing business scale has transformed most ""innocent"" problems into huge technical challenges, and there is no better place to experience it first-hand if you love technologies as much as we do.
About the Team:
About Sea Labs Indonesia
Sea Labs is at the core of the Sea platforms development, supporting diverse business lines from e-commerce, supply chain, games, payment and finance, among many others. The strong growth and unique positioning of Sea's e-commerce business, Shopee, spurred the launch of Sea Labs Indonesia. Since its inception, the group of passionate engineers have charted the course to drive the best experience for our users in Indonesia, many of which solutions are even adapted to other markets in the region.

Sea's hyper-growing business scale has transformed most ""innocent"" problems into huge technical challenges, and there is no better place to experience world-class projects first-hand if you love technologies as much as we do.Together with our passionate and driven teams, you'll get to develop your skills, build on industry knowledge and collaborate with global teams in a dynamic space. Browse our Sea Labs Indonesia team openings to see how you can make an impact with us.

About the Team
The Payment team, best known for their flagship product: ShopeePay, aims to develop a mature, world-class payment platform connecting individuals and businesses within Shopee ecosystem. Beyond ShopeePay, the Team also connects with a large number of local financial institutions to serve billions of Shopee and SeaMoney users across the different markets.

Together, we aim to reach the forefront of cashless payment technology by providing a more accessible, secure and reliable payment network that empowers individuals as well as micro, small and medium enterprises around the globe.
Job Description:
As a Back End Engineer, you will work with some of the most talented minds in the world, collaborating with fellow Developers, Product Managers, User Experience Designers and Operation Engineers to build user-centric, business-critical functionalities that delight both internal businesses and external end-users. Your main responsibility includes (but not limited to):
Design and development of backend services, systems, or platforms used by our products and our user
Write high-quality, clean, elegant, and maintainable code
Build common libraries
Analyse requirements, design, and develop functionalities based on the product requirements
Understand the product thoroughly, constantly optimise the product, identify and fix problems, improve stability and user experience
Design and implement various supporting tools as needed
Collaborate with other engineers, product managers, user experience designers, and operations engineers to build features and products

Requirements:
Bachelor's degree or above in Computer Science or related fields
Candidates with no working experience are welcome to apply
Passionate about coding and programming, innovation, and solving challenging problems
In-depth understanding of computer science fundamentals (data structures and algorithms, operating systems, networks, databases, etc)
Strong and hands-on experience with at least one of the programming languages such as Go, Python, Java
Hands-on experience and knowledge in relational databases such as MySQL
Strong logical thinking abilities
Familiar with Linux development environments and multi-threaded programming
Familiar with common network protocols (TCP, UDP, HTTP) and network programming
Experience in server/web security
Hands-on experience in Web Service frameworks and technologies such as Django, Ruby On Rails, or Node.js",,,Jakarta
