Company Names,Job Titles,Posted On,Job Details,Images,Type Location,Locations
Deloitte,Graduate Analyst Program - Technology Strategy & Transformation - October intake,Posted 30+ days ago,"Graduate Analyst Program - Technology Strategy & Transformation - October intake
Date: 28 Aug 2024
Service Line / Portfolios: Enterprise Technology & Performance
Location: Jakarta, ID
Brunei, BN
Are you ready to unleash your potential?

At Deloitte, our purpose is to make an impact that matters for our clients, our people, and the communities we serve.

We believe we have a responsibility to be a force for good, and WorldImpact is our portfolio of initiatives focused on making a tangible impact on society’s biggest challenges and creating a better future. We strive to advise clients on how to deliver purpose-led growth and embed more equitable, inclusive as well as sustainable business practices.

Hence, we seek talented individuals driven to excel and innovate, working together to achieve our shared goals.

We are committed to creating positive work experiences that foster a culture of respect and inclusion, where diverse perspectives are celebrated, and everyone is recognised for their contributions.

Ready to unleash your potential with us? Join the winning team now!

Work you will do
You will be part of our structured Deloitte SEA Graduate Analyst Program and be given a personal coach, the opportunity to undergo a 2-week intensive bootcamp training aimed at equipping you with the skillsets necessary to excel, and opportunities to gain regional exposure by travelling across SEA as part of project assignments, and other professional development opportunities.


This program will allow you to develop core consulting skills and business acumen whilst gaining access to a wide scope of training and development activities. In addition, you will have an opportunity to work with like-minded people and gain exposure to a variety of projects within the chosen business area. You will be at the center of it all, performing research, data analysis and modelling to tackle complex business problems. In addition, you will contribute directly to the development of proposals, presentations, and publications.

This role sits within the Technology Strategy and Transformation (TS&T) team of Deloitte Southeast Asia, which encompasses IT Strategy and Transformation. As a leader of this group, you will drive the growth of our TS&T business in the region and be responsible for the creation, sale and delivery of TS&T solutions: IT Strategy, Application & Systems Development, IT Business Transformation, etc

As an Analyst, your role would include but not limited to:

Supporting project teams in providing end-to-end advisory and overlay point-of-views and industry insights onto the research and analyses provided by the project teams, and seek to formulate innovative technology-enabled solutions to address our clients’ business needs.
Managing the assessment and business requirements gathering processes, review appropriateness of functional specifications against the problem statements/business requirements, and support solutions prototyping and architecture re-design by applying industry insights and know-hows.
Engaging our clients in discussions, presentations and workshops to validate technology-enabled solutions provided by the project teams, as well as perform walk-through of work products and deliverables with the clients.
Develop trusted relationships with your clients and gain recognition in the marketplace for technical and advisory capabilities across the spectrum.
Provide quality assurance and ensure timely delivery of work products developed by the project teams.
Actively coach project teams during the execution of projects and support senior team members in maintaining operational excellence at all times.
Together with project team, meet clients on a regular basis to define problem statements, analyze key priorities/issues, and work with senior team members to develop responses to client enquiries, formulate proposals and produce point-of-view publications.

Your role as a leader

At Deloitte, we believe in the importance of empowering our people to be leaders at all levels. We connect our purpose and shared values to identify issues as well as to make an impact that matters to our clients, people and the communities. Additionally, Analyst across our Firm are expected to:

Demonstrate a strong commitment to personal learning and development.
Understand how our daily work contributes to the priorities of the team and business.
Understand the set expectations and demonstrate accountability in keeping personal performance on track.
Actively focus on developing effective communications and relationship-building skills with stakeholders, clients, and team.
Demonstrate an appreciation for working with others.
Understand what is fundamental to Deloitte’s success as a business.
Demonstrate integrity and an awareness of strengths, differences, and personal impact.
Develop their understanding of Deloitte and offer a fresh perspective.

What we are looking for
In your final year of study or recent graduate between 0-2 years of work experience
Available to commence in October 2024.
Strong academic performance in Information Technology, Business Information Systems, Business, Engineering or Computer Science or related disciplines
Some experience in either advisory or as implementation experience in the following areas:
- IT Strategy: IT strategy development, IT governance, IT operating model, enterprise architecture
IT Transformation: IT sourcing advisory, program and project management advisory
IT Operations: IT service management, IT shared service management
IT Optimization: IT cost reduction, IT Merger & Acquisition
Understanding of current IT trends (cloud computing, big data, social media, RPA, IoT, blockchain, etc.).
Team player with effective interpersonal and communication skills • Demonstrated leadership and teamwork within or outside a work setting
Exceptional problem-solving ability, logical reasoning, creative thinking, comfort with numbers, and the ability to untangle complex issues
Fluent verbal and written English language skills

Due to volume of applications, we regret that only shortlisted candidates will be notified.

Please note that Deloitte will never reach out to you directly via messaging platforms to offer you employment opportunities or request for money or your personal information. Kindly apply for roles that you are interested in via this official Deloitte website.

This role is open to those that possess a valid permit or status to work in Indonesia, Malaysia, Thailand, Singapore.

#LI-LC

Requisition ID: 104666
In Indonesia, the services are provided by Imelda & Rekan and other related entities in Indonesia (""Deloitte in Indonesia""), which are affiliates of Deloitte Southeast Asia Ltd. Deloitte Southeast Asia Ltd is a member firm of Deloitte Touche Tohmatsu Limited. Deloitte in Indonesia, which is within the Deloitte Network, is the entity that is providing this Website.",,,Jakarta
PwC,Associate - Tax - Data Analytics,Posted 30+ days ago,"Line of Service
Industry/Sector
Specialism
Management Level
Associate
Job Description & Summary
The Innovation Team is at the core of innovation and emerging technology development, discovery, deployment and support activity. Our team is leading the effort to digitally enable our business. Our mission is to develop disruptive & innovative technologies and products that drive the evolution of how we deliver our services now and in the future. The key technology domains we are currently focused on include business process automation, data curation, industrialized analytics, machine learning & AI and scalable delivery platform.

A career in our Tax Reporting and Strategy practice, within Innovation services, will provide you with the opportunity to help our clients’ tax departments redesign, redefine, and redeploy tax to be a strategic asset across the enterprise. You’ll focus on assisting clients incorporate increased automation in the tax reporting process, increase analytic capabilities through data integration, and create solid internal controls that will enable the Tax function to deliver better quality output and contribute more strategically to organisational decision making.

Our team helps our clients expand the tax role to include research, analytics, and technologies to improve how their organisation collaborates and performs. You’ll focus on enhancing the tax reporting process by incorporating increased automation, integrating quality data, developing analytic capabilities, and utilising technology to deliver better quality output in less time.
To really stand out and make us fit for the future in a constantly changing world, each and every one of us at PwC needs to be a purpose-led and values-driven leader at every level. To help us achieve this we have the PwC Professional; our global leadership development framework. It gives us a single set of expectations across our lines, geographies and career paths, and provides transparency on the skills we need as individuals to be successful and progress in our careers, now and in the future.
As an Associate, you'll work as part of a team of problem solvers, helping to solve complex business issues from strategy to execution. PwC Professional skills and responsibilities for this management level include but are not limited to:
Invite and give in the moment feedback in a constructive manner.
Share and collaborate effectively with others.
Identify and make suggestions for improvements when problems and/or opportunities arise.
Handle, manipulate and analyse data and information responsibly.
Follow risk management and compliance procedures.
Keep up-to-date with developments in area of specialism.
Communicate confidently in a clear, concise and articulate manner - verbally and in the materials I produce.
Build and maintain an internal and external network.
Seek opportunities to learn about how PwC works as a global network of firms.
Uphold the firm's code of ethics and business conduct.
Essential Skills and Experience
Bachelor degree from Computer Science, Information System, and related, with minimum GPA of 3.. Fresh graduates are welcome to apply.
Background and passionate in data analysis, programming, and how these can be used to create value to a client from data analytics spectrum.
Familiar/experienced in data structures and query language (SQL, ETL, SSIS).
Experience in statistical packages (Excel, R, Python, SPSS, SAS) is a plus point.
Strong analytical thinking, problem solving, and strong attention to detail.
Good communication skill, able to articulate a business issue and potential impact without resorting to technical language.
Well-rounded team player as well as individual settings.
Actively building good working relationships with both colleagues and client personnel at all levels.
The ability to work flexibly and effectively in different teams for varying periods of time.
Some knowledge of finance, accounting, ERP systems, although not essential.
Education (if blank, degree and/or field of study not specified)
Degrees/Field of Study required:
Degrees/Field of Study preferred: Bachelor Degree
Certifications (if blank, certifications not specified)
Required Skills
Optional Skills
Desired Languages (If blank, desired languages not specified)
Travel Requirements
0%
Available for Work Visa Sponsorship?
No
Government Clearance Required?
No
Job Posting End Date",,Full-time,Jakarta
Jakarta,Data Analyst (AG),Posted 6 days ago,"Jadi bagian dari tim hebat dari perusahaan global.
Bergabunglah dengan perusahaan global kami dan buka peluang tanpa batas dengan berkolaborasi bersama tim yang beragam dan berbakat. Bersama-sama, kami menciptakan kesuksesan, mendorong inovasi, dan menciptakan dunia dengan berbagai peluang yang tak terbatas.

Detail Pekerjaan
1. Gather data from various sources, such as databases, APIs, and spreadsheets. 2. Clean, organize, and prepare data for analysis, ensuring accuracy and consistency. 3. Analyze datasets to identify trends, patterns, and insights that can help inform business decisions. 4. Use statistical techniques and tools to interpret data and generate meaningful insights. 5. Create reports, dashboards, and visualizations to present data findings to stakeholders. 6. Use data visualization tools (e.g., Excel, Tableau, Power BI) to effectively communicate complex data in a clear and concise manner. 7. Ensure data accuracy and integrity by performing regular data audits and validation checks. 8. Support business planning by offering data-backed projections and scenario analysis. 9. Identify opportunities for business growth and optimization through data analysis. 10. Implement tools and technologies that streamline data processing and reporting.
Persyaratan Keahlian
1. Must have experience with data analysis tools and programming languages, such as SQL, Python, or SAS. 2. Must have Experience with data visualization tools like Power BI, Looker Studio, or Tableau. 3. Familiarity with database systems, data lakes, and cloud-based data platforms (e.g., AWS, Google Cloud, Azure). 4. Experience in creating and delivering presentations to senior management. 5. A degree in Data Science, Statistics, Mathematics, Computer Science, or a related field 6. 1 year minimum experience in the same field.
Tingkat Pendidikan
Bachelor Degree in Any Major.",,,Jakarta
Kredivo Group,Data Engineer & Analytics,Just posted,"As a Data Engineer and Analytic you will be tasked with empowering internal stakeholders to delve deep into the complexities of the data in our warehouse. You will work closely with Product, Engineering, and Data teams to build scalable data pipelines and design data analytics engines that empower deep insights for users. The person in this position will take work seriously, has a strong sense of duty, and is disciplined. The position will generally be task oriented, requiring someone with a conservative, careful, and cautious approach to work.
About the job:
Design and develop scalable business data solutions across the entire data supply chain.
Create and review technical and user-focused documentation for data solutions (data models, data dictionaries, business glossaries, process and data flows, architecture diagrams, etc.).
Solve for complex data integrations across multiple systems.
Collaborate with management, business partners, analysts, developers, architects, and engineers to support data quality efforts.
Expertise (can teach/instruct others): in current data warehousing concepts (using technologies like Redsift, Spark, Hadoop, web services, etc to support business-driven decisioning)
SQL and database scripting
With data manipulation scripting languages (like Python or Scala)
With Data Science toolsets and technology stack
About you:
A passionate and curious individual in Data Engineering and Analytics subject areas
1-3 years of any relevant experiences in Data Engineering, Data Warehouse, Business Intelligence, Analytics
Good proficiency in writing SQL, either in RDBMS (i.e. MySQL, PostgreSQL, etc) or OLAP (i.e. BigQuery, Redshift, Oracle, etc.)
Ability to write robust and scalable code in Python or other scripting programming language
Good knowledge in creating a workable business dashboard.
Basic proficiency or experience in infrastructure setup using cloud services (i.e. AWS, GCP, Azure).
Strong passion in data engineering or business intelligence areas, ability to search or create solutions.
Good communication skills in Bahasa and English. Mostly explaining technical things.
Good workable attitude, something we could invest time to develop",,Full-time,Jakarta
Cybertrend Intrabuana,Web UI/UX Designer Intern,Posted 30+ days ago,"Internship
Join the Cybertrend’s center of data science and AI excellence and create solution with real business value side by side with us!
We are looking someone with:
Excellent communication skills to collaborate with various stakeholders
Strong knowledge of UX and web design.
Strong Proficiency with the following UX tools (Overflow, Sketch, Figma, Invision / Marvel).
In the event that you haven’t received any updates after 3 weeks, your data will be kept and we may contact you for another career opportunity.
Location : Jakarta",,Internship,Jakarta
SMART Agribusiness and Food,Digital Talent Program,Posted 30+ days ago,"Job description:
Drive / design / build cool digital-solutions (Web, Mobile, AI, Cloud, IoT, Beautiful Data Visualization applications) to solve business problems
Involve in driving game-changing process improvements in various area, among other – commerce, logistic, plantation, manufacturing, Finance, HR, Procurement and IT
Demonstrate leadership competency development during the project delivery: Focuses on Customers, Innovates, Realizes People’s Potential, Acts as a Business Owner
Ability to perform hands-on technical tasks
Have a lot of fun, continuously learn new things

Job requirements:
Candidate must possess at least a Bachelor's Degree, Master's Degree / Post Graduate Degree, Computer Science/Information Technology from reputable university with min GPA 3,20
Having more than 1 year system development experience is preferred
Fresh graduate are welcome to apply
One or some combination of the following exposure:
UX / UI research
Web / mobile development preferably on JavaScript/HTM/CSS, front-end framework (e.g. VueJS), back-end framework (e.g. NodeJS), Android Kotlin / Java
Business Intelligence & ETL preferably on Microsoft PowerBI, Microsoft SSIS, Talend
AI, machine learning and big data preferably on Python,TensorFlow, Hadoop
Willing to travel once in a while, generally when performing system requirement gathering or system deployments
Strong communication skill and team player
Full-Time position(s) available

""Our company has never levied any fees for the recruitment process nor has it required to order tickets and accommodation through a certain travel agent or certain person.""",https://d2q79iu7y748jz.cloudfront.net/s/_squarelogo/256x256/cafec34e1ef97da8a8f50c2b291be73f,Full-time,Jakarta
Samsung Electronics,Data Engineer,Posted 30+ days ago,"Position Summary
1. Provide service reliability by analyzing the required data, conducting data modeling and designing, implementing and operating database architecture for each service.
2. Enhance service quality by developing and analyzing data to provide impactful services.
3. Provide service engineering through standardization/automation of technology analysis for each database solution.
4. Advanced SW Certification (Coding Test)
Role and Responsibilities
1. [Data modeling] Guarantee the data integrity by analyzing service requirements and data flow and conduct the logical/physical modeling of the entire structure with optimized performance.
2. [Data pipelining] Automate and schedule tasks using various tools such as Airflow.
3. [Data warehouse design and operation] Design, implement, and operate data storages so that analyzable structured/unstructured data are stored.
4. [Data processing & analysis] Perfom analysis and ETL from various data sources to produce reliable datasets.

5. Have good communication skills in English
6. Have experience in advanced SQL Query
7. Knowledge and experience in data modeling, ETL, and data engineering tools such as Python, Airflow
8. Strong analytical & statistical skills and ability to analyze and interpret complex data
9. Have good organization & teamwork

Preferable
10. Have experience in AWS Athena / Google Big Query is a plus
11. Have experience in Batch processing using Spark / AWS EMR is a plus
12. Have experience in Real-time processing using Spark Streaming / Flink is a plus
13. Have experience in cloud is a plus
Skills and Qualifications
Develops professional expertise by complying with company policies and procedures
Works on problems of moderate scope where analyzing situations or data requires a review on various factors
Exercises judgment within defined procedures and practices to determine appropriate action
Normally receives general instructions on routine work with detailed instructions on new projects or assignments
Bachelor or Master Degree in Computer Science, Mathematics, Electrical Engineering and Physics from Reputable Universities.",https://d2q79iu7y748jz.cloudfront.net/s/_squarelogo/256x256/08f9772288de0157ee1f9a21f4ef38a0,Full-time,Jakarta
Cybertrend Intrabuana,Software Engineer Intern,Posted 30+ days ago,"Internship
Join the Cybertrend’s center of data science and AI excellence and create solution with real business value side by side with us!
We are looking someone with:
Research web technology trends
Collaborate with diverse teams to plan, prototype, build and maintain new features
Design, implement & operate new web services using some language program
(WordPress, HTML, PHP, Java Script, Json and MySQL)
In the event that you haven’t received any updates after 3 weeks, your data will be kept and we may contact you for another career opportunity.
Location : Jakarta",,Internship,Jakarta
PwC,Associate 2 - Assurance - Risk Assurance (Data Analytics),Posted 30+ days ago,"Line of Service
Assurance
Industry/Sector
Not Applicable
Specialism
Assurance
Management Level
Associate
Job Description & Summary
A career within Information Technology Risk Assurance services, will allow you to develop and apply strategies that help clients leverage enterprise technologies so they can get a higher return on their investment, mitigate risks, streamline processes, and find operational inefficiencies. We assist clients in understanding and challenging their current risk profiles and develop strategies to build digital confidence by embracing opportunities to stay competitive through building trust and resilience into their technology systems. We cover a wide range of disciplines, including risk evaluation, operational and strategic Information Technology processes, project governance, application implementation, data integrity, cyber security, and accounting/audit.
To really stand out and make us fit for the future in a constantly changing world, each and every one of us at PwC needs to be a purpose-led and values-driven leader at every level. To help us achieve this we have the PwC Professional; our global leadership development framework. It gives us a single set of expectations across our lines, geographies and career paths, and provides transparency on the skills we need as individuals to be successful and progress in our careers, now and in the future.
As an Associate, you'll work as part of a team of problem solvers, helping to solve complex business issues from strategy to execution. PwC Professional skills and responsibilities for this management level include but are not limited to:
Invite and give in the moment feedback in a constructive manner.
Share and collaborate effectively with others.
Identify and make suggestions for improvements when problems and/or opportunities arise.
Handle, manipulate and analyse data and information responsibly.
Follow risk management and compliance procedures.
Keep up-to-date with developments in area of specialism.
Communicate confidently in a clear, concise and articulate manner - verbally and in the materials I produce.
Build and maintain an internal and external network.
Seek opportunities to learn about how PwC works as a global network of firms.
Uphold the firm's code of ethics and business conduct.
Preferred skills
Fresh graduates with a degree in Information Technology or Computer Science with minimum GPA 3.00 out of 4.00. Those with 1 - 2 years of experience are also welcome to apply.
Familiar with/experienced in query language (at least SQL), programming algorithms (Python, C#, .NET), or robotic technology (RPA).
Familiar with/experienced in web programming such as ASP.NET , ReactJS, JavaScript, JSON, CSS, and HTML is a plus.
Strong analytical thinking, problem solving, and strong attention to detail.
Good communication skill, able to articulate a business issue and potential impact without resorting to technical language.
Well-rounded team player as well as individual settings.
Actively building good working relationships with both colleagues and client personnel at all levels.
The ability to work flexibly and effectively in different teams for varying periods of time.
Some knowledge of finance, accounting, ERP systems, although not essential.
Education (if blank, degree and/or field of study not specified)
Degrees/Field of Study required:
Degrees/Field of Study preferred: Bachelor Degree - Computer Science, Bachelor Degree - Information Technology
Certifications (if blank, certifications not specified)
Required Skills
Optional Skills
Desired Languages (If blank, desired languages not specified)
Travel Requirements
Up to 40%
Available for Work Visa Sponsorship?
No
Government Clearance Required?
No
Job Posting End Date",,Full-time,Jakarta
