Company Names,Job Titles,Posted On,Job Details,Images,Type Location,Locations
Global Tiket Network,Associate Data Scientist,Posted 30+ days ago,"Your main duties in flying with us:
Work with stakeholders throughout the organization to identify opportunities for leveraging company data to drive business solutions.
Mine and analyze data from company databases to drive optimization and improvement of product development, marketing techniques, and business strategies.
Develop custom data models and algorithms to apply to data sets.
Use predictive modeling to increase and optimize customer experiences, revenue generation, ad targeting, and other business outcomes.
Develop company A/B testing framework and test model quality.
Coordinate with different functional teams to implement models and monitor outcomes.
Develop processes and tools to monitor and analyze model performance and impact on the business.
Do mentoring and guiding junior team members
Research and development on novel machine learning techniques, including research paper writing and their applications
Mandatory belongings that you must prepare:
Bachelor's/Master's degree in Computer Science, Statistics, Mathematics, Engineering, or a related field.
0-2 years of experience in data science, machine learning, data analysis and modelling or a relevant field.
Proven track record of conducting research and publishing papers in reputable conferences or journals.
Strong problem-solving skills with an emphasis on product development.
Proficient in programming skills (Python, R, SQL, etc.) for data acquisition, processing, and analysis from large data sets.
Knowledge of data science concepts (regression, classification, clustering, properties of distributions, statistical tests, and proper usage, etc.) and experience with applications.
Have the understanding on design and implement statistical models.
Knowledge of a variety of machine learning techniques (Random forest, SVM, artificial neural networks, etc.) and their real-world advantages/drawbacks.
Excellent written and verbal communication skills for coordinating across teams.
A drive to learn and master new technologies and techniques.",,Full-time,Jakarta
AwanTunai,Data Scientist,Posted 7 days ago,"Jakarta, DKI Jakarta
Work Type: Full Time

Company Overview
AwanTunai is the leading vertical fintech player digitizing the offline FMCG supply chain in Indonesia. We solve for both operational and financing pain points through ERP software and integrated embedded financing for offline suppliers. Our traditional suppliers have aggregate annual sales of over $3bn+ and our embedded financing is on track to reach the annualized $1bn milestone next quarter. We have been growing revenues at an average 30% QoQ with 0.2% credit loss rates over the pandemic period across hundreds of traditional suppliers.

Our financial impact has won accolades from the UNCDF, Monetary Authority of Singapore, and with the IFC (World Bank Group) as a major shareholder. Management and our impact focused shareholders are committed to building a world class team regardless of diversity or location.
Our fraud management has won the trust of global banking groups (MUFG, OCBC), the largest local institutions (Bank BRI, Bank Mandiri), as well as global insurers (AA rated Munich Re) who protect our loan assets against credit default.

Role
AwanTunai is looking for a Data Scientist who will analyze and interpret complex data using statistical methods, machine learning, and domain expertise to extract insights, make predictions, and drive data-driven decisions.

Responsibilities
1. Conduct data exploration and discovery, and advanced data mining analysis on spatial-temporal data, user behavioral data, transaction data, machine/device log data, and others
2. Conduct experiments with data, build working prototypes to demonstrate ideas and results
3. Build scalable pipeline and data science models with open source systems or proprietary tools
4. Collaborate with business teams to contribute to new use cases for solving clients’ problems
5. Participate in IP creation, such as patenting, case studies, white papers and research papers as determined by business needs

Requirements
1. 3+ years experience of successful application of machine learning, data mining, and statistical analysis with demonstrable impact and proven track records
2. Demonstrated ability to take high level, loosely-defined business problems and identify precise, quantitative solutions
3. Working knowledge of databases and query engines for structured and unstructured data, data transformation (ETL), software development methodologies, and data science languages like Python, R, or others
4. Self-starter, capable of experimenting with various tools and developing own code and scripts for data manipulation, experimentation, algorithm implementation, accuracy measurements, etc.
5. Familiar with basic software development skills (agile methodologies, testing, version control, etc.)
6. Preferred to have advanced degree in Computer Science, Machine Learning, Operational Research, Mathematics or Statistics, or other equivalent subjects
7. Preferred to be familiar with basic software development skills (agile methodologies, testing, version control, etc.)",,Full-time,Jakarta
Amar Bank,Jr Data Scientist,Posted 30+ days ago,"Who are we?

Amar Bank is one of the most technologically advanced digital banks in Indonesia. Our leading
digital lending product, Tunaiku has the distinction of being the first FinTech product in
Indonesia. We are also the first digital bank on the cloud. As the first profitable digital bank, we
managed to get listed on the Indonesian Stock Exchange.

How did we manage to do that?

We are changing people’s perception of a bank. We believe we are the innovators who combine
customer focus principles with creating technology-based impact. We incorporate freedom and
flexibility as part of our startup working culture DNA to encourage innovation in creating better
financial solutions for the banking industry. We think of ourselves as, ‘A technology company
with a banking license’. For this reason, we ‘Act like a FinTech, and think like a Bank.’

How did it all start?

Founded on March 15, 1991, in Surabaya as PT Anglomas International Bank (Amin Bank), the
bank was acquired by Tolaram Group and transformed to PT Bank Amar Indonesia (Amar Bank)
in 2014. It has then undergone a significant digital transformation to become one of the
country's forerunning fintech institutions through its award-winning digital lending platform,
Tunaiku.

Our philosophy, mission, and vision

Technology must impact lives, must improve lives. We exist to provide banking to those who
‘need’ and not only to those who ‘want’. Services when provided to those who need at the time
of their need brings smiles. Our vision is to bring 200 million smiles.

More about the bank with startup culture environment

Consist of 1000+ people, you will meet people who love to grow, dream big, and actually have
fun at the workplace! We provide a great working environment that pushes people to grow
outside their comfort zone. People with high drive and ambition find us a very attractive place to
work as their career growth matches their own drive and not any staid policies. Thus we hold
the honor of being awarded “Best Place to Work in Indonesia”.

Recently Amar Bank was awarded as Inspirational Brand from APEA (Asia Pacific Enterprise
Awards) 2022. Of course, our innovation won't stop here. So if you would love to be a part of it,
have a growth mindset, and are constantly hungry for challenges, we invite you to join us in our
journey to ‘Impact Lives’.

Join us today and create #unlimitedinnovations!
Responsibilities
Data Cleaning and Preprocessing: data cleaning and preprocessing tasks, preparing data for analysis.
Implementation of Models: implementing machine learning models may work on simpler models and have less experience in selecting and fine-tuning them.
Collaboration: work closely with senior team members, learning from them and contributing to projects under guidance.
Documentation: documenting their work, including data processing steps, model implementation, and results.
Requirements
Education: a bachelor's or master's degree in a relevant field such as computer science, statistics, or a related quantitative discipline.
Programming skills: proficiency in programming languages like Python or R.
Basic statistics and mathematics: understanding of basic statistical concepts and mathematical foundations of machine learning.
Tools and Frameworks: familiarity with common data science tools and frameworks.
Communication Skills: ability to communicate findings effectively to both technical and non-technical stakeholders.
Bonus Point If
Prior working experience from banking sector, especially from area of debt collection
We exist to innovate and maintain the architecture of Amar Bank's products. As part of our main focus to create through technology we ensure the process and technology we use helps maintain and build human connection at scale.

It’s our job to plan, monitor, and control the technology growth so we can provide a faster, more convenient, and more efficient way of performing business transactions.",,Full-time,Jakarta
Nestle Operational Services Worldwide SA,"IT Analytics, Data and Integration Technology Expert",Posted 2 days ago,"Position Snapshot
Location: Jakarta, Indonesia
Company: Nestlé Indonesia
Full Time

Position Summary
Joining Nestlé means you are joining the largest food and Beverage Company in the world. At our very core, we are a human environment – passionate people driven by the purpose of unlocking the power of food to enhance quality of life for everyone, today and for generations to come.

As an IT Analytics, Data Integration Technology Expert, Under the supervision and guidance of her/his primary Community of Practice Lead and Product Group Manager based in Switzerland, the Technology Expert brings deep expertise and knowledge to the product or platform team. S/He guides and promotes optimal use of technology to support the cost effective delivery of business requirements within their area of expertise. Working at the leading edge of IT for the product or platform, the Technology Expert performs preliminary studies, helping to set the technological direction with the product or platform manager. S/He supports delivery and sustain of the most complex applications and business capabilities, and may be accountable for specific deliverables in relation to development or support or may lead the technical activity within their area of specialty.

A day in the life of IT Analytics, Data and Integration Technology Expert
Technology expertise; Provides deep specialist knowledge and skills in data science and engineering, supports integration of solutions with various technologies.
Operational effectiveness and efficiency; Implements continuous improvement on effectiveness, efficiency and delivery of services through the use of technology and technical methodologies.
Security, compliance & risk management; Responsible for ensuring that all solutions are delivered and maintained securely and compliant with internal standards and external regulations, including privacy requirements and understands the business risks and delivers solutions within acceptable risk level.
Stakeholder engagement; Works with functional managers, product managers, Tech Leads, Solution Architects and Business Analysts as required to ensure any solution fits with strategic and technical direction.
Supplier and strategic partners management; Liaises closely with suppliers and vendors, for example where third party works involve significant functional, technical, process, data or integration decisions.

What will make you successful
Bachelor's degree in computer science, system analysis or a related study, or equivalent experience
4 years of experience in the relevant area of expertise
Experience of successfully leading technical evaluations
Experience of resolving technical issues, including those involving 3rd parties
Preferably certification in corresponding technical fields
Experience with effective communication at different levels in the organization and in English
Experience working in a global environment and with virtual teams",,Full-time,Jakarta
TyrAds,Data Engineer,Posted 8 days ago,"Data Engineer
Bali, BALI
Work Type: Full Time

Job Summary:
We are seeking a skilled Data Engineer to join our team. The ideal candidate will have a strong technical background in designing and developing data pipelines, integrating and managing data systems, and collaborating with various stakeholders to deliver high-quality data solutions. This role is vital to ensuring our data infrastructure is robust, scalable, and optimized to meet the business’s evolving needs.

Location: Bali, Indonesia (in office)
Key Responsibilities:
Design and Develop Data Pipelines:
Create and maintain optimal data pipeline architecture.
Assemble large, complex data sets that meet functional and non-functional business requirements.
Data Integration and ETL:
Build the infrastructure required for the optimal extraction, transformation, and loading (ETL) of data from various data sources.
Develop processes and tools to monitor and analyze data pipeline performance.
Database Management:
Work with data and analytics experts to strive for greater functionality in our data systems.
Implement, maintain, and optimize database solutions, including both SQL and NoSQL databases.
Collaboration and Communication:
Collaborate with data scientists, business analysts, and other stakeholders to understand data needs and provide technical solutions.
Communicate project progress, issues, and solutions effectively to the team and management.
Data Quality and Governance:
Ensure data quality and data governance standards are maintained.
Implement data security measures and compliance policies.
Qualifications:
Education and Experience:
Bachelor’s or Master’s degree in Computer Science, Information Technology, Engineering, or a related field.
Proven experience as a Data Engineer or in a similar role.
Technical Skills:
Proficient in SQL and experienced with relational databases.
Experience with big data tools such as Hadoop, Spark, or Kafka.
Knowledge of data pipeline and workflow management tools like Airflow or Luigi.
Experience with cloud services (AWS, Azure, GCP) and containerization technologies (Docker, Kubernetes).
Programming Skills:
Strong programming skills in Python, Java, Scala, or similar languages.
Soft Skills:
Strong problem-solving skills and attention to detail.
Excellent communication and teamwork abilities.
Ability to work in a fast-paced, dynamic environment.
Preferred Qualifications:
Experience with machine learning and data mining techniques.
Familiarity with data visualization tools such as Tableau or Power BI.
Knowledge of data privacy regulations and best practices.
Why Join Us?
This is an exciting opportunity to contribute to the development and optimization of our data infrastructure, working with a team of talented professionals in a fast-paced and innovative environment. If you are passionate about data and have the technical skills to match, we encourage you to apply.",,Full-time,Bali
Mekari (PT. Mid Solusi Nusantara),Data Intelligence,Active 22 days ago,"Mekari is Indonesia's no. 1 Software-as-a-Service (SaaS) company. With our ecosystem of software solutions—including Mekari Jurnal, Mekari Talenta, Mekari Qontak, and Mekari Flex, we aim to facilitate entrepreneurs and leaders as they accelerate the digital transformation of their businesses.

In our 10+ years of journey we have reached over 1 Million platform users, and we're not planning to stop any time soon. We need more people like you: builders and owners with calculated ambition who are eager to grow and create their #BiggestImpact.
Job Descriptions:
Performs analysis and generates insights and recommendations to support the business/product in decision-making.
Creating and maintaining data models to represent the structure and relationships within the data.
Conducting in-depth analysis of data to discover patterns, trends, and insights.
Collect data from multiple sources to create integrated views that can be used to drive decision-making.
In charge of the day-to-day analytical requirements, communicating issues, and suggesting remedial action and improvements where appropriate.
Oversee the execution of strategy recommendations for intelligence/data-driven capacity.
Accountable for data integrity and quality, ensuring it is continuously maintained and improved.
Develop and update technical documentation as necessary.
Requirements:
Experience with Big Data/Analytics Platforms like R and Phyton is preferred.
Analytical mindset and ability to see the big picture and influence others.
Detail-oriented and must have an aptitude for solving unstructured problems.
Background in data warehouse design (e.g. dimensional modeling) and data mining.
Familiar with one or more languages for querying (e.g. SQL, PostgreSQL).
Proven abilities to take initiative and be innovative.
Analytical mind with a problem-solving aptitude.
BSc/BA in Mathematics, Computer Science, Engineering, or relevant field.
Working Arrangement: Hybrid.
Office location: Sudirman, Jakarta, Indonesia.
Our team will review your application and will be in touch if your application is shortlisted to the next stage. If you do not hear from us in 30 days, we will keep your resume on file in case a relevant opportunity opens up.

Don't forget to check our Recruitment FAQ at bit.ly/RecruitmentFAQ-Mekari [ENG] or bit.ly/RekrutmenMekari-FAQ [INA] to find the answers to commonly-asked questions regarding our recruitment process.
We wish you the best. Hope to see you around soon!",,,Jakarta
HSBC,Manager Data and Analytics,Posted 5 days ago,"Job Advert Details
Some careers shine brighter than others.
If you’re looking for a role that will help you stand out at HSBC, take a look at how you can fulfil your potential.
Wealth and Personal Banking serves more than 50 million customers worldwide with a complete range of banking and wealth management services to enable them to manage their finances and protect and build their financial futures. It is a global business that brings together management responsibility for Retail Banking, Wealth Management, Insurance and Asset Management with a focus on customer-centric propositions and innovative and efficient distribution channels.
We are currently seeking an experienced professional to join this team in the role of Associate Manager / Manager Data and Analytics
Responsibilities:
This role will be responsible for securely and correctly monitoring, maintaining, and designing WPB databases. A majority of the tasks involves creating and modeling databases, which means this role will spend a significant amount of time collaborating with users to identify the data they need to use, the frequency, what categories they require, and how to smoothen the process for them. After developing the dataset, this role will be responsible for testing it extensively to ensure accuracy. Data troubleshooting, security, backup, integrity and regulatory compliant are critical parts of this job.

Qualifications
To be successful in this role, you should meet the following requirements:
Indonesia Citizen only
Advanced working SAS, SQL knowledge and experience working with relational databases, as well as working familiarity with a variety of databases.
Experience building and optimizing ‘big data’ data pipelines, architectures and data sets.
Strong project management and organizational skills.
Experience supporting and working with cross-functional teams in a dynamic environment.
2+ years of experience in a Data Engineer role, who has attained a Graduate degree in Computer Science, Mathematics, Physics, Statistics, Informatics, Information Systems or another quantitative field
Experience with big data tools.
Experience with data pipeline and workflow management tools.
Experience with cloud services
Experience with stream-processing systems.
Experience with object-oriented/object function scripting languages: Python, Java, C++, SAS, R programming, etc.
You’ll achieve more at HSBC
HSBC is committed to building a culture where all employees are valued, respected and opinions count. We take pride in providing a workplace that fosters continuous professional development, flexible working and opportunities to grow within an inclusive and diverse environment.",,Full-time,Jakarta
