Company Names,Job Titles,Posted On,Job Details,Images,Type Location,Locations
ConnectOne,Head of Data Science (ID) - Tech Consulting Company,Posted 30+ days ago,"REFERRAL REWARD: SGD$500
Head of Data Science
Our client is a tech consulting company and they are looking for a Head of Data Science. As a Head of Data Science you will hold a strategic role in advancing the client's modeling, data science and AI initiatives by extracting business insights and at the same time working closely with the product team to deliver and develop world class solutions.
Responsibilities
Provide strategic leadership and direction to data science teams, leading throughout all stages of technology development, from discovery to deployment of enterprise class solutions.
Work closely with different teams within the company to solve challenging business problems by developing and applying data science and machine learning best practices.
Recruit and build a world class data science team
Provide analysis and insights to the business teams
Skills and Qualifications
Master’s or PhD from a recognized university in engineering, mathematical sciences, physics or related quantitative disciplines
Minimum 10 years of extensive experience and having led teams in modeling, data science, machine learning and digital transformation.
Experience in leading commercial software development teams
Strong communication and interpersonal skills
Familiarity with the mining or oil and gas industry",,,Indonesia
Barry Callebaut,Community Development Specialist,Posted 2 days ago,"Community Development Specialist
Location: Bandung, ID, 40256
At Barry Callebaut, we are on a journey to transform the cocoa and chocolate industry. As the world’s leading manufacturer of high-quality chocolate and cocoa products, our actions truly shape the future of our industry. We are a business-to-business company, serving the entire food sector, from the cocoa bean to the finest chocolate product. We are a company with a purpose, we believe in doing well by doing good and reinvesting in the communities we operate. We have a long-standing commitment to sustainability and our goal is to shape a sustainable cocoa and chocolate future. We are headquartered in Zurich, and have more than 12,000 passionate Employees working in more than 40 countries worldwide. We are very proud of who we are and what we do. And of course, we are always looking for talented people to help us have a positive impact on our industry and beyond!
JOB SUMMARY
Sustainability is at the heart of Barry Callebaut. Forever Chocolate is our commitment to have more than 500,000 cocoa farmers in our supply chain lifted out of poverty, eradicate child labor from our supply chain, become carbon and forest positive and have 100% sustainable ingredients in all of our products. Cocoa farmer poverty and a lack of income hinders the hiring of professional workers and the utilization of mechanization, which often leads to reliance on family members, including children, to undertake work which is classified as child labor.
This role will be a key player to support the goal of Human Right pillar, including child protection, Income Generating Activity & VSLA.
In addition, this role also will support the Sustainability Team as the story teller of field activities on the ground.
KEY RESPONSIBILITIES
Developing annual work plan per cocoa sustainability program together with Area Program Manager[s] on the Community Development implementation, including budget management, & setting strategy to achieve the target
Regular monitoring in the project location(s) to ensure all the Community Development activity well implemented & have an improvement
Reviewing & updating the SOP of CCPC, human right [assess & address], IGA & VSLA implementation in Indonesia
Providing creative regular report, news & content (monthly/ quarterly/half year/ yearly) based on Customer Projects related to Community Development activities & if needed to support the other Customer report/news/ media content
Starting/ maintaining the relationship with local & national level of government which relate to all of the Community Development activities
Developing the internal communication which relate to individual Customer Projects, promote & encourage to our internal Sustainability Team to have better understanding & ownership on the implementation
Promote, assist, encourage and monitor the Human Right implementation in all Customer Projects
Capacity building of SCP[s] in all Customer Projects to ensure proper Human Right commitment process is well adopted by supply chain partners & BC stakeholders
REQUIRED ACADEMIC & TECHNICAL QUALIFICATIONS
Possess Bachelor from any major, preferable from Agriculture or Social science
Fluent in both Bahasa Indonesia & English, written & spoken
3-5 years of working experience in agriculture community development (cocoa/ coffee/ palm oil) from the credible company/ NGO
Having proper knowledge on the human right DD, and experienced on the IGA & VSLA
Have an experienced as the community storyteller and social media content creator
ADDITIONAL CONSIDERATIONS
Willing to travel to the cocoa sustainability program location[s] regularly
Based in Bandung
ESSENTIAL EXPERIENCE / KNOWLEDGE
Solid knowledge & understanding of community development (social issue) in agriculture with farmer
Expert in communication
Expert in child protection, human right, income generating & VSLA activity within smallholder farmers/ community
TECHNICAL / FUNCTIONAL COMPETENCIES
Human right DD [national & worldwide; child protection & wellbeing, forced labor, discriminations, gender equality]
IGA [income generating activity] & VSLA [village saving & loans association]
Advance social media knowledge, content creator
Project management, including manage the budget vs expense
Visual communication [photograph, animation, etc.]
INTERPERSONAL / LEADERSHIP COMPETENCIES
Good coordinator, negotiation & communication skill
Creative, initiative & agile in communicating with stakeholders (internal & external)
Ability to analyze data & draw insight
Good leader & team work
Able to work under minimum supervision
PERSONAL STYLE / ATTITUDE / MOTIVATION
Empathy & compassion, non-judgmental & positive attitude
Persistent
Creative thinking & problem solving ability
Accountable
Resilient
At Barry Callebaut, we are committed to Diversity & Inclusion. United by our strong values, we thrive on the diversity of who we are, where we come from, what we’ve experienced and how we think. We are committed to nurturing an inclusive environment where people can truly be themselves, grow to their full potential and feel they belong. #oneBC - Diverse People, Sustainable Growth.
If you want to learn more about Barry Callebaut, please find further information here.
Were you missing anything in this job ad? Please share your feedback with us by clicking here.",,,Bandung
Indodana,Data Scientist - Risk Platform,Posted 11 days ago,"Job Description

We’re looking for fresh graduates with experience in manipulating datasets and building statistical models for credit risk by leveraging machine learning techniques. You will partner with business, product, and engineering team to explore, determine, analyze, propose, and solve some of the most challenging business problems in lending and reduce risk. You will perform deep-dive exploration and analysis to find improvements in our existing framework. You will be submerged in a fast-paced environment working tightly in a strong team of data scientists and experience firsthand our robust data infrastructure.
Responsibilities
Perform features selection, parameter binning, and optimize custom predictive machine learning models for credit risk scoring
Query, process, cleanse, and verify the integrity of data used for analysis
Analyze key metrics to determine risk and explore areas for improvements
Create reports and dashboards to monitor model impact and performance
Help build the variety of data ingredients needed to do modelling effectively
Maintain the credit risk model platform which is utilized by the team
Provide advice and guidance on potential efficiency gains and new state-of-the-art credit risk modelling methodologies

Qualifications
Bachelor degree in an analytical or quantitative discipline (e.g. math, statistics, engineering, computer science), however other disciplines will be considered
Experienced in using statistical computer languages such as R, Python SAS, SQL, or advanced MS Excel skills is a plus.
Have good communication skills and able to work together in a team
Excellent problem-solving skills and have the drive to learn and master new technologies and techniques
Willingness to learn new skills independently and have a strong sense of project ownership
Not afraid to get your hands dirty to explore data and build statistical models",,Full-time,Jakarta
DKatalis,Data Scientist,Posted 25 days ago,"About DKatalis
DKatalis is a financial technology company with multiple offices in the APAC region. We serve as the technological backbone for Bank Jago, an Indonesian digital bank whose mission is to drive financial inclusion by developing bespoke banking products and services that cater to a diverse customer base, from individual retail consumers to micro, small, and medium enterprises.
What sets us apart?
Real-world Impact: Your models and analyses will directly shape bespoke banking products, influencing financial services for millions of users across Indonesia.
Data-Rich Environment: Access vast, diverse datasets spanning individual retail consumers to micro, small, and medium enterprises (MSMEs).
Cutting-edge Tech Stack: Leverage the latest in big data technologies, cloud computing, and machine learning frameworks.
Cross-functional Collaboration: Work closely with product, engineering, and business teams to turn data insights into actionable strategies.
About the role
We are looking for a mid to senior-level Data Scientist with expertise in advanced modelling techniques, including knowledge graphs, recommendation systems, and fine-tuning Large Language Models (LLMs). The ideal candidate will have strong Natural Language Processing (NLP) skills to support our initiative in conversational banking and building comprehensive customer profiles.
You will work with various data types (e.g., transactional financial data, system log data, clickstream data, customer support chat logs) to help build sophisticated models that support:
Conversational banking interfaces and chatbots
Advanced customer profiling and personalization
Knowledge graph construction for financial entity relationships
Recommendation systems for financial products and services
Digital banking product features such as AI-driven financial recommendations
Customer segmentation and engagement analysis
Business operations optimization
Assisting with fraud detection and risk management functions
Supporting the improvement of various technical operations within the business
We value candidates who are self-motivated, proactive problem-solvers with a can-do attitude. The ideal candidate demonstrates persistence and grit when facing challenges and has a track record of initiating and completing complex projects.
You will lead the delivery of data science and machine learning solutions from ideation to model development and deployment. You'll work closely with other data scientists, machine learning engineers, and product teams to drive innovation in our banking products and services.
Requirements:
Education and Background
A Master's or Ph.D. degree in computer science, statistics, physics, mathematics, or a related field.
Courses or certifications in finance, economics, or related disciplines are a plus.
Technical Skills
Advanced proficiency in Python and its data science ecosystem, including tools such as Numpy, pandas, scikit-learn.
Expertise in deep learning frameworks like PyTorch or TensorFlow.
Experience with NLP libraries and techniques (e.g., spaCy, NLTK, transformers).
Proficiency in building and maintaining knowledge graphs.
Experience in developing and deploying recommendation systems.
Familiarity with LLM fine-tuning techniques and frameworks.
Strong version control skills (e.g., Git) and collaborative coding practices.
Knowledge and Experience
Deep understanding of advanced statistics, machine learning concepts, and their application to real-world problems.
5+ years of experience working with complex machine learning models in production environments.
Demonstrated ability to translate business problems into data science solutions.
Experience in building conversational AI systems or chatbots.
Familiarity with financial domain knowledge and its application in data science.
Soft Skills and Attributes
Strong analytical and problem-solving skills.
Excellent communication skills, both written and verbal.
Ability to lead and mentor junior team members.
Eagerness to stay current with the latest advancements in AI and machine learning.
Preferred Qualifications:
Experience in the financial technology or retail banking sector.
Active contributions to data science communities or open-source projects.
Demonstrated thought leadership through publications, presentations, or patents.
Expertise in big data technologies and cloud computing platforms (e.g., AWS, GCP, or Azure).
Stand-out Qualities
Track record of implementing innovative AI solutions in fintech or related industries.
Strong portfolio of relevant projects, particularly in NLP, knowledge graphs, or recommendation systems.
Leadership in the data science community (organising events, giving talks, leading workshops).
Unique skills that complement and enhance the existing Data Science team.
Advanced understanding of cloud technologies and containerization (e.g., Docker, Kubernetes).
Experience in ethical AI and responsible machine learning practices.",,,Jakarta
