Company Names,Job Titles,Posted On,Job Details,Skill
ABeam Consulting Indonesia,Manufacturing Automotive Industry Pre-sales & Project Manager,Reposted 1 week ago,"Requirements

Candidate must possess at least Bachelor’s Degree.
Proficient in English (business level) is must.
Proficient in Japanese (business level) is preferable.
Having more than 10 years of working experience as presales and project manager in Manufacturing Automotive Industry field.
Excellent manager-level Interpersonal skills.
Having good problem solving, analytical, logical thinking and teamwork.
Proactive and self-motivated, able to work under pressure in tight schedule.

Responsibilities

Industry Expertise: is expected to have a deep understanding of Manufacturing Industry. This includes various IT knowledge/ experience such as ERP, IoT, Smart Factory, Data Analytics and more, depending on the company's portfolio. Prepare material to support sales activities, such as industry trends, pain points and discuss with clients. Present the industry trends and pain points in seminars.
Requirements Gathering: Presales consultants work closely with the sales team and potential clients to gather and analyze business requirements. This information helps in proposing the solution to match the client's unique needs.
Proposal Preparation/Presentation: Presales Consultants contribute to proposal writing and tender responses and presentation. They create comprehensive documents detailing the proposed solution, implementation plan, pricing, and other relevant information required for the client's decision-making process.
Collaboration: The role requires close collaboration with the sales team, product managers, project managers, and other stakeholders. Presales consultants provide valuable insights to the sales team regarding client needs and market trends, which aids in devising winning strategies.
Continuous Learning: Industry trends is continually evolving, with updates and new releases being introduced regularly. This role needs to stay up to date with the latest advancements in products and solutions to effectively address client inquiries and present the most relevant solutions.
Project Management capabilities: This role also requires project delivery capabilities and experience as a project manager in Manufacturing Automotive Industry.

About Us

From business process re-engineering to global business expansion for Japanese corporations, we have served our clients through more than 40 years of growth. With our vision of being the No. 1 global consulting firm from Asia, ABeam Consulting helps our clients take on the challenge of business transformation. With 5,900 consultants in Japan, and 2,400 in overseas offices concentrated in Asia, our 8,300 consultants and global alliance partners provide truly comprehensive services.","Automobiles, Automotive, Business Analytics, Critical Thinking, Market Analysis, Presales, Presentations, Project Delivery, Proposal Preparation, and Proposal Writing"
Deloitte,Consultant - Technology Strategy and Transformation - ID,1 day ago,"At Deloitte, we offer a unique and exceptional career experience to inspire and empower talents like you to make an impact that matters for our clientsDate: 13 Aug 2024

Service Line / Portfolios: Enterprise Technology & Performance

Location:

Jakarta, ID

Are you ready to unleash your potential?

At Deloitte, our purpose is to make an impact that matters for our clients, our people, and the communities we serve.

We believe we have a responsibility to be a force for good, and World Impact is our portfolio of initiatives focused on making a tangible impact on society’s biggest challenges and creating a better future. We strive to advise clients on how to deliver purpose-led growth and embed more equitable, inclusive as well as sustainable business practices.

Hence, we seek talented individuals driven to excel and innovate, working together to achieve our shared goals.

We are committed to creating positive work experiences that foster a culture of respect and inclusion, where diverse perspectives are celebrated, and everyone is recognised for their contributions.

Ready to unleash your potential with us? Join the winning team now!

Work you will do:

This role sits within the Technology Strategy and Transformation (TS&T) team of Deloitte Southeast Asia, which encompasses IT Strategy and Transformation. As a leader of this group, you will drive the growth of our TS&T business in the region and be responsible for the creation, sale and delivery of TS&T solutions: IT Strategy, Application & Systems Development, IT Business Transformation, etc.

 You will review outputs from the Analysts and will provide further in-depth, root-cause analyses to formulate perspectives, as well as draw additional insights on potential areas for enhancement and improvement. 
 You will undertake assessments across different elements of IT functions, document and translate business requirements into specifications, and support the formulation of appropriate technology-enabled solutions by defining appropriate technology strategy, architecture vision and implementation roadmap. 
 You will work with the Analysts to co-develop presentation materials and to present the results of your analyses and findings to fellow project team members. 
 You will support the project teams in gathering business requirements and definition of problem statements by engaging clients to understand their business needs and challenges. 
 You will assist project teams in the set up and execution of Technology Strategy & Architecture projects, in accordance to the firm’s service delivery standards and quality requirements. 
 You will contribute to the development of our practice by providing guidance to junior team members and in assisting senior team members on pursuits as well as adherence with the firm’s processes for set up and execution of engagements. 
 You will be actively involved in deal pursuits, and will assist senior team members in the preparation, development and delivery of strong proposals, presentations and publications. 

Requirements:

 A good honors Degree, preferably at postgraduate level, in Information Technology, Business Information Systems, Business, Engineering, Mathematics or related disciplines. 
 Practical experience with Agile, DevOps will be an advantage 
 A minimum of 2+ years of experience working in IT implementation 
 Involved in overall SDLC - requirement gathering, design, test, deploy/release, data migration, project management Understanding of current IT trends (cloud computing, big data, social media, RPA, IoT, blockchain, etc.) 
 Strong analytical skills, excellent oral and written communication skills in English, be self-motivated, and be able to work in stressful situations with changing priorities 
 Excellent problem solving skills, ability to think out-of-the-box, work under pressure and tight project timelines 
 Drive, tenacity, client focused and results oriented 
 Proven demonstration of sound business acumen, teamwork and leadership qualities. 
 Willingness to work outside of office base and most of all… 
 An appreciation of the consulting lifestyle and ability to travel (both locally and abroad) is a pre-requisite to fit to our short-term and long-term project assignment 

Due to volume of applications, we regret only shortlisted candidates will be notified.

Please note that Deloitte will never reach out to you directly via messaging platforms to offer you employment opportunities or request for money or your personal information. Kindly apply for roles that you are interested in via this official Deloitte website.

Requisition ID: 105039

In Indonesia, the services are provided by Imelda & Rekan and other related entities in Indonesia (""Deloitte in Indonesia""), which are affiliates of Deloitte Southeast Asia Ltd. Deloitte Southeast Asia Ltd is a member firm of Deloitte Touche Tohmatsu Limited. Deloitte in Indonesia, which is within the Deloitte Network, is the entity that is providing this Website.","Business Requirements, Communication, English, IT Strategy, Presentations, Problem Solving, Project Teams, Stressful Situations, Timelines, and Written Communication"
EY,Financial Technology Junior Consultant (FSO),Reposted 1 day ago,"Why should I work for Ernst & Young's Financial Services (FSO)?

We are the only professional services organisation who has a separate business dedicated exclusively to the financial services marketplace. Join Financial Services (FSO) and you will work with multi-disciplinary teams from around the world to deliver a global perspective. Aligned to key industry groups including asset management, banking and capital markets, insurance and private equity, we provide integrated advisory, assurance, tax, and transaction services.

Through diverse experiences, world-class learning and individually tailored coaching you will experience ongoing professional development. That’s how we develop outstanding leaders who team to deliver on our promises to all of our stakeholders, and in so doing, play a critical role in building a better working world for our people, for our clients and for our communities. Sound interesting? Well this is just the beginning. Because whenever you join, however long you stay, the exceptional EY experience lasts a lifetime.

The opportunity

In a world where disruption is commonplace and technology changes business at an amazing rate, we help solve complex industry challenges while helping our clients manage risk and improve their performance. As a future FSO Technology Consultant, you will help our clients in the following domains:

Business & strategic challenges: business & solution architecture, business process design for the digitization of core banking or insurance processes, digital transformation in an agile context, project / program management, business and IT alignment of digital driven business initiatives, front-to-back renewal, and design & improvement of digital operating models.
Technical matters: data science, advanced analytics embedded in core business processes, IoT, data strategy, data governance, data quality, data architecture, data management, data usage, blockchain, artificial intelligence and RPA.

As part of the team, you will work on specific projects critical to financial services current landscape, with opportunities to switch teams, as you and our fast-paced business grow and evolve. You will play an important part in taking EY to the next level.

Positions we are looking for

Cybersecurity
Digital
Platform
Data & Analytics

To qualify for the role you must have

A Bachelor or Master's Degree in (Business) Engineering, Computer Science, Information Systems Management, Mathematics, (applied) Economics or a related field of studies with an affinity for leading-edge technologies.
Previous experience of at least 1-2 years in roles of Functional Consultant or Analyst Programmer preferably in companies in the financial services industry (payments, banks, insurance, capital markets).
Solid analytical skills.
Knowledge of project management with agile, traditional and hybrid methodologies.
Advanced level of English.
Experience in team leadership.
Excellent oral and written communication skills.

If you can demonstrate that you meet the criteria above, please apply as soon as possible.","Analytical Skills, Communication, Computer Science, Data Strategies, Digitization, English, IT Consulting, Team Leadership, Technology Consulting, and Written Communication"
Deloitte Consulting,"Manager - Energy, Resources & Industrials - Japanese Client Services (JCS-ERI)",Reposted 4 weeks ago,"■ Deloitte Consulting SEAについて
弊社はグローバルでトップクラスのコンサルティング実績を誇り、最大規模のプロフェッショナル・ネットワークと歴史を誇る、Deloitte Consultingの東南アジアプラクティスです。
東南アジアに長い歴史を有し、現地でのあらゆる経営課題の解決に必要な知見、ケイパビリティを培っています。
  ■ 本ポジションの概要
本ポジションは、東南アジアにおける日本企業向けの資源・エネルギー・生産財インダストリー部門 (JCS-ERI) のコンサルタント職におけるマネジャークラスの募集です。
  ■ 東南アジア (ASEAN 10ヶ国) 全域をフィールドに活躍できます
Deloitte Consulting Southeast Asia (SEA) は、東南アジア全体を一つのプラクティスとして運営する体制を構築しています。これにより域内複数国にまたがるプロジェクトをスピーディーかつシームレスに実行したり、域内全ての拠点からベストなメンバーでプロジェクトチームを組成することが出来ます。クライアントの多くは複数国で事業を展開しているため、クライアントのニーズにより応えやすいプラットフォームです。
 
■ 総合コンサルティングファームとして地域最大級の規模を活かすことができます
Deloitte Consulting SEAは地域最大級の総合コンサルティングファームであり、戦略・オペレーション・DX・人事・テクノロジーなど幅広いテーマをカバーしています。またJapanese Client Servicesはこの中の重要な一部であり、日本企業にフォーカスしているプラクティスとして域内最大級の規模、プレゼンスを有しています。大規模かつ複合的な経営課題にも構想から実現まで一気通貫でサポートが可能です。一人ひとりの強みとチームとしての総合力でクライアントの経営課題の解決を支援しています。
 
■ グローバル人材として成長できる環境を得ることができます
東南アジア各国はもちろんそれ以外の地域の出身者も多数在籍しており、多様なバックグラウンドを有するメンバーと働くことができます。また、東南アジアで長年コンサルティングを経験しているメンバーが多数いるため、豊富な経験や知見を吸収することが可能です。日本経済・社会・企業文化に関する理解を強みとしながら、同時にグローバル 人材として成長することができる、またとない環境と自負しています。
 少子高齢化に代表される社会構造の長期的な変化により、日本企業にとって海外事業の拡大・成功は重要な経営課題です。成長市場であり文化・距離的にも日本と比較的に近い東南アジア市場は獲得が必須の市場といっても過言ではありません。
 一方で、東南アジアは巨大な経済圏でありながら、一つ一つの国が異なる性質を持つという多様性に富んだ地域でもあります。こうした多様性は東南アジアに進出する日本企業のビジネスをより複雑なものにしています。また、日本企業にとって競合となる現地企業や海外企業の競争力も日増しに高まっています。
Deloitte Consulting SEAでは日本企業の東南アジアにおける成功を一緒に支えていただける方を求めています。
  ■ 本ポジションの生まれた背景
人口7億人に迫る一大経済圏である東南アジアにおいて、近年日本企業の投資意欲が益々高まっております。
従来は低廉な人件費を活用した製造・輸出拠点という側面が強かったですが、経済成長及び中間層の拡大に伴いマーケットとしての存在が増すと共に、リープフロッグ的に拡大を見せるデジタル経済の成長を現地のパートナーとの協業を通じて取り込んでいくことが求められています。また、官民のグリーン・持続可能性に対する意識は様変わりし、本ポジションの「資源・エネルギー・生産財」産業の主たるテーマである脱炭素・SDGs、といったトレンドも注目を集めています。
 こうした変化に加え、これまで日本企業が誇りとしていた品質の高さという点においても、欧米や中国、韓国、および地場企業の競争力向上により相対的な優位性が脅かされつつある状況です。そのため、デジタル化、効率化、高付加価値化といったテーマを支援するコンサルティングのニーズが近年ますます増加しており、本ポジションを積極的に採用するに至りました。
  ■ プロジェクトテーマ
  事業戦略、参入戦略策定
M&A、アライアンス、スタートアップ連携
オペレーションのデジタル化
製造プロセスのIoT、AI活用
データ管理、運用の改善
RPA、機械学習
SAP、SFDC、Microsoftといったシステムの導入支援
  ■ ミッション
マネジャーとして、下記のミッションを担っていただきます
  Deloitteの目標を理解した明確な優先順位と方向性の設定、シニアステークホルダーとの良好な関係の確立によって、メンバーをこれらの目標と合致させる
チームや個人に前向きな影響を与える。メンバーの成長と成功のために模範を示して指導し、平等な機会の提供
優れたクライアントサービスの提供。事業や地域を超えたコラボレーションを促進しながら、成果の最大化とメンバーの高いパフォーマンスを引き出す
多様性あるチームの管理。貢献が尊敬され、評価されるような包括的なチーム文化の醸成
チャレンジングで有意義な機会を通じた高いパフォーマンスを発揮するチームの育成、ならびにその影響力の評価
  ■ 業務内容
上記に関わるコンサルティングサービスに従事していただきます。
  プロジェクトリーダーとして、ローカルとの混成チームにおいてリーダーシップを発揮したプロジェクトのリード
個人としての得意分野を生かして案件・顧客開拓のサポート
  
■ 応募資格
【必須 (MUST)】
 言語要件
日本語ネイティブレベルかつ英語ビジネスレベル以上
または英語ネイティブレベルかつ日本語ビジネスレベル以上
  マインドセット
常に新しい分野に興味を持ち、向学心が高く、チャレンジを続けられる人
消費者向けビジネス事業の知見があり、更にそれを深く追求したい人
日本企業のグローバル進出を加速させ、海外で勝てる企業になることを支援したいという想いのある人
困難な課題や障壁があっても、成長機会ととらえてぶつかって乗り越えていくことが出来る人
明確な作業手順や解法がないなかでも、自らの創意工夫でソリューションを開発し、能動的・自立的に行動できるマインド。
新しいソリューションの開発や新しいオファリングを産み出す活動に積極的に参画し、ありきたりでない付加価値をクライアントに提供することに積極的になれるマインド
  専門領域
資源、エネルギー、生産財業界のクライアントを対象とした戦略・オペレーションの豊富なコンサルティング経験
  職務経験
上記領域における改革プロジェクト経験
グローバルプロジェクトにおいて、ローカルとの混成チームでリーダーシップを発揮したプロジェクトのリード経験
コンサルティングファームでの上記領域における8年以上の職務経験
  【歓迎 (WANT)】
ケミカル業界のクライアントを対象としたコンサルティング経験","Business English, Business Strategy, Client Services, Energy Industry, Japanese, Manufacturing, and Strategy Formulation"
Siemens Digital Industries Software,Enterprise Solutions Consultant (Indonesia),Reposted 2 weeks ago,"Siemens Digital Industries Software is a leading provider of solutions for the design, simulation, and manufacture of products across many different industries. Formula 1 cars, skyscrapers, ships, space exploration vehicles, and many of the objects we see in our daily lives are being conceived and manufactured using our Product Lifecycle Management (PLM) software.

As part of our continuing growth in Southeast Asia (SEA), we are now looking for a driven and highly motivated Enterprise Solutions Consultant to join our Technical Solutions team in Jakarta, Indonesia. The ideal candidate will need to have an excellent understanding of the technical aspects of software business and including a strong focus on building and leveraging relationships with our partners and selective end users, representing Siemens DISW solutions portfolios to senior levels of customers’ organization, and bringing opportunities forward on a selective basis to enable timely and successful closure.

Responsibilities:

 Responsible for aligning a clear vision from customer executives to leaders, for defining executable value and solution along a digital roadmap during the customer Discover stage.
 Responsible for conducting value and solution road mapping (VSR) workshops to establish Business Case (ROI) for customers during the customer Define stage.
 Capture customer requirements and expectations accurately into a SOW to ensure smooth handover to services during the customer Confirm stage.
 To perform as customers’ Trusted Advisor and continuously update the vision and digital transformation roadmap.
 Provide technical solution leadership and orchestrate various product presales to establish Siemens’ Unique Value Proposition with our Xcelerator portfolio, leveraging a combination of application and domain expertise to a variety of Siemens customers in both discrete and process industries.
 Bring opportunities to a technical closure through participating in the value discovery and assessment process to assist in determining the customer needs
 Develop opportunities by creative technical/commercial thinking.
 Lead technical discussions and conduct product demonstrations to customers
 Lead or assist in software proposal, and assist & verify with partners in solution proposals to customers
 Support customer product evaluations through workshop, training, and benchmarks
 Plan, coach, and support channel presales teams in SEA on technical enablement and value discovery and assessment method
 Support channel partners in technical sales process to facilitate the sales of software/solutions
 Support transition from pre- to post-sales, assisting implementation team to take over.
 Funnel creation through supporting sales process and marketing events such as trade shows, presentations, seminars, etc.
 Uphold the professional integrity of Siemens at all times
 Adhere to, and promote, all core internal and customer processes relating to the effective undertaking of the role
 Undertake any business administration in line with job activity
 Undertake any other duties required by the company

Requirements:

 Bachelor/Master’s Degree in Computer Science/Electrical Engineering/Information Technology/Software Engineering/Industrial Engineering.
 Good knowledge of enterprise systems customer’s challenges, industry trends, competitor landscapes and implementation.
 Good experience in customer engagement to define methods, develop value propositions, business cases and solution visions.
 Good database and full stack programming knowledge.
 Familiarity with enterprise SaaS ecosystem.
 Demonstrate strong interest with some experience in Cloud, Gen AI, IoT, Tech, Manufacturing and Industry 4.0 topics.

Competencies:

 Must have minimum 8 years of MES/PLM Solutions Consultant/Presales experience with additional experience preferably in ERP.
 Possess minimum 5 years in MES/PLM and/or SCM/ERP project implementation and support experience.
 Direct/hands-on work experience with AWS Cloud and certified Cloud Practitioner/Solution Architect will be preferred.
 Skilled and knowledge in Cloud, Gen AI and IoT will be preferred.
 Ability to lead and work independently and confidently in analysing customer requirements and transform them into a workable solutions.
 Ability to prioritize multiple assignments and deadlines.
 Dynamic with excellent leadership and high level of accountability.
 Excellent sales and relation building skills.
 Excellent communication skills in English with good presentation skills.
 Ability to work well under pressure and self-motivated.
 Willing to work hard and face challenges.
 IT savvy and ability to multitasks.
 Travelling is required and ability to travel within a short notice is a must.

Working at Siemens Software

Why us?

Working at Siemens Software means flexibility - Choosing between working at home and the office at other times is the norm here. We offer great benefits and rewards, as you'd expect from a world leader in industrial software.

Siemens Software. Transform the everyday.","Business Case Preparation, Handover, Post-Sales, Presentation Skills, Presentations, Product Demonstration, Product Evaluations, Product Lifecycle Management, Software Configuration Management, and Technical Discussions"
