Company Names,Job Titles,Posted On,Job Details,Skill
Deloitte,Senior Consultant - Technology Strategy and Transformation - ID,1 day ago,"At Deloitte, we offer a unique and exceptional career experience to inspire and empower talents like you to make an impact that matters for our clientsDate: 13 Aug 2024

Service Line / Portfolios: Enterprise Technology & Performance

Location:

Jakarta, ID

Are you ready to unleash your potential?

At Deloitte, our purpose is to make an impact that matters for our clients, our people, and the communities we serve.

We believe we have a responsibility to be a force for good, and World Impact is our portfolio of initiatives focused on making a tangible impact on society’s biggest challenges and creating a better future. We strive to advise clients on how to deliver purpose-led growth and embed more equitable, inclusive as well as sustainable business practices.

Hence, we seek talented individuals driven to excel and innovate, working together to achieve our shared goals.

We are committed to creating positive work experiences that foster a culture of respect and inclusion, where diverse perspectives are celebrated, and everyone is recognised for their contributions.

Ready to unleash your potential with us? Join the winning team now!

Work you will do:

 You will provide end-to-end advisory and overlay point-of-views and industry insights onto the research and analyses provided by the project teams, and seek to formulate innovative technology-enabled solutions to address our clients’ business needs. 
 You will manage the assessment and business requirements gathering processes, review appropriateness of functional specifications against the problem statements/business requirements, and support solutions prototyping and architecture re-design by applying industry insights and know-hows. 
 You will engage our clients in discussions, presentations and workshops to validate technology-enabled solutions provided by the project teams, as well as perform walk-through of work products and deliverables with the clients. 
 You will develop trusted relationships with your clients and gain recognition in the marketplace for technical and advisory capabilities across the spectrum. 
 You will provide quality assurance and ensure timely delivery of work products developed by the project teams. 
 You will actively coach project teams during the execution of projects and support senior team members in maintaining operational excellence at all times. 
 You will meet clients on a regular basis to define problem statements, analyse key priorities/issues, and work with senior team members to develop responses to client enquiries, formulate proposals and produce point-of-view publications. 

Requirements: 

 A good honors Degree, preferably at postgraduate level, in Information Technology, Business Information Systems, Business, Engineering, Mathematics or related disciplines. 
 Senior consultant will require a minimum of 6 years of experience in IT management consulting. 
 Experience in both advisory as well as implementation experience in the following areas:
 IT Strategy: IT strategy development, IT governance, IT operating model, enterprise architecture 
 IT Transformation: IT sourcing advisory, program and project management advisory 
 IT Operations: IT service management, IT shared service management 
 IT Optimization: IT cost reduction, IT Merger & Acquisition 
 Understanding of current IT trends (cloud computing, big data, social media, RPA, IoT, blockchain, etc.) 
 Strong analytical skills, excellent oral and written communication skills in English, be self-motivated, and be able to work in stressful situations with changing priorities 
 Excellent problem solving skills, ability to think out-of-the-box, work under pressure and tight project timelines 
 Drive, tenacity, client focused and results oriented 
 Proven demonstration of sound business acumen, teamwork and leadership qualities. 
 Willingness to work outside of office base and most of all… 
 An appreciation of the consulting lifestyle and ability to travel (both locally and abroad) is a pre-requisite to fit to our short-term and long-term project assignment. 
Due to volume of applications, we regret only shortlisted candidates will be notified.

Please note that Deloitte will never reach out to you directly via messaging platforms to offer you employment opportunities or request for money or your personal information. Kindly apply for roles that you are interested in via this official Deloitte website.

Requisition ID: 105040

In Indonesia, the services are provided by Imelda & Rekan and other related entities in Indonesia (""Deloitte in Indonesia""), which are affiliates of Deloitte Southeast Asia Ltd. Deloitte Southeast Asia Ltd is a member firm of Deloitte Touche Tohmatsu Limited. Deloitte in Indonesia, which is within the Deloitte Network, is the entity that is providing this Website.","Business Requirements, Functional Specifications, IT Management, Implementation Experience, Management Consulting, Problem Solving, Requirements Gathering, Stressful Situations, Timelines, and Written Communication"
Deloitte,Senior Consultant - Technology Strategy and Transformation - ID,1 day ago,"At Deloitte, we offer a unique and exceptional career experience to inspire and empower talents like you to make an impact that matters for our clientsDate: 13 Aug 2024

Service Line / Portfolios: Enterprise Technology & Performance

Location:

Jakarta, ID

Are you ready to unleash your potential?

At Deloitte, our purpose is to make an impact that matters for our clients, our people, and the communities we serve.

We believe we have a responsibility to be a force for good, and World Impact is our portfolio of initiatives focused on making a tangible impact on society’s biggest challenges and creating a better future. We strive to advise clients on how to deliver purpose-led growth and embed more equitable, inclusive as well as sustainable business practices.

Hence, we seek talented individuals driven to excel and innovate, working together to achieve our shared goals.

We are committed to creating positive work experiences that foster a culture of respect and inclusion, where diverse perspectives are celebrated, and everyone is recognised for their contributions.

Ready to unleash your potential with us? Join the winning team now!

Work you will do:

 You will provide end-to-end advisory and overlay point-of-views and industry insights onto the research and analyses provided by the project teams, and seek to formulate innovative technology-enabled solutions to address our clients’ business needs. 
 You will manage the assessment and business requirements gathering processes, review appropriateness of functional specifications against the problem statements/business requirements, and support solutions prototyping and architecture re-design by applying industry insights and know-hows. 
 You will engage our clients in discussions, presentations and workshops to validate technology-enabled solutions provided by the project teams, as well as perform walk-through of work products and deliverables with the clients. 
 You will develop trusted relationships with your clients and gain recognition in the marketplace for technical and advisory capabilities across the spectrum. 
 You will provide quality assurance and ensure timely delivery of work products developed by the project teams. 
 You will actively coach project teams during the execution of projects and support senior team members in maintaining operational excellence at all times. 
 You will meet clients on a regular basis to define problem statements, analyse key priorities/issues, and work with senior team members to develop responses to client enquiries, formulate proposals and produce point-of-view publications. 

Requirements: 

 A good honors Degree, preferably at postgraduate level, in Information Technology, Business Information Systems, Business, Engineering, Mathematics or related disciplines. 
 Senior consultant will require a minimum of 6 years of experience in IT management consulting. 
 Experience in both advisory as well as implementation experience in the following areas:
 IT Strategy: IT strategy development, IT governance, IT operating model, enterprise architecture 
 IT Transformation: IT sourcing advisory, program and project management advisory 
 IT Operations: IT service management, IT shared service management 
 IT Optimization: IT cost reduction, IT Merger & Acquisition 
 Understanding of current IT trends (cloud computing, big data, social media, RPA, IoT, blockchain, etc.) 
 Strong analytical skills, excellent oral and written communication skills in English, be self-motivated, and be able to work in stressful situations with changing priorities 
 Excellent problem solving skills, ability to think out-of-the-box, work under pressure and tight project timelines 
 Drive, tenacity, client focused and results oriented 
 Proven demonstration of sound business acumen, teamwork and leadership qualities. 
 Willingness to work outside of office base and most of all… 
 An appreciation of the consulting lifestyle and ability to travel (both locally and abroad) is a pre-requisite to fit to our short-term and long-term project assignment. 
Due to volume of applications, we regret only shortlisted candidates will be notified.

Please note that Deloitte will never reach out to you directly via messaging platforms to offer you employment opportunities or request for money or your personal information. Kindly apply for roles that you are interested in via this official Deloitte website.

Requisition ID: 105041

In Indonesia, the services are provided by Imelda & Rekan and other related entities in Indonesia (""Deloitte in Indonesia""), which are affiliates of Deloitte Southeast Asia Ltd. Deloitte Southeast Asia Ltd is a member firm of Deloitte Touche Tohmatsu Limited. Deloitte in Indonesia, which is within the Deloitte Network, is the entity that is providing this Website.","Business Requirements, Functional Specifications, IT Management, Implementation Experience, Management Consulting, Problem Solving, Requirements Gathering, Stressful Situations, Timelines, and Written Communication"
Infineon Technologies,Specialist Engineering Competency Development,2 weeks ago,"In this role you are responsible to lead and implement engineering competency programs and projects. In your new role you will:

Lead competency assessments including preparation, implementation, reporting
Design blended learning solutions
Use digital tools to create flexible and innovative learning programs
Design a range of learning interventions, including technical and leadership programs and working with external partners where relevant
Lead the improvement projects

You are best equipped for this task if you have:

Bachelor's degree in Education, Human Resources or Business Administration
At least 1–2 years of experience in a training related role with instructional design and delivery experience
Very good organization and follow-up skills to coordinate program efforts
Reliable time management skills with great attention to detail and systematical skills with a high degree of professionalism
Comfortable taking the initiative with an innovative approach to designing solutions
Very good with MS Office tools and Keynote, and preferably training specific authoring tools
Ability to maintain databases

#WeAreIn for driving decarbonization and digitalization.

As a global leader in semiconductor solutions in power systems and IoT, Infineon enables game-changing solutions for green and efficient energy, clean and safe mobility, as well as smart and secure IoT. Together, we drive innovation and customer success, while caring for our people and empowering them to reach ambitious goals. Be a part of making life easier, safer and greener.

Are you in?

We are on a journey to create the best Infineon for everyone.

This means we embrace diversity and inclusion and welcome everyone for who they are. At Infineon, we offer a working environment characterized by trust, openness, respect and tolerance and are committed to give all applicants and employees equal opportunities. We base our recruiting decisions on the applicant´s experience and skills.

Please let your recruiter know if they need to pay special attention to something in order to enable your participation in the interview process.","Attention to Detail, Competency Assessment, Databases, Instructional Design, and Statistical Tools"
Kyndryl,Consultant for IT Operating Model,Reposted 2 weeks ago,"Who We Are

At Kyndryl, we design, build, manage and modernize the mission-critical technology systems that the world depends on every day. So why work at Kyndryl? We are always moving forward – always pushing ourselves to go further in our efforts to build a more equitable, inclusive world for our employees, our customers and our communities.

The Role

Do you have a passion for driving meaningful change through technology? Are you a master of IT strategy and eager to make an impact on our customers? We're seeking a talented IT Strategy Consultant to join our team for multi-disciplinary, complex consulting engagements.

As an IT Strategy Consultant at Kyndryl, you'll be responsible for delivering value to customers and Kyndryl by applying deep domain, technology, and industry expertise, consulting techniques, and cognitive approaches to analyze issues and create innovative solutions. You'll establish milestones, quality targets, and manage the work of others while possessing strong communication skills to articulate the impact and business benefits of your solutions and manage stakeholder expectations.

In this role, you will use your experience and knowledge in guiding customers in their adoption of both major cloud and non-cloud technologies, including virtualization and containers. You will advise customers on technology options and help them make strategic choices and decisions. Additionally, you will have experience capturing and prioritizing complex requirements and resolving conflicting requirements. But that's not all – our IT Strategy Consultants have seen how organizations benefit from change and most importantly, know how to plan for it – giving our partners and customers the confidence to make a convincing case for it.

As a trusted and experienced Consultant, you will be responsible for a vast number of essential technical components such as analyzing the customer's current state, defining IT Strategy including key outcomes, designing conceptual solutions, planning and executing design and implementation work (with support from technical specialists), and accounting for time, cost, and quality targets. You will also develop IP and own specific assets, tools, and white papers articulating point of views in a specific domain, assemble and lead a team of consultants and architects, and facilitate and capture lessons learned from engagements to update methodologies and assets.

Lastly, as a transformational catalyst, you'll spearhead comprehensive modernization programs encompassing people, culture, process, and technology, revolutionizing organizations from within. Join us at Kyndryl and redefine the very essence of IT strategy consultancy.

Your Future at Kyndryl

As an IT Strategy Consultant at Kyndryl you will join the Kyndryl Consultant Profession, working with other Kyndryl Consultants, Architects, Project Managers, and cross-functional Technical Subject Matter Experts. Whether you want to lead multi-disciplined teams as a Senior Strategy Consultant or delve into transforming Fortune 500 companies as a Strategy and Transformation Consultant – you’ll have access to unlimited opportunities with Kyndryl.

Who You Are

You’re good at what you do and possess the required experience to prove it. However, equally as important – you have a growth mindset; keen to drive your own personal and professional development. You are customer-focused – someone who prioritizes customer success in their work. And finally, you’re open and borderless – naturally inclusive in how you work with others.

Required Skills And Experience

Consulting experience with an IT professional service “big 4” firm or similar background focused on IT strategy enablement
Knowledge of major cloud technologies including virtualization, containers, networking etc. on different cloud platforms
Subject matter expertise in at least three domains (e.g., cloud computing, IT strategy, infrastructure, IT operations, applications, enterprise architecture, solution architecture, automation, data management, AI/ML, IoT and cloud governance models) to advise on industry-leading solutions
Data modeling and analytical experience using common tools (e.g., Excel, Tableau)
Issue-based analysis determined and structured data to collect, and produced structured conclusions, recommendations, and roadmaps
Knowledge of IT Operating Model and Process Frameworks
Awareness of broad competencies and depth in specific competency areas (IT strategy, enterprise architecture, solution architecture, process reengineering, automation)
Ability to lead/facilitate workshops and interviews, great presentation skills
Understanding of DevSecOps, Agile, Scrum construct to identify inefficiencies through readiness assessments and development of strategies and approaches to optimize the implementation of IT or cloud resources and capabilities

Preferred Skills And Experience

Experience in the areas of IT and/or cloud technology architecture, service management and/or resiliency
ITSM and ITIL or COBIT certification
Business case skills, ROI, and TCO analysis to validate IT strategy
Experience leading workshops and interviews for discovery and assessment engagements

Being You

Diversity is a whole lot more than what we look like or where we come from, it’s how we think and who we are. We welcome people of all cultures, backgrounds, and experiences. But we’re not doing it single-handily: Our Kyndryl Inclusion Networks are only one of many ways we create a workplace where all Kyndryls can find and provide support and advice. This dedication to welcoming everyone into our company means that Kyndryl gives you – and everyone next to you – the ability to bring your whole self to work, individually and collectively, and support the activation of our equitable culture. That’s the Kyndryl Way.

What You Can Expect

With state-of-the-art resources and Fortune 100 clients, every day is an opportunity to innovate, build new capabilities, new relationships, new processes, and new value. Kyndryl cares about your well-being and prides itself on offering benefits that give you choice, reflect the diversity of our employees and support you and your family through the moments that matter – wherever you are in your life journey. Our employee learning programs give you access to the best learning in the industry to receive certifications, including Microsoft, Google, Amazon, Skillsoft, and many more. Through our company-wide volunteering and giving platform, you can donate, start fundraisers, volunteer, and search over 2 million non-profit organizations. At Kyndryl, we invest heavily in you, we want you to succeed so that together, we will all succeed.

Get Referred!

If you know someone that works at Kyndryl, when asked ‘How Did You Hear About Us’ during the application process, select ‘Employee Referral’ and enter your contact's Kyndryl email address.","Big Four Accounting Firms, Business Case Preparation, Customer-Focused Service, Enablement, Growth Strategies, IT Service Management, IT Strategy, Technical Specialists, Technology Architecture, and White Papers"
Devoteam G Cloud,Machine Learning Engineer,Reposted 1 day ago,"Company Description

Company description

Devoteam is a leading consulting firm focused on digital strategy, tech platforms, and cybersecurity.

By combining creativity, tech, and data insights, we empower our customers to transform their business and unlock the future.

With 25 years’ of experience and 8,000 employees across Europe and the Middle East, Devoteam promotes responsible tech for people and works to create better change.

#Creative Tech for Better Change

Devoteam has launched in January 2021 its new strategic plan, Infinite 2024, with the ambition to become the #1 EMEA partner of the leading Cloud-based platform companies (AWS, Google Cloud, Microsoft, Salesforce, ServiceNow), further reinforced by deep expertise in digital strategy, cybersecurity, and data.
 
 
Job Description

The Machine Learning Engineer will be responsible for the following activities:
interpret our customers’ needs, and extract value from their data using GCP and its suite of tools
be involved in pre-sales activities as well as building upon our customers’ cloud infrastructure, creating analytics in the cloud
advocate for Google Cloud Platform and all of its products: Vertex AI, Cloud SQL, BigQuery, etc.
understanding the customer's requirements and suggesting a product or service accordingly
demonstrating the product and services
develop new products or integrations as required
undertake such duties and exercise such powers in relation to the Group Companies and its business as the Board shall from time to time assign to or vest in him;
in the discharge of such duties and in the exercise of such powers, observe and comply with all resolutions, regulations and directions from time to time made or given by the Company or the Board;
unless prevented by ill health or accident, devote so much of his time and attention and ability to the discharge of his duties hereunder;
in pursuance of his duties hereunder perform such services for any Group Company and accept such offices in such Group Company as the Board may from time to time reasonably require; and
 
 
Qualifications

  BA/BS in Computer Science or related technical field, or equivalent experience
Experience in one or more development languages, such as Java, Python, Go, PHP or similar
Experience in drawing UML diagrams
Enjoys programming in a test driven, agile methodology
Expert knowledge of database and data analysis technologies, including relational and NoSQL databases, data warehouse design, BI reporting and dashboard development
Experience in Hadoop Ecosystems
 
 
Additional Information

Education and Experience
Bachelor’s degree in Engineering required.
Two years of related experience is highly preferred.
Experience in AI ML for IoT is highly preferred.
One professional certifications in GCP (within 3 months after joining).


Status: Full-Time

Duration: -

Beginning date: August 2024

The Devoteam Group is committed to equal opportunities, promoting its employees on the basis of merit and actively fighting against all forms of discrimination. We believe that diversity contributes to the creativity, dynamism, and excellence of our organisation. All our positions are open to people with disabilities.","Computer Science, Data Analytics, Databases, Diagram Design, Doctrine (PHP), Good Clinical Practice (GCP), Google Cloud Platform (GCP), Hadoop, Pattern Recognition, and Unified Modeling Language (UML)"
Infineon Technologies,Process Integration Engineer,1 day ago,"In this role, you will be responsible for the wire-bond process, FOL auto vision, for improvement, analysis, and corrective actions, performing DOE, parameter optimization, and evaluation, and responsible for SFLA (Safe Launch Activity) of new products, machines, and processes to ensure a smooth transition from Development to Operation. In your new role, you will:

Handle wire-bond and FOL Autovision
Provide process improvements for Wirebond and FOL Autovision
Performing DOE, parameter optimization and evaluations
Responsible to run PSFLA/ SFLA builds at wire-bond and FOL Autovision
Responsible for providing PSLFA/ SFLA reports and other documents related (Spec update, OJTI, OPL, etc)
Provide root cause analysis and corrective actions on issues encountered during PSFLA/ SFLA

You are best equipped for this task if you have:

Bachelor's degree in Electrical /Electronic Engineering
Minimum 2 years of experience in the electronic industry
Strong knowledge of the wire bond process experienced
Good in engineering report and presentation
Ability to do machine set-up 
Good communication in English both written and verbal

#WeAreIn for driving decarbonization and digitalization.

As a global leader in semiconductor solutions in power systems and IoT, Infineon enables game-changing solutions for green and efficient energy, clean and safe mobility, as well as smart and secure IoT. Together, we drive innovation and customer success, while caring for our people and empowering them to reach ambitious goals. Be a part of making life easier, safer and greener.

Are you in?

We are on a journey to create the best Infineon for everyone.

This means we embrace diversity and inclusion and welcome everyone for who they are. At Infineon, we offer a working environment characterized by trust, openness, respect and tolerance and are committed to give all applicants and employees equal opportunities. We base our recruiting decisions on the applicant´s experience and skills.

Please let your recruiter know if they need to pay special attention to something in order to enable your participation in the interview process.","Chemical Vapor Deposition (CVD), Communication, Corrective Actions, Material Characterization, Materials Science, Presentations, Process Integration, Root Cause, Root Cause Analysis, and Wire"
